Data Row,Search Keyword,Platform,Job ID,Job Title,Tracking ID,Company Name,Location,Industry,Job Description,Employment Type,Company URL,Job URL,Job Age,Job Age Number,Job Date,Collection Date
147,author,LinkedIn,2299585022,Experienced Project Evaluator,Nzwmz9rSS12ZYLPKttD0cg==,HiiL The Hague Institute for Innovation of Law,"The Hague, South Holland, Netherlands","['Nonprofit Organization Management', 'Research', 'Government Administration']","Final Project EvaluationTerms of ReferenceAuthorDocument Number1MTBORevisionReview byV120102020MTBOTS, MB, RL, VYSMThese are the Terms of Reference for the final project evaluation of the Uganda Justice Innovation Programme with grantID 51180135HiiL has been active in Uganda since 2015 In addition to our headquarters in The Hague with 39 international staff, we have a local office in Kampala with three local staff members in October 2020In partnership with the Swedish Embassy in Uganda, HiiL has been running the Uganda Justice Innovation Programme since 2017 and activities will end on 31 December 2020 The programme was designed to ensure that more people in Uganda, in particular the most vulnerable, are empowered to resolve their most pressing justice problems more fairly and effectively Together with our partners, we work to increase capacity of the justice system and make it more open, inclusive and innovative The programme followed on from a Justice Needs and Satisfaction survey that was conducted in 2015 and aimed to address some of those justice needsProgramme RationaleAt the time of development the rationale behind the programme is summarised below Lessons have been learnt along the way and some of that rationale will have changed and will need to be incorporated into the evaluationBetter justice delivery is organised through collecting and sharing data from the experiences of the users of the justice system This data creates more awareness of the most pressing justice needs, the quality and costs of access to justice amongst the users of justice, civil society organisations, publicly funded justice delivery organisations, academia, the different arms of government, and donors, on the basis of which they can advocate, prioritize, and work to improve services and procedures through evidencebased learning Additionally by capturing best practices on what works on family justice issues, this can be used by practitioners to improve on the delivery of justiceEach country has social entrepreneurs Entrepreneurship is an enabler, a driver and an empowering tool for sustainable development The power of entrepreneurship can also be harnessed to increase access to justice The most promising justice entrepreneurs are selected to address problems identified in the justice needs survey and accelerated to increase their impact, based on sustainable funding models and using business acceleration methods This will increase access to justice that is locally owned, embedded, and sustainably fundedFinally traditional rule of law building activities, such as building capacity and infrastructure, do not suffice Innovative approaches that start from citizens needs and take the political dimension of rule of law building into account are essential This requires supporting agents of sustainable change at all levels, including justice reformers at the highest political level who experience strong resistance and challenges in improving the justice system Through providing peer support and advice to justice leaders at the highest political level, they develop stronger leadership knowledge, skills, attitudes, personalities and networks, which positions them to innovate, develop and maintain effective justice systemsThe majority of the programme has taken place in Kampala, though a part of the work has taken place in other areas Arua, Mbarara, Soroti, Kibaale district as well The original logframe is attachedProgramme ObjectivesThe main objectives of the programme can be summarised as followsThe expected outcomes per component of the project can be found in the logframe document attached with this ToREvaluation purpose and intended useThe primary aim is to assist HiiL management, stakeholders, and the donor Sida to understand the overall project performance towards achieving its objectives, and to provide learning points from experiences of the project Specifically, the evaluation aims toThe primary users will be the Management Team of HiiL, the Product Group Directors and local office staff in Kampala to make adjustments and improvements to the design and implementation of future programmesHiiL will also use the evaluation to understand how the programme activities fit within the local context of Uganda and align with the national action plans of the Ugandan justice sectorThe evaluation will be shared with SIDA, the Swedish Embassy in Kampala, to contribute to knowledge building in justice innovation programmes The evaluation may also be shared with the Justice Law and Order Sector Secretariat and Leadership Committee and the Dutch Embassy in KampalaThe evaluation is based on the project logframe and proposal The evaluation covers the period of 20172020 and focuses on the processes, results at various levels, as well as connections and relations between results It will concern activities conducted during the SIDA programme in Uganda onlyThe evaluation shall conform to OECD DAC criteria for evaluations and focus on the following criteriaRelevanceCoherenceEffectivenessEfficiencySustainabilityImpactLessons and best practices learned from the projectMethodologyThe proposed evaluation shall build on existing theories and reports conducted previously Due to the Covid 19 pandemic, travel to the region will not be possible The evaluation will therefore be done by an international consultant at distance, who is expected to gather data virtually andor liaise with a local data collection company in Uganda for primary data collection The evaluation is expected to use a gender sensitive approachmethodology, methods, tools and data analysis techniquesThe design of the evaluation should include the following elements but HiiL remains open to suggestionsDeliverablesTimelineStart date 1 December 2020Inception report 15 December 2020Evaluation start 1 January 2021Draft report 1 March 2021Final report 31 March 2021Logistical supportA Steering Committee composed of Project Management and MEL Specialist will coordinate the process of the evaluationHiiL will provide the following support to the evaluation teamThe focal point of contact is the MEL Specialist at HiiL, who is supported by the Steering Committee The local office in Uganda will provide additional support if requiredHiiL is looking for a consultant, or team of consultants, with the following experience and capacityThe criteria for awarding contracts resulting from this Request for Proposals are based on best value for moneyA complete assessment of technical, organisational and pricing factors quality of the training, content, trainers, previous experience, the format in which it is presented, ability to execute the training online if needed and the delivery timeTechnical evaluation total points 100 counts for 60 To be technically acceptable, a proposal must meet or exceed the requirements and specifications in the Request for Proposals as listed belowTechnical criteriaDocuments requiredMax scoreProposal addressing all technical requirements in experience and capacity, demonstrating an understanding of the ToR, methodology, tools to be used, and formatProposal which outlines the work plan, methodology, team and risk mitigation due to Covid 19 situation60Proof of expertise and knowledge needed to carry out the evaluationCV and 2 references from organisations that can verify the quality of the consultants work and or publicly available example of a previous evaluation40Only proposals that score a minimum of 50 points for the technical evaluation will go to the commercial evaluationCommercial evaluation total points100 counts for 40Commercial criteriaDocuments requiredMax scoreProposal clearly indicating the pricesFinancial offer outlining the budget in EUR100Proposals may be submitted on or before 22 November 2020 at 1700 CEST only through email to the following email address michelletonhiilorg  Proposals shall be submitted in English, signed by the organisation, and with the subject line Evaluation Ugandaname organisationAn online interview will be part of the assessment process and take place in the final week of November 1st week of DecemberPlease email michelletonhiilorg to receive the original programme logframe In 2020 additional outputs and activities were added but the outcomes remain the same",Full-time,https://www.linkedin.com/jobs/view/externalApply/2299585022?url=https%3A%2F%2Fwww%2Eimpactpool%2Eorg%2Fjobs%2F649722&urlHash=n6L8&refId=6702b58b-f9da-4169-bee1-2fd7e19b37a8&trk=public_jobs_apply-link-offsite,https://nl.linkedin.com/jobs/view/experienced-project-evaluator-at-hiil-the-hague-institute-for-innovation-of-law-2299585022?refId=6702b58b-f9da-4169-bee1-2fd7e19b37a8&position=22&pageNum=5&trk=public_jobs_job-result-card_result-card_full-click,4 days ago,4 days ago,2020-11-13,2020-11-18
150,author,LinkedIn,2278326516,Postdoctoral researcher,E/tbRWaLRY6XjERTudQPqQ==,Leiden University,"Leiden, South Holland, Netherlands",['Higher Education'],"The project is being conducted in collaboration with London School of Economics and Political Science, Kings College London, BI School of Management Norway, and IBEI Spain The successful candidate will work together with prof dr Caelesta Braun and dr Bert Fraussen as part of the Leiden University project moduleThe successful candidate will support this major comparative research project that explores the nature of changing demands on contemporary administrative states, and the responses by administrative states to these demands The overall project focuses on areas of constitutional, regulatory, welfare, and civil society engagement visavis administrative states in comparative perspective The Leiden Universitybased module is to lead on the civil society engagement element of the project, but also to support the research efforts of the other project teams The project involves a range of research strategies, and the successful candidate will be centrally involved in the conduct of the fieldwork for this projectOffer Requirements",Temporary,https://www.linkedin.com/jobs/view/externalApply/2278326516?url=https%3A%2F%2Fjoblift%2Enl%2Fdetails%2Fc26b11fb-df57-4963-9ebb-ae5327769598%3Fjid%3D4648f661fcf6f697e0c6dfd0c8d0c5603d2295485d81d76e82086d2646b3ad25%26utm_source%3Dlinkedin_nl%26utm_medium%3Dexternal_feed%26utm_campaign%3D126&urlHash=epfZ&refId=6702b58b-f9da-4169-bee1-2fd7e19b37a8&trk=public_jobs_apply-link-offsite,https://nl.linkedin.com/jobs/view/postdoctoral-researcher-at-leiden-university-2278326516?refId=6702b58b-f9da-4169-bee1-2fd7e19b37a8&position=25&pageNum=5&trk=public_jobs_job-result-card_result-card_full-click,4 days ago,4 days ago,2020-11-13,2020-11-18
151,author,LinkedIn,2277649777,Postdoctoral researcher,IJpPB198Rj+kFrXrQHCEFg==,AcademicTransfer,"Utrecht, Utrecht, Netherlands",['Higher Education'],"The project is being conducted in collaboration with London School of Economics and Political Science, Kings College London, BI School of Management Norway, and IBEI Spain The successful candidate will work together with prof dr Caelesta Braun and dr Bert Fraussen as part of the Leiden University project moduleThe successful candidate will support this major comparative research project that explores the nature of changing demands on contemporary administrative states, and the responses by administrative states to these demands The overall project focuses on areas of constitutional, regulatory, welfare, and civil society engagement visavis administrative states in comparative perspective The Leiden Universitybased module is to lead on the civil society engagement element of the project, but also to support the research efforts of the other project teams The project involves a range of research strategies, and the successful candidate will be centrally involved in the conduct of the fieldwork for this project",Temporary,https://www.linkedin.com/jobs/view/externalApply/2277649777?url=https%3A%2F%2Fjoblift%2Enl%2Fdetails%2Fbbd411f6-eadf-4610-812f-9560b73ad520%3Fjid%3Db9ce24c425333d9a443d637e331961b84d13e234417316ad80b519c9e1a6ec70%26utm_source%3Dlinkedin_nl%26utm_medium%3Dexternal_feed%26utm_campaign%3D126&urlHash=cAW5&refId=27b4d581-5725-4931-a9ce-7020ce94bf36&trk=public_jobs_apply-link-offsite,https://nl.linkedin.com/jobs/view/postdoctoral-researcher-at-academictransfer-2277649777?refId=27b4d581-5725-4931-a9ce-7020ce94bf36&position=1&pageNum=6&trk=public_jobs_job-result-card_result-card_full-click,4 days ago,4 days ago,2020-11-13,2020-11-18
152,author,LinkedIn,2306146855,Postdoctoral researcher - Leiden,QmZ9zN2lQHeoCQNSep1qbg==,IamExpat,"Leiden, South Holland, Netherlands","['Information Technology and Services', 'Computer Software', 'Research']","The project is being conducted in collaboration with London School of Economics and Political Science, Kings College London, BI School of Management Norway, and IBEI Spain The successful candidate will work together with prof dr Caelesta Braun and dr Bert Fraussen as part of the Leiden University project moduleThe successful candidate will support this major comparative research project that explores the nature of changing demands on contemporary administrative states, and the responses by administrative states to these demands The overall project focuses on areas of constitutional, regulatory, welfare, and civil society engagement visavis administrative states in comparative perspective The Leiden Universitybased module is to lead on the civil society engagement element of the project, but also to support the research efforts of the other project teams The project involves a range of research strategies, and the successful candidate will be centrally involved in the conduct of the fieldwork for this projectThe successful candidate is expected to haveThe postdoctoral researcher to be recruited will be part of an ambitious and dynamic team of colleagues who intend to build further on the successes of recent years, in an environment of cooperation across disciplinary borders You will be appointed for 12months Depending upon funding and performance, the position can be extended for the duration of the project maximum 24 months in total We would prefer you to start as soon as possibleSalary range is from  2790 to 4402 gross per month pay scale 10, in accordance with the Collective Labour Agreement for Dutch UniversitiesLeiden University offers an attractive benefits package with additional holiday 8 and endofyear bonuses 83 , training and career development and sabbatical leave Our individual choices model gives you some freedom to assemble your own set of terms and conditions Candidates from outside the Netherlands may be eligible for a substantial tax break For more information, see the websiteLeiden University is strongly committed to diversity within its community and especially welcomes applications from members of underrepresented groupsEinsteinweg 55",Full-time,https://www.linkedin.com/jobs/view/externalApply/2306146855?url=https%3A%2F%2Fneuvoo%2Enl%2Fjob%2Ephp%3Fid%3D8e0fef6a3da8%26source%3Dlinkedin%26utm_source%3Dpartner%26utm_medium%3Dlinkedin%26puid%3Dfdd8cadbeddgcadaeadbaadabddagadfadddfadc3aefcdc8fec3ddcg3e&urlHash=zea7&refId=27b4d581-5725-4931-a9ce-7020ce94bf36&trk=public_jobs_apply-link-offsite,https://nl.linkedin.com/jobs/view/postdoctoral-researcher-leiden-at-iamexpat-2306146855?refId=27b4d581-5725-4931-a9ce-7020ce94bf36&position=2&pageNum=6&trk=public_jobs_job-result-card_result-card_full-click,4 days ago,4 days ago,2020-11-13,2020-11-18
154,author,LinkedIn,2312908041,"Program Director, LASER PULSE USAID Funded Program - Rotterdam",C7nKLIrwT1iAY0UawRMteA==,Purdue University,"Rotterdam, South Holland, Netherlands",None,"LASER Long Term Services for Research PULSE Partners for Universityled Solutions Engine is a fiveyear, 70M USAID funded program to deliver researchdriven solutions to fieldsourced development challenges in USAID interest countries and technical sectors Funded through USAIDs Global Development Lab, LASER PULSE is implemented by a Purdue Universityled consortium with Catholic Relief Services, Indiana University, Makerere University, and the University of Notre Dame LASER PULSE convenes a growing network of 2,300 researchers and development practitioners in 54 countries It works with USAID missions, bureaus, offices and other local stakeholders to identify research needs for critical development challenges, and funds and strengthens the capacity of researcherpractitioner teams to codesign solutions that translate into policy and practiceThe Program Director PD for LASER PULSE has overall responsibility for the management and coordination of all project activities and staff to ensure timely and highquality completion of workplan activities and deliverables The PD reports to the LASER Academic Director and works with the LASER Academic Leadership LASER Principal Investigators  Director and Academic Director to help them establish and execute the program strategy All Key Personnel, as described in the LASER Award, report to the PD, including the Technical Director TD at Purdue the Monitoring, Evaluation, and Learning Lead MEL at the University of Notre Dame the Research Translation Strategy Lead RTSL and Catholic Relief Services and the Research Translation Communications Lead RTCL at Indiana UniversityThe PD will cultivate open and collaborative management relationships with the project team at USAIDWashington and LASER PULSE Academic leadership The PD will have principal responsibility for representing LASER PULSE to USAID and works closely with the USAID Agreement Officer Representative AOR to strengthen partnerships with other USAID MissionsBureausIndependent Offices and other international and national organizations The PD plays the lead role in working with the USAID AOR in creating new partnership opportunities for LASER PULSE, within and without of USAID working with consortium partners to organize preand postaward research for development meetings and associated trainings around the world, whether inperson or virtually engaging and growing the LASER PULSE network, which already has more than 2,000 registered researchers and practitioners leading the mobilization of research networks and relevant assets within and across development partners Additionally, the PD works closely with LASER PULSE Academic Leadership and consortium coPrincipal Investigators PI to evolve LASER PULSE strategy, pivots, and adaptations as needed develops the annual workplan and activities in a collaborative manner with the consortium ensures that program activities are in compliance with agreement requirements, applicable USG regulations, and appropriate standards and procedures and supervises the communications specialist to ensure high quality and frequently updated LASER PULSE communicationsRemote work may be considered, however there is a requirement for consistent and frequent travel to West Lafayette, IN, as well as to other consortium partners for building effective relationships with staff and partnersRequiredPreferredAdditional Information",Contract,https://www.linkedin.com/jobs/view/externalApply/2312908041?url=https%3A%2F%2Fneuvoo%2Enl%2Fjob%2Ephp%3Fid%3D7e08ed7dc200%26source%3Dlinkedin%26utm_source%3Dpartner%26utm_medium%3Dlinkedin%26puid%3Dfdd9cadbeddgcdd8eadbaadcbdd9gadcaaddfdde3degcdcgfec3ddcg3e&urlHash=Esbx&refId=27b4d581-5725-4931-a9ce-7020ce94bf36&trk=public_jobs_apply-link-offsite,https://nl.linkedin.com/jobs/view/program-director-laser-pulse-usaid-funded-program-rotterdam-at-purdue-university-2312908041?refId=27b4d581-5725-4931-a9ce-7020ce94bf36&position=4&pageNum=6&trk=public_jobs_job-result-card_result-card_full-click,4 days ago,4 days ago,2020-11-13,2020-11-18
155,author,LinkedIn,2278072867,PMV&R RA Specialist,D7Mg7PhVQzaG46guJb+6Cg==,Fisher Clinical Services,"Bleiswijk, South Holland, Netherlands",['Legal Services'],"Thermo Fisher is seeking an experienced Regulatory Affairs professional to join the exciting area of In Vitro Diagnostic and Clinical Research productsThe position is located on one of our IVD manufacturing site in Europe, or homebased, reporting to Manager of Regulatory Affairs and will work in the Global Regulatory Affairs department with members from Global Quality Assurance, and several Global Customer Facing Teams to evaluate and execute complaint handling, adverse event reporting, and recall strategies that are compliant to global regulatory requirements, specifically affecting IVDs on EMEA marketsYou will be responsible for managing the field actionrecall process for EMEA region and ensuring global regulatory authorities are notified within the appropriate time restrictionsIn addition, you will conduct global training for regulatory compliance, maintain key MDRrecall performance metrics, participate in process improvement projects, and assist with auditsYou will have the opportunity to interact with Thermo Fisher Scientific colleagues all over the world and have the ability to influence organizations global policies and procedures to improve regulatory complianceTitle is dependent upon experienceWhat will you doServe as a member of the Global Regulatory Affairs department and will have direct line reporting to IVDR RA Manager and supporting EMEA Director of Regulatory AffairsClinicalAct as subject matter expert regarding customer complaint processing, adverse event reporting, and, field action, and recall reportingIndependently lead others and conduct regulatory assessments with minimal guidance or supervisionDetermine global product field action and recall strategiesApply knowledge of device regulatory requirements in order to complete and submit MDRAE reports and recall reports within regulatory timeframesManage field action strategies and associated regulatory body notificationsMaintain, develop, and modify global procedures for regulatory reporting decision models regarding recalls and MDRAE to uphold compliance with reporting regulationsAuthor and peer review global regulatory field action and MDRAE reports to ensure ontime submissions to the appropriate regulatory authoritiesAuthor Health Hazard Evaluations and work with medical experts to determine potential health risks in the fieldCoordinate with Global Regulatory Affairs team members in APAC, EU, LATAM, and Americas regions to ensure customer complaint and nonconforming product data is properly analyzed and regional health authority reporting decisions are documented adequatelyEnsure continued compliance with ISO 13485 and global regulatory requirements inclTherapeutic Goods Administration, Medicines and Healthcare products Regulatory Agency, and other applicable regionsGenerate key recalls  MDR metrics and status reports for Leadership and corporate reviewParticipate in process improvement projectsResponsible for SOP revisionsdocument creationannual document review as assignedReview customer notificationsInterface with Quality Assurance and Customer Facing Teams for product investigations and trend reportingHow will you get hereA minimum BSc degree in Biology, Chemistry, bioengineering or related science without relevant direct experienceMust have a minimum of 3 years of IVD Regulatory Affairs experienceExperience with complaint handling and recall reporting is highly desirableMust be well versed in the aspects of regulatory strategy creation, design control, cGMPQuality Systems, and importexport requirementsDirect and positive experience in communicating with Regulatory Authorities and internal partnersDemonstrate indepth understanding of technicalscientific principles related to IVD reagent chemistry, laboratory automation, and software components of IVD medical devicesHandson, actionoriented, and able to implement effectively through hisher teamContinuous improvement minded familiar with balancing the need for Quality and the need for efficiencyAble to work autonomously in a matrixmanaged organizationWillingness to travel 1015Comfortable with ambiguity and changeUnderstanding of medical terminologyExperience in regulated environment and pertinent to ISO 13485 is preferred",Full-time,https://www.linkedin.com/jobs/view/externalApply/2278072867?url=https%3A%2F%2Fjoblift%2Enl%2Fdetails%2Ff7196cc9-fbdf-43af-8ebe-c573baf981bb%3Fjid%3D5e24caebe178ffa544168e1e111a75e63efc4c64ad51d7c43f95c94c600eba21%26utm_source%3Dlinkedin_nl%26utm_medium%3Dexternal_feed%26utm_campaign%3D126&urlHash=K9O7&refId=27b4d581-5725-4931-a9ce-7020ce94bf36&trk=public_jobs_apply-link-offsite,https://nl.linkedin.com/jobs/view/pmv-r-ra-specialist-at-fisher-clinical-services-2278072867?refId=27b4d581-5725-4931-a9ce-7020ce94bf36&position=5&pageNum=6&trk=public_jobs_job-result-card_result-card_full-click,4 days ago,4 days ago,2020-11-13,2020-11-18
