Search Keyword,Platform,Job ID,Job Title,Company Name,Location,Job Description,Rating,Employment Type,Company URL,Job URL,Job Age,Job Age Number,Collection Date
information,Indeed,p_3badd4b25eb0dfad,Junior Management Consultant,INNOPAY, Amsterdam Zuid,"INNOPAY helps companies and public institutions to innovate in their digital transformation - from strategy to execution - by offering tailored consultancy services by combining business, technology and regulation (BTR) expertise and insights. We help our clients to navigate in the world of digital transformation and move towards new business models to leverage the opportunities that a more open and data-driven economy offers.
MORE THAN EVER organisations (corporates, SMEs and scale-ups) need to focus on their digital strategy to engage with their customers. The competitive landscape in the financial industry has already changed significantly and will continue to do so in the coming years. Similar changes are starting to occur in other industries (such as Logistics, Mobility, and Public Services). Technology- and data-driven companies, such as scaling Fintech, established Bigtech and the more innovative incumbents, are continuously challenging the existing customer relationships with innovative customer-centric value propositions and business models. INNOPAY specialises in the delivery of innovative strategies, solutions and services across a variety of sectors and helps companies in achieving their business goals.
Academic master's degree in business, technology or regulation related fields;
Fresh graduate or max up to 3 years of work experience: preferably within management consulting;
Affinity with topics such as Digital Innovations, Digital Transformation, Digital Payments, Open Banking, Blockchain, Cybersecurity, Artificial Intelligence, Machine Learning etc.
Outstanding record of academic achievements, combined with broad personal development (e.g. international exchange programs, internships, professional extracurricular activities etc.).
Exceptional strategic and analytical skills and a track record of leadership in a work setting or through extracurricular activities
Fluency in Dutch and English is a must

AS MANAGEMENT CONSULTANT you will work closely in a team that advises companies on strategic topics (e.g. data sharing, onboarding, PSD2) in the field of digital transactions. You will be responsible for specific components of the project, such as performing outside-in or inside-out analyses, conducting interviews with clients or specialists. You – together with a team of 1-5 colleagues from different professional backgrounds – will support our international clients with sector-specific knowledge and strategic advice: enabling them to co-create new strategies, services and products. You will translate complex commercial, organisational, and technical information into concrete advice, reports and specifications. Besides project responsibilities, you will have the opportunity to help write proposals for clients and build propositions on key themes (e.g. Open Banking, Data Sharing, Cybersecurity, Advanced Analytics, Internet of Things).


WE OFFER an agile organisation structure and culture that is characterised by entrepreneurship, forward-thinking, collaboration and ownership. We believe in - and will offer you - personal(ised) growth rather than a fixed career path through career coaching and a personal development plan. We offer you a flexible and open working environment where you will be part of innovation projects with true impact.


Also, we rank fun very high, which is reflected by our weekly Friday evening drinks, our annual ski trip, our offsite weekends, sporting events, Christmas party and more!


For more information regarding INNOPAY or this role, please contact us via recruitment@innopay.com",-1.0,-1,https://indeed.nl/rc/clk?jk=3badd4b25eb0dfad&from=vj&mvj=0&vjfrom=vjs&pos=bottom&astse=eda8ee902d506949&assa=5525,https://nl.indeed.com/vacature-bekijken?jk=3badd4b25eb0dfad&fccid=76b58db98152ecc5&vjs=3,2 dagen geleden,2 dagen geleden,2021-03-02
information,Indeed,p_0d43c277a747031b,Compliance Manager,Athora, Amstelveen,"Reporting to: Group Head of Compliance

Team: Group Compliance

Function: Group Compliance & Legal

Location: Dublin, London, Netherlands


This is an exciting role that allows for career growth and development in the area of Compliance. You will play a pivotal role in influencing a culture of compliance across Athora as well as having the scope to develop and people manage a Compliance Associate.


The Company’s compliance function is headed by the Group Head of Compliance, who is responsible for ensuring compliance with regulatory requirements and legal obligations. The Group Head of Compliance is supported by Heads of Compliance in Compliance Functions in each of our regulated entities.


The Group Compliance Framework has been developed and defines the organisational roles, responsibilities, and approach to ensuring compliance with applicable laws, regulation, and internal policies. The Framework sets out the key requirements which are to be adopted across the Group. The Board receives updates on the Company’s compliance activities on a quarterly basis. The Board monitors the Athora Group’s compliance function, which is overseen by the Group Head of Compliance who reports to a member if the Management Executive Committee, the Group General Counsel.


The successful candidate will support the Group Head of Compliance and assume day-to-day management of the Compliance Framework; the further embedding of the Framework and supporting business units in their local management of our compliance obligations. This role has a direct reporting line to the Group Head of Compliance.
Key Contribution Areas
Support the Group Head of Compliance with respect to managing the existing Compliance Programme (e.g. Financial Crime/Fraud/Data Privacy/Conduct of Business) and provide assurance on the effectiveness of these programmes across each entity to the AHL Board and its sub committees;
Foster and encourage a strong culture of compliance across the Athora Group and promote awareness of the Compliance Framework, supporting compliance policies and regulations.
Support and manage the delivery of the Annual Group Compliance Plan.
Review and update the Group Compliance Framework and supporting Compliance Policies incorporating new/amended regulatory requirements in line with the policy review cycle.
Contribute and participate in Second Line of Defence Committees (e.g. ORWG) and attend and participate in any relevant First Line Committees on behalf of Compliance (e.g. Product Line Committee).
Support the Group Head of Compliance with the annual Compliance Risk Assessment Process to determine the compliance risk areas which pose the most significant threats to the Group and ensure that risk areas are sufficiently identified and monitored in each entity;
Assist and support the Group Head of Compliance with any Regulatory Engagements
Act as Chair for the Compliance Functional Board and supporting working Groups (Data Privacy, Financial Crime, Compliance Obligations and E-Learning)
Maintain the Group Compliance Universe ensuring all current and emerging compliance risks are captured and incorporated as appropriate into our suite of compliance policies.
Advise and support Business Units in relation to Compliance obligations on an ongoing basis and respond to ad-hoc requests.
Perform compliance monitoring on behalf of the Group Compliance based on the Board Approved Compliance Monitoring Plan.
Report regulatory breaches to the Group Head of Compliance and MEC as required and support the Business Units with remediation.
Promote effective use of tooling and control frameworks to ensure that our compliance risks are appropriately managed.
Maintain the Group Compliance Training Programme, track and monitor mandatory training to determine effectiveness.
Overseeing and managing the reporting and escalation of any breaches of regulation to the relevant Governance Committee and/or Regulatory Body.
Personal Capabilities Required
Positive, Adaptable and Inclusive Leader with willingness to challenge status quo
Candidates who are strong in either Data Privacy or Financial Crime and are willing to gain expertise in the other topic, may be considered.
Effective communication and report writing skills and ability to operate within reporting deadlines
Sound judgement and ability to know when to escalate and when to seek assistance.
Ability to manage multiple competing priorities and adapt to varied decision making scenarios
Able to work independently to assess/analyse/provide recommendations for complex issues
Developing, building, and maintaining excellent relationships across our business units to strengthen relationships
A strong service ethic, focused on the needs of colleagues
Analytical mind and skillset with excellent attention to detail.
Cultural awareness to operate in a complex, multi-country environment
Functional or Technical Knowledge and Skill Required
A professional Compliance Qualification, or relevant professional qualifications/ relevant third level degree.
Relevant experience in working within a Compliance Function, Risk Function or Audit Function, preferably in the Insurance and Reinsurance or Financial Services Industry.
A strong understanding of the current and emerging compliance risks and practical experience of managing and effective compliance program
Proven experience developing, implementing, and supporting long term strategic compliance initiatives
Excellent analytical skills and ability to communicate effectively, presenting information at the appropriate level relative to the audience – e.g. Business Units, Board / MEC or our Regulators
Apply By:
26-01-2021",-1.0,-1,https://indeed.nl/rc/clk?jk=0d43c277a747031b&from=vj&mvj=0&vjfrom=vjs&pos=bottom&astse=4ea06ae923221e19&assa=3286,https://nl.indeed.com/vacature-bekijken?jk=0d43c277a747031b&fccid=6f6f67165910ca26&vjs=3,Meer dan 30 dagen geleden,Meer dan 30 dagen geleden,2021-03-02
information,Indeed,p_f8c6632df9e9658b,Data Entry Analyst,Independent Recruiters, Amsterdam,"Data Entry Analyst
For a temporary project of 3 weeks we are looking for a Data Entry Analyst in Amsterdam to update and maintain information in the databases. The project will be from Monday 8th of March until Monday 29th of March for 40 hours per week.
Are you available, located in Amsterdam and do you have data entry skills? Let's get in touch!

Responsibilties Data Entry Analyst

To support a project, we are looking for a Data Entry Analyst. You will be responsible for collecting and entering contracts in databases and mainitaining accurate records of valuable company information. The information is stored in Filenet System.

Requirements Data Entry Analyst

You will be suitable if;
Experience with Data entry;
Fast typing and an eye for detail;
Familiar with spreadsheets and online forms;
Experience with FileNet system is a big plus;
Located in Amsterdam;
Available for the period of 8th of March until 29th of March.


Offer
You will work in a dynamic and international environment. The salary will be market conform based on experience and education. I would like to tell you more in a personal conversation!",-1.0,-1,https://indeed.nljavascript:void(0);,https://nl.indeed.com/vacature-bekijken?jk=f8c6632df9e9658b&fccid=5b5d5a4463a5ac7c&vjs=3,Meer dan 30 dagen geleden,Meer dan 30 dagen geleden,2021-03-02
information,Indeed,pj_29ab4f248f95fc0e,Manager Operations Clearing,ABN AMRO Bank, Amsterdam,"Can you empower team members in doing their jobs. Coach and develop staff at all levels and recognizs high potentials. The manager sets vision and guidelines, is results oriented and has a strong sense of responsibility for the performance and development of his/her team and its members. The manager delivers change, understands who to collaborate with and aligns with all stakeholders. Is pro active, takes ownership, and is continuously striving to improve. The manager has several leadership styles and understand how to lead and motivate staff. The manager can participate in the Agile organisation, can participate in Scrum session and understands the interests of the stakeholder and the organisation as a whole.

What do you see when you envision the next step? Work on achieving your goals and develop yourself professionally and personally. Tell us your story.

Your job
You are expected to fully carry out your own tasks and responsibilities including, but not limited to:
Lead execution of the departmental plan and budget with a view on the next 2 or 3 years and contributes to the strategy of the department / line of business.Manages between 20 – 30 fte directly.Are responsible for the integration of activities and processes of own business which are generally related and where there is a requirement for coordination with related departments / functions which requires extended communication.Responsible for ensuring successful delivery of project goals, including timeliness of completion, adherence to budget and quality, and facilitation of group discussions and decision making, through effective delegation to project team members.

Working environment
ABN AMRO Clearing offers an integrated approach to global transaction processing, financial logistics and risk management. Clients benefit from our global reach as well as from our staff's extensive expertise of local financial markets. With 11 offices around the globe we offer proximity to market infrastructures on 4 continents. We strive to deliver the most professional service, to make our clients globally competitive. We consistently ranks among the top three clearers in every time zone, based on market share of transactions cleared.

Working at ABN AMRO Clearing means thriving in an international, professional yet informal, fast-paced environment. The Network Management Team has a lot of knowledge and shows drive and passion. The team brings an important contribution to the performance of the company and is based in Amsterdam. They are in contact with multiple service providers (exchanges, CCPs, Custodians, CSDs etc.), brokers and internal departments on a daily basis in order to manage the relationship.

Your profile
You have the ability to manage and coach colleagues from different backgrounds, expertise and cultures together in order to optimally serve our clients. Our clients are highly demanding, so you need to be as well. You know how to strike a balance between the interests of the customer, the operational department and AACB itself. In order to find this balance, you are be able to act in the interest of all our stakeholders. Do you think you are a match?

Check your profile:
master levelstrong understanding of international clearing and settlement practices, rules and regulationsspeaks and writes in English fluently and therefore has no trouble communicating with people all over the worldstrong management and coaching skillsknowledge of leading teams and team dynamics, setting development targets, personal communication skills and motivational triggersyou are result driven, have an inquisitive mind and you enjoy learning new things in an international environmentstrong analytical, decision making and negotiation skills, high work standards and attention to detailexcellent stakeholder management capabilities

We are offering
You have the possibility to develop business in a sustainable way for the benefit of our clients, employees and society at large. There is lots of room to grow both personally and professionally.

Salary scale (classification is based on knowledge and experience): EUR 78.006 - 111.437 all-in based on a 40 hour work week (36 is also possible).
A personal development budget of EUR 1.000 per year.
An annual public transportation card.
A solid pension plan.

Interested?
Please apply online. For more information, please contact Monique Verhoef, 06 1095 2647. We like to meet you!

When applying are in possession of a Dutch work permit

Acquisition by external agencies is not appreciated.",-1.0,-1,https://indeed.nl/rc/clk?jk=29ab4f248f95fc0e&from=vj&sjdu=0ZFwD5rbjMRcHz87Kzx_g4iztdTb_2bOBnSpyL0eJqqSkSGR1RuntkWHj6WL-shYsmB5nFFPBspj7zX7fFHCTG9T52d15MZTOjD-viioHthxkD_J-gjevFuU75zHWZtaE6RvwJ95I02pI9JhC9IIeeeZNoNWqSPfSBbOyYAFCY7V4VL3Im6c4DEGYwfniy7RU67pFdyPYxSAmYg46oB8wA&spon=1&adid=341330116&mvj=0&vjfrom=vjs&pos=bottom&ad=-6NYlbfkN0A_cWh5ufxJCEatf9FOtgdwl-LajcKrnY3NwdklpeSDnu3zP8nC49W8vdwlFzj2GRkStnXPX0LR3jCMeHpVxjkGpAEXXUHaD0F36mgWgpXOQnCHt0VVfqUtp-j6h5Udbs4z275hCSmk0RcEI6Tnx5U8XV7gK6WmnGm7Hawvv5Yj_NNLaovGxTLoWEQ1FVMj1jp5TdYpfKTgTvYk5yuI-FuVlHTLgENLJhh5udIHdUiuzgUmNNW2rHRLUzhviHErBd-qLSwD6HzH3_lnHM4Cb4GQuMqOrn9DvKeqyXiMPU8rzM1z7XwC6tHrubuATZ5ms4vmkIo0RYD3OpSoqY1Y6_MyYB4N1xJJsKZdavDVsnhdhIZajKI_CPfyyFDGjt0isfVoWRrlxWtiMA_73ydOvCMnOTzN_m4ewRUQ6dr6AZaFEphVFSJ_A0UkIKcVUWGqDFDzh_dXF8JjqLCVRntlXdnU7wp1nFDRR7aDQ0YCNSwuH49lXCJDcLL_YzbDM1DXgVCztIohAOapq_o12KsY1qNZsaSv5gQYlqC4wv9WKZhrD0rvDCB1RmuGj1xkhol7e8_6b3esJvfxXTKC1XNE4a-czvEUKz0fcinDJdj4NS_Ul9neb6td0g-JliDh90IaqnOc2HBDTqR2fUzWbAWJUkgo3S64Ed4Oi19PPojV69qumz42PFDNMvW99oNdNF6LDIp5ZKdGER6oPJSJxclxeXkKLpOYvGzdqANRfgmG7L5gqgZbv8nRZmBAUQ4RKt84gRvhqfIZV9D2zQ==&astse=65bb68d3fda1c339&assa=2698,https://nl.indeed.com/vacature-bekijken/pagead/clk?mo=r&ad=-6NYlbfkN0A_cWh5ufxJCEatf9FOtgdwl-LajcKrnY3NwdklpeSDnu3zP8nC49W8vdwlFzj2GRkStnXPX0LR3jCMeHpVxjkGpAEXXUHaD0F36mgWgpXOQnCHt0VVfqUtp-j6h5Udbs4z275hCSmk0RcEI6Tnx5U8XV7gK6WmnGm7Hawvv5Yj_NNLaovGxTLoWEQ1FVMj1jp5TdYpfKTgTvYk5yuI-FuVlHTLgENLJhh5udIHdUiuzgUmNNW2rHRLUzhviHErBd-qLSwD6HzH3_lnHM4Cb4GQuMqOrn9DvKeqyXiMPU8rzM1z7XwC6tHrubuATZ5ms4vmkIo0RYD3OpSoqY1Y6_MyYB4N1xJJsKZdavDVsnhdhIZajKI_CPfyyFDGjt0isfVoWRrlxWtiMA_73ydOvCMnOTzN_m4ewRUQ6dr6AZaFEphVFSJ_A0UkIKcVUWGqDFDzh_dXF8JjqLCVRntlXdnU7wp1nFDRR7aDQ0YCNSwuH49lXCJDcLL_YzbDM1DXgVCztIohAOapq_o12KsY1qNZsaSv5gQYlqC4wv9WKZhrD0rvDCB1RmuGj1xkhol7e8_6b3esJvfxXTKC1XNE4a-czvEUKz0fcinDJdj4NS_Ul9neb6td0g-JliDh90IaqnOc2HBDTqR2fUzWbAWJUkgo3S64Ed4Oi19PPojV69qumz42PFDNMvW99oNdNF6LDIp5ZKdGER6oPJSJxclxeXkKLpOYvGzdqANRfgmG7L5gqgZbv8nRZmBAUQ4RKt84gRvhqfIZV9D2zQ==&p=2&fvj=0&vjs=3,Meer dan 30 dagen geleden,Meer dan 30 dagen geleden,2021-03-02
information,Indeed,p_0336cb6c5556eff6,Business Analyst,Leaseweb, Amsterdam,"Team Profile

As the Business Intelligence department, we are the single provider of management information within the company. We support and guide all (but the technical) departments with information on their processes, accomplished results and possible options for improvement. The goal of the Business Intelligence department is to support data driven decision making by team managers up to C-level executives.

With the implementation of the SAP stack (ERP, CRM, and Business Warehouse) in the company we are in a phase of redefining processes, metrics and performance indicators to fit the need for future operational excellence. Furthermore, with the new front-end possibilities we are redefining the way we communicate on data within the company. We do this with a cross-functional team of 6-8 people consisting of developers, business analysts and business controllers.

Position Features

Project

Creating dashboards and reports with front-end SAP tools (SAP Analytics Cloud, Analysis for Office)
Designing, testing and implementing metrics and segmentations
Developing the structure of foundational business data in SAP in relation to business requirements for reporting and analysis
Connecting the team's developers and the business to realize new business insights
Implementing new reporting & analysis systems in the organization and giving training on those tools
Participating in creating a data-driven ecosystem within the company

Analysis

Preparing and analyzing sales and performance reports for various entities, making detailed comments on the KPI's such as orders, billing, pipeline, new deals, revenues, costs, products, client trends and product portfolio, churn and sales per week/ month
Analyzing the trends and presenting findings to management
Identifying and improving business processes; making sure we meet clients' expectations
Flag data quality issues related to the business process
Reporting on the performance of branches and products, identifying deviations and trends
Support colleagues in business cases with data models and insights

Candidate Profile

Bachelor's or Master's degree in a relevant field (Economics, Business, Science, etc.)
Preferably >4 years of relevant experience in fast paced environment
>2 years of experience in setting up reporting and analysis dashboards
Able to switch between high level conceptual thinking and detailed (data) modelling
Strong analytical skills, thorough attitude, eye for detail, well developed business sense
Results oriented, independent, proactive and self-starting
Good communication skills, excellent command of English; Dutch is a plus

What we offer:

Competitive salary + annual bonus
Defined contribution pension plan and collective health care plan
25 days of paid time-off
Free lunch & Free parking
The possibility to develop yourself and build up your career
Team fun events, including a full two-day hackathon every quarter
Ping-pong, game consoles, monthly happy hours and other fun events
The chance to leave your mark in a company that grows quickly but still manages to keep a pioneer spirit.

Want to learn more or apply?

Please use the link to apply. For more information, please contact Jana Reiss,Talent Acquisition Specialist via: j.reiss@global.leaseweb.com

Recruitment agency? Thank you for your interest, but we are sourcing all our candidates directly. We appreciate you trying anyway but please keep in mind that any unsolicited profiles you send us will be treated as direct applications.",-1.0,-1,https://indeed.nljavascript:void(0);,https://nl.indeed.com/vacature-bekijken?jk=0336cb6c5556eff6&fccid=ee8373b0f3a14710&vjs=3,Meer dan 30 dagen geleden,Meer dan 30 dagen geleden,2021-03-02
