Search Keyword,Platform,Job ID,Job Title,Company Name,Location,Job Description,Rating,Employment Type,Company URL,Job URL,Job Age,Job Age Number,Collection Date
information,Indeed,p_83fad27e2a5804a7,Material Planner,Merck KGaA, AmsterdamZuidoost,"A career at our company is an ongoing journey of discovery: our 57,000 people are shaping how the world lives, works and plays through next generation advancements in healthcare, life science and performance materials. For more than 350 years and across the world we have passionately pursued our curiosity to find novel and vibrant ways of enhancing the lives of others.

Your role

The purpose is to manage the material flow for the European supply chain supporting both the planning and day to day execution in support of the immediate business needs. The goal is to optimize the supply chain by balancing the need for service level with the most cost-effective strategy. A high focus will be to ensure customer on time deliveries with 100% satisfaction of service and product, as well as to ensure a high focus on safety and regulatory compliance is maintained. The Material Planner will be responsible for the short-term planning and day to day execution of the material flow thru the European SC. Working closely with the SBU SC Managers, the MP will evaluate and set replenishment strategies and stocking levels to support customer service levels required. The position will be inclusive of raw materials, manufactured finished goods & purchased buy-resell finished goods. The position will also execute the fleet strategy in the form of conversions, new builds and dispositioning of excess fleet utilizing inventory settings for RT planning and the creation of process orders and/or purchase orders for execution. The Material Planner will be responsible for blocked stock activities including disposition. The position will also identify and escalate any potential of at-risk inventory to the Supply Chain Analyst and coordinate the scrapping of any such inventory. The Material Planner will manage any expedites required for their product lines within region and coordinating with other regions as needed. In the event there is the need for allocation, the Material Planner will escalate to the Manager for a decision to be made. The Material Planner will manage the allocation plan once the decision is made.

Who you are
Diploma/BS/BA in Supply Chain is preferred
At least 1-3 years of experience in supply chain
Experience using an ERP/SAP system and MS applications
Good team player, communication skills and self-starter attitude
Fluent in English

What we offer: With us, there are always opportunities to break new ground. We empower you to fulfil your ambitions, and our diverse businesses offer various career moves to seek new horizons. We trust you with responsibility early on and support you to draw your own career map that is responsive to your aspirations and priorities in life. Join us and bring your curiosity to life!

Curious? Apply and find more information at https://jobs.vibrantm.com

Job Requisition ID: 216822
Location: Amsterdam Zuidoost
Career Level: C - Professional (1-3 years)
Working time model: full-time
Careers during Covid-19
Thank you for visiting our careers website, we are always looking for curious minds to join our teams. We understand how much the world is being impacted by the Covid-19 crisis and we want to assure you that your safety is very important to us. To ensure that everyone’s health is protected, instead of a standard face-to-face interview, it is likely that you will be offered alternative digital interview options.
US Disclosure
The Company is an Equal Employment Opportunity employer. No employee or applicant for employment will be discriminated against on the basis of race, color, religion, age, sex, sexual orientation, national origin, ancestry, disability, military or veteran status, genetic information, gender identity, transgender status, marital status, or any other classification protected by applicable federal, state, or local law. This policy of Equal Employment Opportunity applies to all policies and programs relating to recruitment and hiring, promotion, compensation, benefits, discipline, termination, and all other terms and conditions of employment. Any applicant or employee who believes they have been discriminated against by the Company or anyone acting on behalf of the Company must report any concerns to their Human Resources Business Partner, Legal, or Compliance immediately. The Company will not retaliate against any individual because they made a good faith report of discrimination.
North America Disclosure
The Company is committed to accessibility in its workplaces, including during the job application process. Applicants who may require accommodation during the application process should speak with our HR Services team at 855 444 5678 from 8:00am to 5:30pm ET Monday through Friday.",-1.0,-1,https://indeed.nl/rc/clk?jk=83fad27e2a5804a7&from=vj&mvj=0&vjfrom=vjs&pos=bottom&astse=0eb7b1dc923d105d&assa=6094,https://nl.indeed.com/vacature-bekijken?jk=83fad27e2a5804a7&fccid=68d0e0954a811351&vjs=3,8 dagen geleden,8 dagen geleden,2021-02-28
information,Indeed,p_606dcf92caa4f050,Strategic Project Analyst,Optiver, Amsterdam,"Are you intrigued by the financial markets and ready for the next step in your career? Do you excel at figuring out how things work and making them better? Are you energized by driving thoughtful and impactful initiatives? Then you just might be the Strategic Project Analyst we're looking for.

Who we are

Optiver is a leading global electronic market maker, focused on pricing, execution, and risk management. From our offices in Amsterdam, Chicago, Shanghai, and Sydney, we provide liquidity to financial markets using our own capital, at our own risk, trading a wide range of products: from listed derivatives, cash equities, ETFs, and bonds to foreign exchange. What really sets Optiver apart from other companies is its openness, honesty, and our colleagues. People have strong opinions, but they're also open to listen and to change their mind when the facts presented by others have more value.

What you'll do

The Strategic Projects team is based in Amsterdam and is looking to add an Analyst to the team. Recently created, the team focuses on reshaping operating models across the business to support the firm's continued growth and further accelerate its path to operational excellence. The Strategic Project Analyst will work with teams throughout the business to design and implement scalable business processes and technology solutions. The Analyst will work on a broad range of topics across the organization, for example:

Develop short- and long-term strategies for functional teams and technology platforms;
Optimize tools, systems, and business processes and support the development of businesses;
Analyze, document, and recognize current processes and patterns;
Establish priorities across diverse stakeholders and timelines.

What you'll need

Between 3 to 5 years of top-tier strategy consulting and/or industry strategy experience;
Master's degree with a strong academic record;
Exceptional analytical and conceptual problem-solving skills;
Keen attention to detail;
Robust process analysis and project management skills with an understanding of financial markets;
Strong sense of ownership and personal responsibility;
Outstanding written and oral communication skills to convert complexity into digestible insights;
Team mentality, putting the team and company goals above individual acknowledgement;
Fluency in English and advanced skills in MS Office (incl. Excel, PowerPoint, Visio).

 What you'll get

We understand that our best work is done together. We constantly ask ourselves how to do better, which creates a stimulating and fun environment, where you are seriously rewarded for your performance. To be concrete, we offer competitive remuneration and great secondary benefits, such as an attractive profit-sharing structure, training opportunities, fully paid first-class commuting expenses, a premium-free pension, breakfast and lunch facilities, sports and leisure activities, even weekly chair massages and of course Friday afternoon drinks. We are used to guiding expats through their relocation and offer relocation packages and discounts on health insurance.

Interested?
If you are interested, please apply directly below by uploading your CV and Cover letter in English. Applications without a letter of motivation will not be reviewed. If you have any questions, feel free to contact Claire van Raay at clairevanraay@optiver.com.

More information on how Optiver Europe processes your personal data can be found in our Privacy Policy.

Kindly note that we don't require any assistance from third-parties including agencies in the recruitment of this role.",-1.0,-1,https://indeed.nljavascript:void(0);,https://nl.indeed.com/vacature-bekijken?jk=606dcf92caa4f050&fccid=8ef4fa42d160b676&vjs=3,8 dagen geleden,8 dagen geleden,2021-02-28
information,Indeed,p_357773f6a9100430,European Customer Service Representative,Canon, Amstelveen,"In the role of our multilingual European Customer Service Representative you are responsible for providing support to small-to-medium business customers across Europe. You work with both internal and external resources to assist the customer thoroughly. With your communicative personality and problem-solving skills, you enjoy providing a high level of service to our internal and external business customers.
You are the first point of contact for our German, Engels speaking business customers and you ensure excellent support is provided by answering calls, e-mails, solving queries and managing the order portfolio in an accurate and timely manner. As a Customer Service Representative you help to drive continuous improvement regarding the customer experience for our customers in Europe, whilst liaising with the National Sales Organisations to deliver best-in-class service. Our diverse and international Customer Service team is based at the European headquarters in Amstelveen.
In the role you work closely together with Canon National Sales Organisations (NSO’s), Business Units and your direct colleagues to ensure best practice sharing. You’ll join a culture fueled by collaboration, innovation, and openness, driven by our mission to make a positive, meaningful difference and work together on the common good.
Are you ready to be the best guide for our customers and support them with their orders in English and German If yes, then we are looking forward to your application!
What we give
With Canon, you'll get the support and encouragement you need to grow, from people who share your ambition. We'll invest in your professional development to help you learn and progress in your role with us. You'll find leaders who give you the freedom to explore new things and a team where knowledge is shared openly.
As the European Customer Service Representative, your key responsibilities will include
Manage orders and overall order portfolio queries and claims from order entry through to delivery shipment of product to customer respecting Service Level Agreements (SLA);
Support multi-location customers with multiple services at each location;
Interface with various levels of sales, operations and other functional groups to ensure order flows appropriately;
Monitor order related compliance of the delivery dates and quantities to initiate proactive measures for optimising delivery reliability in good time and to be always capable to provide [order] information;
Meet departmental KPIs ;
Benchmark with the National Sales Organisations (NSO’s) for operational performance to highlight areas for potential improvement;
Deliver insights and challenge all aspects of Customer Fulfilment to identify and capture efficiency and process improvement opportunities;
Communicate business requirements with all stakeholders effectively.
What we ask
We need people who can achieve the exceptional by working collaboratively, who have the courage to risk new ways of doing things and the ability to see the world the way their customers see it. We're looking for creative problem-solvers like you, someone who can ensure Canon stays ahead in an ever-changing world.
What we ask
Relevant Bachelor degree, with experience in a Customer Service Representative with focusing on ordermanagement;
Absolutely fluency in English and German (language checks will be done as part of the recruitment process);
Strong analytical skills and business analytics knowledge is a plus;
Ability to work variable schedule(s) and overtime as necessary;
Ability to work within a team and independently;
Ability to track and monitor key priorities;
Motivation and capacity to learn new tools and processes;
Strong organisational skills;
Flexibility.
You will need
You will need
To succeed in this role you will need to demonstrate the following competencies:
Apply business acumen.
Communicate effectively.
Focus on the customer.
Create insight.
Create solutions to problems.
Drive for results.
Further Information
Please note that we will only consider applications received in English language and via our career website.
Canon is enriching lives and businesses in incredible new ways. You can play a part in shaping the future of a company that’s strong, ambitious and considerate, where people do great things together. You can expect the exceptional and achieve the exceptional, with the world's best imaging company.

Expect the Exceptional.

Canon is enriching lives and businesses in incredible new ways. You can play a part in shaping the future of a company that’s strong, ambitious and considerate, where people do great things together. You can expect the exceptional and achieve the exceptional, with the world's best imaging company.

Expect the Exceptional.",-1.0,-1,https://indeed.nl/rc/clk?jk=357773f6a9100430&from=vj&mvj=0&vjfrom=vjs&pos=bottom&astse=84b6cc5745b8b66c&assa=9552,https://nl.indeed.com/vacature-bekijken?jk=357773f6a9100430&fccid=07c3401e02238daf&vjs=3,8 dagen geleden,8 dagen geleden,2021-02-28
information,Indeed,p_b91ff56cd98b7b9f,Application Security Specialist,DAZN Group, Amsterdam,"Job Description
Job Title:
Application Security Specialist
Location:
Amsterdam, The Netherlands
Schedule:
Full-Time, Permanent
Team:
Software Engineering
Department:
Technology
What's your new role about?
Want to be part of the leading sports application providing world wide OTT coverage? Well, we are now looking for an Application Security Specialist. In this role you will make sure that DAZN's product applications are designed, and deployed in a secure manner! Which is highly crucial for our global operations supporting millions of users. On top of that, you will be exposed to new tech, large audience and traffic, challenges that come with high resiliency, scale and growing a product on a global scale. Our environment is flexible, result-driven and offers you independence and autonomy to achieve.

Feel up to the challenge?
HERE’S A BREAKDOWN OF WHAT YOU’LL DO (NOT ALL OF IT, JUST THE MOST IMPORTANT STUFF)
Working closely with Application Architects and Software Engineers acting as a Subject Matter Expert in application security threats, vulnerabilities, risks & controls.
Ensuring projects teams are following and correctly implementing DAZN’s application security policies, standards & guidelines.
Supporting the project teams with on-going security risk assessments of new and in-flight software projects.
Facilitating threat modelling sessions for new and in-flight projects in Amsterdam and across other development centres.
Proactively guiding the remediation work for identified application security risks and vulnerabilities.
Facilitating the Security Champions Programme in Amsterdam.
Writing and reviewing code in either NodeJS or Golang and in HCL for infrastructure.
Securing the SDLC and automating security scanning with SAST, DAST, OSA, etc.
YOU’LL NEED TO HAVE THESE ESSENTIALS
Very good understanding of modern development practices in a cloud-native environment (AWS/GCP/Azure).
Very good knowledge of information security principles and practices in a secure SDLC.
Good knowledge of application security testing, static analysis and dependency security.
Ability to develop positive relationships and act as an ambassador for information security.
Software engineering background with hands-on coding experience.
Appetite to research, learn and follow current trends.
IT WOULD BE GREAT IF YOU HAD THESE TOO
Authentication and authorization frameworks, Oauth2. Familiar with standards such as JWT, JWS.
Expertise in OWASP Top Ten, OWASP ASVS or other application security frameworks.
Able to act in an internal consulting capacity
Able to work in an international environment
Being able to translate technical requirements into business language
Here's a little more about us…
At DAZN we're doing things no-one has done before, giving fans and customers access to sport anytime, anywhere. We're using world-class technology to transform sports and revolutionise the industry, and we're not going to stop.

We're growing fast and have made a big impact so far, and that's just the beginning. There's so much we can do. Working with us is exciting, empowering and truly global.

DAZN – who we are and what we do:
Headquartered in the UK with 2,200 employees located in over 25 countriesHome to DAZN – the largest, fastest-growing global sports streaming service live in over 200 countries and territories. You can subscribe to our global service at www.dazn.comWe guarantee affordable access on most connected devices including smart TVs, set-top boxes, streaming sticks, smartphones, tablets, PCs and game consolesWe work across every aspect of the way fans engage with sports; from production, through to content distribution and commercialisation.
We are committed to fostering an inclusive environment, both inside and outside of our walls, that values equality, diversity and where everyone can contribute at the highest level and have their voices heard. For us, this means hiring and developing the best people across all races, ethnicities, religions, age groups, sexual orientations and gender identities. We would actively discourage any photos, personal letters or disclosure of any information that concerns other information than your professional experience.
Share this role",-1.0,-1,https://indeed.nl/rc/clk?jk=b91ff56cd98b7b9f&from=vj&mvj=0&vjfrom=vjs&pos=bottom&astse=1630acd49ee8d7d6&assa=7450,https://nl.indeed.com/vacature-bekijken?jk=b91ff56cd98b7b9f&fccid=3ed5bdcf16e31d00&vjs=3,8 dagen geleden,8 dagen geleden,2021-02-28
information,Indeed,p_0f9e0769342034de,"Basel Expert, with focus on Regulatory Implementation",ABN AMRO Bank, Amsterdam,"We are looking for an additional colleague in the Basel Centre with a general role in supporting and overseeing the implementation of prudential regulation. Your role is to support the management of prudential regulatory risk from a second line of defense perspective. The role comprises a wide variety of activities. If you are familiar with Basel/CRD framework on banking supervision, possess excellent communications skills and if you are eager to learn and develop yourself, then you could be our new colleague!
Your job
The Basel Centre is a team of experts that focusses on the interpretation of the Basel/CRD framework, with a view of supporting the management of regulatory risk for the bank in significant discussions and decision processes. This vacancy fits within the responsibility of the team to the share knowledge on prudential regulation. Your role will be very diverse and will range from writing detailed implementation standards to assisting in the preparation of briefings and advises to senior management on the management of regulatory risk. As part of your work, you will have to build up considerable knowledge on the regulatory framework.
You use your knowledge of the Basel/CRD framework to write principles and standards for implementation, to help the implementation process in other second line departments and to review the implementation in specific cases. Other tasks of the team include tracking and interpreting new publications on prudential regulation, providing overview and guidance to related teams and informing senior management where relevant. It is expected that you develop your knowledge and skills. Your direct colleagues are supporting you in your personal development and knowledge gathering.

Working environment
Our team is part of the larger Enterprise Risk Management Network of the Central Risk Management Division and shares capacity and knowledge within that network. In particular we support our colleagues of the Risk Policies teams, who are implementing the CRD/CRR framework in the internal risk policies of ABN AMRO. The vacant position offers opportunities to develop your knowledge of the Basel/CRD framework in a broad context and develop your communicative skills. The way of working of the Enterprise Risk Management Network offers great opportunities to learn more about the wider set-up of ABN AMRO’s risk management.

Your profile
You are a great candidate to become our new colleague, if you meet the following description:
You have some experience with the Basel/CRD framework.
You are looking forward to stakeholder management and engaging in discussions.
You have excellent communications skills, especially in writing. Fluency in English is required. Fluency in Dutch is a significant advantage.
You have the competence the explain the details of prudential regulation to colleagues with various backgrounds and experiences
You have an appetite to learn more about the Basel/CRD framework, the internal organisation of ABN AMRO, as well as about the European legislative process.

We will evaluate candidates based on their individual qualities as well as on the basis of their added value to the skills, knowledge and diversity of the team.

We are offering
The opportunity to be the best you can be, work flexible hours and lots of room to grow both personally and professionally
A salary ranging from EUR 47.615 to EUR 68.003 per year based on a 36-hour workweek
A supplementary benefit budget of 11%, which you can spend on additional fringe benefits
A personal development budget of EUR 1.000 per year
An annual public transportation pass or travel budget, depending on the function
A solid pension plan
Interested?
For more information please contact Candice Pelger, Head Central Regulations & Policies: Candice.Pelger@nl.abnamro.com or Jesse Kaijser, Head Basel Centre: Jesse.Kaijser@nl.abnamro.com, or send your online application.",-1.0,-1,https://indeed.nl/rc/clk?jk=0f9e0769342034de&from=vj&mvj=0&vjfrom=vjs&pos=bottom&astse=b2928c5be96b137b&assa=9610,https://nl.indeed.com/vacature-bekijken?jk=0f9e0769342034de&fccid=e89599deea2fe85c&vjs=3,8 dagen geleden,8 dagen geleden,2021-02-28
information,Indeed,p_67fed2b6f1880a4e,Regional D2C Demand Planning Operation Specialist (f/m/d),Beiersdorf NV Netherlands, Amsterdam,"Your Tasks
Lead the S&OP process (Sales & Operation Planning) to ensure high quality of the sales forecast for the European
eShops assortment together with Sales, Marketing and Controlling

Control and coordination of sales planning: ensuring the flow of information to the functions involved, e.g. in bottleneck management
or in the launch / relaunch control and in the monthly coordination meetings in sales & operation planning

Steering and monitoring of external FSP to ensure smooth operation
Coordinate the day-to-day operation for the eShop with FSP and the Beiersdorf internal departments
Support specific supply planning activities: leftover & scrapping management, monitor o/o stock, manual replenishment orders
Continuous improvement of the internal fulfillment processes with the FSP and across the supply chain network
FSP KPI´s / invoice approval
Analysis & reporting
Member of D2C Teams
Your Profile
Technical or Economics University Degree
Minimum 3 years of relevant business experience in Supply Chain function (Demand & Supply planning and / or Logistics will be appreciated)
S&OP experience
Experience with Cosmetic or Therapeutic products is a plus
Familiar with dynamics in E-commerce field
Very good knowledge of SAP, especially SAP R / 3, APO
Analytical team player who convinces with very good communication skills
Good knowledge of MS Office, especially Excel
Self-motivated, strong follow up and diplomatic skills
Fluent in English, second language advantageous
ADDITIONAL INFORMATION
You are welcome to apply without a cover letter.
If you want to attach a cover letter, please upload it with your resume.",-1.0,-1,https://indeed.nl/rc/clk?jk=67fed2b6f1880a4e&from=vj&mvj=0&vjfrom=vjs&pos=bottom&astse=a3343dc588e22a54&assa=1450,https://nl.indeed.com/vacature-bekijken?jk=67fed2b6f1880a4e&fccid=3efbdc3610149ea1&vjs=3,8 dagen geleden,8 dagen geleden,2021-02-28
