Data Row,Search Keyword,Platform,Job ID,Job Title,Tracking ID,Company Name,Location,Industry,Job Description,Employment Type,Company URL,Job URL,Job Age,Job Age Number,Job Date,Collection Date
112,author,LinkedIn,2296655988,Sr Scientist Fill Finish Process Development,EMQyZEhYRM+roP3PI7yULA==,University of North Carolina at Chapel Hill,"Leiden, South Holland, Netherlands","['Research', 'Biotechnology', 'Pharmaceuticals']","IntroductieAt Janssen Vaccines  Prevention BV, part of Johnson  Johnson, we are dedicated to bringing meaningful innovation to global health Our team focuses on the development of novel therapeutics and vaccines to treat, cure and prevent complex infectious diseases The Corona pandemic has a huge impact on public life and the world economy Besides Corona, these range from respiratory infections like Respiratory Syncytial Virus RSV to Human Immunodeficiency Virus HIV and pathogens of global concern such as Polio and EbolaDe functie  The roleThe FillFinish Process Development group within the Drug Product Development department is responsible for early and latestage process development activities in drug product manufacturing The developed manufacturing processes are transferred to external GMP production facilities to produce clinical batches as well as for scaledup process validationverification and commercial manufacturing This is done in close collaboration with both internal and external partners Would you like to be part of our team to contribute to this game changing development and bring life threatening diseases to a haltAs Senior Scientist FillFinish Process Development you will be working in a multidisciplinary team on the process development and technology transfer of several innovative vaccines and your main responsibilities are toLead teams of motivated FillFinish process developersDevelop and execute Drug Product early and latestage process development and tech transfer strategiesEstablish and maintain a trustful and professional relationship with the different stakeholders from other departments within the company as well as with external partnersAct as senior author in the preparation of presentations, technical reports, documents for regulatory filing and patentsCreate and manage research plans with great complexity in the delivery of business resultsRepresent the FillFinish Process Development group in multidisciplinary project teamsLead and participate in specialized committees, as appropriate to ensure continuous improvement on departmental and project levelHet profiel  Your profileQualificationsPreferably a PhD degree or MSc degree in biopharmaceutical sciences, biotechnology or related fieldsA minimum of 7 years of experience in latestage pharmaceutical development and GMP drug product manufacturing, including technology transfersExperience with two or more of the following life cycle process validation regulatory submission writing technology transfer process improvementsYou work with passion and demonstrate strong leadership and initiativeYou can analyze problems on a high levelYou have a critical attitude and a strong scientific and quality mindsetOur highly dynamic environment requires you to have a strong work ethic, be resilient to change and be creativeGood communication and interpersonal skills with different stakeholdersProject management skillsExcellent written and oral communication skills in EnglishHet aanbod  The offerYour development is key to us, and we consider it our daytoday responsibility We believe we can make a difference together and take your career seriously Through onthejob and development trainings, projects and various programs, we ensure your personal and professional growth Via multiple employee benefits, our company offers support for you and your family now and in the futureSolliciteer hierIndien u verwijst naar een ongeldig webadres, is de vacature hoogstwaarschijnlijk inmiddels vervuld Attendeer FMF hieropGegevensJanssen Vaccines  PreventionJohnson  JohnsonLeidenGeplaatst op FMFFarma  Biotech, MedicalRDWOacademisch  MSc, PhD510 jaar,  10 jaar",Full-time,https://www.linkedin.com/jobs/view/externalApply/2296655988?url=https%3A%2F%2Fnl%2Ejooble%2Eorg%2Fexternal%2F-6520107188706038135%3Futm_campaign%3DNL%26utm_medium%3Dsocial%26utm_source%3Dlinkedin%26JobSource%3DBoard&urlHash=xIJS&refId=daff5548-ba82-4a9f-99fc-5c395702108f&trk=public_jobs_apply-link-offsite,https://nl.linkedin.com/jobs/view/sr-scientist-fill-finish-process-development-at-university-of-north-carolina-at-chapel-hill-2296655988?refId=daff5548-ba82-4a9f-99fc-5c395702108f&position=12&pageNum=4&trk=public_jobs_job-result-card_result-card_full-click,4 days ago,4 days ago,2020-11-13,2020-11-18
113,author,LinkedIn,2280127774,Molecular and Bioassay Scientist,AR+h+h/nSvCUcdO1xQYogA==,Real Staffing,"Leiden, South Holland, Netherlands","['Staffing and Recruiting', 'Biotechnology', 'Pharmaceuticals']","Our departmentThe Molecular and Bioassay MBA team is a dynamic group 35 team members, which is part of Analytical Development AD, responsible for developing methods to characterize our vaccines Together, we use biological and chemical technologies to assess quantity, potency, purity, and identity characteristics of our products We have a pivotal role between the regulatory authorities, quality unit and process developmentWe are looking for a scientist whoThe perfect candidate will have a PhD degree or equivalent with 15 years of postdoctoral experience in a relevant field of cellbased or molecular assays, life sciences and or virology Experience in the pharmaceutical industry or ICH method development or GMP is highly preferableThe candidate demonstrates strong leadership, interpersonal and teambuilding skills Importantly, you have a critical attitude and value accuracy in the execution of your work and that of others We value an ethical working environment, as described in our Credo, where trust, diversity and inclusion is the fundament for success",Full-time,https://www.linkedin.com/jobs/view/externalApply/2280127774?url=https%3A%2F%2Fwww%2Erealstaffing%2Ecom%2Fen-jp%2Fjob%2Fmolecular-and-bioassay-scientist%2FRE-33562605%3Futm_source%3Dlinkedin%26utm_medium%3Dwrapped_jobs&urlHash=A8gC&refId=daff5548-ba82-4a9f-99fc-5c395702108f&trk=public_jobs_apply-link-offsite,https://nl.linkedin.com/jobs/view/molecular-and-bioassay-scientist-at-real-staffing-2280127774?refId=daff5548-ba82-4a9f-99fc-5c395702108f&position=13&pageNum=4&trk=public_jobs_job-result-card_result-card_full-click,4 days ago,4 days ago,2020-11-13,2020-11-18
114,author,LinkedIn,2260059982,"Medical Education Director - Cardio, ID, Immunology",1WRv25R5S2CYNk+dyOtVvA==,Medscape,"Amsterdam, North Holland, Netherlands","['Internet', 'Online Media']","Medscape, a division of WebMD, develops and hosts physician portals and related mobile applications that make it easier for physicians and healthcare professionals to access clinical reference sources, stay abreast of the latest clinical information, learn about new treatment options, earn continuing medical education credits and communicate with peers",Full-time,https://www.linkedin.com/jobs/view/externalApply/2260059982?url=https%3A%2F%2Fapp%2Ejobvite%2Ecom%2Fj%3Fcj%3DojxQdfwD%26s%3Dlinkedin_job_slots_%28paid%29&urlHash=L3WG&refId=daff5548-ba82-4a9f-99fc-5c395702108f&trk=public_jobs_apply-link-offsite,https://nl.linkedin.com/jobs/view/medical-education-director-cardio-id-immunology-at-medscape-2260059982?refId=daff5548-ba82-4a9f-99fc-5c395702108f&position=14&pageNum=4&trk=public_jobs_job-result-card_result-card_full-click,4 days ago,4 days ago,2020-11-13,2020-11-18
115,author,LinkedIn,2279974010,Scientist Molecular Bioassays,0CAeD59FSPGGjNGS2VRwtg==,CheckMark Labrecruitment,"Leiden, South Holland, Netherlands","['Research', 'Biotechnology', 'Pharmaceuticals']","Info over het bedrijfA global biotech company that focuses on the development, production and marketing of vaccines, recombinant proteins and antibodies to prevent and combat infectious and other diseases The Molecular Bioassay MBA team is part of the Analytical Development AD group and is responsible for developing methods that are employed to analyze and characterize virus based vaccinesFunctieomschrijvingAre you a motivated postdoc and are you expertised with techniques as ELISA, qPCR, cell culturebased assays and NGS As a Scientist Molecular Bioassays, you you will act as a technical lead to strengthen the product development strategy Interested Apply nowIn this role as a Scientist Molecular Bioassays, you will develop bioassays for characterization of vaccines You will act as a technical lead to strengthen the product development strategy of the MBA teamFunctieeisenFor the position of Scientist Molecular Bioassays we are looking for a PhD canddiate with 25 years postdoctoral experience in a relevant field of cellbased or molecular assays, life sciences and or virologyAanbodSollicitatieprocedureNeem voor meer informatie contact op met Jurjen Wilschut click apply  click applyVacaturenummer 6751",Full-time,https://www.linkedin.com/jobs/view/externalApply/2279974010?url=https%3A%2F%2Fnl%2Ejooble%2Eorg%2Fexternal%2F-8139177318742996864%3Futm_campaign%3DNL%26utm_medium%3Dsocial%26utm_source%3Dlinkedin%26JobSource%3DBoard&urlHash=XUXz&refId=daff5548-ba82-4a9f-99fc-5c395702108f&trk=public_jobs_apply-link-offsite,https://nl.linkedin.com/jobs/view/scientist-molecular-bioassays-at-checkmark-labrecruitment-werving-selectie-en-detachering-in-chemie-en-life-sciences-2279974010?refId=daff5548-ba82-4a9f-99fc-5c395702108f&position=15&pageNum=4&trk=public_jobs_job-result-card_result-card_full-click,4 days ago,4 days ago,2020-11-13,2020-11-18
116,author,LinkedIn,2197040474,ILS & Change Management engineer,lvvejuWXTc2X6azdiPFRrw==,GKN Aerospace,"Papendrecht, South Holland, Netherlands","['Construction', 'Aviation & Aerospace', 'Mechanical or Industrial Engineering']","About UsGKN Aerospace is the worlds leading multitechnology tier 1 aerospace supplier With 50 manufacturing locations in 15 countries, we serve over 90 of the worlds aircraft and engine manufacturers We design and manufacture innovative smart aerospace systems and components Our technologies are used in aircraft ranging from the most used single aisle aircraft and the largest passenger planes in the world to business jets and the worlds advanced 5th generation fighter aircraftGKN Aerospace is a global engineering business Every time you travel by air almost anywhere in the world, it is likely that GKN is helping you on your way We design, manufacture and service systems and components for original equipment manufacturers around the world We are continuously evolving, pioneering new technologies and reinventing existing ones, stretching ourselves to be better in everything we doWe are looking for people who want to make a difference, talented members with the skills and passions to become the best of the future in what they doAs part of the Integrated Logistics Support ILS service, we need to direct the Internal ILS change management process Any change requests or proposals need to be processed Current backlog of ECRECP is a growing number year by year, and the volume of activities for the ILS department has increased dramatically The Change ManagementILS Engineer sets the requirements on the ILS Process for every ECRECP in the backlog This is done by participating in the Design Build  Support Teams that assist in the processing of the CM process and creating the Fokker Impact Analysis Document FIAD You participate in the Technical Solution Meeting TSM and creates the MSRYou take the lead and inform the various other ILS disciplines in what change is to be incorporated Based on the FIAD content a planning is realized You followi up progress in the LSA processMSG3 analysis update You discusses based on the FIAD and content the changes with the ILS Tech Pub lead Together they determine the information required for the Tech Pub Manager to start his internal process Source data ECP content  orthographic engineering drawings, The engineering data base general aircraft technical documentation and CAD 3D model information, is provided to the IPD Engineers as such they can plan to incorporate Class 2 ECP into their Database In case an SB is deemed required to inform the fleet, the Engineer takes the lead to have this SB created Written An SB author is available to the engineer to physically create the SB Where applicable, the creation of the DARAMP is also the responsibility of the CMILS EngineerBesides an innovative and international work environment that offers you a good worklife balance , We offer you opportunities to learn and grow, a competitive salary, pension plan, 40 days off and travel allowance from 10 km single journey as wellFor more information about this job please contact our recruiters via recruitmentsupportfokkercomDo you like to come on board Apply directly with your CV and motivation via the apply now buttonDiversity and InclusionAs a global engineering company, innovation is what differentiates us from our competitors and is central to our successA balance of cultures, ethnicities and genders help bring new ideas and creativity to GKN We need people of different backgrounds, with different skills and perspectives to spark originality, imagination and creativeness in our teams around the worldGKN is an equal opportunity employerWe treat all our employees and applicants fairly and are committed to ensuring that there is no discrimination or harassment against any employee or qualified applicant on the grounds of age, race, creed, color, national origin, ancestry, marital status, affectional or sexual orientation, gender identity or expression, disability, nationality, sex, or veteran status or any other characteristic protected by law",Full-time,https://www.linkedin.com/jobs/view/externalApply/2197040474?url=https%3A%2F%2Fcareers%2Egknaerospace%2Ecom%2Fjob%2FPapendrecht-ILS-%26-Change-Management-engineer%2F626196501%2F%3Flocale%3Den_GB&urlHash=-9_6&refId=daff5548-ba82-4a9f-99fc-5c395702108f&trk=public_jobs_apply-link-offsite,https://nl.linkedin.com/jobs/view/ils-change-management-engineer-at-gkn-aerospace-2197040474?refId=daff5548-ba82-4a9f-99fc-5c395702108f&position=16&pageNum=4&trk=public_jobs_job-result-card_result-card_full-click,4 days ago,4 days ago,2020-11-13,2020-11-18
117,author,LinkedIn,1989652414,"Global Solutions Architect - Global Accounts, Automotive",Y+mSUgyrTUaaPA4BTGLLuQ==,Amazon Web Services AWS,"Amsterdam, North Holland, Netherlands","['Computer Software', 'Information Technology and Services', 'Internet']","DescriptionAmazon Web Services AWS is looking for experienced and motivated technologists who possess a unique balance of technical depth and strong interpersonal skills You will partner some of the worlds largest companies, to craft highly scalable, flexible and resilient cloud architectures that address customer business problems and accelerate the adoption of AWS services in the Automotive domain As a trusted customer advocate, the solutions architect will help organizations understand best practices around advanced cloudbased solutions, and how to migrate existing workloads to the cloud You will have the opportunity to help shape and execute a strategy to build mindshare and broad use of AWS within enterprise customers The ability to connect technology with measureable business value is critical to a solutions architect You should also have a demonstrated ability to think strategically about business, products, and technical challengesBe great fun to work withAt AWS, we have a credo of Work hard Have fun Make history In this role, you will love what you do, and instinctively know how to make work fun You will be dynamic and creative, and willing to take on any challenge and make a big impactEnjoy working with large, global customers You will have a passion for educating, training, designing, and building cloud solutions for a diverse and challenging set of enterprise customersHave a strong understanding of large scale computing solutions in the Automotive domain You will enjoy keeping your existing technical skills honed and developing new ones, so you can make strong contributions to deep architecture discussions You will regularly take part in deepdive education and design exercises to create worldclass solutions built on AWSRoles and Responsibilities AWS EMEA SARL NetherlandsJob ID A1056286",Full-time,https://www.linkedin.com/jobs/view/externalApply/1989652414?url=https%3A%2F%2Fwww%2Eamazon%2Ejobs%2Fjobs%2F1056286%2Fglobal-solutions-architect-global-accounts-automotive%3Fcmpid%3DSPLICX0248M%26utm_source%3Dlinkedin%2Ecom%26utm_campaign%3Dcxro%26utm_medium%3Dsocial_media%26utm_content%3Djob_posting%26ss%3Dpaid&urlHash=J4eu&refId=daff5548-ba82-4a9f-99fc-5c395702108f&trk=public_jobs_apply-link-offsite,https://nl.linkedin.com/jobs/view/global-solutions-architect-global-accounts-automotive-at-amazon-web-services-aws-1989652414?refId=daff5548-ba82-4a9f-99fc-5c395702108f&position=17&pageNum=4&trk=public_jobs_job-result-card_result-card_full-click,4 days ago,4 days ago,2020-11-13,2020-11-18
118,author,LinkedIn,2234543730,Principal Systems & Applications Engineer for Analog & Logic ICs,DF5qs9PFR++uMnU0DSkwBw==,Nexperia,"Nijmegen, Gelderland, Netherlands",['Semiconductors'],"Nexperia is a worldclass company in semiconductor development and inhouse production We form a global network of talent, with passion and performance, perseverance and professionalism Join TeamNexperia and become part of a leading company that supports, rewards and challenges you equally, in a dynamic environment, working for worldclass results Talk to us today and learn your true capabilities in an energetic company where you will develop and thrive, the Efficiency Company  ",Full-time,https://www.linkedin.com/jobs/view/externalApply/2234543730?url=https%3A%2F%2Fnexperia%2Ewd3%2Emyworkdayjobs%2Ecom%2Fcareers%2Fjob%2FNijmegen%2FEMEA-Product-Development-Engineer_R-20003144%3Fsource%3DLinkedin&urlHash=zs_D&refId=daff5548-ba82-4a9f-99fc-5c395702108f&trk=public_jobs_apply-link-offsite,https://nl.linkedin.com/jobs/view/principal-systems-applications-engineer-for-analog-logic-ics-at-nexperia-2234543730?refId=daff5548-ba82-4a9f-99fc-5c395702108f&position=18&pageNum=4&trk=public_jobs_job-result-card_result-card_full-click,4 days ago,4 days ago,2020-11-13,2020-11-18
119,author,LinkedIn,2295362456,(Medior/ Senior) Software Engineer Vehicle Dynamics,jQeSkYeDSp2xynQlP0+KQA==,Trinamics,"Eindhoven, North Brabant, Netherlands","['Electrical/', 'Electronic Manufacturing', 'Information Technology and Services', 'Computer Software']","IntroductionAs Software Engineer Vehicle Dynamics you are responsible for the engine afterthreatment sub domain In this job you secure all the knowledge and having the technical lead within the domain You need to create architecture within this functional area, in agreement with the function lead engineer Want to know more Read on and contact Anne for more informationOrganizationWorld Leader in the development and production of excellent light, medium and heavy commercial vehiclesAs Software Engineer Vehicle Dynamics you are responsible for the engine afterthreatment sub domainFunctionAs Software Engineer Vehicle Dynamics you are responsible for the engine afterthreatment sub domain In this job you secure all the knowledge and having the technical lead within the domain You need to create architecture within this functional area, in agreement with the function lead engineer You discuss functional requirements in your functional area with the author of the technical requirement documents Besides that you support embedded software engineers in designing and testing software implementation As a central point of contact youll be responsible for planning and reporting status of issues in your domain, in agreement with the functional lead engineerBSc MSc PhD with a specialization control theory, mechanical or automotive engineeringRelevant experience in the engine aftertreatment functional domainKnowledge of embedded software design and experience with real time embedded systemsExperience with Aspice CANbus Matlab Simulink Stateflow is a prAnalyticFluent in EnglishStrong personal skillsOfferA competitive salary based on your experience and educationGood secondary conditions such as 25 holidays, Flexible work hours and 8 holiday allowanceCourses to develop yourself professionally and personallyDiscount on your healthcare and referral bonussesNice yearly events with the Trinamics teamInformationAre you interested in this position andor do you have any questions Feel free to contact Anne Zijlmans on 076 548 73 73 or send your rsum to azijlmanstrinamicsnlApplicationAnne Zijlmans 0765487373",Full-time,https://www.linkedin.com/jobs/view/externalApply/2295362456?url=http%3A%2F%2Ftrinamics%2Ecarerix%2Ecom%2Fcxportal%2Fjobdetails%2F6570%2FRegio-Eindhoven%2F%28Medior-Senior%29-Software-Engineer-Vehicle-Dynamics%2Ehtml&urlHash=8zw5&refId=daff5548-ba82-4a9f-99fc-5c395702108f&trk=public_jobs_apply-link-offsite,https://nl.linkedin.com/jobs/view/medior-senior-software-engineer-vehicle-dynamics-at-trinamics-2295362456?refId=daff5548-ba82-4a9f-99fc-5c395702108f&position=19&pageNum=4&trk=public_jobs_job-result-card_result-card_full-click,4 days ago,4 days ago,2020-11-13,2020-11-18
