Search Keyword,Platform,Job ID,Job Title,Company Name,Location,Job Description,Rating,Employment Type,Company URL,Job URL,Job Age,Job Age Number,Collection Date
information,Indeed,p_17eb54a76f49d4e2,TCS – Customer Experience Improvement Officer,Nissan Motor Parts Center, Amsterdam,"Vacature TCS – Customer Experience Improvement Officer
Nissan is one of the largest car manufacturers in the world. Nissan in Europe commits to creating customer value and shifting expectations. Not only by introducing trendsetting cars like the QASHQAI, Micra, Juke, LEAF and GT-R, but also by providing top level service to customers.
Department information

NISA’s “Total Customer Satisfaction” (TCS) organization based in the European region and responsible end to end for customer satisfaction. This responsibility is for both “product” as well as “experience” throughout the complete lifetime of the customer journey.


As part of TCS - Customer Experience Quality (CEQ); Experience Quality improvement (EQI) team is leading such topics as Vehicle Campaign completion, Experience investigation, Dealer Warranty Compliance Audits, Nissan Connected Services Off board Taskforce. Team’s objective is to identify & resolve key customers issues through Gemba (audits) and ensure consistent customer experience processes are applied.
Purpose

We are an aspiring organization, and we are looking for an innovative and creative team member with strong analytical skills to join our Experience Quality improvement team. Nissan is positioned to become Top 3 automotive manufacturer in Sales and Service Quality (S&S) in Europe. The EQI team plays a vital role to achieve this objective.


Primary role and responsibilities
Managing Analysis of out of line behavior (Sales & Service) of the dealer network.
Establish, Monitor and Coordinate Dealer Gemba programme activities, and Support the European markets / RBUs to deliver their action plan to improve Customer Experience level.
Lead Nissan Connected Services (CS) Taskforce, with the aim to improve the overall Customer satisfaction through continues follow up on latest CS top concerns.
Profiel TCS – Customer Experience Improvement Officer
Qualifications & Skills
Education level: Bachelor degree (HBO);
Self-starter and used to work without day to day supervision, able to respond to changes and ability to take on new tasks.
Strong analytical skills
Comfortable to switch between defining new ideas and Hands on approach.
You function well in a small team and have a great sense of responsibility.
Excellent communication skills verbal and in writing, both in Dutch and English and preferably in a third language such as German and / or French;
You are easily approachable and have a sensible approach working with different people at different levels e.g. Markets and senior management.
Office package proficiency (Excel, Word, Outlook, PowerPoint and Access)
Contact
Interested?
If you are interested in this unique international function, please sent your application to Elvir Petinic e.petinic@nissan-europe.com",-1.0,-1,https://indeed.nl/rc/clk?jk=17eb54a76f49d4e2&from=vj&mvj=0&vjfrom=vjs&pos=bottom&astse=0cdfd2555aad1048&assa=272,https://nl.indeed.com/vacature-bekijken?jk=17eb54a76f49d4e2&fccid=138c5e0515aa3e4c&vjs=3,29 dagen geleden,29 dagen geleden,2021-02-28
information,Indeed,pj_8550ad27448b463e,Programme Management Engineer - Germany (Darmstadt),EUMETSAT, Nederland,"EUMETSAT is Europe’s meteorological satellite agency - monitoring the weather and climate from space - 24 hours a day, 365 days a yearEUMETSAT is an international organisation employing staff from across all 30 member states and this role is being advertised on multiple international job boards, but please note that this role would be based in Darmstadt, Germany and would require international applicants to relocate if successful.We are currently looking for an experienced Programme Management Engineer to join our international team of young and inspiring engineers and industry professionals, tasked with driving innovation within the Space, Satellite and Earth Observation sector.This role is rooted in EUMETSAT’s commitment to the European Union's Copernicus Earth observation programme and will provide the opportunity to work with leading IT, Space and Earth Observation organisations and domain experts to make a positive impact on society!BACKGROUNDBuilding on its multi-mission infrastructure and synergies with its own missions, EUMETSAT is the operator of those Copernicus missions dedicated to ocean (Jason-3, Sentinel-3) and atmospheric composition (Sentinel-4 and Sentinel-5) monitoring.Through its Copernicus Mission Development Division (CMD), EUMETSAT also cooperates with European Space Agency in the design and development of future and next generation Sentinel satellite systems, focusing on system-level and Ground Segment activities.Reporting to the Head of CMD Division the Programme Support Engineer provides Programme/Project Management support to programmes and projects under preparation or development.This includes programme planning and scheduling and supervising the contracted CMD programme planning and scheduling service, action management, progress tracking, analysis & reporting and programmatic support to technical, cost, schedule and risk assessments.DUTIES · Ensure coordination on Programme/Project Management methodologies across CMD programmes/projects;· Support H/CMD and CMD Programme/Project Managers in their day-to-day management activities, including baseline changes;· Regularly review and analyse the programmes’ schedule(s), status of deliverables and identify any issues for action or resolution within EUMETSAT or with international partners;· Support the generation of progress reporting to CMD and PRD management and the Copernicus Programme Office (CPO). This includes also the definition, maintenance and improvement to the analysis of key performance indicators and programme management dashboards;· Generate and maintain registers of risks and other critical issues relevant for the CMD programmes/projects and support the risk management & mitigation process.· Prepare and support internal and external management meetings across the programmes; record actions from these meetings and follow up these actions, reporting any criticalities to the programme/project managers and H/CMD;· Interface with different matrix functions in the organisation especially supporting interactions between Programme/Project Managers and EUMETSAT administrative and supporting divisions, as well as with the EUMETSAT Copernicus Programme Office (CPO) and PRD Programme Management Office (PMO), as required. This includes:· Support the definition, maintenance and continuous improvement of Programme / Project Management Plans, tailoring of processes and working practises compliant with the applicable Organization Management System.· Support Programme Managers in the definition and maintenance of plans and agreements with external partners.· Support the structuring and costing of new activities in CMD.SALARY AND BENEFITS· Excellent salary, of up to Euro 6,500 NET (after tax) based on skills and experience;· Flexible working time including additional flexi-leave;· Full medical coverage for employee and family;· Attractive pension;· 30 days of annual leave + 14.5 days public holidays;· Training and development support;· Relocation allowance and support (if applicable).SKILLS AND EXPERIENCE· Proven experience in project management preferably in the frame of international space development programmes. A Programme/Project management certification (e.g. PMP, PRINCE 2) is considered an asset.· Proven technical understanding of complex system development. Experience with Earth Observation space systems is considered an asset.· Demonstrated transversal attitude and proven ability to manage and facilitate complex interfaces, both technically and programmatically.· Ability to understand, synthesise, and report on complex technical and programmatic issues and appreciate conflicting interests.· Familiarity of quality assurance processes, procedures and continuous improvement cycles (PDCA). Proficient use of MS Office, MS Project; use of SAP and web based collaboration platforms for reporting and/or actions management is advantageous.· Good interpersonal skills with proven ability to apply them to the management of a team and to the interactions with other teams are essential.QUALIFICATIONS· University degree or equivalent vocational experience.More about usEUMETSAT’s role is to establish and operate meteorological satellites to monitor the weather and climate from space - 24 hours a day, 365 days a year. This information is supplied to the National Meteorological Services of the organisation's Member and Cooperating States in Europe, as well as other users worldwide. EUMETSAT also operates several Copernicus missions on behalf of the European Union and provide data services to the Copernicus marine and atmospheric services and their users. As an intergovernmental European Organisation, EUMETSAT can recruit nationals only from the 30 Member States (Austria, Belgium, Bulgaria, Croatia, Czech Republic, Denmark, Estonia, Finland, France, Germany, Greece, Hungary, Iceland, Ireland, Italy, Latvia, Lithuania, Luxembourg, The Netherlands, Norway, Poland, Portugal, Romania, Slovakia, Slovenia, Spain, Sweden, Switzerland, Turkey and the United Kingdom). Benefits:Work from home opportunitiesFlexible working hoursCompany pensionJob Types: Full-time, PermanentSalary: Up to €6,500.00 per monthCOVID-19 considerations:EUMETSAT strictly follows the COVID guidance of the German Government. Only essential operational personnel are working on site with all others working remotely. All meetings and interviews are conducted online. All unnecessary travel is cancelled.",-1.0,-1,https://indeed.nl/rc/clk?jk=8550ad27448b463e&from=vj&sjdu=BLn5dotXP-NTIXmhDy__H8KYTtNNAjTHcAXmF3JFhyIgf8hHmIet5CrATTdNGTWS&spon=1&adid=364002280&mvj=0&vjfrom=vjs&pos=bottom&ad=-6NYlbfkN0A09mPrzln9NJBCwAnKZvb5Xsb06nEC_MDbi1tjHwjGCXb6ZlrAeCYDb1MeP8URlVWB3FRyoBXqEYOWKre5aEcHKDqOk52pRg4zCbLwOSRIhie_5iUFPDX3QkB-5b5Q_z4aUoo-Q-97MRrFRQvxD68OEhT2AMc9utiFc7uzCI47bcCbFa8IhG4Niip5Ouj3suOhVYdwBSi3hRpVXr8byZ7egBNuxb4S1T-Ki-xW8tzRTt8gadogvGcCdWaLXU6NnEzSFK6WDQ8vNpJZ0q7P-sw235VENxXypXX2UduLopZxMoVYD9Gu5VNGnjJz6B4nHuXzrweQ7mvpwj8-YtzB_iGwBvmeV6m9bA5enBAHEvcYoMjjtoO5dWoInPWkD6DhfigpUErAjdwpnIft8mI8V5DNDFGjoxW5LDd2nD5b_Ur9-gt4TYZSyCcP&astse=ab6bfed97e2637cc&assa=9175,https://nl.indeed.com/vacature-bekijken/pagead/clk?mo=r&ad=-6NYlbfkN0A09mPrzln9NJBCwAnKZvb5Xsb06nEC_MDbi1tjHwjGCXb6ZlrAeCYDb1MeP8URlVWB3FRyoBXqEYOWKre5aEcHKDqOk52pRg4zCbLwOSRIhie_5iUFPDX3QkB-5b5Q_z4aUoo-Q-97MRrFRQvxD68OEhT2AMc9utiFc7uzCI47bcCbFa8IhG4Niip5Ouj3suOhVYdwBSi3hRpVXr8byZ7egBNuxb4S1T-Ki-xW8tzRTt8gadogvGcCdWaLXU6NnEzSFK6WDQ8vNpJZ0q7P-sw235VENxXypXX2UduLopZxMoVYD9Gu5VNGnjJz6B4nHuXzrweQ7mvpwj8-YtzB_iGwBvmeV6m9bA5enBAHEvcYoMjjtoO5dWoInPWkD6DhfigpUErAjdwpnIft8mI8V5DNDFGjoxW5LDd2nD5b_Ur9-gt4TYZSyCcP&p=16&fvj=1&vjs=3,29 dagen geleden,29 dagen geleden,2021-02-28
information,Indeed,pj_7340be78c1e57ea6,Facilities Management Engineer - Germany (Darmstadt),EUMETSAT, Nederland,"EUMETSAT is Europe’s meteorological satellite agency - monitoring the weather and climate from space - 24 hours a day, 365 days a year.EUMETSAT is an international organisation employing staff from across all 30 member states and this role is being advertised on multiple international job boards, but please note that this role would be based in Darmstadt, Germany and would require international applicants to relocate if successful.Working for EUMETSAT, you can make a world of difference and be a part of something that makes a positive impact on society. You will be at the cutting edge of satellite technology, with a meaningful role in an organisation focused on space-based observations of the Earth’s weather and climate.Within the General Services Division, the Facility Management Technician supports the maintenance, installation and development of the EUMETSAT Headquarters Buildings, their facilities, infrastructure and services. This includes direct coordination and supervision of providers of maintenance services, performance of infrastructure testing and technical inspections, and hands-on activities in the area of technical building infrastructure. He/she participates in the activities of the stand-by and call-out team of the Division. The Facility Management Technician is member of a team of engineers and technicians reporting to the Technical Facilities Manager.What you’ll be doing· Support the maintenance of the EUMETSAT technical building infrastructure at its Headquarters in Darmstadt; with a focus on the field of electrical power supply and electronic security systems and other building systems like HVAC systems, lifts, doors, building and fire security systems etc.;· Supervise and coordinate technical service providers for maintenance and installation activities. Coordinate, plan and schedule maintenance activities, extensions and refurbishments to assigned technical installations and systems.;· Perform regular technical inspections of EUMETSAT’s building infrastructure including recording of anomalies and follow-up their processing. Perform regular functional checks of technical building infrastructure such as monthly sprinkler test, diesel generator exercises etc.;· Perform small installation works and repairs, resolve and follow-up trouble tickets related to technical infrastructure received via service desk;· Perform formal procurement activities for the assigned technical installations and systems;· Support the Facility Management documentation activities;· Participate in the Technical Facility Management stand-by and call out team.What we offer· EUMETSAT is an intergovernmental agency that is exempt from German income tax. We offer an excellent salary, of up to 6000 NET (after internal deductions) which is negotiable based on skills and experience· Flexible working time including additional flexi-leave· Private medical coverage for employee and family· Attractive final salary pension· 30 days of annual leave + 14.5 days public holidays· Training and development support· Relocation allowance and support (if applicable)RequirementsQualifications· Full secondary education and appropriate professional qualifications and experience as electrical technician;· A master craftsmen or state-certified-technician degree or similar education and training would be advantageous.Skills and Experience: · Proven experience in the area of technical building systems and installation of such systems preferably in an ISO 9001-certified environment and according to formal documentation of working practices and procedures;· Knowledge of rules and standards applicable in the field of electrical installations and systems;· Computer skills and, in particular, a good knowledge of MS Office, Outlook, CAD Software (Autocad) and CAFM systems;· Knowledge of occupational health & safety, security and fire prevention;· Experience and skills in administrative/technical support and capacity to work independently;· Strong analytical, problem solving and communication skills, and the ability to work within a team.Language: · Ability to work effectively in English and GermanMore about usEUMETSAT’s role is to establish and operate meteorological satellites to monitor the weather and climate from space - 24 hours a day, 365 days a year. This information is supplied to the National Meteorological Services of the organisation's Member and Cooperating States in Europe, as well as other users worldwide. EUMETSAT also operates several Copernicus missions on behalf of the European Union and provide data services to the Copernicus marine and atmospheric services and their users. As an intergovernmental European Organisation, EUMETSAT can recruit nationals only from the 30 Member States (Austria, Belgium, Bulgaria, Croatia, Czech Republic, Denmark, Estonia, Finland, France, Germany, Greece, Hungary, Iceland, Ireland, Italy, Latvia, Lithuania, Luxembourg, The Netherlands, Norway, Poland, Portugal, Romania, Slovakia, Slovenia, Spain, Sweden, Switzerland, Turkey and the United Kingdom). Benefits:Work from home opportunitiesFlexible working hoursCompany pensionJob Types: Full-time, PermanentSalary: Up to €6,500.00 per monthCOVID-19 considerations:EUMETSAT strictly follows the COVID guidance of the German Government. Only essential operational personnel are working on site with all others working remotely. All meetings and interviews are conducted online. All unnecessary travel is cancelled.Work Remotely:Temporarily due to COVID-19",-1.0,-1,https://indeed.nl/rc/clk?jk=7340be78c1e57ea6&from=vj&sjdu=BLn5dotXP-NTIXmhDy__H8KYTtNNAjTHcAXmF3JFhyK0dK_lcc-H10SMiyAHkolJ&spon=1&adid=363997619&mvj=0&vjfrom=vjs&pos=bottom&ad=-6NYlbfkN0A09mPrzln9NJBCwAnKZvb5Xsb06nEC_MDbi1tjHwjGCbL3AcUsxBhzS3p0NPjPzZURVCBCpGPADcOXpYVe2ynt0YWxoF-KX1hnmGbfEwOL0CxxN3eLrymaiL1uTJQjO7a7BEZ9G6vsSD0GTi9wwpeDpusX17FrPpad5qBbr2R5AzVfNPDodgxhwuc7yGVo6bcaMx2D5n7ltb7rSDMNfFDsly8Jvr-d5Nj8LTvvfFkLoRE9lzhPK4bsWGnaAlBC3fczyhLAja4nL9ecnq40pYIItkfAN2F4hQcToj_f_J-xlmnXJzJXLO2v6tf_6cHQqOm32dHFnbC7sUklp-T-h0Hr6AXg8XS9DoWqn_RLgjnmM_WN3I6aCzzpLioydr4SE_GTjbT7-hWTBwdsP1Oqbc0LnuXSIkpnfuIz_QqV0mwtJH9KEA3tNE9R&astse=aef2c3ccb4058f33&assa=6220,https://nl.indeed.com/vacature-bekijken/pagead/clk?mo=r&ad=-6NYlbfkN0A09mPrzln9NJBCwAnKZvb5Xsb06nEC_MDbi1tjHwjGCbL3AcUsxBhzS3p0NPjPzZURVCBCpGPADcOXpYVe2ynt0YWxoF-KX1hnmGbfEwOL0CxxN3eLrymaiL1uTJQjO7a7BEZ9G6vsSD0GTi9wwpeDpusX17FrPpad5qBbr2R5AzVfNPDodgxhwuc7yGVo6bcaMx2D5n7ltb7rSDMNfFDsly8Jvr-d5Nj8LTvvfFkLoRE9lzhPK4bsWGnaAlBC3fczyhLAja4nL9ecnq40pYIItkfAN2F4hQcToj_f_J-xlmnXJzJXLO2v6tf_6cHQqOm32dHFnbC7sUklp-T-h0Hr6AXg8XS9DoWqn_RLgjnmM_WN3I6aCzzpLioydr4SE_GTjbT7-hWTBwdsP1Oqbc0LnuXSIkpnfuIz_QqV0mwtJH9KEA3tNE9R&p=1&fvj=1&vjs=3,29 dagen geleden,29 dagen geleden,2021-02-28
information,Indeed,p_7dbf41c94b7f2e0a,Project Engineer (Zoom Phone),"Zoom Video Communications, Inc", Amsterdam,"Zoomies help the world connect — and deliver happiness while doing it. We set out to build the best video conferencing product for the enterprise, and today help people communicate better with products like Zoom Phone, Zoom Rooms, Zoom Video Webinars, Zoom Apps, and OnZoom.
We’re problem-solvers and self-starters, working at a fast pace to design solutions with our customers and users in mind. Here, you’ll work across teams to dig deep into impactful projects that are changing the way people communicate, and enjoy opportunities to advance your career in a diverse, inclusive environment.
Zoom is seeking a UC/Voice Engineer for the Professional Services Organization. The UC/Voice Engineer will be designing, deploying and supporting Zoom Phone.
Responsibilities:
 Work closely with the sales organization to drive Professional Services engagements and revenue. (Pre-sales engagements, pre-sales collateral, training)
Help to scale the Professional Services organization in Europe via onboarding of new employees and delivery partners.
Determine impact of known and anticipated business needs by reviewing system configurations in use. Research, evaluate, architect, design, and propose solutions to meet business needs in accordance with best practices
Work closely with the customer, account team, other team members
Migrate customers voice solutions from other voice solutions to the Zoom Phone solution
 Exchange information, verbally and in writing, clearly, accurately, reliably, and timely
 Support and Troubleshoot deployments
 Document best practices and create deployment and support playbook
What you bring to Zoom:
UCaaS/Cloud experience strongly preferred
Strong experience with UC and Voice best practices, process, and procedures for architecting, design, deployment and support
 Experience with Enterprise level UC and Voice migrations. Experience with migrations to Cloud Voice/UCaaS strongly preferred
 Strong pre-sales engagement experience and experience presenting and working with Enterprise customers at both the pre-sales and post sales level
 Experience configuring SBCs, trunks, gateways
 Knowledgeable of VoIP protocols
 Strong background and knowledge of other Cloud and Premise UC/Voice Solutions (Cisco, Ring Central, Microsoft, 8x8, Avaya, Mitel, Vontage, etc..)
 Strong networking Experience and good understanding of network requirements for a UC/Voice deployment
Ability to put in place processes and scale the team/resources to meet the demand",-1.0,-1,https://indeed.nl/rc/clk?jk=7dbf41c94b7f2e0a&from=vj&mvj=0&vjfrom=vjs&pos=bottom&astse=e5b3324e95700d32&assa=9356,https://nl.indeed.com/vacature-bekijken?jk=7dbf41c94b7f2e0a&fccid=e32d933c26e873c8&vjs=3,29 dagen geleden,29 dagen geleden,2021-02-28
information,Indeed,p_2ef26cb3fcfaf216,Associate Equity Analyst,Morningstar, Amsterdam,"As an Associate Equity Analyst, you will work closely with the senior members of the analyst team, assisting them with stock coverage, modeling, and various research projects. This position is based in our Amsterdam office.
Job Responsibilities
Liaise closely with the senior members of the research team on researching, analyzing, and valuing companies in several sectors.
Work on research projects that assist senior members of the department in evaluating companies’ competitive advantages (or moats), relative positioning within their respective sectors.
Assist in building and maintaining detailed discounted cash flow models for companies covered by senior analysts, focusing on the key drivers of the business and incorporating scenario analyses.
Qualifications
A minimum of a Bachelor’s degree in finance or related field is required; a Chartered Financial Analyst® or CPA designation and/or a Master's degree in business administration are preferred.
Independence, critical thinking skills, and a passion for investing, with a bias toward long-term fundamental research and investing.
Knowledge of various financial models, including discounted cash flow model. Advanced Microsoft Excel skills.
Excellent written and spoken communication skills.
The ability to work under tight deadlines, sometimes with incomplete information.
B99_MstarHollandBV Morningstar Holland BV Legal Entity",-1.0,-1,https://indeed.nl/rc/clk?jk=2ef26cb3fcfaf216&from=vj&mvj=0&vjfrom=vjs&pos=bottom&astse=5d275214e74fd1b7&assa=1348,https://nl.indeed.com/vacature-bekijken?jk=2ef26cb3fcfaf216&fccid=eaabf52abd909bd5&vjs=3,29 dagen geleden,29 dagen geleden,2021-02-28
information,Indeed,p_5e6e50e47d1bbe42,Project Manager,Appical, Amsterdam,"The challenge

Appical is the creative and effective platform for onboarding, engaging and retaining employees. We power the world’s best employee experiences by making it easy for our customers to create workflows, build employee journeys and improve connections. At Appical we are experiencing substantial global growth. We’re investing to accelerate our momentum and we’re looking to grow our customer onboarding team.

If you constantly strive for excellence, are passionate about innovation, and want to work with a collaborative, energetic team – then Appical is the ideal next step in your career!

As a Project Manager at Appical, you'll be the go-to person for everything involving a project's organization, budget and timelines. Your job will be to coordinate people and processes to ensure that our projects are delivered on time successfully. You will be the link between key clients and our internal stakeholders like Product Owners, Sales, Customer Success Managers and Onboarding Consultants.

Your daily responsibilities:

Manage the relationship with customers and internal stakeholders

Create, discuss and share the project planning with clients during the whole project
Set goals and objectives, define the metrics and conditions for success
Coordinate internal resources and clients for the flawless execution of projects
Ensure that all projects are delivered on-time, within scope and budget
Track progress by using appropriate verification techniques to manage changes in project scope, schedule and costs
Create and maintain comprehensive project documentation
Facilitate and maintain a productive team environment

Our ideal candidate has:

3-5 years proven experience as project manager working in an international environment, experience in the information technology sector is a plus
Excellent stakeholder management skills (internal and external)
The ability to lead, motivate, and inspire team members
Technical understanding or hands-on experience in software development and web technologies
Excellent written and verbal communications skills in Dutch and English
Strategic organizational skills that include attention to detail and multi-tasking.
Highly developed skills at program management, scheduling, budgeting, and task estimation.
Decisive mindset and the ability to create clarity for those around you.
Comprehensive understanding of project management methodologies
Ability to quickly analyse project metrics and overall project health, proactively report issues and risks; present recommendations and appropiate solutions
Effectively prioritizes and handles multiple concurrent projects and activities",-1.0,-1,https://indeed.nl/rc/clk?jk=5e6e50e47d1bbe42&from=vj&mvj=0&vjfrom=vjs&pos=bottom&astse=5ef3278b93e56703&assa=5862,https://nl.indeed.com/vacature-bekijken?jk=5e6e50e47d1bbe42&fccid=46ba8cc2459c999f&vjs=3,29 dagen geleden,29 dagen geleden,2021-02-28
