Search Keyword,Platform,Job ID,Job Title,Company Name,Location,Industry,Job Description,Type of ownership,Rating,Company URL,Job URL,Job Age,Job Age Number,Collection Date
specialised services manager,Glassdoor,4042710334,Nederlandse Klantenservice Medewerker B2B voor Google Ads in Lissabon (m/v) Signing Bonus €2000,Sensys Gatso Group,Nederland,-1,"IntroductionDo you want to make the world a safer place? We at Sensys Gatso are driven by a passion to change traffic behavior. We do not just enjoy our position as world market leader but we want to change the world in which we live. In short, through our products we want to change the world to a safer place.Our team at our location in Haarlem is in need of a new colleague, who considers him or herself to be an experienced Technical Project Manager. You will be responsible for delivering the right solutions to our customers, overseeing the complete delivery process, from the first contact to the final acceptance, and in that sense contribute to a better world in a very direct manner. You will find yourself in a team of highly skilled and motivated colleagues, with an international composition who are always searching for the latest technologies, opportunities and innovations.DescriptionAs a Technical Project Manager you will be part of our engineering department that’s helping our national and international customers realize their product and project goals.What does it take to become our delivery manager?You must be fluent in English and DutchDriven to create value for customers, being in the front line of our company.Experience in customer facing activities.Five years or more experience in delivering products or projectsA technical background either in experience or through educationInterested in business development, contract management and commercial activitiesHaving an agile mindset, experience with scrum is a preBe able to write extensive and complex (technical) documentationSocial, patient, structured and proactive personal characteristics are essentialAble to work for multiple clients at the same time in an international environmentWhat do we expect from this role?Getting the customer needs clear, including limitations given by legislationBeing involved in the early stages of the sales cycle, most likely in the tender phase, including defining the solution, pricing and contract negotiations.Guide the entire process ranging from bid phase till acceptance by the customerGet products, solutions and projects legally approved and accepted by the customerDiscuss required efforts within the company with the product owners from the different teams and monitor the progress during execution.Facilitating effective collaboration between the customer, stakeholders and the companyQuickly gain deep insights in our customers, products and the market in generalYou make complex stuff less complex and challenge others to do the sameOfferCompetitive salaryBonus structureTons of training opportunities and possibilities. Our company values personal development plans and take an active part in supporting the developers journeyAn environment that empowers all employees25 days of leave and 6,5 (ATV days)Regular fun activities with your colleagues.An international working environment and we value diversity
Do you want to make the world a safer place? We at Sensys Gatso are driven by a passion to change traffic behavior. We do not just enjoy our position as world market leader but we want to change the world in which we live. In short, through our products we want to change the world to a safer place.
Our team at our location in Haarlem is in need of a new colleague, who considers him or herself to be an experienced Technical Project Manager. You will be responsible for delivering the right solutions to our customers, overseeing the complete delivery process, from the first contact to the final acceptance, and in that sense contribute to a better world in a very direct manner. You will find yourself in a team of highly skilled and motivated colleagues, with an international composition who are always searching for the latest technologies, opportunities and innovations.
As a Technical Project Manager you will be part of our engineering department that’s helping our national and international customers realize their product and project goals.

What does it take to become our delivery manager?

What do we expect from this role?
Competitive salaryBonus structureTons of training opportunities and possibilities. Our company values personal development plans and take an active part in supporting the developers journeyAn environment that empowers all employees25 days of leave and 6,5 (ATV days)Regular fun activities with your colleagues.An international working environment and we value diversity",Beursgenoteerd bedrijf,4.7,https://www.glassdoor.nl/https://www.glassdoor.nl/partner/jobListing.htm?pos=103&ao=1044074&s=58&guid=0000017878651f07b09f27ffef501140&src=GD_JOB_VIEW&t=SR&vt=w&cs=1_1bda3ddd&cb=1616927596812&jobListingId=4042710334,https://www.glassdoor.nl/partner/jobListing.htm?pos=103&ao=1044074&s=58&guid=0000017878651f07b09f27ffef501140&src=GD_JOB_AD&t=SR&vt=w&cs=1_665d08d8&cb=1616927596812&jobListingId=4042710334,2d,2d,2021-03-28
specialised services manager,Glassdoor,4034284979,Nederlandse Klantenservice Medewerker B2B voor Google Ads in Lissabon (m/v) Signing Bonus €2000,VanMoof,Utrecht,Fabricage consumentenproducten,"We’re obsessed with cities and we made it our mission to get the next billion on bikes. That’s why we’re looking for a forward-thinking leader to run one of our brand new service hubs, the Utrecht hub which is located at our Utrecht Warehouse.These are more than just service locations, they are city hubs for all things VanMoof. As our Service Hub Manager, you’ll have a strong focus on the daily operations and the in-store experience of our customers. That includes everything from offering them a test ride on our latest bikes, to helping with a quick tune-up, or even just making a coffee and having a chat.You’ll recruit, lead, and train the Service Hub team, perfecting the in-store look, feel, and experience across all visitor touch points. With your hands-on experience and expertise, you’ll lift productivity, increase conversion, boost customer satisfaction, and act as an example for the team.What you’ll doGrow the hub into a VanMoof brand ‘embassy’ by offering our customers the best experience and customer experience during their store visit with our test rides and repair service.Turn the annual sales forecast into an actionable plan for your team to make sure we (over)deliver on our promises to customers and hit the targets.Manage the team and focus on training and development of the team to optimize sales performance.Recruit and manage a high-performance Service Hub Sales and Bike Doctor team.Take responsibility for the full operation of the brand store / hub. Manage stock levels and prepare accurate forecasts together with the Operations and Bike Doctor teams.Together with the Global Retail team you will overcome potential roadblocks and work on continuously improving the in-store experience and in-store productivity.Develop ideas to surprise and delight our local riders and in-store efficiency.What you'll bringMinimum of 2-3 years’ people management experience.Strong analytical and organizational skills.A proactive, problem-solving attitude.World-class written and verbal communication skills.Willingness to work weekends.An unstoppable get-the-work-done entrepreneurial spirit.What you'll get24 holidays for you to unwind.Retirement plan.Travel allowance (when living further than 10km from the hub).Your very own VanMoof bike (lend-lease).Laptop and software tools.Insider experience in a rapidly-growing international company.Special snacks, tasty coffee (and lots of tea) in your Service Hub.Weekly (Virtual) Bootcamp, Weekly (Virtual) Yoga, Onefit discount & Classpass credits.Discount on Dutch Health Insurance.About usWe’re obsessed with cities. So are our bikes. Truly city-proof, they shrink long commutes, scare off bike thieves, and amplify your pedal power. We made it our mission to get the next billion on bikes. Join us on this journey.Job descriptions are difficult to interpret. We understand you might not tick all the above boxes. The truth is, we don't either. If you feel excited about our upcoming challenges, we encourage you to apply now!",Privébedrijf,4.4,https://www.glassdoor.nl/https://www.glassdoor.nl/partner/jobListing.htm?pos=105&ao=1044074&s=58&guid=0000017878651f07b09f27ffef501140&src=GD_JOB_VIEW&t=SR&vt=w&cs=1_53552b8e&cb=1616927596812&jobListingId=4034284979,https://www.glassdoor.nl/partner/jobListing.htm?pos=105&ao=1044074&s=58&guid=0000017878651f07b09f27ffef501140&src=GD_JOB_AD&t=SR&vt=w&cs=1_41c4c5ce&cb=1616927596812&jobListingId=4034284979,11d,11d,2021-03-28
specialised services manager,Glassdoor,4043332441,Project Manager,PRA Health Sciences,Groningen,Biotechnologie en farmacie,"When you join PRA Health Sciences, you will not only witness the future of clinical development. You come to shape it!Are you ready for a new challenging position at an international life-changing company? Do you want to manage and coordinate new clinical trials? If you have a Master or Phd Degree with a biomedical- or life science background and at least three years of work experience (or a PhD degree in the same field), it’s now time to join PRA Health Sciences! We are now looking for a (Senior) Project Manager for our Early Development Services division.What does PRA Health Sciences do?The Early Development Services (EDS) division of PRA is a global leader in providing early-phase clinical research and bioanalytical services to the pharmaceutical and biotechnology industries. With a reputation built on excellence, quality and professionalism, we work with leading pharmaceutical and biotechnology companies, performing clinical research and bioanalytical projects on many of the most advanced experimental drugs and biologics in development today. Our enthusiastic and dedicated EDS employees work in a dynamic, informal organization. To extend our Project Management team we are looking for a:(Senior) Project Manager (Early Phase Clinical Research, 32 – 40 hours in Groningen)The Project Manager is responsible for owning and achieving interim and final contractual deliverables for assigned clinical research projects, according to time, quality, scope, budget and customer satisfaction.What will you be doing?You manage the execution of day-to-day results for clinical trial projects within sites in the Netherlands and external sitesYou lead and direct cross-functional teams (with e.g. Research Physician, Clinical Study Manager, Recruitment Specialist, Data manager, Biostatistician, Medical Writer)You understand and manage customer expectations to achieve client satisfaction and ensure adequate internal and external communication of informationYou proactively identify, resolve and escalate risks and/or issuesYou adhere to ICH/GCP guidelines, local laws and regulations, and PRA standard operating proceduresWhat do you bring?As a Project Manager you are naturally strong in organizational- and communication skills. You are client-focused, result- and quality-oriented, decisive. You hold a Master or PhD degree and you have at least three years of work experience as a (project)manager within clinical research, preferably in a commercial/industry setting. Besides that:You are fluent in English and able to speak DutchYou are able to direct a team without being hierarchical superiorFor Project Managers with multiple years of experience we have more complex and challenging projects, we also invite you to applyWe offer you:A challenging position in a growing international companyWe offer a competitive salary and an excellent working environmentWe start with a year contract with a view to extension or permanent employment, the contract is for 32, 36 or 40 hoursPRA has its own collective labor agreement that provides good conditions for our employees like 35 holiday days per year and a good pension fundEvery year we organize (sporting) activities aimed at, among other things, teambuilding and conviviality. Also, using the PRA cares theme, we organize social activities as well.Apply for the position:If you are interested in a dynamic job and career, please send us your application letter and resume in English.Contact information:If you require further information please contact Chenthuran Raveerathan, Staff recruiting consultant on +31 50 40 22 222.PRA is an EEO/AA employer and is committed to providing opportunities to minorities, women, veterans and individuals with disabilities.",Beursgenoteerd bedrijf,4.0,https://www.glassdoor.nl/https://www.glassdoor.nl/partner/jobListing.htm?pos=201&ao=1044074&s=149&guid=000001789cad7d67b2334023ef76f3ac&src=GD_JOB_VIEW&t=SRFJ&vt=w&cs=1_356cd855&cb=1617536319412&jobListingId=4043332441,https://www.glassdoor.nl/partner/jobListing.htm?pos=201&ao=1044074&s=149&guid=000001789cad7d67b2334023ef76f3ac&src=GD_JOB_AD&t=SRFJ&vt=w&cs=1_43b1c727&cb=1617536319413&jobListingId=4043332441,9d,9d,2021-04-04
specialised services manager,Glassdoor,4045464279,Project Manager,Coolblue,Rotterdam,Verkoop consumentenelektronica en apparaten,"As Manager Customer Service, you’re responsible for opening a new location in Germany and helping to put Coolblue on the map there.How do I become a Manager Customer Service Germany at Coolblue?Do you have experience with opening customer service locations? Become a Manager Customer Service and create our German location together with a team of enthusiastic Coolbluers. Want to become Manager Customer Service at Coolblue? See if the job is a match below.You enjoy doing thisCreating and sticking to a tight project schedule.Making sure every single detail is implemented before the opening of a new customer service location.Working towards the opening together with all the stakeholders within the project.Being responsible for setting up the German team.Collaborating with recruitment and making sure the positions are filled in time.You recognize yourself in the followingYou have at least a university degree o, a degree from the ‘Hochschule’ if you’ve studied in Germany.You speak and write German fluently.You’re willing to be on-site in Cologne and surrounding areas at least 3 out of 5 days.You have at least 2 years of experience as a project manager.You have experience with managing large-scale projects. For example, building and opening new work locations.You are able to make a clear project schedule and ask for commitment from all of the involved (internal and external) stakeholders.You’re a real networker.This is what you’re looking for in a jobMoneyWith over 30 training courses in our own Coolblue University, you can become a little bit better every day.A discount on all our products.Extraordinarily good work environment, including freshly made snacks, monthly drinks, legendary Coolblue parties, awesome team activities, and an informal, playful department.25 leave days. As long as you promise to come back.Travel allowance and a retirement plan.A picture-perfect office at a great location. You could crawl to work from Rotterdam Central Station. Though we recommend just walking for 2 minutes.Room for new initiatives and ideas. We’re always open to those, whether you’ve been with us for a week, a month, or a year.Challenging work to fully immerse yourself in, so that you occasionally forget that you’re working.A flat organization in the broadest sense of the word. You can have a beer with the boss if you like.",Privébedrijf,4.0,https://www.glassdoor.nl/https://www.glassdoor.nl/partner/jobListing.htm?pos=202&ao=1044074&s=149&guid=000001789cad7d67b2334023ef76f3ac&src=GD_JOB_VIEW&t=SRFJ&vt=w&cs=1_b6eae72d&cb=1617536319416&jobListingId=4045464279,https://www.glassdoor.nl/partner/jobListing.htm?pos=202&ao=1044074&s=149&guid=000001789cad7d67b2334023ef76f3ac&src=GD_JOB_AD&t=SRFJ&vt=w&cs=1_e13d24b0&cb=1617536319416&jobListingId=4045464279,5d,5d,2021-04-04
specialised services manager,Glassdoor,4026922202,ServiceNow Manager,Maintec Nederland,Nijverdal,Consulting,"In our dynamic and digitalized world, a lot of companies switch to the ServiceNow platform for managing, not only their IT services but also their HR, customer, project or financial services. Accenture is a Global Elite partner of ServiceNow and is realizing transformational implementation projects at its clients in all possible domains and industries.Due to our significant growth we are looking for candidates to strengthen our highly diverse team.Your jobAs a ServiceNow Manager, you will advise our clients on ServiceNow options and possibilities to support all IT and non-IT services. As the ServiceNow platform has a broad spectrum of components, you will work with most Service Management methodologies as well as cutting-edge technologies like ITOM, Machine Learning, DevOps and AI.Together with the ServiceNow management team you will be working on interesting proposals and sales activities on ServiceNow deals. You will be involved in implementations and introduction of ServiceNow to new and existing clients. In your role as manager you will be responsible for managing delivery projects as well as consultancy projects at various clients and is expected that you’re able to setup a project approach, staffing and determine the scope.Working at Accenture is working together with ambitious and talented colleagues from all over the world. Through the trusted relationships you build, you help our clients develop essential capabilities such as Service Integration, Service Automation, Multi-Speed IT operating models, to get the best out of the increasingly complex IT ecosystem clients are operating.This role is part of our Accenture CloudFirst practice. We know cloud technology is the first stop on the digital transformation highway. And we know that a digitally transformed business is a business that achieves greater value, and can scale, operate at speed, outmaneuver competition and external threats, and succeed. We are putting everything into cloud: our deep expertise, massive cloud resources, 70,000 cloud professionals and a $3 billion investment over three years to help our clients reimagine every aspect of their business—industry, function, data, culture, talent, applications, infrastructure and edge—to become “cloud first” now.Your teamAccenture Technology leverages design thinking, industry insights and the latest digital methodologies to help clients innovate, grow and improve their businesses. Our expertise, capabilities and experience mean that our clients (including some of the biggest brands in the world) trust us to find the right solutions for their needs.Together with our talented international colleagues, within the Accenture ServiceNow capability, but also with our Consulting and Technology teams, we focus on connecting the needs of businesses with the new possibilities that come with technological progress. You will have unrivalled access to know-how, assets and projects that matter to the world’s most admired organizations. Because that is where the real challenges are: inventing and testing things that have never been tried before, getting new applications ready for roll-out, and ultimately guiding clients to select and implement the right technologies to transform their businesses.
In our dynamic and digitalized world, a lot of companies switch to the ServiceNow platform for managing, not only their IT services but also their HR, customer, project or financial services. Accenture is a Global Elite partner of ServiceNow and is realizing transformational implementation projects at its clients in all possible domains and industries.
Due to our significant growth we are looking for candidates to strengthen our highly diverse team.

Your job

As a ServiceNow Manager, you will advise our clients on ServiceNow options and possibilities to support all IT and non-IT services. As the ServiceNow platform has a broad spectrum of components, you will work with most Service Management methodologies as well as cutting-edge technologies like ITOM, Machine Learning, DevOps and AI.

Together with the ServiceNow management team you will be working on interesting proposals and sales activities on ServiceNow deals. You will be involved in implementations and introduction of ServiceNow to new and existing clients. In your role as manager you will be responsible for managing delivery projects as well as consultancy projects at various clients and is expected that you’re able to setup a project approach, staffing and determine the scope.

Working at Accenture is working together with ambitious and talented colleagues from all over the world. Through the trusted relationships you build, you help our clients develop essential capabilities such as Service Integration, Service Automation, Multi-Speed IT operating models, to get the best out of the increasingly complex IT ecosystem clients are operating.


Accenture Technology leverages design thinking, industry insights and the latest digital methodologies to help clients innovate, grow and improve their businesses. Our expertise, capabilities and experience mean that our clients (including some of the biggest brands in the world) trust us to find the right solutions for their needs.
Together with our talented international colleagues, within the Accenture ServiceNow capability, but also with our Consulting and Technology teams, we focus on connecting the needs of businesses with the new possibilities that come with technological progress. You will have unrivalled access to know-how, assets and projects that matter to the world’s most admired organizations. Because that is where the real challenges are: inventing and testing things that have never been tried before, getting new applications ready for roll-out, and ultimately guiding clients to select and implement the right technologies to transform their businesses.

Your backgroundWe are looking for people with the following qualifications:A minimum completed bachelor’s or master’s degree in the areas of Business or IT;At least 5-10 years of working experience in the area of IT, with relevant management skills;Team player with strong analytical and structured problem-solving skills;Excellent communication skills and fluent in English and willing to learn Dutch;You are creative, client focused and mindset to deliver value to our clients;Experience in driving sustainable, organizational change;Experience in ServiceNow (development);Experience in Service Management;Experience with project and/or consulting type of work.Our offerAccenture is an incredible place to work – and to keep learning. By joining us, you will become part of a global company with a world-class brand and reputation. Besides the work we do for our clients, we are proud of our vibrant, diverse workplace culture: we believe in openness and honesty, fairness and equality, common sense and realism. We want to get to know the real you and help you explore and grow - whatever it is you are great at. You will always have many learning opportunities (formal and informal) to improve your role-specific skills and expertise.Besides our high-profile, challenging projects and our nurturing work environment, we offer excellent employee benefits, including:A flexible transport arrangement that suits your personal situation (electric car or bicycle, flexible budget including NS business card)An expense allowanceDiscount on Accenture sharesThe possibility to work 4 x 9 hours a weekInterested?Are you looking for possibilities at Accenture where you can be yourself and do what you love? Please connect with the recruiter, Dorine Hogendorp, dorine.hogendorp@accenture.com or +31 6 57094234.Accenture is prioritizing the safety of its employees, for this reason we do not have face-to-face meetings, until further notice.
Your background
We are looking for people with the following qualifications:

Our offer
Accenture is an incredible place to work – and to keep learning. By joining us, you will become part of a global company with a world-class brand and reputation. Besides the work we do for our clients, we are proud of our vibrant, diverse workplace culture: we believe in openness and honesty, fairness and equality, common sense and realism. We want to get to know the real you and help you explore and grow - whatever it is you are great at. You will always have many learning opportunities (formal and informal) to improve your role-specific skills and expertise.
Besides our high-profile, challenging projects and our nurturing work environment, we offer excellent employee benefits, including:

Interested?
Are you looking for possibilities at Accenture where you can be yourself and do what you love? Please connect with the recruiter, Dorine Hogendorp, dorine.hogendorp@accenture.com or +31 6 57094234.

Accenture is prioritizing the safety of its employees, for this reason we do not have face-to-face meetings, until further notice.
",Beursgenoteerd bedrijf,3.7,https://www.glassdoor.nl/https://www.glassdoor.nl/partner/jobListing.htm?pos=201&ao=1044074&s=149&guid=000001789ce9f6bca7789baec141147a&src=GD_JOB_VIEW&t=SRFJ&vt=w&cs=1_9b534b14&cb=1617540282660&jobListingId=3741874940,https://www.glassdoor.nl/partner/jobListing.htm?pos=207&ao=1044072&s=58&guid=000001789cad7d67aba5ecd3a2b982e7&src=GD_JOB_AD&t=SR&vt=w&cs=1_3f75d743&cb=1617536319421&jobListingId=4026922202,25d,25d,2021-04-04
