Data Row,Search Keyword,Platform,Job ID,Job Title,Tracking ID,Company Name,Location,Industry,Job Description,Employment Type,Company URL,Job URL,Job Age,Job Age Number,Job Date,Collection Date
376,sale,LinkedIn,2260041431,Sales Manager,tFPDVqgsTt+PzLDmb2R4dw==,Centric,"Gouda, South Holland, Netherlands","['Information Technology and Services', 'Internet', 'Insurance']","Zorg jij, samen met jouw team, voor het uitbouwen van ons succes, , Als Sales Manager ben je verantwoordelijk voor de verdere groei van Centric Solution Engineering Jouw focus hierin zal liggen op het aansturen van de salesorganisatie en tevens zorg je er samen met het team voor dat het klantenbestand op gestructureerde wijze uitgebouwd wordt, , Je zult betrokken zijn bij het bepalen van het commercile beleid van de unit en je zorgt voor de vertaling hiervan naar een operationeel salesplan Tevens denk je mee over het uptomarket houden van ons dienstenprotfolio en signaleer je ontwikkelingen bij klanten en in de markt Tevens zorg je voor constante optimalisatie van de commercile processen, , Je ondersteunt Account Managers in salestrajecten voornamelijk new business en je onderhoudt, op tactisch en strategisch niveau, contacten met DMUs Decision Making Units binnen klanten en prospects Je bouwt een persoonlijke vertrouwensrelatie op met bijvoorbeeld CEOs, CFOs, CMOs en CIOs van huidige en nieuwe klanten, en helpt hen fundamentele vraagstukken en technische problemen te doorgronden en op te lossen, , Als Sales Manager stuur je het commercile team aan, bestaande uit Account Managers, Account Executives, Marketing en Commercile Binnendienst Je verantwoordelijk voor het ontwikkelen, coachen, begeleiden en beoordelen van de medewerkers in dit team, , De potentile klanten voor Centric Solution Engineering bevinden zich in de top 1000 bedrijven van Nederland, in zowel de profit als nonprofit sector Je bent als Sales Manager omzet en resultaatverantwoordelijk en je rapporteert aan de Commercieel Directeur, , , , , , , , , , Het onderdeel Centric Solution Engineering SE ontwikkelt platform en maatwerkoplossingen die organisaties helpen bij hun digitale transformatie Simpel gezegd, zijn wij er voor die uitdagingen die niet opgelost kunnen worden met standaardapplicaties De consultants en engineers van Solution Engineering werken zij aan zij met de opdrachtgevers om door middel van advies, proofofconcepts en DevOps teams business uitdagingen te vertalen in hoogwaardige en duurzame IT oplossingen Daarnaast voert Solution Engineering twee software suites op het gebied van risico management Logilink en data uitwisseling EDI Met ruim honderd collegas in Nederland bieden we consultancy, ontwikkeling, beheer en hosting",Full-time,https://www.linkedin.com/jobs/view/externalApply/2260041431?url=https%3A%2F%2Fcareers%2Ecentric%2Eeu%2Fnl%2Fvacatures%2Fsales-manager-40921%2F%3Futm_source%3Dlinkedin%26utm_medium%3Djobboard%26utm_campaign%3Djobmarketing%26utm_content%3Djobslots&urlHash=z_-r&refId=c6ed10e9-25de-4b03-a1d3-4962b3944588&trk=public_jobs_apply-link-offsite,https://nl.linkedin.com/jobs/view/sales-manager-at-centric-2260041431?refId=c6ed10e9-25de-4b03-a1d3-4962b3944588&position=1&pageNum=15&trk=public_jobs_job-result-card_result-card_full-click,2 days ago,2 days ago,2020-11-28,2020-11-30
377,sale,LinkedIn,2286381577,Strategisch inkoper,RYuUJWLcTnujYrsPzHygLg==,Eqib  The Human Factor,"Neede, Gelderland, Netherlands","['Chemicals', 'Plastics']","Wij zijn op zoek naar een Strategisch Inkoper bij Timmerije in Neede Een functie waar jij de verbindende factor tussen inkoop, verkoop en engineering bent Vanuit jouw expertise weet jij de markt van kunststoffen snel te doorgronden, de organisatie te adviseren en processen te optimaliseren",Full-time,,https://nl.linkedin.com/jobs/view/strategisch-inkoper-at-eqib-the-human-factor-2286381577?refId=c6ed10e9-25de-4b03-a1d3-4962b3944588&position=2&pageNum=15&trk=public_jobs_job-result-card_result-card_full-click,2 days ago,2 days ago,2020-11-28,2020-11-30
378,sale,LinkedIn,2291868916,Sales Manager Nederland,U0LLQge3ShW5W7t1m2+Bgg==,Machiels Building Solutions nv,"Weert, Limburg, Netherlands",['Construction'],"Sales Manager Nederland, , Je functie,  Het detecteren en prospecteren van potentile klanten en projecten die in aanmerking komen voor de MBS oplossingen",Full-time,,https://nl.linkedin.com/jobs/view/sales-manager-nederland-at-machiels-building-solutions-nv-2291868916?refId=c6ed10e9-25de-4b03-a1d3-4962b3944588&position=3&pageNum=15&trk=public_jobs_job-result-card_result-card_full-click,2 days ago,2 days ago,2020-11-28,2020-11-30
379,sale,LinkedIn,2226306185,Sales Manager,kKXZTDfhS+uPhhRfxq6+7A==,General Logistics Systems Netherlands,"Zwolle, Overijssel, Netherlands","['Package/', 'Freight Delivery']","Ben jij de peoplemanager die het beste uit zijn salesteam haalt, met een grote glimlach naar huis gaat als je met je team de salestargets overtreft en op strategisch niveau meedenkt en werkt aan de organisatiedoelen, , Zwolle  40 uur per week",Full-time,,https://nl.linkedin.com/jobs/view/sales-manager-at-gls-netherlands-2226306185?refId=c6ed10e9-25de-4b03-a1d3-4962b3944588&position=4&pageNum=15&trk=public_jobs_job-result-card_result-card_full-click,2 days ago,2 days ago,2020-11-28,2020-11-30
380,sale,LinkedIn,2323771379,Receptionist(e) (Parttime) - Utrecht,3GAq0F4BTQyVbAVM0ctEVw==,Muntstad,"Utrecht, Utrecht, Netherlands",['Automotive'],"Ben jij klant en servicegericht en communicatief sterk Dan zijn wij opzoek naar jou, , Als receptioniste ben je het visitekaartje van ons bedrijf Je bent het eerste contact met de klanten van de werkplaats n de verkoop Je biedt de klant een kopje koffie aan en begeleidt de klant naar de beschikbare service of verkoopadviseur Tevens zorg je voor een nette en opgeruimde wachtruimte Daarnaast verzorg je de behandeling van alle inkomende telefoongesprekken voor de vestiging Je voert daarnaast lichte administratieve werkzaamheden uit Kortom een functie met veel klantcontact, waarin je dagelijks een bijdrage levert aan de klanttevredenheid van Muntstad, , , , Twee parttime 3 dagen pw receptioniste voor twee verschillende vestigingen Namelijk voor de vestigingen Muntstad Volkswagen Zeist  Muntstad Audi Utrecht, , , , , , , , , Werken bij Muntstad is uitdagend en daar zetten we uiteraard iets tegenover Naast een goed salaris ontvang je ook 24 vakantiedagen, vakantietoeslag, woon en werkverkeer regelingen, een goed pensioen, uitzicht op een vast contract en meer Ook vinden we het belangrijk dat jij het beste uit jezelf kan halen maar dat we ook het beste uit elkaar halen Daarom zijn er ruime mogelijkheden voor het volgen van opleidingen en cursussen, waardoor jij n wij elke dag een beetje beter worden Daarnaast heeft Muntstad een eigen personeelsvereniging de PeeVee De PeeVee organiseert met enige regelmaat leuke feestjes en sportieve activiteiten voor werknemers Je hebt zelf de keuze om wel of niet lid te zijn, , Bij Muntstad ontbreekt het je aan niets een moderne werkomgeving, enthousiaste collegas, dynamische werksfeer Elke dag is anders en dat maakt het een leuke en interessante organisatie En met elf vestigingen in de regio Utrecht is er altijd wel n bij jou in de buurt Muntstad is een werkmaatschappij binnen Pon Holdings BV Muntstad vertegenwoordigt de merken Volkswagen, Audi, KODA, SEAT en Volkswagen Bedrijfswagens Een mooi portfolio waar wij en onze collegas trots op zijn, , , Solliciteer direct bij Muntstad via onderstaande button, , , Mail dan naar click apply",Part-time,https://www.linkedin.com/jobs/view/externalApply/2323771379?url=https%3A%2F%2Fnl%2Ejooble%2Eorg%2Fexternal%2F-1991158010733816364%3Futm_campaign%3DNL%26utm_medium%3Dsocial%26utm_source%3Dlinkedin%26JobSource%3DBoard&urlHash=O2B0&refId=c6ed10e9-25de-4b03-a1d3-4962b3944588&trk=public_jobs_apply-link-offsite,https://nl.linkedin.com/jobs/view/receptionist-e-parttime-utrecht-at-muntstad-2323771379?refId=c6ed10e9-25de-4b03-a1d3-4962b3944588&position=5&pageNum=15&trk=public_jobs_job-result-card_result-card_full-click,2 days ago,2 days ago,2020-11-28,2020-11-30
381,sale,LinkedIn,2301947481,Sales Manager Gears,xYFVO0aARs+9gDsLu9sGmg==,"Stork, a Fluor company","Rotterdam, South Holland, Netherlands","['Mechanical or Industrial Engineering', 'Maritime', 'Oil & Energy']","Als Sales Manager Stork Gears  Services beheer jij het volledige verkoopproces voor het onderhoud en nieuwbouw van tandwielkasten en heb je affiniteit met de verkoop van pompen, turbomachinery en generatorenEMotors in de Maritieme, Industrile en Energy sectoren Je bent verantwoordelijk voor het onderhouden en uitbouwen van bestaande klantrelaties, maar ook het acquireren van nieuwe klanten in een internationaal werkveld Met behulp van je technische kennis en je brede netwerk die je op hebt gebouwd in de power, olie  gas, chemische of maritieme industrie weet jij ons klantportfolio de juiste aandacht te geven en verder uit te bouwen om daarmee onze uitdagende omzetdoelstellingen te realiseren",Full-time,https://www.linkedin.com/jobs/view/externalApply/2301947481?url=https%3A%2F%2Fbanners%2Eknollenstein%2Ecom%2Fadnetwork%2Fservlet%2FadvertBeans%2ETrackingServlet%3Fseid%3D65301026%26t%3D101%26cid%3DSTTS-NL%26vid%3D74902&urlHash=nsHH&refId=c6ed10e9-25de-4b03-a1d3-4962b3944588&trk=public_jobs_apply-link-offsite,https://nl.linkedin.com/jobs/view/sales-manager-gears-at-stork-a-fluor-company-2301947481?refId=c6ed10e9-25de-4b03-a1d3-4962b3944588&position=6&pageNum=15&trk=public_jobs_job-result-card_result-card_full-click,2 days ago,2 days ago,2020-11-28,2020-11-30
382,sale,LinkedIn,2317638617,Commercieel medewerker binnendienst,+39iEi1hS3qbK9QdBg7lxQ==,UBN Uitzendbureau,Germany,['Marketing and Advertising'],"Ben jij de commercile topper waar wij naar op zoek zijn Vind jij het leuk om commercile kansen te signaleren en daar actie op te ondernemen Dan is deze functie iets voor jou Wij zoeken voor onze opdrachtgever een Sales Service Representative Nadat jij kennis hebt opgedaan over de organisatie en de diensten die zij leveren, ga je snel aan de slag om hun klanten optimaal verder te helpen Zo heb je dagelijks contact met de klanten uit jouw eigen regio, je directe buitendienst collega en alle uitvoerende afdelingen Je bent de schakel tussen klant en organisatie, , In de functie ben je altijd bezig met het uitbreiden van je eigen en de teamportefeuille Zo verkoop je zelfstandig de diensten van de organisatie aan nieuwe en bestaande klanten Je bent ook continu bezig jezelf te verbreden en je kennis te vergroten en signaleert kansen en mogelijkheden door deel te nemen aan projecten binnen de organisatie Aan het eind van de week maak je de balans op, door middel van cijfermatige onderbouwing en laat je zien wat er goed is gegaan en waar nog kansen liggen, , Je belangrijkste taken",Full-time,https://www.linkedin.com/jobs/view/externalApply/2317638617?url=https%3A%2F%2Fjoblift%2Enl%2Fdetails%2F51d3bf16-b8a9-466b-8d63-30e9fade09b6%3Fjid%3D75b630ab3b3f5941ac6418331366f8a6923a1d0938c9ef625c344ca18415b8fa%26utm_source%3Dlinkedin_nl%26utm_medium%3Dexternal_feed%26utm_campaign%3D595&urlHash=HlaA&refId=c6ed10e9-25de-4b03-a1d3-4962b3944588&trk=public_jobs_apply-link-offsite,https://nl.linkedin.com/jobs/view/commercieel-medewerker-binnendienst-at-ubn-uitzendbureau-2317638617?refId=c6ed10e9-25de-4b03-a1d3-4962b3944588&position=7&pageNum=15&trk=public_jobs_job-result-card_result-card_full-click,2 days ago,2 days ago,2020-11-28,2020-11-30
383,sale,LinkedIn,2313634169,Verkoop binnendienst speelgoedzaak,fW56fbIgSMaIp1LMAW+kbQ==,Van Ee Buitenspeelgoed,"Kootwijkerbroek, Gelderland, Netherlands",['Retail'],"Van Ee Buitenspeelgoed is een speelgoedzaak in groot buitenspeelgoed zoals bekende merken trampolines , schommels en skelters Particulieren en hoveniers in de Benelux weten ons te vinden via onze showroom in Kootwijkerbroek en via de uitgebreide webwinkel Van Ee onderscheidt zich van andere spelers doordat we niet alleen bekende merken verkopen, maar ook een deel van ons speelgoed zelf ontwerpen en produceren, , Om onze klanten nog professioneler te kunnen helpen, zoeken we een, , , Fulltime 38 uur, , Als verkoper buitenspeelgoed help je onze klanten om hun tuin kindvriendelijk in te richten Je adviseert klanten en stelt offertes op nav je gesprekken met klanten via de telefoon, mail en ook in de showroom Wil de klant er nog even over nadenken Jij onderhoudt proactief contact met jouw klant Dankzij jouw luisterende oor weet jij bezwaren op te lossen  krijg je akkoord voor de order, , Vervolgens zorg je ervoor dat de opdracht wordt uitgevoerd je plant bijvoorbeeld een monteur in  zorgt ervoor dat de benodigde artikelen op tijd op de zaak liggen door ze tijdig te bestellen, , Opdracht misgelopen Jouw leergierige houding zorgt ervoor dat je achterhaald waarom Je persoonlijke leerpunten deel je actief met je collegas Zo stem jij de offertes van het verkoopteam steeds beter af op onze klant, , Tevens ben jij degene die ons zakelijke netwerk verder uitbouwt en actief gaat onderhouden, , , , We zijn met een klein team Dat betekend in de praktijk dat je ook regelmatig werk doet buiten je eigen functie Dit maakt het werk afwisselend zo zit je ook gerust af en toe op de heftruck om een leverancier te lossen, help je soms mee met orders picken en werk je mee aan het actueel houden van de webwinkel, , Jouw profiel, , Verder woon je bij voorkeur op niet meer dan 30 minuten rijden van Kootwijkerbroek En houd er rekening mee dat je de meeste zaterdagen zult werken, , Dit mag je van ons verwachten, , , Reageren, , Stuur je motivatie en CV naar Hans van Leersum click apply, , We lezen in je motivatie graag hoe jouw karakter aansluit op ons bedrijf en deze vacature, , Vragen over deze vacature Stuur even een mail met je telefoonnummer, dan bellen we je terug",Full-time,https://www.linkedin.com/jobs/view/externalApply/2313634169?url=https%3A%2F%2Fnl%2Ejooble%2Eorg%2Fexternal%2F8598275031010905943%3Futm_campaign%3DNL%26utm_medium%3Dsocial%26utm_source%3Dlinkedin%26JobSource%3DBoard&urlHash=Ee8b&refId=c6ed10e9-25de-4b03-a1d3-4962b3944588&trk=public_jobs_apply-link-offsite,https://nl.linkedin.com/jobs/view/verkoop-binnendienst-speelgoedzaak-at-van-ee-buitenspeelgoed-2313634169?refId=c6ed10e9-25de-4b03-a1d3-4962b3944588&position=8&pageNum=15&trk=public_jobs_job-result-card_result-card_full-click,2 days ago,2 days ago,2020-11-28,2020-11-30
384,sale,LinkedIn,2304656448,Recruitment- en Sales Consultant (HBO),PRaPeDHGQdOKR4IPlmrJoA==,BuildingCareers,"Beverwijk, North Holland, Netherlands",['Staffing and Recruiting'],"Ook wij zoeken een collega, en niet zomaar een Nu kunnen we een opgeklopt verhaal houden over hoe fantastisch we zijn maar liever stellen wij de vraag Wat zoek jij, , De opdrachtgever",Full-time,https://www.linkedin.com/jobs/view/externalApply/2304656448?url=http%3A%2F%2Fwww%2Esabdetachering%2Enl%2F%3Fpub_id%3D6270&urlHash=vqxe&refId=c6ed10e9-25de-4b03-a1d3-4962b3944588&trk=public_jobs_apply-link-offsite,https://nl.linkedin.com/jobs/view/recruitment-en-sales-consultant-hbo-at-buildingcareers-2304656448?refId=c6ed10e9-25de-4b03-a1d3-4962b3944588&position=9&pageNum=15&trk=public_jobs_job-result-card_result-card_full-click,2 days ago,2 days ago,2020-11-28,2020-11-30
385,sale,LinkedIn,2312470964,Account Manager,pdPWCIEDSO6yTGUKBnLJNg==,VIKING LifeSaving Equipment AS,"Zwijndrecht, South Holland, Netherlands",['Telecommunications'],"Viking LifeSaving Equipment BV zoekt een Account Manager te HBO geplaatst op, , VIKING zoekt een, , , Kom werken bij een bedrijf dat een verschil maakt en help mee aan een veiligere wereld Zit verkopen in je bloed Staat kwaliteit bij jou hoog in het vaandel En kom jij altijd je beloftes na Dan is VIKING LifeSaving Equipment BV wellicht het bedrijf waar jij wilt werken, , VIKING is toonaangevend in maritieme veiligheid en onze missie is duidelijk we zijn toegewijd aan het beschermen en redden van levens overal ter wereld We doen het door continue innovaties op het gebied van veiligheidsapparatuur, service en training En we brengen geweldige mensen samen om het te laten gebeuren, , Wat ga je doen, , , Daarom is het belangrijk dat je de klant snel goed advies kunt geven en kunt schakelen tussen de verschillende vragen Voor de komende dagen plan je interessante bezoeken in en registreert dit in CRM, , Wie ben jij, , , Het is belangrijk dat je de klant ons totaalpakket aanbiedt en deze zo veel mogelijk ontzorgt Ben je daarnaast goed in prioriteiten stellen Kun je aandachtig luisteren, werk je gestructureerd en ben je stressbestendig Dan is deze functie echt iets voor jou, , Interesse, , Vanwege Algemene Verordering gegevensbescherming AVG worden alle sollicitaties online ontvangen, , Applicaties worden online ontvangen via send application, deze is rechts bovenaan te vinden Alle sollicitaties worden vertrouwelijk behandeld, , Gewenste startdatum zo snel mogelijk, , Mocht je vragen hebben, dan kun je contact opnemen met HR Adviseur Karin Udo op telefoonnummer, , Waarom VIKING, , VIKING LifeSaving Equipment is marktleider in maritieme veiligheid en de offshoreindustrie VIKING heeft oplossingen ontwikkeld die de standaard definiren voor offshore freefall reddingsbootsystemen Het bedrijf biedt een uitgebreid productassortiment voor offshoretoepassingen, waaronder een baanbrekend assortiment elektrische reddingsboten, , Samen streven we er altijd naar de beste te zijn en de lat hoger te leggen als het op veiligheid aankomt We zijn trots om nieuwe en opwindende producten te ondersteunen, evenals nieuwe markten Onze werkomgeving is informeel en toch professioneel  en een goed gevoel voor humor is altijd welkom, , , , VIKING LifeSaving Equipment AS is a global market leader in maritime, offshore and fire safety, providing and servicing safety and firefighting equipment for passenger and cargo ships, offshore installations, fishing vessels, the navy, helicopter services, fire departments and leisure yachts, , VIKING is a privately held corporation founded in 1960 with group headquarters in Esbjerg, Denmark Today, with more than 3000 employees worldwide, , The VIKING group is represented by 8 Manufacturing Facilities, 3 Training Academies, 85 Branch Offices and 275 Certified Servicing Stations, , Interesse in de functie van Account Manager bij Viking LifeSaving Equipment BV regio Reageer nu met je CV en motivatie via de solliciteer button, Acquisitie naar aanleiding van deze vacature wordt niet op prijs gesteld",Full-time,https://www.linkedin.com/jobs/view/externalApply/2312470964?url=https%3A%2F%2Fjoblift%2Enl%2Fdetails%2Ffc5db438-4c30-4990-8157-4acc970a2f69%3Fjid%3D599af6b92b4a7e91448ddaba0fcc7b4002bb9c613a4d372c6172cee676464f7a%26utm_source%3Dlinkedin_nl%26utm_medium%3Dexternal_feed%26utm_campaign%3D404&urlHash=wBdP&refId=c6ed10e9-25de-4b03-a1d3-4962b3944588&trk=public_jobs_apply-link-offsite,https://nl.linkedin.com/jobs/view/account-manager-at-viking-life-saving-equipment-a-s-2312470964?refId=c6ed10e9-25de-4b03-a1d3-4962b3944588&position=10&pageNum=15&trk=public_jobs_job-result-card_result-card_full-click,2 days ago,2 days ago,2020-11-28,2020-11-30
386,sale,LinkedIn,2263929289,Ondernemende makelaarstalenten gezocht!,iiCfQ763T+Ooc1M1VHH0JQ==,2bconnected,"Alkmaar, North Holland, Netherlands","['Information Technology and Services', 'Staffing and Recruiting', 'Human Resources']","Introduction, , Altijd makelaar willen worden en direct in omgeving Alkmaar aan de slag Gaat jouw bloed sneller stromen van onroerend goed, nieuwe concepten en het runnen van je eigen toko, , Dit is je kans om binnen no time als zelfstandig makelaar werkzaam te zijn, , Organization, , Onze opdrachtgever is een digitaal veilinghuis waar koper en verkoper samenkomen Trefwoorden zijn snelheid en zekerheid, , De verkoopprocedure biedt alle partijen transparantie, waardoor dit makelaarsconcept met name onder particulieren aan populariteit wint, , De opdrachtgever heeft op dit moment drie vestigingen en biedt een aantal ondernemers en aankomend makelaars de mogelijkheid om middels de unieke concept te gaan makelen Je krijgt een training op maat, inclusief coachingonthejob, , Function, , Wij zoeken commercile netwerktalenten die het concept met plezier en overtuiging uitdragen Je bent zelf verantwoordelijk voor het uitvoeren van makelaarswerkzaamheden zoals het voeren van verkoopgesprek, vaststellen van de waardebepaling, woninginvoer, verkoopactiviteiten zoals bezichtiging en open huis, alsmede opstellen van koopcontract  kortom, jij zorgt nog steeds voor de service, , , , Wil jij n van de makelaars worden die met dit unieke concept gaan werken, dan vragen wij het volgende, , Offer, , , , , , Information, , Benieuwd Voor informatie kun je contact opnemen met Olof Raas, 2B Connected  d recruitmentspecialist voor makelaar en hypotheekprofessionals, telefoon 0207640777 en mobiel 0648474407, , Application, , Of mail direct een korte motivatie mt recent CV naar Olof Raas 2B Connected oraas2bconnectedorg, , Zodra we je gegevens ontvangen verneem je altijd binnen enkele dagen van ons",Full-time,https://www.linkedin.com/jobs/view/externalApply/2263929289?url=http%3A%2F%2F2bconnected%2Ecarerix%2Ecom%2Fcxportal%2Fjobdetails%2F2836%2FAlkmaar%2FOndernemende-makelaarstalenten-gezocht%21%2Ehtml&urlHash=NMuA&refId=c6ed10e9-25de-4b03-a1d3-4962b3944588&trk=public_jobs_apply-link-offsite,https://nl.linkedin.com/jobs/view/ondernemende-makelaarstalenten-gezocht%21-at-2bconnected-2263929289?refId=c6ed10e9-25de-4b03-a1d3-4962b3944588&position=11&pageNum=15&trk=public_jobs_job-result-card_result-card_full-click,2 days ago,2 days ago,2020-11-28,2020-11-30
387,sale,LinkedIn,2282682452,Sales Area Manager,QnZMJOk+SeWecUlQFO9zlQ==,ATS Automation,"Joure, Friesland, Netherlands","['Electrical/', 'Electronic Manufacturing', 'Industrial Automation', 'Mechanical or Industrial Engineering']","Job Description, , Job Title Sales Area Manager The Netherlands, , Company Comecer Netherlands, , Location, , Reporting to, , , , Comecer Netherlands BV in Joure develops, assembles and sells innovative equipment and software for Pharmaceutical manufacturing companies and for Nuclear Medicine departments in hospitals and industry Comecer Netherlands BV is part of Comecer, which is an ATS Automation company Our products are sold worldwide, , , , , , We are looking for an Area Sales Manager for The Netherlands, who take ownership and full responsibility for all direct sales and business development activities dealing with Comecer products and services focusing on Nuclear Medicine and Nuclear Industry markets",Contract,https://www.linkedin.com/jobs/view/externalApply/2282682452?url=https%3A%2F%2Fjobs%2Eatsautomation%2Ecom%2FComecer%2Fjob%2FJoure-Sales-Area-Manager-FR-8501-XC%2F619350001%2F&urlHash=svkz&refId=c6ed10e9-25de-4b03-a1d3-4962b3944588&trk=public_jobs_apply-link-offsite,https://nl.linkedin.com/jobs/view/sales-area-manager-at-ats-automation-2282682452?refId=c6ed10e9-25de-4b03-a1d3-4962b3944588&position=12&pageNum=15&trk=public_jobs_job-result-card_result-card_full-click,2 days ago,2 days ago,2020-11-28,2020-11-30
388,sale,LinkedIn,2257908311,Account Manager Noord-Holland (m/f/x),vaC4jkQsQFex9TcrDWNS2g==,Straumann Group,"IJsselstein, Utrecht, Netherlands","['Information Technology and Services', 'Computer Software', 'Human Resources']","Functieomschrijving, , Wij zijn op zoek naar jou als onze nieuwe Account Manager mv, , Als Account Manager ben je verantwoordelijk voor de verkoop en promotie van de Straumann producten en diensten in het rayon Midden Nederland Je belangrijkste klanten zijn kaakchirurgen, implantologen, tandartsen en tandtechnische laboratoria, , Je rapporteert aan de Area Sales Manager, , , , , , , , , , Functieeisen, , , Aanvullende informatie, , We bieden een zelfstandige functie met een goed salaris en uitstekende secundaire arbeidsvoorwaarden zoals auto, telefoon, pensioen, bonusregeling en een interne opleiding om gedegen productkennis op te bouwen, , Acquisitie naar aanleiding van deze vacature wordt uitdrukkelijk niet op prijs gesteld",Full-time,https://www.linkedin.com/jobs/view/externalApply/2257908311?url=https%3A%2F%2Fjobs%2Esmartrecruiters%2Ecom%2FStraumannGroup1%2F743999719214575-account-manager-noord-holland-m-f-x-&urlHash=9Bmk&refId=c6ed10e9-25de-4b03-a1d3-4962b3944588&trk=public_jobs_apply-link-offsite,https://nl.linkedin.com/jobs/view/account-manager-noord-holland-m-f-x-at-straumann-group-2257908311?refId=c6ed10e9-25de-4b03-a1d3-4962b3944588&position=13&pageNum=15&trk=public_jobs_job-result-card_result-card_full-click,2 days ago,2 days ago,2020-11-28,2020-11-30
389,sale,LinkedIn,2282671553,Assistent-bedrijfsleider,Q6kkW8lKQTynx7CAxtBHxQ==,Accord,"Naarden, North Holland, Netherlands",['Retail'],"Introductie, Ben jij op zoek naar een baan met verantwoordelijkheid waarbij jij de rechterhand wordt van de eigenaar van een luxe interieurwinkel Dan is dit jouw baan",Full-time,,https://nl.linkedin.com/jobs/view/assistent-bedrijfsleider-at-accord-2282671553?refId=c6ed10e9-25de-4b03-a1d3-4962b3944588&position=14&pageNum=15&trk=public_jobs_job-result-card_result-card_full-click,2 days ago,2 days ago,2020-11-28,2020-11-30
