Data Row,Search Keyword,Platform,Job ID,Job Title,Tracking ID,Company Name,Location,Industry,Job Description,Employment Type,Company URL,Job URL,Job Age,Job Age Number,Job Date,Collection Date
99,education,LinkedIn,2273087849,Asset Manager Modulaire Bouw,ZZLkDRZVsxbfukWKurV+yA==,Venturn,"Oirschot, North Brabant, Netherlands",['Construction'],"Grensverleggers die in alles wat ze doen het belang van de wereld om hen heen als belangrijkste uitgangspunt nemen De Meeuw is zon grensverlegger die, op het gebied van flexibele huisvestingsconcepten, een inspirerende wereld aan ongekende mogelijkheden biedt",Full-time,https://www.linkedin.com/jobs/view/externalApply/2273087849?url=https%3A%2F%2Fwww%2Eventurn%2Enl%2Fvacancies%2Fhoofd-unitbeheer-oirschot&urlHash=-Pql&trk=public_jobs_apply-link-offsite,https://nl.linkedin.com/jobs/view/asset-manager-modulaire-bouw-at-venturn-2273087849?refId=4b3df599-52d2-4a8f-924b-19f31e8e0a85&trackingId=ZZLkDRZVsxbfukWKurV%2ByA%3D%3D&position=24&pageNum=3&trk=public_jobs_job-result-card_result-card_full-click,2 weeks ago,2 weeks ago,2020-11-19,2020-11-30
101,education,LinkedIn,2323441910,Financieel administratief medewerker,r12xsmPIsjsb0SeygsThVg==,Onderwijsgroep Tilburg,"Tilburg, North Brabant, Netherlands",['Education Management'],"Financieel administratief medewerker, , Ben jij cijfermatig sterk en klantgericht Zie jij geen problemen maar oplossingen en ben je zowel schriftelijk als mondeling communicatief sterk Dan ben jij de financieel administratief medewerker die wij zoeken voor de afdeling Financin van de Administratieve Dienst van Onderwijsgroep Tilburg, , , , Je doet alle voorkomende werkzaamheden op de administratie, zoals crediteurenadministratie, bankmutaties, debiteurenadministratie en het verwerken van betalingen Je hebt een aandeel in het opleveren van de jaarrekening, zoals het opstellen van een deel van het balansdossier Daarnaast ben je met een collega aanspreekpunt voor alle projecten die binnen de organisatie lopen en waarover verantwoording moet worden afgelegd Ook ben je verantwoordelijk voor de juiste manier van vastlegging van de projecten, , , , Je hebt een relevante afgeronde hbo of mboniveau 4opleiding met enige jaren ervaring Je bent op de hoogte van de laatste theoretische ontwikkelingen op je vakgebied en je werkt gestructureerd Het werken met Microsoft Office is vanzelfsprekend voor je je bent hierin een expert Bij voorkeur heb je ook ervaring met de administratieve verwerking en verantwoording van projecten Ervaring met AFAS Software is een pr, , Daarnaast zijn het onder druk halen van deadlines en daarbij oog houden voor de kwaliteit uitdagingen die je goed afgaan Je hebt oog voor procesverbeteringen en optimalisatie en je vindt het leuk om hier continu mee bezig te zijn Je bent in staat om dit enthousiast over te brengen en op te pakken met je collegas, , , , Onderwijsgroep Tilburg biedt haar scholen Bestuurs, Management en Onderwijsondersteuning met de afdelingen Administratieve Dienst, Advies en Beleid Ondersteuning, Advies en Beleid Onderwijs, Frontoffice, Operationele Services, Onderwijslogistieke Services en Huisvesting, , Onderwijsgroep Tilburg is een onderwijswereld op zich Vmbo, mbo, entreeopleidingen, schakelonderwijs, voortgezet volwassenonderwijs, educatie en inburgering en maatwerk in bedrijfsgericht opleiden Leerlingen, studenten en deelnemers Onderwijzend en ondersteunend personeel Ieder met zijn eigen uitdagingen en mogelijkheden Onderwijsgroep Tilburg biedt de ruimte te ontdekken waar jij goed in bent",Full-time,https://www.linkedin.com/jobs/view/externalApply/2323441910?url=https%3A%2F%2Fneuvoo%2Enl%2Fjob%2Ephp%3Fid%3D8087acf43c6e%26source%3Dlinkedin%26utm_source%3Dpartner%26utm_medium%3Dlinkedin%26puid%3Dfdd8cddgedd88dd9badf9addaadagddcadddfadd3deacacbfec3ddcg3e&urlHash=-bNt&refId=0bace62a-389b-4f5e-b4da-4ba852656910&trk=public_jobs_apply-link-offsite,https://nl.linkedin.com/jobs/view/financieel-administratief-medewerker-at-onderwijsgroep-tilburg-2323441910?refId=0bace62a-389b-4f5e-b4da-4ba852656910&trackingId=r12xsmPIsjsb0SeygsThVg%3D%3D&position=1&pageNum=4&trk=public_jobs_job-result-card_result-card_full-click,2 weeks ago,2 weeks ago,2020-11-19,2020-11-30
102,education,LinkedIn,2267738193,Accountant AA | Manager samenstelpraktijk | Amsterdam,c8she+I69Gz+8W448VqdBg==,"Adviesgroep88  Het recruitment bureau voor Accountants  Fiscalisten, sinds 1988","Amsterdam, North Holland, Netherlands","['Insurance', 'Mental Health Care', 'Health, Wellness and Fitness']","Ben jij de Accountant AA  Manager samenstelpraktijk  Amsterdam die wij zoeken, Onze opdrachtgever, , Voor een snelgroeiend en ambitieus accountantskantoor, met drie vestigingen is ons gevraagd opzoek te gaan naar een manager accountant AA die op korte termijn onderdeel wil worden van het samenstelteam, , , , Een van onze consultants heeft een paar cruciale posities ingevuld en zit dicht op onze opdrachtgever Dus we kennen de vestigingen, de bemanning en de ambities Daarom willen we dat graag overbrengen op onze kandidaten, , Niet alleen door het netwerk waarbij men is aangesloten, maar ook door de locaties hebben de vestigingen een internationale vibe Er wordt hard gewerkt, maar er is geen overwerk cultuur Successen worden gevierd, teleurstellingen samen gedragen Ook wordt er soms over de vestigingen heen gewerkt wat de samenwerking op alle kantoren ten goede komt, , Bovendien doorstaat onze opdrachtgever vaktechnisch alle toetsen der kritiek en wordt er veel aan training en educatie gedaan Qua automatisering is er nauwelijks verschil met de Big Four en loopt men voor op het gebruik van BI, Dataanalyse en gebruik van portals Tenslotte nemen alle medewerkers die willen groeien in hun ontwikkeling jaarlijks hun POP door en werken daar continu aan, , , , , , , Onze opdrachtgever is een van de kantoren die weet dat je goede mensen in deze tijd goed moet belonen Daar wordt dan ook zeker niet op bezuinigd Zowel primair en secundair wordt er een goed pakket geboden, , De arbeidsvoorwaarden zijn uitstekend te noemen en liggen daarmee boven de norm van belastingadvies of administratiekantoren Deze omvatten ondermeer een 13e maand, bonusregeling en 30 vakantiedagen Ook zijn er doorgroeimogelijkheden aanwezig Daarnaast worden de studiefaciliteiten die beschikbaar zijn ook ondersteund, , Het is er ons veel aan gelegen om deze vacature in te vullen Wij willen dan ook de beste match maken Als jij de geschikte kandidaat bent voor deze positie dan garanderen wij jou een snelle en passende procedure Interview s avonds of in het weekend Geen probleem, , ,  Je hebt geen woord te veel gezegd Alleen de entree al Wat een prachtig pand, maar veel belangrijker fijne werksfeer en ontzettend plezierige leiding Ik ben de eerste week goed opgevangen en ingewerkt Al snel had ik het eerste klantcontact wat goed verliep Ik krijg veel vrijheid en kan overleggen met wie ik maar wil De deuren staan altijd open of in ieder geval op een kier  Een kleinschalig maar hoogwaardig kantoor, wat me heel veel afwisselend werk geeft En dat zocht ik Peter ontzettend bedankt voor deze kans , , Meer referenties vind je hier Consultant Peter A Tijssen  Referentienummer ADPT08829, sponsored by aol, Direct solliciteren Meer vacatures",Full-time,https://www.linkedin.com/jobs/view/externalApply/2267738193?url=https%3A%2F%2Fwww%2Egroep88%2Enl%2Fvacature%2Faccountant-aa-manager-samenstelpraktijk-amsterdam%2F&urlHash=QHz1&trk=public_jobs_apply-link-offsite,https://nl.linkedin.com/jobs/view/accountant-aa-manager-samenstelpraktijk-amsterdam-at-adviesgroep88-het-recruitment-bureau-voor-accountants-fiscalisten-sinds-1988%21-2267738193?refId=0bace62a-389b-4f5e-b4da-4ba852656910&trackingId=c8she%2BI69Gz%2B8W448VqdBg%3D%3D&position=2&pageNum=4&trk=public_jobs_job-result-card_result-card_full-click,2 weeks ago,2 weeks ago,2020-11-19,2020-11-30
103,education,LinkedIn,2206228485,Inspecteur SNA keurmerk/Auditor CAOs (32-40 uur),6HgAy4uaqoTYrKJYPrHkZg==,FlexSpect BV,"South Holland, Netherlands",['Financial Services'],Vind jij het leuk om iedere dag een andere werkplek te hebben Houd je van vrijheid en zelfstandigheid binnen een jonge en platte organisatie Bijt jij je graag vast in je werk en vind je het leuk om contact te hebben met verschillende klanten Dan is deze functie als Inspecteur SNA keurmerkAuditor CAOs regio Nederland iets voor jou,Full-time,https://www.linkedin.com/jobs/view/externalApply/2206228485?url=https%3A%2F%2Fwww%2Esteamz%2Enl%2Fvacatures%2Fvacature-inspecteur-sna-keurmerk-auditor-cao-s-32-40-uur-6789286-11%2Ehtml&urlHash=1ik3&trk=public_jobs_apply-link-offsite,https://nl.linkedin.com/jobs/view/inspecteur-sna-keurmerk-auditor-cao%E2%80%99s-32-40-uur-at-flexspect-b-v-2206228485?refId=0bace62a-389b-4f5e-b4da-4ba852656910&trackingId=6HgAy4uaqoTYrKJYPrHkZg%3D%3D&position=3&pageNum=4&trk=public_jobs_job-result-card_result-card_full-click,2 weeks ago,2 weeks ago,2020-11-19,2020-11-30
104,education,LinkedIn,2287288254,GZ psycholoog ouderen parttime,aRH8C1twjFQ0m68catlGQQ==,"Relationship Marketing, Inc RMi","Amsterdam, North Holland, Netherlands","['Health, Wellness and Fitness']","Bedrijfsomschrijving, , Deze organisatie binnen de ouderenzorg met locaties in Amsterdam eo is niet alleen zelf in ontwikkeling, ze bieden jou ook volop mogelijkheden tot ontwikkeling Je werkt in kleine, zelforganiserende teams waarin je de vrijheid hebt om samen naar oplossingen te zoeken en initiatieven te nemen De ouderzorg is complex, daarom is de organisatie steeds in beweging Dit biedt jou kansen om mee te denken, deel te nemen aan projecten en trainingen te volgen op het gebied van de nieuwste kennis en vaardigheden, , , , Ben jij GZ psycholoog met passie voor de ouderenzorg en ben je toe aan meer ontwikkeling Wil je werken in een prettige organisatie met kleine teams, waar aandacht is voor ieders professie en verantwoordelijkheid Samen maken jullie het verschil in het leveren van de beste zorg op liefdevolle en respectvolle wijze, , , , , , , Wat neem jij mee, , , , , Een uitdagende baan in een fijne werksfeer, waarin je de vrijheid hebt om je vak goed uit te voeren Met jouw passie draag je bij aan de kernwaarden van de organisatie liefdevolle zorg, respect en ruimte voor eigenheid Binnen deze functie kun je meedenken aan toekomstige ontwikkelingen Daarnaast is er ook ruimte voor onderzoek, , De fuctie is zowel partime vanaf 24 uur per week als fulltime 36 uur per week in te vullen Je komt direct in dienst bij de opdrachtgever Je start met een tijdelijk contract voor de duur van een jaar, met uitzicht op vast dienstverband, , Uiteraard biedt de organisatie een marktconform arbeidspakket volgens de CAO Verpleeg en Verzorgingshuizen Daarnaast bieden zij mooie extras, zoals aandacht voor combinatie werk en mantelzorg thuis, een fiets en sportplan, een eindejaarsuitkering en leuke personeelskortingen op verzekeringen, theater en concerten, , Kom jij deze unieke organisatie versterken Of wil je graag meer weten We bieden je graag de mogelijkheid tot een vrijblijvende meeloop dag binnen de organisatie, zodat je de werksfeer zelf kunt ervaren, Neem contact op met Karin van Vlierden, Senior Consultant bij Start People Arts en Specialist 0641644121 Direct solliciteren via de button kan ook",Part-time,https://www.linkedin.com/jobs/view/externalApply/2287288254?url=https%3A%2F%2Feasyapply%2Ejobs%2Fr%2F17NM2l12TzPZ51OYKnG&urlHash=uRM8&trk=public_jobs_apply-link-offsite,https://nl.linkedin.com/jobs/view/gz-psycholoog-ouderen-parttime-at-relationship-marketing-inc-rmi-2287288254?refId=0bace62a-389b-4f5e-b4da-4ba852656910&trackingId=aRH8C1twjFQ0m68catlGQQ%3D%3D&position=4&pageNum=4&trk=public_jobs_job-result-card_result-card_full-click,2 weeks ago,2 weeks ago,2020-11-19,2020-11-30
105,education,LinkedIn,2317385324,Stage scientific educator,Pr1xA01NbMIZjEmeJoa1ag==,StudentenBureau,"Amsterdam, North Holland, Netherlands",['Staffing and Recruiting'],"Dit ga je leren, De organisatie waar jij komt te werken is actief op het gebied van voedingssupplementen, De organisatie heeft als doel om de optimale gezondheid van de mens te waarborgen, , In totaal werken 65 medewerkers op kantoor in Almere, , Per september zijn zij op zoek naar een meewerkstudent die kan ondersteunen op de marketingafdeling, De marketingafdeling bestaat uit 10 medewerkers in verschillende functies zoals brand manager, marketing  communicatie specialist en new product development Zij werken nauw samen met de afdelingen sales en supply chain, , Als junior scientific educator pak je ondersteun je bij onderstaande taken, , , merkcampagnes, , Zo ziet jouw dag eruit, Wie bij jij, , , , Dit ben jij, , , Over dit bedrijf, Jouw toekomstige stagebedrijf is actief in voedingssupplementen en er werken 65 medewerkers binnen het bedrijf De sfeer binnen de organisatie is te omschrijven als informeel, , Je komt te werken op de marketingafdeling met 10 medewerkers, , Je krijgt bij dit bedrijf goede begeleiding op HBO niveau en je ontvangt een prima stagevergoeding, , Vanaf Amsterdam Centraal is het 30 minuten met de trein",Full-time,https://www.linkedin.com/jobs/view/externalApply/2317385324?url=https%3A%2F%2Fnl%2Ejooble%2Eorg%2Fexternal%2F-2149677082853778205%3Futm_campaign%3DNL%26utm_medium%3Dsocial%26utm_source%3Dlinkedin%26JobSource%3DBoard&urlHash=885Z&trk=public_jobs_apply-link-offsite,https://nl.linkedin.com/jobs/view/stage-scientific-educator-at-studentenbureau-2317385324?refId=0bace62a-389b-4f5e-b4da-4ba852656910&trackingId=Pr1xA01NbMIZjEmeJoa1ag%3D%3D&position=5&pageNum=4&trk=public_jobs_job-result-card_result-card_full-click,2 weeks ago,2 weeks ago,2020-11-19,2020-11-30
106,education,LinkedIn,1989644866,Cloud Engineer,Y5A2D0Jggwe5c3M6p4fUZg==,asr,"Utrecht, Utrecht, Netherlands","['Financial Services', 'Insurance']","Wil jij samen met andere Cloud Engineers de voortrekker zijn in de transformatie van asr En zoek je een omgeving waar je los kunt gaan met experimenteren Kom je dan verder ontwikkelen als Cloud Engineer bij asr, , Als Cloud Engineer help je bij het implementeren, configureren en onderhouden van een modern platform in de Azure cloud Verschillende applicatieteams binnen asr gebruiken dit platform om hun applicaties op te bouwen Denk hierbij bijvoorbeeld aan de portals voor onze klanten om hun verzekeringsproducten te bekijken, , Het Azure team gebruikt de nieuwste technieken, zoals Terraform, AzureDevOps en natuurlijk een flinke set aan Azure services om het platform te ontwikkelen en onderhouden Veel dingen die we doen zijn echt nieuw, dus er is veel ruimte om te experimenteren Ook is persoonlijke ontwikkeling voor iedereen in het team top prioriteit en is er veel ruimte voor educatie en kennisdeling Zo zijn we niet alleen voorlopers, maar blijven we het ook Wil jij creatieve initiatieven spuien Dan zit je helemaal goed bij asr als Cloud Engineer, , , , , , , , , , , , Je gaat werken binnen de afdeling Technology Services, onderdeel van de centrale ICT afdeling van asr Binnen deze afdeling wordt gewerkt op basis van Agileprincipes, je maakt onderdeel uit van een van onze multidisciplinaire teams Er is een gezellige en ongedwongen sfeer waar we hard werken, maar ook de tijd nemen voor de nodige, luchtige ontspanning We vinden het belangrijk dat we over de benodigde vakmanschap beschikken, zodat we onze klanten nog beter kunnen helpen en doortasten en vooruitstrevend te werk gaan Kom jij kennis maken met asr, , , , , , , , , , , , Enthousiast geworden Reageer via de button solliciteer Mocht je nog vragen hebben neem dan contact op met Juliet David recruiter, telefoon 06226 08876 Als onderdeel van onze sollicitatieprocedure vragen wij je een persoonlijkheidsvragenlijst en capaciteitentest in te vullen Alle informatie hierover ontvang je van Juliet",Full-time,https://www.linkedin.com/jobs/view/externalApply/1989644866?url=https%3A%2F%2Fwww%2Ewerkenbijasr%2Enl%2Fvacatures%2F2000001S%2FCloud-Engineer%2F%3Futm_source%3Dlinkedin%26utm_medium%3Dcareersite%26utm_campaign%3Djobwrapping&urlHash=WTlm&refId=0bace62a-389b-4f5e-b4da-4ba852656910&trk=public_jobs_apply-link-offsite,https://nl.linkedin.com/jobs/view/cloud-engineer-at-a-s-r-verzekeringen-1989644866?refId=0bace62a-389b-4f5e-b4da-4ba852656910&trackingId=Y5A2D0Jggwe5c3M6p4fUZg%3D%3D&position=6&pageNum=4&trk=public_jobs_job-result-card_result-card_full-click,2 weeks ago,2 weeks ago,2020-11-19,2020-11-30
107,education,LinkedIn,2307059872,Roosteraar,YV9ZQByAXRFFCX4k5ht+pw==,Koning Willem I College,"sHertogenbosch, North Brabant, Netherlands","['Primary/', 'Secondary Education']",Ben jij een kei in het puzzelen met roosters en niet gauw van je stuk gebracht door situaties die elk uur veranderen Voel jij je thuis in een functie die bestaat uit het zorgen voor een goede onderwijslogistiek Dan ben jij misschien wel de roosteraar die we zoeken en maken wij graag digitaal met je kennis,Part-time,https://www.linkedin.com/jobs/view/externalApply/2307059872?url=https%3A%2F%2Fwerkenbij%2Ekw1c%2Enl%2Fvacatures%2F20201105%2Froosteraar-schaal-8&urlHash=QAAA&trk=public_jobs_apply-link-offsite,https://nl.linkedin.com/jobs/view/roosteraar-at-koning-willem-i-college-2307059872?refId=0bace62a-389b-4f5e-b4da-4ba852656910&trackingId=YV9ZQByAXRFFCX4k5ht%2Bpw%3D%3D&position=7&pageNum=4&trk=public_jobs_job-result-card_result-card_full-click,2 weeks ago,2 weeks ago,2020-11-19,2020-11-30
108,education,LinkedIn,2321516955,Pedagogisch medewerker VE,FN0uelhbQikkCRrs3oC3wQ==,Prokino Kinderopvang,"Dordrecht, South Holland, Netherlands",['Food & Beverages'],"Heb jij een passie om spelenderwijs een bijdrage te leveren aan de ontwikkeling van kinderen, Ben je flexibel en kunnen jouw collegas op je rekenen als ze even hun handen vol hebben, Heb je oog voor wat kinderen nodig hebben en vind je het leuk om aan te sluiten bij hun belevingswereld, , , Dan is Prokino op zoek naar jou, , Stichting Prokino  SPD heeft 18 peuterspeelzalen voor Voorschoolse Educatie VE in Dordrecht Per januari 2021 worden de openingstijden verruimd en krijgen peuters meer speeltijd Wij zijn daarom op zoek naar enthousiaste en betrokken pedagogisch medewerkers voor onze peuterspeelzalen De contracturen zijn in overleg bespreekbaar vanuur per week, , Als pedagogisch medewerker op de VEpeuterspeelzaal ondersteun je spelenderwijs de ontwikkeling van jonge kinderen in de belangrijkste periode van hun leven Je zorgt dat er ruimte is voor ontwikkeling, samenspel en beweging maar ook voor rust en ontspanning Het VE programmma Piramide vormt een belangrijk onderdeel van het werken met de peuters, ervaring daarmee is een pr, , Wat ga je doen, , , , Wat bieden we jou, , Prokino vindt het belangrijk dat jij tevreden bent, want alleen dan kunnen we samen kinderen de allerbeste ontwikkeling bieden, , Daarom bieden we jou",Full-time,https://www.linkedin.com/jobs/view/externalApply/2321516955?url=https%3A%2F%2Fjoblift%2Enl%2Fdetails%2F42e5abae-f488-443f-9b3f-7fbfd45bea39%3Fjid%3D75d008a21f7a31bf863de9f6c7724c7b56234b9aac8b7f15b97ec1e3a84a1a1b%26utm_source%3Dlinkedin_nl%26utm_medium%3Dexternal_feed%26utm_campaign%3D126&urlHash=AeC8&trk=public_jobs_apply-link-offsite,https://nl.linkedin.com/jobs/view/pedagogisch-medewerker-ve-at-prokino-kinderopvang-2321516955?refId=0bace62a-389b-4f5e-b4da-4ba852656910&trackingId=FN0uelhbQikkCRrs3oC3wQ%3D%3D&position=8&pageNum=4&trk=public_jobs_job-result-card_result-card_full-click,2 weeks ago,2 weeks ago,2020-11-19,2020-11-30
109,education,LinkedIn,2308363228,Docent Aardrijkskunde (Pabo),pBstB5FQTKR+dKo40Rzj+Q==,De Haagse Hogeschool  The Hague University of Applied Sciences,"The Hague, South Holland, Netherlands",['Higher Education'],"Weet jij onze studenten te inspireren met jouw passie voor onderwijs en geeft het begeleiden van studenten je energie We zijn op zoek naar een docent Aardrijkskunde voor de Opleiding tot Leraar Basisonderwijs Pabo, , Wat ga je precies doen",Part-time,https://www.linkedin.com/jobs/view/externalApply/2308363228?url=https%3A%2F%2Fbit%2Ely%2F2Va2JKc&urlHash=f-lw&refId=0bace62a-389b-4f5e-b4da-4ba852656910&trk=public_jobs_apply-link-offsite,https://nl.linkedin.com/jobs/view/docent-aardrijkskunde-pabo-at-de-haagse-hogeschool-the-hague-university-of-applied-sciences-2308363228?refId=0bace62a-389b-4f5e-b4da-4ba852656910&trackingId=pBstB5FQTKR%2BdKo40Rzj%2BQ%3D%3D&position=9&pageNum=4&trk=public_jobs_job-result-card_result-card_full-click,2 weeks ago,2 weeks ago,2020-11-19,2020-11-30
110,education,LinkedIn,2257699610,"Frontend Developer Applicaties smart industry, educatie en zorg | Zwolle | Frontend Professionals",dteDqhj59IyezRHtRlbnhw==,ICTerGezochtnl,"Zwolle, Overijssel, Netherlands","['Information Technology and Services', 'Computer Software', 'Computer & Network Security']","Vacature van Frontend Professionals, locatie Zwolle, , Ben jij een ervaren Frontend Developer en ben je woonachtig in de omgeving van Enschede Ben jij graag met de klant in contact en kun je goed schakelen tussen verschillende projecten Dan is dit leuke team op zoek naar jou, , Als Frontend Developer kom je terecht in een klein team van Developers en speel jij een leuke en belangrijke rol in eigenlijk het hele ontwikkeltraject Van het eerste prototype, het ontwerp en de architectuur tot de bouw en support alles krijg je mee Dat is natuurlijk niet alleen leuk, maar ook leerzaam, omdat je je aandacht kunt focussen op de punten die jij interessant vindt, , Zo komt jouw werkdag er ongeveer uit te zien rond een uur of 845 kom je aan op kantoor, waar je om op te starten eerst een kop versgemalen koffie voor jezelf en je collegas zet Daar score je punten mee Je klapt je laptop open en start rustig op Vervolgens start je samen met je collegas de dag en kun je delen waar je tegenaan loopt, zodat je met een zeker gevoel verder kunt werken  Lunchtijd Samen met je collegas geniet je van de lunch, wandel je een rondje of kletsen jullie bij s Middags komt er een van de klanten op bezoek, waarmee je kunt sparren over nieuwe ideen Genoeg gezeten vandaag Je sluit de dag af bij de stapc waar je nog even de benen kunt strekken, je uren kunt registreren en met een goed gevoel je pc kunt dichtklappen, , Qua technische stack is vooral kennis van HTML, CSS en een van de moderne JavaScript frameworks Vue, Angular, React van belang Verder zijn we op zoek naar iemand met dezelfde positieve en teamgerichte drive als de rest van de groep Herken je jezelf hierin Dan zijn we op zoek naar jou, , , , , 5cd8a0b9cc68f9ffa4c9253553278a55",Full-time,https://www.linkedin.com/jobs/view/externalApply/2257699610?url=https%3A%2F%2Fwww%2Eictergezocht%2Enl%2F7622_frontend-professionals%2Fict-vacatures%2F60286_frontend-developer-applicaties-smart-industry-educatie-en-zorg%2F%3Fsource%3D5cd8a0b9cc68f9ffa4c9253553278a55%26utm_source%3Dlinkedin%26utm_medium%3Dreferral%26utm_campaign%3Dlinkedin_referral_vertical_vac_feed%26utm_term%3Ddeveloper%252bcat_frontend%2Bzw&urlHash=u77b&trk=public_jobs_apply-link-offsite,https://nl.linkedin.com/jobs/view/frontend-developer-applicaties-smart-industry-educatie-en-zorg-zwolle-frontend-professionals-at-ictergezocht-nl-2257699610?refId=0bace62a-389b-4f5e-b4da-4ba852656910&trackingId=dteDqhj59IyezRHtRlbnhw%3D%3D&position=10&pageNum=4&trk=public_jobs_job-result-card_result-card_full-click,2 weeks ago,2 weeks ago,2020-11-19,2020-11-30
111,education,LinkedIn,2283892092,Surveillant ROC,GdAUez3DOpLuvP+myVdwpA==,Uitzendbureau 65plus BV,"Leiden, South Holland, Netherlands",['Staffing and Recruiting'],"Op flexibele basis betaald bezig blijven als surveillant in Leiden, , Wellicht kunt u het zich nog herinneren een toetsmoment Zon moment ging en gaat nog steeds altijd gepaard met zenuwen, de doodste stilte en surveillanten die zorgen voor een goed verloop van de toets Door de aanwezig van een surveillant krijgen alle studenten de mogelijkheid om hun toets in alle rust te maken Surveillanten spelen dan ook een sleutelrol tijdens dit moment Wilt u deze rol graag op u nemen en houdt u van flexibiliteit Dan is de functie surveillant zeker iets voor u, , , , Momenteel zoeken wij voor een mooie onderwijsinstelling in Leiden enthousiaste AOWgerechtigden die graag aan de slag willen als surveillant De instelling is gericht op beroepsonderwijs en educatie voor volwassenen Met als kernwaarden vakkundig, innovatie en betrokken, zetten de medewerkers zich in voor de ruim 25000 studenten, , , , , , , , , , , , , , , , Bent u enthousiast en wilt u solliciteren Leuk",Full-time,https://www.linkedin.com/jobs/view/externalApply/2283892092?url=http%3A%2F%2Fwww%2E65plus%2Enl%2Fonderwijs%2Fwebcore%2Fvacancy%2Fredirect%2F202008-5381&urlHash=UsgX&refId=0bace62a-389b-4f5e-b4da-4ba852656910&trk=public_jobs_apply-link-offsite,https://nl.linkedin.com/jobs/view/surveillant-roc-at-uitzendbureau-65plus-bv-2283892092?refId=0bace62a-389b-4f5e-b4da-4ba852656910&trackingId=GdAUez3DOpLuvP%2BmyVdwpA%3D%3D&position=11&pageNum=4&trk=public_jobs_job-result-card_result-card_full-click,2 weeks ago,2 weeks ago,2020-11-19,2020-11-30
