Data Row,Search Keyword,Platform,Job ID,Job Title,Tracking ID,Company Name,Location,Industry,Job Description,Employment Type,Company URL,Job URL,Job Age,Job Age Number,Job Date,Collection Date
36,education,LinkedIn,2317049310,Leerkracht groep 1/2,k83s8Lp/Qmy7kdvaHdejsg==,OnderwijsPost,"Amsterdam, North Holland, Netherlands",['Staffing and Recruiting'],"Over deze vacature, , Vind jij het tof om het begin proces van de kinderen van groep 12 te volgen en deel uit te maken van de begin stapjes van hun gehele onderwijs Lees dan snel verder, , Een basisschool in de omgeving van Amsterdam is op zoek naar een leerkracht voor groep 1 en 2 Na de kerstvakantie ga jij hier drie dagen aan de slag De dagen zijn bespreekbaar maar jij bent in elk geval beschikbaar op de woensdag Het is een vacature voor een langere periode want jij gaat lesgeven tot de zomervakantie In de onderbouw gaat het het grootste gedeelte om plezier maken en daar kan jij als geen ander voor zorgen Door de kleine klassen heb jij extra aandacht voor de leerlingen en hun ontwikkelingen Je creert een uitdagende speel en leeromgeving waarin kinderen zich veilig voelen en alle kansen krijgen om zich te ontwikkelen Je motiveert, stimuleert en instrueert en zorgt er voor dat iedere dag goed verloopt, , Deze basisschool is een plek om te groeien De plek om te groeien wordt gecreerd door een veilige, inspirerende leeromgeving waar ieder kind de ruimte krijgt om zich te ontwikkelen Er is veel expertise om het beste uit de leerlingen te halen Binnen de school is een gedragsspecialist, rekenspecialist, taalspecialist en hoogbegaafdheidsspecialist aanwezig De school biedt ook veel aanbod voor naschoolse activiteiten en voor en vroegschoolse educatie Jij komt terecht in een leuk, gezellig en hardwerkend team Er zijn zeven kleutergroepen, allemaal met ondersteuning van assistenten De leerlingen hebben een continuerooster van 815 tot 1400 uur, , Ben je enthousiast geworden Solliciteer direct en wij nemen contact met je op om de mogelijkheden te bespreken, , Daar tegenover staat, , , , Wie zijn wij, , OnderwijsPost is een arbeidsbemiddelingsbureau gespecialiseerd in het onderwijs Wij brengen al jaren op succesvolle wijze opdrachtgevers en professionals bij elkaar binnen alle lagen van het onderwijs en de kinderopvang Hierbij gaat het om zowel kortdurende vervangingen als vaste dienstverbanden Persoonlijke aandacht is voor ons erg belangrijk om de wensen van onze professionals en opdrachtgevers goed in kaart te brengen Veel van onze recruiters en accountmanagers hebben zelf een achtergrond in het onderwijs en begrijpen hierdoor het werkveld Met onze OnderwijsPost Academy trainingen kunnen professionals zich blijven ontwikkelen en gezellige uitjes zorgen voor een groot onderwijs netwerk, , Functie eisen",Full-time,https://www.linkedin.com/jobs/view/externalApply/2317049310?url=https%3A%2F%2Fonderwijspost%2Enl%2Fvacatures%2Fleerkracht-groep-1-2&urlHash=nIGO&refId=026ccf1b-1781-4f24-84a9-d37889a02f79&trk=public_jobs_apply-link-offsite,https://nl.linkedin.com/jobs/view/leerkracht-groep-1-2-at-onderwijspost-2317049310?refId=026ccf1b-1781-4f24-84a9-d37889a02f79&position=11&pageNum=1&trk=public_jobs_job-result-card_result-card_full-click,2 weeks ago,2 weeks ago,2020-11-19,2020-11-30
37,education,LinkedIn,2284813041,Senior Digital Content Creator,I3MySCMeQiCeko48fUnjmw==,Radboud University,"Nijmegen, Gelderland, Netherlands","['Higher Education', 'Research']","Reageer uiterlijk 5 januari 2021, , Wij zoeken, , Iemand met een passie voor het creren van multimedia producties en alles wat daarbij komt kijken Hierbij weet je een verhaal om te zetten naar een prikkelend visueel product dat aansluit bij het onderwerp en doelgroep, , Jij neemt opdrachtgevers mee in het proces van schets tot eindproduct en je hoofd stroomt tijdens brainstormsessies over van ideen Door jouw werkervaring ben je een echte teamplayer die samen met een van je nieuwe collegas afstemt wat er nodig is voor een video De editor levert je een script aan en jij ondersteund in het opstellen van een storyboard en vormgeving van de set, grafische elementen en camerashots, , In grafieken zie jij glijbanen en eindeloze teksten zijn voor jouw kansen om je visuele vaardigheden aan op te hangen Je bent niet bang om je ideen voor te leggen bij de opdrachtgever of collegas Radboud Educational Clips bestaat uit een kernteam met daarnaast een grote groep werkstudenten die ons ondersteunen in creatieve werkprocessen Je vindt het leuk om je kennis te delen en weet welke taken je het beste kunt uitbesteden zodat jij efficint kunt werken, , Naast het vormgeven en uitwerken van grafisch werk ben je bij ons ook veel te vinden in een van onze vijf studios Hier ga je aan de slag met het opnemen van onderwijsvideos, webinars, podcasts of schiet je een serie fotos Ook zijn er dagen dat we van de campus afgaan en op een externe locatie filmen en beelden maken, , Kortom, we zijn op zoek naar een creatieve duizendpoot die overal inspiratie opdoet en deze inbrengt om onze producten naar een hoger niveau te tillen, , Wij vragen, , , , Wij zijn, , Radboud Educational Clips REC bestaat uit een team van creatieve beeldmakers met een focus op educatie en communicatie Onze missie is om multimedia zo educatief en effectief mogelijk te maken en in te zetten voor studenten en andere doelgroepen, , , Wij staan de opdrachtgevers bij van ontwerp tot implementatie Om tot het beste resultaat te komen wordt intensief samengewerkt met hen om het juiste product te ontwikkelen voor hun einddoel Dit kan een online college zijn, een webinar, een TEDtalk of een promotiefilm op verschillende locaties zowel op als buiten de Universitaire campus, , , Het RECteam heeft een brede basis aan competenties Er is expertise aanwezig op het gebied van didactiek, videotechniek, ICT in het onderwijs en communicatie De aanpak is gebaseerd op evidencebased learning en er is veel aandacht voor de persoonlijke visie van de opdrachtgever ten aanzien van de concrete leersituatie, , , Gedurende een videoproject werken de docentopdrachtgever en het RECteam nauw samen Hierdoor ontdekt de docent de specifieke kenmerken en mogelijkheden van het video medium binnen een didactische context Het creatieve werkproces is tevens een open leersituatie Naast concrete kennis over edidactiek, het visualiseren van leercontent en het maken van een script krijgt de docent ook training en coaching met betrekking tot presentatie voor een camera Ook faciliteren wij workshops en masterclasses voor docenten en studenten om hen de basis van effectief, visueel aantrekkelijke en inhoudelijk sterke videos maken bij te brengen, , , REC bestaat uit een kernteam met daarnaast een grote groep werkstudenten die ons ondersteunen in creatieve werkprocessen Er heerst een flexibele en informele werksfeer waar vragen aangemoedigd worden en er ruimte is voor persoonlijke ontwikkeling, , REC is onderdeel van het Teaching and Learning Centre TLC Het Radboud TLC wil ontmoeting, inspiratie en samenwerking tussen onderwijsgevers faciliteren en stimuleren om zo samen de kwaliteit van het onderwijs te versterken, , , Wij willen het beste halen uit de wetenschap, uit anderen en onszelf Waarom Omdat dit hard nodig is voor de wereld om ons heen Vooraanstaand onderzoek en onderwijs leveren een onmisbare bijdrage aan een gezonde, vrije wereld met gelijke kansen voor iedereen Dat is wat meer dan 22000 studenten en 5000 medewerkers van de Radboud Universiteit samenbrengt En wat vraagt om nog meer talent, samenwerking en een leven lang ontwikkelen Je bent nodig, , , , , , Meer weten, , Meer over de inhoud van de vacature, Gideon Kessler, senior videomaker, Telefoon 06 39 85 71 88, Email kennisclipsrunl, , Jos in den Bosch, teamleider Onderwijsvernieuwing met ICT, Email jindenboschrunl, , Solliciteren, , Richt de sollicitatiebrief aan Gideon Kessler en solliciteer, via de solliciteerbutton, uiterlijk 5 januari 2021, , Stuur met de sollicitatie de volgende bijlagen mee, , , De eerste gesprekken vinden plaats op 12 januari 2021 De eventuele tweede gesprekken vinden plaats op 19 januari 2021, Na een eerste sollicitatieronde zal er een meesterproef plaatsvinden in de vorm van grafische opdracht en videomontage",Full-time,https://www.linkedin.com/jobs/view/externalApply/2284813041?url=https%3A%2F%2Fwww%2Eru%2Enl%2Fvacinfo%3Frecid%3D1133221%26taal%3Dnl%26doel%3Drss%26%253Futm_source%3Dlinkedin%26utm_medium%3Dsocial%26utm_campaign%3Djobwrapping&urlHash=8JuQ&trk=public_jobs_apply-link-offsite,https://nl.linkedin.com/jobs/view/senior-digital-content-creator-at-radboud-university-2284813041?refId=026ccf1b-1781-4f24-84a9-d37889a02f79&position=12&pageNum=1&trk=public_jobs_job-result-card_result-card_full-click,2 weeks ago,2 weeks ago,2020-11-19,2020-11-30
38,education,LinkedIn,2327358435,Enthousiaste Fondsenwervers,V67B3WckRbmf+ii2t3MT+g==,ErvarenJaren Uitzendbureau,"Amsterdam, North Holland, Netherlands",['Staffing and Recruiting'],"Introductie, , U hecht belang aan het goede werk ten behoeve van goede doelen in de zorg, , De organisatie, , Onze opdrachtgever is een organisatie die zich richt op het werven van donateurs voor de zorgsector Denk hierbij aan donaties voor onderzoek, voorzieningen voor patinten van ziekenhuizen en educatie Op dit moment hebben wij vacatures in Amsterdam, , , , U gaat met mensen in gesprek die het ziekenhuis verlaten en onderzoekt of zij medisch onderzoek als donateur willen ondersteunen, , , , , , Uitstekende communicatieve vaardigheden, , Commercile werkervaring is een pr, , Een sterk ontwikkeld empathisch vermogen, , Flexibele instelling, , Affiniteit met goede doelen, , Woonachtig in Amsterdam, , Klantgericht en enthousiast, , Deze functie is ook zeer geschikt voor 65 plus kandidaten, , U bent minimaal zes tot maximaal 15 uur per week beschikbaar U wordt goed ingewerkt en begeleid door een professioneel fondsenwerver",Full-time,https://www.linkedin.com/jobs/view/externalApply/2327358435?url=https%3A%2F%2Fneuvoo%2Enl%2Fjob%2Ephp%3Fid%3Df11edf59cd96%26source%3Dlinkedin%26utm_source%3Dpartner%26utm_medium%3Dlinkedin%26puid%3Dfadacddfeddf8adbbadc9adaaddbgdd7aaddfadc3de7cdcafec3ddcg3e&urlHash=A5i-&refId=026ccf1b-1781-4f24-84a9-d37889a02f79&trk=public_jobs_apply-link-offsite,https://nl.linkedin.com/jobs/view/enthousiaste-fondsenwervers-at-ervarenjaren-uitzendbureau-2327358435?refId=026ccf1b-1781-4f24-84a9-d37889a02f79&position=13&pageNum=1&trk=public_jobs_job-result-card_result-card_full-click,2 weeks ago,2 weeks ago,2020-11-19,2020-11-30
39,education,LinkedIn,2306057972,Succesmanager Educatie (Groningen/Friesland),OhiDVLhOThOGdhnH7gN1oA==,EWISE,"Utrecht, Utrecht, Netherlands","['E-', 'Learning']","Succesmanager Educatie GroningenFriesland, , Met de nieuwste technieken, een eigen studio, eigen ICTontwerpers en een design afdeling zijn we in staat snel te accelereren en in te spelen op de kansen die de markt ons biedt EWISE is een gezond, dynamisch bedrijf met enorme potentie, , Naast het uitbouwen van onze bestaande producten hebben we eind 2017 twee nieuwe producten gentroduceerd op de scholenmarkt complete nascholingspakketten voor leerkrachten in het primair en docenten in het voortgezet onderwijs Daarmee spelen we in op de nascholingsbehoefte in het onderwijs EWISE streeft ook hier naar marktleiderschap Een positie die we in andere markten met succes hebben afgedwongen Vanwege het grote succes zijn we nu op zoek naar uitbreiding van ons implementatieteam, , Naast uitgebreide marketingprogrammas zetten we in op professioneel relatiemanagement Hierbij richten we ons op directies van scholen en eventueel overkoepelende organen We zoeken daarvoor verantwoordelijke, ondernemende initiatiefrijke professionals met kennis van de markt",Full-time,https://www.linkedin.com/jobs/view/externalApply/2306057972?url=https%3A%2F%2Fneuvoo%2Enl%2Fjob%2Ephp%3Fid%3D627dcc9aad06%26source%3Dlinkedin%26utm_source%3Dpartner%26utm_medium%3Dlinkedin%26puid%3Dfddacddeedd98adcbadd9addadd7gadfaadffadc3degcdcafec3ddcg3e&urlHash=iplq&refId=026ccf1b-1781-4f24-84a9-d37889a02f79&trk=public_jobs_apply-link-offsite,https://nl.linkedin.com/jobs/view/succesmanager-educatie-groningen-friesland-at-e-wise-2306057972?refId=026ccf1b-1781-4f24-84a9-d37889a02f79&position=14&pageNum=1&trk=public_jobs_job-result-card_result-card_full-click,2 weeks ago,2 weeks ago,2020-11-19,2020-11-30
40,education,LinkedIn,2326312662,BSO/KDV Pedagogisch Medewerker,cMVAxiF/RIizQhV24er7Dw==,New Business Company BV,"AmsterdamZuidoost, North Holland, Netherlands",['Food & Beverages'],"Je gaat bij opdrachtgevers van Zorgwerk flexibel aan de slag als BSOKDV Pedagogisch Medewerker in Someren en regio BrabantZuidoost Je kunt onder andere werken bij onze opdrachtgevers op het gebied van Kinderopvang en BabysAls pedagogisch medewerker in de kinderopvang begeleid je groepen kinderen in een kinderdagverblijf, buitenschoolse opvang BSO, naschoolse opvang NSO of peuterspeelzaalJe zorgt als pedagogisch medewerker voor een huiselijke sfeer, waarin kinderen zich veilig voelen Je houdt de ontwikkeling van de kinderen en de groep goed in de gaten, dus het is belangrijk om oplettend en alert te zijn Als er problemen zijn, overleg je dat met je collegas, de ouders of een deskundige Ook als ouders vragen hebben kunnen ze bij jou terechtJe organiseert activiteiten op het gebied van sport en bewegen, kunst en creativiteit Deze activiteiten leveren een bijdrage aan de opvoeding van de kinderen en passen goed bij hun leeftijd Op deze manier begeleid en stimuleer je kinderen in hun sociale, emotionele en cognitieve ontwikkelingOok draag je zorg voor de inventaris van gemeenschappelijke en groepsruimten, waarbij je lichte huishoudelijke taken verrichtBen je enthousiast geworden om als BSOKDV Pedagogisch Medewerker aan het werk te gaan in Someren eo en voldoe je aan de funtieeisen Schrijf jezelf dan veilig online in,  Je hebt een diploma dat je kwalificeert voor de functie pedagogisch medewerker voor dagopvang of BSONSO volgens de CAO Kinderopvang, zoals SPW 34 MBO, HBO Pedagogiek of PABO Je hebt ervaring in de dagopvang of op de buitenschoolse opvang Je bezit goede communicatieve vaardigheden en kan zowel zelfstandig als in een team functioneren Je staat ingeschreven in het Personenregister Kinderopvang of je bent bereid je in te schrijven Hiervoor dien je een VOG aan te vragen de VOG vergoeden wij na je eerst gewerkte dienst VVEcertificaat en kwalificatie taaleis 3F voor voorschoolse educatie is een pr Je bent enthousiast om via Zorgwerk aan het werk te gaan Je beschikt over een sterk ontwikkeld verantwoordelijkheidsgevoel Je hebt affiniteit met Kinderopvang en babys,  Goed salaris marktconform cao voor Kinderopvang en wekelijks uitbetaald Alle vrijheid jij bepaalt zlf met de app waar, wanneer en hoe vaak je werkt Of niet werkt Veel afwisseling doe brede werkervaring op bij uiteenlopende opdrachtgevers in diverse sectoren Gratis scholing neem vanaf je eerste werkdag deel aan praktijkgerichte trainingen en leuke bijeenkomsten Geweldige community vind vrienden met de app en je staat er nooit alleen voor Hippe werkgever Zorgwerk is een innovatieve werkgever die om je geeft",Full-time,https://www.linkedin.com/jobs/view/externalApply/2326312662?url=https%3A%2F%2Fjoblift%2Enl%2Fjoblink%3Fto%3DeyJ0eXAiOiJKV1QiLCJhbGciOiJIUzI1NiJ9%2EeyJvZmZlcklkIjoiMjY1NWU4NWUtNmRmOS00NDlkLWIwODUtZTQ0Y2VhZWQyMDQxIn0%2En5eKgJjFg9HXnuuQDAMIzP65efNdd_fDAG1RypUsUHc%26jid%3De11993a6d5c5e36124011f3e5254c98808e69042b100d1ec3ffa7c7f325f6e12%26utm_source%3Dlinkedin_nl%26utm_medium%3Dexternal_feed%26utm_campaign%3D66&urlHash=D3vA&trk=public_jobs_apply-link-offsite,https://nl.linkedin.com/jobs/view/bso-kdv-pedagogisch-medewerker-at-new-business-company-bv-2326312662?refId=026ccf1b-1781-4f24-84a9-d37889a02f79&position=15&pageNum=1&trk=public_jobs_job-result-card_result-card_full-click,2 weeks ago,2 weeks ago,2020-11-19,2020-11-30
41,education,LinkedIn,2300307121,Adjunct-directeur,dBPZJl6PT/GLucig4TPzuQ==,ICK Amsterdam,"Amsterdam, North Holland, Netherlands",['Performing Arts'],"ICK Dans Amsterdam zoekt ADJUNCT DIRECTEUR  CULTUREEL ONDERNEMER , Met Rucksichtslos Idealisme actief in het culturele hart van de hedendaagse dans",Part-time,,https://nl.linkedin.com/jobs/view/adjunct-directeur-at-ick-amsterdam-2300307121?refId=026ccf1b-1781-4f24-84a9-d37889a02f79&position=16&pageNum=1&trk=public_jobs_job-result-card_result-card_full-click,2 weeks ago,2 weeks ago,2020-11-19,2020-11-30
42,education,LinkedIn,2306088317,"Directeur Fontys Hogeschool Bedrijfsmanagement, Educatie en Techniek - Utrecht",JgfI4m2CRtO5IwWiupyIJQ==,AcademicTransfer,"Utrecht, Utrecht, Netherlands","['Information Technology and Services', 'Research', 'Hospital & Health Care']","Plaats in de organisatie, Als directeur rapporteert u rechtstreeks aan het College van Bestuur U geeft rechtstreeks leiding aan het managementteam bestaande uit de onderwijsmanagers, de lectoren, de manager van het Centrum voor Ondernemerschap en de manager bedrijfsvoering Indirect geeft u leiding aan de circa 250 medewerkers van Fontys Hogeschool Bedrijfsmanagement, Educatie en Techniek, , , Als directeur bent u integraal verantwoordelijk voor onderwijs, onderzoek, innovatie en de bedrijfsvoering binnen het instituut Bedrijfsmanagement, Educatie en Techniek U stimuleert en geeft richting aan de doorontwikkeling van zowel de technisch bedrijfskundige opleidingen als de lerarenopleidingen van de PTH en bevordert de samenwerking tussen de opleidingen binnen het instituut als ook de samenwerking met andere opleidingen binnen het domein Techniek  Innovatie van Fontys Het versterken van regionale en internationale samenwerking en de verbindingen met het werkveld is een belangrijk deel van uw werk Als directeur staat u voor het belang van het geheel van opleidingen, onderzoek en de andere activiteiten in het domein en stuurt u op de meerwaarde van de verbinding tussen alle onderdelen Tevens is een belangrijke taak om het domein met verve naar buiten toe bij de externe stakeholders te vertegenwoordigen, , In aanvulling op uw activiteiten voor het domein geeft u samen met uw collegadirecteuren mede vorm aan de strategische koers van de hogeschool en bent daarin partner voor het College van Bestuur U neemt deel aan het directeurenoverleg en rapporteert aan het College van Bestuur Bovendien vervult u een rol bij projecten op hogeschoolniveau, , Als directeur Fontys Hogeschool Bedrijfsmanagement, Educatie en Techniek bent u verantwoordelijk voor",Full-time,https://www.linkedin.com/jobs/view/externalApply/2306088317?url=https%3A%2F%2Fneuvoo%2Enl%2Fjob%2Ephp%3Fid%3D6e39755ae5a1%26source%3Dlinkedin%26utm_source%3Dpartner%26utm_medium%3Dlinkedin%26puid%3Dfddacadbeddd8dd7bdd99ddbaddbgadfaadbfddb3aefcdcffec3ddcg3e&urlHash=WFOU&refId=026ccf1b-1781-4f24-84a9-d37889a02f79&trk=public_jobs_apply-link-offsite,https://nl.linkedin.com/jobs/view/directeur-fontys-hogeschool-bedrijfsmanagement-educatie-en-techniek-utrecht-at-academictransfer-2306088317?refId=026ccf1b-1781-4f24-84a9-d37889a02f79&position=17&pageNum=1&trk=public_jobs_job-result-card_result-card_full-click,2 weeks ago,2 weeks ago,2020-11-19,2020-11-30
43,education,LinkedIn,2306816669,Systeemtherapeut,9WpltEZyQ1ChyOYH5aPKLw==,Parnassia Groep,"Ede, Gelderland, Netherlands","['Mental Health Care', 'Health, Wellness and Fitness', 'Hospital & Health Care']","Systeemtherapeut, , Ook in coronatijd werven wij door Youz, specialistische zorg voor jeugd en gezin, in Ede zoekt een systeemtherapeut, , , Ben jij die optimistische, goed georganiseerde behandelaar, die van een uitdaging houdt Heb jij affiniteit met de doelgroep kinderen en jeugd en maak je graag een uitstapje naar jongvolwassenen en hun systemen, , Op onze gezinspoli in Ede helpen wij kinderen, jongeren en jongvolwassenen die door psychische problemen vastlopen in hun verdere ontwikkeling Ouders worden nauw betrokken en krijgen passende begeleiding aangeboden We werken cultuursensitief en vanuit een systemisch perspectief Dit houdt in dat we in onze behandeling altijd rekening houden met het grotere systeem waar je deel van uitmaakt en je culturele achtergrond, , Kinderen, jongeren en hun ouders zijn bij ons op de juiste plek voor diagnostiek en behandeling van psychische problemen Denk aan ontwikkelingsstoornissen zoals ADHD en autisme, maar ook aan trauma, depressie, angst en lichte persoonlijkheidsproblematiek, , We werken veelal multidisciplinair, dat houdt in dat er meerdere behandelaren betrokken zijn met elk hun eigen expertise Behandeling kan bestaan uit psychoeducatie, individuele psychotherapie, EMDR, ouderbegeleiding, groepstherapie, systeemtherapie of een combinatie hiervan, eventueel aangevuld met medicamenteuze behandeling Ons aanbod zal zich in de toekomst nog verder uitbreiden, , Als systeemtherapeut functioneer je binnen een multidisciplinair team, Onze locatie is gelegen naast station Ede, er is gratis parkeermogelijkheid, , , , Je bent een teamspeler met een flexibele werkhouding en goede communicatieve vaardigheden Je bent in staat tot reflectie betreffende jouw eigen handelen en beschikt over een grote mate van zelfstandigheid en integriteit bij het behandelen en begeleiden van clinten en hun systeem, Om in aanmerking te komen voor deze functie is een positieve Verklaring Omtrent Gedrag VOG vereist, Het natrekken van referenties, integriteitscontrole via het Waarschuwingsregister Zorg  Welzijn en het controleren van diplomas maken onderdeel uit van de sollicitatieprocedure, , , Wij bieden onze collegas gevarieerd en zinvol werk in een professionele en prettige werkomgeving Daarbij hoort natuurlijk een goed pakket aan arbeidsvoorwaarden conform cao GGZ Klik voor meer informatie over onze arbeidsvoorwaarden, , Het betreft een functie voor 2436 uur per week Je krijgt een contract voor onbepaalde tijd Het salaris bedraagt minimaal  3465, en maximaal  4620, FWG 60 bruto per maand op basis van een werkweek van 36 uur, , , is een instelling voor kinder, jeugd en jongvolwassenenpsychiatrie met locaties in bijna heel Nederland Wij bieden diagnostiek en behandeling van oa ADHD, autisme, infant mental health, transitiepsychiatrie en alle andere psychiatrische problematiek, , is onderdeel van , een werkgever in de geestelijke gezondheidszorg die streeft naar een inclusieve cultuur met gelijke kansen voor iedereen We maken geen onderscheid op gebied van geslacht, geloof, sociale achtergrond, geaardheid of etniciteit Wij vinden het belangrijk om van en mt elkaar te leren, dat iedereen zichzelf kan zijn en een ieder zich gewaardeerd voelt Bij ons kun je bijdragen aan tal van specialisaties, wetenschappelijke onderzoeken en via onze eigen Parnassia Groep Academie gebruik maken van geaccrediteerde opleidingsmogelijkheden Alleen in een werkomgeving waarin we openstaan voor verschillen, halen we het beste uit onszelf, kunnen we creatieve en innovatieve oplossingen bieden voor onze patinten en succesvol zijn, , , Heb je vragen of wil je meer weten Neem dan voor inhoudelijke vragen contact op met Simone van der Steen, GZ psycholoog manager zorg, via 0653672726 Voor overige vragen met AnneMarie Eeftink, regiodirecteur Youz Brabant en Gelderland, via 0883581810, , NB Acquisitie wordt niet op prijs gesteld, , pdf, , Solliciteer direct",Full-time,https://www.linkedin.com/jobs/view/externalApply/2306816669?url=https%3A%2F%2Fwww%2Eparnassiagroep%2Enl%2Fwerken-en-leren%2Fvacatures%2F-%2Fvid-95882-systeemtherapeut&urlHash=uUXO&refId=026ccf1b-1781-4f24-84a9-d37889a02f79&trk=public_jobs_apply-link-offsite,https://nl.linkedin.com/jobs/view/systeemtherapeut-at-parnassia-groep-2306816669?refId=026ccf1b-1781-4f24-84a9-d37889a02f79&position=18&pageNum=1&trk=public_jobs_job-result-card_result-card_full-click,2 weeks ago,2 weeks ago,2020-11-19,2020-11-30
44,education,LinkedIn,2280191552,Vestigingsmanager,sc3oFnjfSaGhUWlSzIriIw==,NewFysic,"Bussum, North Holland, Netherlands","['Health, Wellness and Fitness']","NEWFYSIC VERANDERT LEVENS, Onze missie is om heel Nederland aan een gezond gewicht te helpen Dit doen we al meer dan 15 jaar met succes n met elkaar Ons geheim We helpen anderen met heel veel liefde en zijn bovenal klantvriendelijk, professioneel en resultaat gedreven",Full-time,https://www.linkedin.com/jobs/view/externalApply/2280191552?url=https%3A%2F%2Fwww%2Enewfysic%2Enl%2Fvacancies%2Fvestigingsmanager-bussum%2F%3Futm_source%3DLinkedin%26utm_medium%3Dpost%2520Linkedin%2520vacature%26utm_campaign%3DLinkedin&urlHash=gYCX&refId=026ccf1b-1781-4f24-84a9-d37889a02f79&trk=public_jobs_apply-link-offsite,https://nl.linkedin.com/jobs/view/vestigingsmanager-at-newfysic-2280191552?refId=026ccf1b-1781-4f24-84a9-d37889a02f79&position=19&pageNum=1&trk=public_jobs_job-result-card_result-card_full-click,2 weeks ago,2 weeks ago,2020-11-19,2020-11-30
45,education,LinkedIn,2291624571,Senior back-end Developer,DB3NxCABSwWv9fYFEF0ApQ==,Driebit,"Amsterdam, North Holland, Netherlands",['Internet'],"Over Driebit, Wij zijn bedenkers, ontwerpers en bouwers van online platformen en digitale tools Wij willen die technologie inzetten om de wereld inclusiever, schoner en mooier te maken",Full-time,https://www.linkedin.com/jobs/view/externalApply/2291624571?url=https%3A%2F%2Fvacatures%2Edriebit%2Enl%2Fsenior-back-end-developer%2Fnl&urlHash=tw5W&trk=public_jobs_apply-link-offsite,https://nl.linkedin.com/jobs/view/senior-back-end-developer-at-driebit-2291624571?refId=026ccf1b-1781-4f24-84a9-d37889a02f79&position=20&pageNum=1&trk=public_jobs_job-result-card_result-card_full-click,2 weeks ago,2 weeks ago,2020-11-19,2020-11-30
