Data Row,Search Keyword,Platform,Job ID,Job Title,Tracking ID,Company Name,Location,Industry,Job Description,Employment Type,Company URL,Job URL,Job Age,Job Age Number,Job Date,Collection Date
70,education,LinkedIn,2303322224,Senior Account Manager Managed Services,hmpJNt9loW76hksjUHsU5w==,DUVAK Automatisering BV,"NieuwVennep, North Holland, Netherlands",['Information Technology and Services'],"Voor ons salesteam zijn wij op zoek naar een Senior Accountmanager IT voor onze serviceline Managed Services, , Organisatie, DUVAK is een IT organisatie opgericht in 1987 met een focus op IT Solutions, Managed Services  Detachering Wij houden ons bezig met het ontwerpen, implementeren, migreren en beheren van IT Infrastructuren van onze klanten Dit doen wij samen met een hecht team van ruim 80 collegas",Full-time,,https://nl.linkedin.com/jobs/view/senior-account-manager-managed-services-at-duvak-automatisering-bv-2303322224?refId=e94b537d-b3f0-4b1c-bc8a-2614e7868ba2&trackingId=hmpJNt9loW76hksjUHsU5w%3D%3D&position=20&pageNum=2&trk=public_jobs_job-result-card_result-card_full-click,2 weeks ago,2 weeks ago,2020-11-19,2020-11-30
71,education,LinkedIn,2307142252,Hart- en vaatverpleegkundige 16-24 uur,GNwzc3DDnW4SWGNWhYnO9g==,MedWay Vacatures,"Nijkerk, Gelderland, Netherlands",['Religious Institutions'],"Omschrijving, , Ben jij Hart vaatverpleegkundige en wil jij een bijdrage leveren aan het verbeteren van de kennis op het gebied van CVRM binnen de eerstelijns gezondheidszorg Dan hebben wij nu een interessante vacature voor jou, , Voor een van onze opdrachtgevers zijn wij op zoek naar een goede hart en vaatverpleegkundige voor 2  3 dagen in de week vanaf januari 2021, , Binnen de functie zal je voorlichting, educatie en begeleiding gaan bieden aan praktijkverpleegkundigen, praktijkondersteuners, apothekers, verzorgende en apothekersassistenten Een zelfstandige functie met volop ruimte voor eigen inbreng, , De educatie zal bestaan uit het opzetten en draaien van CVRM spreekuren en behandelen van patinten met CV problematiek Het correct uitleggen en sparren over casustieken met doelgroeppersonen, , Er is geen specifieke locatie, het betreft een functie waarbij je er bent voor huisartsenpraktijken door het hele land Grotendeels is de functie erg goed uit te voeren vanuit huis, , Deze functie is een echte buitenkans, wil jij deze grijpen Solliciteer dan direct of neem gerust contact op om jouw vragen te stellen, , Wij bieden jou, , , , Wij zoeken een hart en vaatverpleegkundige die, , , , Uren, , , , Salaris, , Conform cao Ziekenhuizen",Full-time,https://www.linkedin.com/jobs/view/externalApply/2307142252?url=https%3A%2F%2Fjoblift%2Enl%2Fdetails%2F23d25bb9-18e9-4b0f-9cef-77ad06f6be36%3Fjid%3D9882d24ac971c8ad63f0c9039c5d7710d2baca6d7ae884dd960246e08249d954%26utm_source%3Dlinkedin_nl%26utm_medium%3Dexternal_feed%26utm_campaign%3D126&urlHash=VcSe&refId=e94b537d-b3f0-4b1c-bc8a-2614e7868ba2&trk=public_jobs_apply-link-offsite,https://nl.linkedin.com/jobs/view/hart-en-vaatverpleegkundige-16-24-uur-at-medway-vacatures-2307142252?refId=e94b537d-b3f0-4b1c-bc8a-2614e7868ba2&trackingId=GNwzc3DDnW4SWGNWhYnO9g%3D%3D&position=21&pageNum=2&trk=public_jobs_job-result-card_result-card_full-click,2 weeks ago,2 weeks ago,2020-11-19,2020-11-30
72,education,LinkedIn,2319211591,gz-psycholoog - Amsterdam,y58eWZ2MEVIAfDUUn8xcuQ==,Cordaan,"Amsterdam, North Holland, Netherlands",['Hospital & Health Care'],"Omschrijving, , De behandeldienst van Cordaan zoekt per direct een enthousiaste en zelfstandige GZPsycholoog met hart voor de ouderenzorg voor locatie De Die Amsterdam Noord en Het Spaarnhout Amsterdam West, Houthaven, , , , , , , , We bieden je een uitdagende positie binnen een organisatie die de ambitie heeft de beste zorgverlener en zorgwerkgever van Amsterdam te zijn, , , Voor deze functie in Cordaan staan de volgende functieeisen centraal, , , , , Cordaan biedt behandeling en begeleiding, gericht op gezondheid en welbevinden van individuele clinten die aangewezen zijn op psychogeriatrische, somatische, psychiatrische of revalidatie verpleeghuiszorg De GZpsychologen binnen Cordaan zijn onderdeel van het multidisciplinaire team dat werkt vanuit een omgevings en clintgerichte visie waarbij de leefstijl van de clint richtinggevend is voor de keuze en uitvoering van de behandeling De multidisciplinaire behandelteams bestaan uit specialisten ouderengeneeskunde, GZpsychologen, paramedici, geestelijke verzorging en een aantal ondersteunende medewerkers De behandeling en begeleiding worden zoveel mogelijk afgestemd op de leefgewoonten en hulpvragen van de clint Respect en waardering voor de eigenheid van de clint wordt getoond door zijn achtergrond, leefgewoonten, wensen en zorgbehoeften zorgvuldig in kaart te brengen en telkens mee te laten wegen in het aanbod de vorm en aard van de voorgestelde behandeling enof begeleiding en de alternatieven, Cordaan heeft als een van de grootste zorgaanbieders in de regio Amsterdam veel locaties Jij zal gaan werken op De Die in Amsterdam Noord en op onze nieuwe, kleinschalige woonvoorziening in de Houthaven Het Spaarnhout in Amsterdam West Tevens maak je deel uit van de vakgroep GZpsychologen binnen Cordaan Verder is Cordaan aangesloten bij de PgD, een professioneel landelijk samenwerkingsverband van psychologen werkzaam in de verpleeghuiszorg, , , Als GZpsycholoog ben je werkzaam in een actieve en enthousiaste vakgroep van 16 GZpsychologen Je verricht de volgende werkzaamheden, , , Ben jij na het lezen van deze vacature enthousiast geraakt en voldoe jij aan bovenstaande functieeisen Dan nodigen wij je graag uit om te solliciteren Heb je naar aanleiding van de vacature nog vragen, bel dan voor meer informatie Jaap Kamphuis manager behandelaren via 0652717479, , Solliciteren kan tot en met 27 november 2021",Full-time,https://www.linkedin.com/jobs/view/externalApply/2319211591?url=https%3A%2F%2Fneuvoo%2Enl%2Fjob%2Ephp%3Fid%3D4dba38213bdb%26source%3Dlinkedin%26utm_source%3Dpartner%26utm_medium%3Dlinkedin%26puid%3Dfddccadceade8adfbddd9dd8addegddfadddfade3aeccacefec3ddcg3e&urlHash=STA9&trk=public_jobs_apply-link-offsite,https://nl.linkedin.com/jobs/view/gz-psycholoog-amsterdam-at-cordaan-2319211591?refId=e94b537d-b3f0-4b1c-bc8a-2614e7868ba2&trackingId=y58eWZ2MEVIAfDUUn8xcuQ%3D%3D&position=22&pageNum=2&trk=public_jobs_job-result-card_result-card_full-click,2 weeks ago,2 weeks ago,2020-11-19,2020-11-30
73,education,LinkedIn,2277712606,Verpleegkundig Specialist Bipolair,uST/3PIoOc63oniJaZu94Q==,Altrecht,"Utrecht, Utrecht, Netherlands",['Hospital & Health Care'],"Wat ga je doen, , Als Verpleegkundig Specialist heb je een belangrijke rol in de behandeling van onze patinten Je maakt deel uit van een multidisciplinair team en in onderlinge afstemming met andere behandelaren cordineer je de behandelingen van de patinten uit jouw caseload, Je hebt een uitdagend en veelzijdig takenpakket Zo participeert je in intakes, het opstellen en uitvoeren van behandelplannen, voorschrijven van medicatie en het geven van de psychoeducatie cursus en andere groepen, , Wat bieden wij jou, , , , Wat breng je mee",Full-time,https://www.linkedin.com/jobs/view/externalApply/2277712606?url=https%3A%2F%2Fjoblift%2Enl%2Fdetails%2F7db2316c-ee37-43b7-a7ca-b015fc22ad3a%3Fjid%3D83447b3aba29e49550e9d6724407784020a461936d1aa66618ee0879de8cf4ee%26utm_source%3Dlinkedin_nl%26utm_medium%3Dexternal_feed%26utm_campaign%3D126&urlHash=KmL_&trk=public_jobs_apply-link-offsite,https://nl.linkedin.com/jobs/view/verpleegkundig-specialist-bipolair-at-altrecht-2277712606?refId=e94b537d-b3f0-4b1c-bc8a-2614e7868ba2&trackingId=uST%2F3PIoOc63oniJaZu94Q%3D%3D&position=23&pageNum=2&trk=public_jobs_job-result-card_result-card_full-click,2 weeks ago,2 weeks ago,2020-11-19,2020-11-30
74,education,LinkedIn,2327351319,Anesthesiemedewerker in opleiding (september 2021) - The Hague,lChOUctAsWdPCXm8PD7FBg==,Haaglanden Medisch Centrum HMC,"The Hague, South Holland, Netherlands",['Hospital & Health Care'],"Wat ga je doen, Op alle locaties van HMC vinden chirurgische ingrepen plaats Op HMC Antoniushove vinden voornamelijk planbare ingrepen en oncologische ingrepen plaats Op HMC Westeinde ligt de focus op neurochirurgie en traumatologie Op HMC Bronovo worden voornamelijk veelvoorkomende en planbare ingrepen uitgevoerd Er heerst op iedere locatie een intense en laagdrempelige samenwerking met de collega operatieassistenten, anesthesiemedewerkers, recoveryverpleegkundigen n de medisch specialisten, , Als anesthesiemedewerker controleer je voor de operatie alle benodigde apparatuur en assisteer je de anesthesioloog bij het onder narcose brengen van de patint of bij het aanbrengen van een plaatselijke verdoving Gedurende de operatie bewaak je de vitale functies van de patint en onderhoud je de anesthesie Je volgt het verloop van de operatie, zodat je kunt inspringen op eventuele correcties in de anesthesie bij complicaties of andere onverwachte gebeurtenissen Na afloop van de operatie zorg je voor een correcte overdracht van de patint aan de Recovery of Intensive care unit ICU en je verzorgt de administratieve afhandeling wat betreft de anesthesie, , Voor het werken op de OK is het van belang, dat je het hoofd koel kunt houden in hectische situaties, dat je helder en duidelijk kunt communiceren, dat je aanvoelt wat je wel en niet kunt zeggen en dat je, op gepaste wijze, assertief bent Verder moet je fysiek in staat zijn het werk te kunnen doen Dit betekent dat je langdurig geconcentreerd kunt blijven, , , De opleiding tot anesthesiemedewerker is een driejarige inservice opleiding op HBOniveau Het theoretische gedeelte volg je bij het opleidingsinstituut Educatie Zorgsector van het LUMC , het praktijkgedeelte volg je op alle locaties bij HMC Tijdens de opleiding heb je regelmatig een theoretische week volgens het rooster van het LUMC Bij HMC word je begeleidt door een gekwalificeerde praktijkopleider Op deze manier is er optimale afstemming tussen theorie en praktijk De eerste 16 weken van de opleiding zullen voornamelijk theoretisch zijn, , Aangezien je op alle locaties gaat werken heb je de kans om je opleiding deels zelf vorm te geven Hierbij is het wel belangrijk dat je zelf initiatief toont en goed kunt schakelen tussen de verschillende operatiekamers Aan het einde van je opleiding ben je allround anesthesiemedewerker en ontvang je het landelijk erkende CZOdiploma anesthesiemedewerker, , Wil je meer informatie over dit leerwerktraject Bekijk dan ",Full-time,https://www.linkedin.com/jobs/view/externalApply/2327351319?url=https%3A%2F%2Fneuvoo%2Enl%2Fjob%2Ephp%3Fid%3Dd69c06d483b6%26source%3Dlinkedin%26utm_source%3Dpartner%26utm_medium%3Dlinkedin%26puid%3Dfadccddaedd78addbddg9ddaaadcgddcadd8fddd3aeecdcafec3ddcg3e&urlHash=R_La&trk=public_jobs_apply-link-offsite,https://nl.linkedin.com/jobs/view/anesthesiemedewerker-in-opleiding-september-2021-the-hague-at-hmc-haaglanden-medisch-centrum-2327351319?refId=e94b537d-b3f0-4b1c-bc8a-2614e7868ba2&trackingId=lChOUctAsWdPCXm8PD7FBg%3D%3D&position=24&pageNum=2&trk=public_jobs_job-result-card_result-card_full-click,2 weeks ago,2 weeks ago,2020-11-19,2020-11-30
76,education,LinkedIn,2327268325,Fondsenwerving Medewerker | 36 uur,NG4h+ZUIp1X+rO0VoBrkeg==,Nederland Vacature Groep,"Otterlo, Gelderland, Netherlands",['Human Resources'],"Als Medewerker Fondsenwerving krijg je de bijzondere kans om mee te bouwen aan de nieuw te vormen afdeling Development in het museum Je gaat werken aan een brede basis van private en publieke fondsen En je draagt bij aan het behouden en uitbreiden van de groep particuliere gevers de Boekers binnen het Helene KrllerMller Fonds Zowel de fondsen als particuliere gevers ondersteunen het museum in het bereiken van zijn doelstellingen, , , , MEDEWERKER FONDSENWERVING 36 UUR PER WEEK, , De medewerker draagt bij aan de doelstellingen van het museum door het werven van private en publieke fondsen, en door werving van particuliere gevers De geworven middelen worden ingezet voor tentoonstellingen, educatie, programmering en onderzoeks en restauratieprojecten Er is nauwe samenwerking met zowel de Directie als de collegas bij Development, Marketing en communicatie, Presentatie, Collectie en onderzoek en Bedrijfsvoering, , Afdeling Development De nieuw te vormen afdeling Development zal rechtstreeks vallen onder de commercieel directeur De afdeling bestaat uit de medewerker Fondsenwerving, de medewerker Relatiebeheer  ontvangsten en de commercieel directeur, , Functieinhoud en taken, , Fondsenwerving bij publieke en private fondsen, , Particuliere gevers, , Functieeisen, , Arbeidsvoorwaarden en salariring De Museum CAO is van toepassing, , Salariring in schaal 9 bruto minimaal  2840,  en maximaal  3718, per maand bij een fulltime dienstverband van 36 uur per week, plus een eindejaarsuitkering van 3,4, een vakantietoeslag van 8 en een reiskostenvergoeding conform de museum CAO De aanstelling is voor de duur van een jaar Bij gebleken geschiktheid kan de arbeidsovereenkomst verlengd worden, , Het KrllerMller Museum streeft naar een inclusieve organisatie en zoekt nadrukkelijk naar kandidaten die de diversiteit binnen de organisatie versterken Sollicitaties, bestaande uit een motivatiebrief en een curriculum vitae, graag vr 4 januari 2021 aan Arnold Beumer,PO adviseur van het KrllerMller Museum, , De eerste gesprekken zullen plaatsvinden op vrijdag 15 januari 2021 mogelijk gevolgd door een tweede ronde op een nader te bepalen tijdstip, Nadere informatie over de functie kan worden gegeven door Winfred Voordendag, Commercieel Directeur, 06 28284706 of winfredvoordendagkrollermullernl, , Voor meer informatie bekijk onze bedrijfspagina klik op ons logo bovenaan de vacature, , , Solliciteer direct, , ",Full-time,https://www.linkedin.com/jobs/view/externalApply/2327268325?url=https%3A%2F%2Fnederlandvacature%2Enl%2Fvacature%2Ffondsenwerving-medewerker-36-uur-in-otterlo%2F253788%2F%3Futm_source%3Dxmlfeed_linkedin%26utm_medium%3Dwebsite%26utm_campaign%3D39053&urlHash=Epjl&refId=4b3df599-52d2-4a8f-924b-19f31e8e0a85&trk=public_jobs_apply-link-offsite,https://nl.linkedin.com/jobs/view/fondsenwerving-medewerker-36-uur-at-nederland-vacature-groep-2327268325?refId=4b3df599-52d2-4a8f-924b-19f31e8e0a85&trackingId=NG4h%2BZUIp1X%2BrO0VoBrkeg%3D%3D&position=1&pageNum=3&trk=public_jobs_job-result-card_result-card_full-click,2 weeks ago,2 weeks ago,2020-11-19,2020-11-30
77,education,LinkedIn,2322924961,Parttime administratief medewerker,7x5zXmjkVLieaJSGCzGhPQ==,Uitzendbureaunl,"Amsterdam, North Holland, Netherlands","['Internet', 'Machinery', 'Staffing and Recruiting']","Ben jij op zoek naar een tijdelijke parttime administratie uitdaging in de buurt van Amsterdam voor ongeveer 24 uur per week Dan zij wij op zoek naar jou, , Voor een leuk bedrijf in Amsterdam zijn wij op zoek naar een administratief medewerker die per 1 januari kan beginnen voor ongeveer 36 maanden, , De afdeling jij waar jij aan de slag gaat heet Permanente Educatie en is verantwoordelijk voor het nalopen bij houden van de verplichte punten die een accountant moet halen om zijn of haar beroep te kunnen uitoefenen, genaamd PEpunten Ze gaan over van een oud PEpunten systeem naar een nieuw PEpunten systeem en daar komt een hoop administratie bij kijken, , , , Voor deze functie zal jij veel aan de telefoon zitten, bellen is namelijk sneller, , , Deze functie is in eerste instantie tijdelijk en daarom op basis van een tijdelijk dienstverband, , Vaardigheden, , , Opleiding, , MBO 34, , Over de werkgever, , Jij komt te werken bij een beroepsorganisatie van accountants Zij beschermen de titels die accountants mogen dragen doormiddel van het opstellen en handhaven van heldere gedrags en beroepsregels voor alle accountants, door toetsing en door permanente educatie",Part-time,https://www.linkedin.com/jobs/view/externalApply/2322924961?url=https%3A%2F%2Fnl%2Ejooble%2Eorg%2Fexternal%2F-6228427171546649791%3Futm_campaign%3DNL%26utm_medium%3Dsocial%26utm_source%3Dlinkedin%26JobSource%3DBoard&urlHash=wb7r&trk=public_jobs_apply-link-offsite,https://nl.linkedin.com/jobs/view/parttime-administratief-medewerker-at-uitzendbureau-nl-2322924961?refId=4b3df599-52d2-4a8f-924b-19f31e8e0a85&trackingId=7x5zXmjkVLieaJSGCzGhPQ%3D%3D&position=2&pageNum=3&trk=public_jobs_job-result-card_result-card_full-click,2 weeks ago,2 weeks ago,2020-11-19,2020-11-30
78,education,LinkedIn,2260043246,Data Architect (Data governance & Data kwaliteit),kTXOB04xc/+xEONV6ShHgg==,PostNL,"Den Haag, South Holland, Netherlands","['Information Technology and Services', 'Computer Software', 'Internet']","Zorgen voor het modelleren, ontwerpen en implementeren van de PostNL datastromen, , Wat ga je doen, , De functie van Data Architect is belegd binnen de EDM afdeling In essentie is het modelleren, ontwerpen en implementeren van de PostNL datastromen de kernactiviteit van de Data architect Hierbij wordt er ook veel aandacht besteed aan de processen waarin de PostNL data wordt gecreerd, vastgelegd en gewijzigd, , Daarnaast ben je richtinggevend als het gaat om het benutten van het potentieel van de PostNL data, , Op deze manier zorg je ervoor dat de bewustwording rondom het belang van kwalitatief hoogwaardige en goed gemodelleerde data toeneemt, , , , , , , We willen de favoriete bezorger van Nederland zijn door iedere dag weer bijzondere momenten te bezorgen Daarbij staan onze medewerkers voorop en onze klanten centraal We zoeken altijd naar manieren om het ng beter te doen En daar hebben we jou bij nodig Jij gaat ervoor zorgen dat we in onze klantinteractie kunnen beschikken over de benodigde data om de klantbeleving zo optimaal mogelijk te laten zijn",Full-time,https://www.linkedin.com/jobs/view/externalApply/2260043246?url=https%3A%2F%2Fwww%2Epostnl%2Enl%2Fover-postnl%2Fwerkenbij%2Fvacatures-voor-hbo-en-wo%2Fdata-architect-data-governance-data-kwaliteit%2Ehtml%3Ftrc%3Dk-scm_f-p_p-lin_r-jobslot&urlHash=juHn&refId=4b3df599-52d2-4a8f-924b-19f31e8e0a85&trk=public_jobs_apply-link-offsite,https://nl.linkedin.com/jobs/view/data-architect-data-governance-data-kwaliteit-at-postnl-2260043246?refId=4b3df599-52d2-4a8f-924b-19f31e8e0a85&trackingId=kTXOB04xc%2F%2BxEONV6ShHgg%3D%3D&position=3&pageNum=3&trk=public_jobs_job-result-card_result-card_full-click,2 weeks ago,2 weeks ago,2020-11-19,2020-11-30
