Data Row,Search Keyword,Platform,Job ID,Job Title,Tracking ID,Company Name,Location,Industry,Job Description,Employment Type,Company URL,Job URL,Job Age,Job Age Number,Job Date,Collection Date
26,career development specialist,LinkedIn,2324898982,Verzorgende IG - Loopbaanadvies gesprek,7fna4yQeoCk8lirCxtbQUw==,Akkolade,"Hoofddorp, North Holland, Netherlands",['Human Resources'],"Ben jij een Verzorgende IG Zoek je een droombaan, maar kan je hierbij wat hulp gebruiken Dan ben je bij Akkolade in Hoofddorp aan het goede adres Wij bieden je namelijk een gratis loopbaanadvies aan, Standplaats Hoofddorp, , Jouw functie, , Onze missie is zorgprofessionals helpen gelukkig te blijven in hun werk Ben je klaar om een volgende stap in je loopbaan te nemen, , Voel je vrij om al je wensen met ons te delen, zodat we samen op zoek kunnen gaan naar jouw nieuwe droombaan Niets moet na dit gesprek, maar alles mag Wij gaan geheel vrijblijvend samen kijken wat het beste bij jou past De kans is groot dat wij vele openstaande vacatures hebben die voor jou nieuwe deuren openen, , Hierbij bieden wij je een gratis loopbaanadvies gesprek aan Heb je soms het gevoel nog niet helemaal op de juiste plek te zitten Met ons netwerk en expertise binnen de Verpleging, Verzorging en Thuiszorg, gaan wij deze plek samen voor je vinden Als Verzorgende IG ben je namelijk zeer waardevol voor onze gezondheidszorg en verdien je het op de voor jouw juiste plek te zitten, , Neem snel contact op Wij staan voor je klaar, , , , , , , , , , Onze missie is zorgprofessionals helpen gelukkig te blijven in hun werk Dit doen we door jou te verbinden aan de juiste werkgever in de zorg en welzijn sector, waar jij een vaste baan krijgt Na jouw vrijblijvende reactie nodigen we je graag uit voor een kennismaking met ons Tijdens de kennismaking vertellen we jou alles over het team, de functie en de voorwaarden, maar bespreken we vooral ook jouw wensen en kwaliteiten Jij staat centraal in deze procedure, , Door het Coronavirus hebben wij onze procedure aangepast Kennismaken zal zoveel mogelijk plaatsvinden via videobellen Als je positief bent over het team word je uitgenodigd voor het arbeidsvoorwaardengesprek Je komt dan in dienst bij de zorgorganisatie Wij ondersteunen jou met maar n doel dat jij gelukkig wordt in je nieuwe vaste baan",Full-time,https://www.linkedin.com/jobs/view/externalApply/2324898982?url=https%3A%2F%2Fwww%2Eadzuna%2Enl%2Fdetails%2F1654083212%3Fv%3D6FF1E8D2986302BC44573E443EA985DCC4274568%26utm_source%3Dlinkedin2%26utm_medium%3Dorganic%26chnlid%3D880&urlHash=24Uz&refId=6735f4df-3133-4e70-966d-189c44f8ee89&trackingId=7fna4yQeoCk8lirCxtbQUw%3D%3D&trk=public_jobs_apply-link-offsite,https://nl.linkedin.com/jobs/view/verzorgende-ig-loopbaanadvies-gesprek-at-akkolade-2324898982?refId=6735f4df-3133-4e70-966d-189c44f8ee89&trackingId=7fna4yQeoCk8lirCxtbQUw%3D%3D&position=1&pageNum=1&trk=public_jobs_job-result-card_result-card_full-click,2 months ago,2 months ago,2020-10-10,2020-12-04
32,career development specialist,LinkedIn,2331464367,Verzorgende IG - Gratis loopbaanadvies gesprek,mMuTvUEzzVktZMZFkBdIYA==,Akkolade,"IJmuiden, North Holland, Netherlands",['Human Resources'],"Ben jij een Verzorgende IG Zoek je een droombaan, maar kan je hierbij wat hulp gebruiken Dan ben je bij Akkolade in Haarlem aan het goede adres Wij bieden je namelijk een gratis loopbaanadvies aan, Standplaats IJmuiden, , Jouw functie, , Hierbij bieden wij je een gratis loopbaanadvies gesprek aan Heb je soms het gevoel nog niet helemaal op de juiste plek te zitten Met ons netwerk en expertise binnen de Verpleging, Verzorging en Thuiszorg, gaan wij deze plek samen voor je vinden Als Verzorgende IG ben je namelijk zeer waardevol voor onze gezondheidszorg en verdien je het op de voor jouw juiste plek te zitten, , Voel je vrij om al je wensen met ons te delen, zodat we samen op zoek kunnen gaan naar jouw nieuwe droombaan Niets moet na dit gesprek, maar alles mag Wij gaan geheel vrijblijvend samen kijken wat het beste bij jou past De kans is groot dat wij vele openstaande vacatures hebben die voor jou nieuwe deuren openen, , Onze missie is zorgprofessionals helpen gelukkig te blijven in hun werk Ben je klaar om een volgende stap in je loopbaan te nemen Neem dan snel contact op Wij staan voor je klaar, , , , , , , , , , Onze missie is zorgprofessionals helpen gelukkig te blijven in hun werk Dit doen we door jou te verbinden aan de juiste werkgever in de zorg en welzijn sector, waar jij een vaste baan krijgt Na jouw vrijblijvende reactie nodigen we je graag uit voor een kennismaking met ons Tijdens de kennismaking vertellen we jou alles over het team, de functie en de voorwaarden, maar bespreken we vooral ook jouw wensen en kwaliteiten Jij staat centraal in deze procedure, , Door het Coronavirus hebben wij onze procedure aangepast Kennismaken zal zoveel mogelijk plaatsvinden via videobellen Als je positief bent over het team word je uitgenodigd voor het arbeidsvoorwaardengesprek Je komt dan in dienst bij de zorgorganisatie Wij ondersteunen jou met maar n doel dat jij gelukkig wordt in je nieuwe vaste baan",Full-time,https://www.linkedin.com/jobs/view/externalApply/2331464367?url=https%3A%2F%2Fwww%2Eadzuna%2Enl%2Fdetails%2F1660611673%3Fv%3D7168FA55158C9FA0D7790089F68C7D4FEA270BFA%26utm_source%3Dlinkedin2%26utm_medium%3Dorganic%26chnlid%3D880&urlHash=SEMR&refId=6735f4df-3133-4e70-966d-189c44f8ee89&trackingId=mMuTvUEzzVktZMZFkBdIYA%3D%3D&trk=public_jobs_apply-link-offsite,https://nl.linkedin.com/jobs/view/verzorgende-ig-gratis-loopbaanadvies-gesprek-at-akkolade-2331464367?refId=6735f4df-3133-4e70-966d-189c44f8ee89&trackingId=mMuTvUEzzVktZMZFkBdIYA%3D%3D&position=7&pageNum=1&trk=public_jobs_job-result-card_result-card_full-click,2 months ago,2 months ago,2020-10-10,2020-12-04
34,career development specialist,LinkedIn,2324889418,Verzorgende IG - Starter - jouw droombaan - loopbaanadvies,pwN8aePsakDpMtW+CmtPzg==,Akkolade,"Capelle aan den IJssel, South Holland, Netherlands",['Human Resources'],"Pas of bijna klaar met je Verzorgende IG niveau 3 opleiding en wat nu Wat past echt bij je, waar word jij gelukkig van en kan je voldoende ervaring opdoen Deze vragen zijn zo herkenbaar Er zijn zoveel mogelijkheden Maar hoe ziet een organisatie er van binnen uit, wat kunnen ze jou bieden, zijn er mogelijkheden om je nog verder te ontwikkelen Op deze vragen en misschien zo zoveel andere vragen, daar kunnen wij jou antwoord op geven Samen zoeken wij naar de juiste werkplek Neem contact met ons op, wij begeleiden je op een zeer persoonlijke manier, , Jouw functie, , Het is niet moeilijk om ander werk te vinden in de zorg maar waar kom jij het beste tot je recht Hoe ziet een organisatie er van binnen uit Komen ze hun afspraken na Bij Akkolade hebben wij een breed netwerk waar wij wekelijks contact mee houden Wij zijn op de hoogte van de ontwikkelingen en kunnen we je van een advies voorzien welke organisaties het beste bij jouw wensen en verlangens passen, , Daar zijn wij sterk in, de perfecte baan voor jou zoeken Dat is al meer dan 10 jaar onze expertise Waar andere organisaties stoppen, zetten wij net zo lang door totdat wij ons gezamenlijk doel hebben bereikt Ons werk is breed georinteerd Wij staan elke dag voor jou gereed Meer weten, bel, mail of app gerust Jij bent meer dan welkom, , , , , , , , , , Onze missie is zorgprofessionals helpen gelukkig te blijven in hun werk Dit doen we door jou te verbinden aan de juiste werkgever in de zorg en welzijn sector, waar jij een vaste baan krijgt Na jouw vrijblijvende reactie nodigen we je graag uit voor een kennismaking met ons Tijdens de kennismaking vertellen we jou alles over het team, de functie en de voorwaarden, maar bespreken we vooral ook jouw wensen en kwaliteiten Jij staat centraal in deze procedure, , Door het Coronavirus hebben wij onze procedure aangepast Kennismaken zal zoveel mogelijk plaatsvinden via videobellen Als je positief bent over het team word je uitgenodigd voor het arbeidsvoorwaardengesprek Je komt dan in dienst bij de zorgorganisatie Wij ondersteunen jou met maar n doel dat jij gelukkig wordt in je nieuwe vaste baan",Full-time,https://www.linkedin.com/jobs/view/externalApply/2324889418?url=https%3A%2F%2Fwww%2Eadzuna%2Enl%2Fdetails%2F1847251931%3Fv%3DA4F134783326A0A49CE77216FF00C565DD303209%26utm_source%3Dlinkedin2%26utm_medium%3Dorganic%26chnlid%3D880&urlHash=0ech&refId=6735f4df-3133-4e70-966d-189c44f8ee89&trackingId=pwN8aePsakDpMtW%2BCmtPzg%3D%3D&trk=public_jobs_apply-link-offsite,https://nl.linkedin.com/jobs/view/verzorgende-ig-starter-jouw-droombaan-loopbaanadvies-at-akkolade-2324889418?refId=6735f4df-3133-4e70-966d-189c44f8ee89&trackingId=pwN8aePsakDpMtW%2BCmtPzg%3D%3D&position=9&pageNum=1&trk=public_jobs_job-result-card_result-card_full-click,2 months ago,2 months ago,2020-10-10,2020-12-04
35,career development specialist,LinkedIn,2324847956,(bijna) Verzorgende IG - loopbaanadvies - starter,uP+MSrRjd4lOh9alSwsR+Q==,Akkolade,"Breda, North Brabant, Netherlands",None,"Wij denken graag met je mee over je toekomst, welke organisatie cht bij je past en vooral waar jij de komende tijd op je plek zit, Je bent een verzorgende IG die bijna het diploma als verzorgende IG op zak heeft De wereld ligt voor je voeten en de banen voor het oprapen Natuurlijk wil je dolgraag aan de slag nieuwe dingen leren en je ontwikkelen De vraag is echter voor jou waar start ik straks, , Jouw functie, , Wij vinden het van belang om te weten waar jij energie van krijgt met welke doelgroep je een echte klik hebt waar jouw kwaliteiten het beste tot zijn recht komen en wat de wensen en ambities voor de toekomst zijn kortom wat zijn de ingredinten voor jou goede begin bij een organisatie, Bij ons geen loze beloften, we werken samen met de beste werkgevers in de regio n we houden tijdens en na onze gezamenlijke zoektocht naar een passende baan contact met je Kortom maatwerk en advies dat bij je past, , Als bijna afgestudeerde verzorgende IG heb je al veel stages gelopen Tijdens je BBL traject hebt je wellicht al met een aantal verschillende zorgvelden kennis gemaakt Misschien heb je gekozen voor de BOL variant en heb je binnen n organisatie, op een aantal verschillende afdelingen gewerkt, , Voor ons maakt het niet uit waar en hoe je je ervaring als verzorgende IG hebt opgedaan Veel kandidaten hebben een groot deel van hun ervaring intramuraal genoten, vaak in de ouderenzorg of de wereld met mensen met een verstandelijke beperking Misschien heb je stage gelopen in de thuiszorg en ontdekt hoe anders de zorg is als je bij mensen thuis achter de voordeur mag kijken, , Wil je meer weten over ons en de vele mogelijkheden Stuur een WhatsApp bericht  bel of mail naar Petra 0630932757 of pbuijsakkoladeorg, Ik zie uit naar onze ontmoeting, , , , , , , , , , Onze missie is zorgprofessionals helpen gelukkig te blijven in hun werk Dit doen we door jou te verbinden aan de juiste werkgever in de zorg en welzijn sector, waar jij een vaste baan krijgt Na jouw vrijblijvende reactie nodigen we je graag uit voor een kennismaking met ons Tijdens de kennismaking vertellen we jou alles over het team, de functie en de voorwaarden, maar bespreken we vooral ook jouw wensen en kwaliteiten Jij staat centraal in deze procedure, , Door het Coronavirus hebben wij onze procedure aangepast Kennismaken zal zoveel mogelijk plaatsvinden via videobellen Als je positief bent over het team word je uitgenodigd voor het arbeidsvoorwaardengesprek Je komt dan in dienst bij de zorgorganisatie Wij ondersteunen jou met maar n doel dat jij gelukkig wordt in je nieuwe vaste baan",Full-time,https://www.linkedin.com/jobs/view/externalApply/2324847956?url=https%3A%2F%2Ftwiglers%2Enl%2Fvacatures%2Fakkolade%2Fbijna-verzorgende-ig-loopbaanadvies-starter&urlHash=_Dzb&refId=6735f4df-3133-4e70-966d-189c44f8ee89&trackingId=uP%2BMSrRjd4lOh9alSwsR%2BQ%3D%3D&trk=public_jobs_apply-link-offsite,https://nl.linkedin.com/jobs/view/bijna-verzorgende-ig-loopbaanadvies-starter-at-akkolade-2324847956?refId=6735f4df-3133-4e70-966d-189c44f8ee89&trackingId=uP%2BMSrRjd4lOh9alSwsR%2BQ%3D%3D&position=10&pageNum=1&trk=public_jobs_job-result-card_result-card_full-click,2 months ago,2 months ago,2020-10-10,2020-12-04
40,career development specialist,LinkedIn,2324885921,BBL/ BOL - Verzorgende IG - Starters Loopbaanadvies,MSnjo01e/ORsrsZjwZJL7A==,Akkolade,"Zoetermeer, South Holland, Netherlands",['Human Resources'],"Het is niet moeilijk om als startend Verzorgende IG werk te vinden in de zorg maar waar kom jij het beste tot je recht Hoe ziet een organisatie er van binnen uit Komen ze hun afspraken na Wij werken met de beste, leukste zorg instellingen samen en kunnen jou een op maat advies geven, waar je je opleiding af kunt maken en daarna in een mooi dienstverband voor lange termijn aan de slag kan, , Jouw functie, , Bij Akkolade hebben wij een breed netwerk waar wij wekelijks contact mee houden Wij zijn op de hoogte van de ontwikkelingen en kunnen we je van een advies voorzien welke organisaties het beste bij jouw wensen en verlangens passen, , Daar zijn wij sterk in, de perfecte baan voor jou zoeken Dat is al meer dan 10 jaar onze expertise Waar andere organisaties stoppen, zetten wij net zo lang door totdat wij ons gezamenlijk doel hebben bereikt Ons werk is breed georinteerd Wij staan elke dag voor jou gereed Meer weten, bel, mail of app gerust Jij bent meer dan welkom, , , , , , , , , , Onze missie is zorgprofessionals helpen gelukkig te blijven in hun werk Dit doen we door jou te verbinden aan de juiste werkgever in de zorg en welzijn sector, waar jij een vaste baan krijgt Na jouw vrijblijvende reactie nodigen we je graag uit voor een kennismaking met ons Tijdens de kennismaking vertellen we jou alles over het team, de functie en de voorwaarden, maar bespreken we vooral ook jouw wensen en kwaliteiten Jij staat centraal in deze procedure, , Door het Coronavirus hebben wij onze procedure aangepast Kennismaken zal zoveel mogelijk plaatsvinden via videobellen Als je positief bent over het team word je uitgenodigd voor het arbeidsvoorwaardengesprek Je komt dan in dienst bij de zorgorganisatie Wij ondersteunen jou met maar n doel dat jij gelukkig wordt in je nieuwe vaste baan",Full-time,https://www.linkedin.com/jobs/view/externalApply/2324885921?url=https%3A%2F%2Fwww%2Eadzuna%2Enl%2Fdetails%2F1847251932%3Fv%3D291750D0EEB3A10AA0A5B584505816780F8B8C97%26utm_source%3Dlinkedin2%26utm_medium%3Dorganic%26chnlid%3D880&urlHash=Jpzn&refId=6735f4df-3133-4e70-966d-189c44f8ee89&trackingId=MSnjo01e%2FORsrsZjwZJL7A%3D%3D&trk=public_jobs_apply-link-offsite,https://nl.linkedin.com/jobs/view/bbl-bol-verzorgende-ig-starters-loopbaanadvies-at-akkolade-2324885921?refId=6735f4df-3133-4e70-966d-189c44f8ee89&trackingId=MSnjo01e%2FORsrsZjwZJL7A%3D%3D&position=15&pageNum=1&trk=public_jobs_job-result-card_result-card_full-click,2 months ago,2 months ago,2020-10-10,2020-12-04
41,career development specialist,LinkedIn,2331460769,Verzorgende IG - Gratis loopbaanadvies gesprek,BHYweFaVFhsMSROHP3BECw==,Akkolade,"Alkmaar, North Holland, Netherlands",['Human Resources'],"Ben jij een Verzorgende IG Zoek je een droombaan, maar kan je hierbij wat hulp gebruiken Dan ben je bij Akkolade in Alkmaar aan het goede adres Wij bieden je namelijk een gratis loopbaanadvies aan, Standplaats Alkmaar, , Jouw functie, , Hierbij bieden wij je een gratis loopbaanadvies gesprek aan Heb je soms het gevoel nog niet helemaal op de juiste plek te zitten Met ons netwerk en expertise binnen de Verpleging, Verzorging en Thuiszorg, gaan wij deze plek samen voor je vinden Als Verzorgende IG ben je namelijk zeer waardevol voor onze gezondheidszorg en verdien je het op de voor jouw juiste plek te zitten, , Voel je vrij om al je wensen met ons te delen, zodat we samen op zoek kunnen gaan naar jouw nieuwe droombaan Niets moet na dit gesprek, maar alles mag Wij gaan geheel vrijblijvend samen kijken wat het beste bij jou past De kans is groot dat wij vele openstaande vacatures hebben die voor jou nieuwe deuren openen, , Onze missie is zorgprofessionals helpen gelukkig te blijven in hun werk Ben je klaar om een volgende stap in je loopbaan te nemen Neem dan snel contact op Wij staan voor je klaar, , , , , , , , , , Onze missie is zorgprofessionals helpen gelukkig te blijven in hun werk Dit doen we door jou te verbinden aan de juiste werkgever in de zorg en welzijn sector, waar jij een vaste baan krijgt Na jouw vrijblijvende reactie nodigen we je graag uit voor een kennismaking met ons Tijdens de kennismaking vertellen we jou alles over het team, de functie en de voorwaarden, maar bespreken we vooral ook jouw wensen en kwaliteiten Jij staat centraal in deze procedure, , Door het Coronavirus hebben wij onze procedure aangepast Kennismaken zal zoveel mogelijk plaatsvinden via videobellen Als je positief bent over het team word je uitgenodigd voor het arbeidsvoorwaardengesprek Je komt dan in dienst bij de zorgorganisatie Wij ondersteunen jou met maar n doel dat jij gelukkig wordt in je nieuwe vaste baan",Full-time,https://www.linkedin.com/jobs/view/externalApply/2331460769?url=https%3A%2F%2Fwww%2Eadzuna%2Enl%2Fdetails%2F1660612014%3Fv%3D70AA35366640960D50F75F028BD69049DA50B94F%26utm_source%3Dlinkedin2%26utm_medium%3Dorganic%26chnlid%3D880&urlHash=oScg&refId=6735f4df-3133-4e70-966d-189c44f8ee89&trackingId=BHYweFaVFhsMSROHP3BECw%3D%3D&trk=public_jobs_apply-link-offsite,https://nl.linkedin.com/jobs/view/verzorgende-ig-gratis-loopbaanadvies-gesprek-at-akkolade-2331460769?refId=6735f4df-3133-4e70-966d-189c44f8ee89&trackingId=BHYweFaVFhsMSROHP3BECw%3D%3D&position=16&pageNum=1&trk=public_jobs_job-result-card_result-card_full-click,2 months ago,2 months ago,2020-10-10,2020-12-04
42,career development specialist,LinkedIn,2331468124,Verzorgende IG - Nieuwe uitdaging - Loopbaanadvies,cRg1zBP/GkOU7m56IA4fUg==,Akkolade,"Zoetermeer, South Holland, Netherlands",['Human Resources'],"Ben jij als een Verzorgende IG toe aan een nieuwe uitdaging in de regio Zoetermeer Akkolade denkt graag met je mee en biedt een gratis loopbaanadvies aan, Standplaats Zoetermeer, , Jouw functie, , Akkolade biedt graag een luisterend oor, , Voel je vrij om al je wensen met ons te delen, zodat we samen op zoek kunnen gaan naar jouw nieuwe droombaan Met onze expertise in de zorg en welzijn sector en een zeer groot netwerk VVT, Ziekenhuizen en de GGZ kunnen wij jou als geen ander begeleiden naar een nieuwe baan Niets moet na dit gesprek, maar alles mag Wij gaan samen kijken wat het beste bij jou past De kans is groot dat wij vele openstaande vacatures hebben die tot jou nieuwe mogelijkheden behoren, , Raak je al genspireerd om een volgende stap in je loopbaan te nemen Dan staat de koffie of thee klaar en spreken wij je vast snel, , , , , , , , , , Onze missie is zorgprofessionals helpen gelukkig te blijven in hun werk Dit doen we door jou te verbinden aan de juiste werkgever in de zorg en welzijn sector, waar jij een vaste baan krijgt Na jouw vrijblijvende reactie nodigen we je graag uit voor een kennismaking met ons Tijdens de kennismaking vertellen we jou alles over het team, de functie en de voorwaarden, maar bespreken we vooral ook jouw wensen en kwaliteiten Jij staat centraal in deze procedure, , Door het Coronavirus hebben wij onze procedure aangepast Kennismaken zal zoveel mogelijk plaatsvinden via videobellen Als je positief bent over het team word je uitgenodigd voor het arbeidsvoorwaardengesprek Je komt dan in dienst bij de zorgorganisatie Wij ondersteunen jou met maar n doel dat jij gelukkig wordt in je nieuwe vaste baan",Full-time,https://www.linkedin.com/jobs/view/externalApply/2331468124?url=https%3A%2F%2Fwww%2Eadzuna%2Enl%2Fdetails%2F1655786940%3Fv%3D318133724BFEAEE3E4BB0CAD34C3C2A4F5E2EA40%26utm_source%3Dlinkedin2%26utm_medium%3Dorganic%26chnlid%3D880&urlHash=i9XU&refId=6735f4df-3133-4e70-966d-189c44f8ee89&trackingId=cRg1zBP%2FGkOU7m56IA4fUg%3D%3D&trk=public_jobs_apply-link-offsite,https://nl.linkedin.com/jobs/view/verzorgende-ig-nieuwe-uitdaging-loopbaanadvies-at-akkolade-2331468124?refId=6735f4df-3133-4e70-966d-189c44f8ee89&trackingId=cRg1zBP%2FGkOU7m56IA4fUg%3D%3D&position=17&pageNum=1&trk=public_jobs_job-result-card_result-card_full-click,2 months ago,2 months ago,2020-10-10,2020-12-04
43,career development specialist,LinkedIn,2331457916,Verzorgende IG - Loopbaanadvies op maat,Ga3HX3Q0CNqVt5Rzbu8hdQ==,Akkolade,"Alkmaar, North Holland, Netherlands",['Human Resources'],"Ben jij in het bezit van een Verzorgende IG diploma Kom je net van school of werk je al jaren in de zorg Zoek jij een nieuwe uitdaging met voldoende doorgroeimogelijkheden, Standplaats Alkmaar, , Jouw functie, , Voel je vrij om al je wensen met ons te delen, zodat we samen op zoek kunnen gaan naar jouw nieuwe droombaan Niets moet na dit gesprek, maar alles mag Wij gaan geheel vrijblijvend samen kijken wat het beste bij jou past De kans is groot dat wij vele openstaande vacatures hebben die voor jou nieuwe deuren openen, , Hierbij bieden wij je een gratis loopbaanadvies gesprek aan Heb je soms het gevoel nog niet helemaal op de juiste plek te zitten Met ons netwerk en expertise binnen de Verpleging, Verzorging en Thuiszorg, gaan wij deze plek samen voor je vinden Als Verzorgende IG ben je namelijk zeer waardevol voor onze gezondheidszorg en verdien je het op de voor jouw juiste plek te zitten, , Onze missie is zorgprofessionals helpen gelukkig te blijven in hun werk Ben je klaar om een volgende stap in je loopbaan te nemen Neem dan snel contact op Wij staan voor je klaar, , , , , , , , , , Onze missie is zorgprofessionals helpen gelukkig te blijven in hun werk Dit doen we door jou te verbinden aan de juiste werkgever in de zorg en welzijn sector, waar jij een vaste baan krijgt Na jouw vrijblijvende reactie nodigen we je graag uit voor een kennismaking met ons Tijdens de kennismaking vertellen we jou alles over het team, de functie en de voorwaarden, maar bespreken we vooral ook jouw wensen en kwaliteiten Jij staat centraal in deze procedure, , Door het Coronavirus hebben wij onze procedure aangepast Kennismaken zal zoveel mogelijk plaatsvinden via videobellen Als je positief bent over het team word je uitgenodigd voor het arbeidsvoorwaardengesprek Je komt dan in dienst bij de zorgorganisatie Wij ondersteunen jou met maar n doel dat jij gelukkig wordt in je nieuwe vaste baan",Full-time,https://www.linkedin.com/jobs/view/externalApply/2331457916?url=https%3A%2F%2Fwww%2Eadzuna%2Enl%2Fdetails%2F1660610820%3Fv%3DDEBAC8FAEE2B961776ED6D76F045390B086DC135%26utm_source%3Dlinkedin2%26utm_medium%3Dorganic%26chnlid%3D880&urlHash=jzuc&refId=6735f4df-3133-4e70-966d-189c44f8ee89&trackingId=Ga3HX3Q0CNqVt5Rzbu8hdQ%3D%3D&trk=public_jobs_apply-link-offsite,https://nl.linkedin.com/jobs/view/verzorgende-ig-loopbaanadvies-op-maat-at-akkolade-2331457916?refId=6735f4df-3133-4e70-966d-189c44f8ee89&trackingId=Ga3HX3Q0CNqVt5Rzbu8hdQ%3D%3D&position=18&pageNum=1&trk=public_jobs_job-result-card_result-card_full-click,2 months ago,2 months ago,2020-10-10,2020-12-04
44,career development specialist,LinkedIn,2331474384,Verzorgende IG - Nieuwe uitdaging - Loopbaanadvies,VkzSubKdTCpzDwxl2uYTUg==,Akkolade,"Waddinxveen, South Holland, Netherlands",['Human Resources'],"Ben jij als een Verzorgende IG toe aan een nieuwe uitdaging in de regio Waddinxveen Akkolade denkt graag met je mee en biedt een gratis loopbaanadvies aan, Standplaats Waddinxveen, , Jouw functie, , De zorg heeft jouw hart als Verzorgende IG al lang gestolen Maar toch twijfel je soms of je nog wel op je plek zit bij je huidig werkgever Dat is heel normaal, , Akkolade bied je graag een luisterend oor Voel je vrij om al je wensen met ons te delen, zodat we samen op zoek kunnen gaan naar jouw nieuwe droombaan Met onze expertise in de zorg en welzijn sector en een zeer groot netwerk, kunnen wij jou als geen ander begeleiden Niets moet na dit gesprek, maar alles mag Wij gaan samen vrijblijvend kijken wat het beste bij jou past De kans is groot dat wij vele openstaande vacatures hebben die tot jouw nieuwe mogelijkheden behoren Ligt jouw nieuwe uitdaging misschien binnen een ziekenhuis, verpleeghuis of juist in de thuiszorg Samen komen we hier zeker uit, , Raak je al genspireerd om een volgende stap in je loopbaan te nemen Dan staat de koffie of thee klaar en spreken wij je vast snel, , , , , , , , , , Onze missie is zorgprofessionals helpen gelukkig te blijven in hun werk Dit doen we door jou te verbinden aan de juiste werkgever in de zorg en welzijn sector, waar jij een vaste baan krijgt Na jouw vrijblijvende reactie nodigen we je graag uit voor een kennismaking met ons Tijdens de kennismaking vertellen we jou alles over het team, de functie en de voorwaarden, maar bespreken we vooral ook jouw wensen en kwaliteiten Jij staat centraal in deze procedure, , Door het Coronavirus hebben wij onze procedure aangepast Kennismaken zal zoveel mogelijk plaatsvinden via videobellen Als je positief bent over het team word je uitgenodigd voor het arbeidsvoorwaardengesprek Je komt dan in dienst bij de zorgorganisatie Wij ondersteunen jou met maar n doel dat jij gelukkig wordt in je nieuwe vaste baan",Full-time,https://www.linkedin.com/jobs/view/externalApply/2331474384?url=https%3A%2F%2Fwww%2Eadzuna%2Enl%2Fdetails%2F1670738589%3Fv%3D04BD43E861D2845D053792E85BD8EF13DAFE4E04%26utm_source%3Dlinkedin2%26utm_medium%3Dorganic%26chnlid%3D880&urlHash=idML&refId=6735f4df-3133-4e70-966d-189c44f8ee89&trackingId=VkzSubKdTCpzDwxl2uYTUg%3D%3D&trk=public_jobs_apply-link-offsite,https://nl.linkedin.com/jobs/view/verzorgende-ig-nieuwe-uitdaging-loopbaanadvies-at-akkolade-2331474384?refId=6735f4df-3133-4e70-966d-189c44f8ee89&trackingId=VkzSubKdTCpzDwxl2uYTUg%3D%3D&position=19&pageNum=1&trk=public_jobs_job-result-card_result-card_full-click,2 months ago,2 months ago,2020-10-10,2020-12-04
