Data Row,Search Keyword,Platform,Job ID,Job Title,Tracking ID,Company Name,Location,Industry,Job Description,Employment Type,Company URL,Job URL,Job Age,Job Age Number,Job Date,Collection Date
179,transport,LinkedIn,2277169739,Performance Manager Logistics / 3PL Warehousing,ApdrJcrkOrnDtHAj4m6EjQ==,Henkel,"Amsterdam, North Holland, Netherlands","['Chemicals', 'Consumer Goods']","HENKEL IS FOR THOSE WHO STEP UP DO YOU, , At Henkel, you can make a difference and craft your career Thats why you own your projects and take full responsibility from an early stage Our unique brands in markets around the world open up countless opportunities to follow your convictions and explore new paths If you have an entrepreneurial mindset that allows you to always think out of the box  take the chance and shape the digital future together with us, , , , Performance, , Strategy, , Leadership, , Process, , KnowHow, , Innovation, , Projects, , , , , , , University degree preferably in supply chain management  Logistics, , , , , , , , , , , , , Cultural sensitivity to lead and influence across various cultures globally, , , , Working proficiency in English language",Full-time,https://www.linkedin.com/jobs/view/externalApply/2277169739?url=https%3A%2F%2Fhenkel%2Ecsod%2Ecom%2Fux%2Fats%2Fcareersite%2F1%2Frequisition%2F8515%2Fapplication%3Fc%3Dhenkel%26jobboardid%3D0%26source%3DLinkedIn%231&urlHash=E4qa&refId=a3f0824d-7648-438b-9b4a-7d5d62ef78a8&trackingId=ApdrJcrkOrnDtHAj4m6EjQ%3D%3D&trk=public_jobs_apply-link-offsite,https://nl.linkedin.com/jobs/view/performance-manager-logistics-3pl-warehousing-at-henkel-2277169739?refId=a3f0824d-7648-438b-9b4a-7d5d62ef78a8&trackingId=ApdrJcrkOrnDtHAj4m6EjQ%3D%3D&position=4&pageNum=7&trk=public_jobs_job-result-card_result-card_full-click,2 weeks ago,2 weeks ago,2020-11-23,2020-12-07
180,transport,LinkedIn,2305885197,Transport planner,4QCwKcceayfGFDoVpJOPew==,Feel Flex,"Veghel, North Brabant, Netherlands",None,"Door jouw bijdrage in het team van planners loopt het allemaal op rolletjes Jij behoud het overzicht en dit is dan ook 1 van jouw sterke punten Door de veelzijdigheid van de functie transport planner houd het jouw scherp en denk jij altijd in oplossingen en niet in problemen, , , , Jij bent het middelpunt van de organisatie Door de ritplanning weten chauffeurs waar zij aan toe zijn en welke route zij moeten gaan rijden Je hebt dagelijks contact met klanten, leveranciers en chauffeurs en zorgt ervoor dat de chauffeurs hun pauzes kunnen nemen en de goederen op tijd afleveren Samen met jouw team maak je dagelijks de planning, hierdoor is het belangrijk dat je kennis hebt van automatische plansystemen Je weet hoe je je hoofd koel moet houden en hoe je deze rust tijdens drukke dagen zoals Pasen en kerst overbrengt bij collegas, , , , , , , , , , , , Ben jij die toffe kandidaat voor deze vacature en voldoe je aan de eisen Klik dan op de knop Solliciteer direct en we nemen zo snel mogelijk contact met je op, Solliciteer direct Inschrijven",Full-time,https://www.linkedin.com/jobs/view/externalApply/2305885197?url=https%3A%2F%2Fneuvoo%2Enl%2Fjob%2Ephp%3Fid%3D132ee5408b2e%26source%3Dlinkedin%26utm_source%3Dpartner%26utm_medium%3Dlinkedin%26puid%3Dfddfcdddaddeaadb9adbeddb9ddcgddgadd8fade3deecacbfec3ddcg3e&urlHash=q2L5&refId=a3f0824d-7648-438b-9b4a-7d5d62ef78a8&trackingId=4QCwKcceayfGFDoVpJOPew%3D%3D&trk=public_jobs_apply-link-offsite,https://nl.linkedin.com/jobs/view/transport-planner-at-feel-flex-2305885197?refId=a3f0824d-7648-438b-9b4a-7d5d62ef78a8&trackingId=4QCwKcceayfGFDoVpJOPew%3D%3D&position=5&pageNum=7&trk=public_jobs_job-result-card_result-card_full-click,2 weeks ago,2 weeks ago,2020-11-23,2020-12-07
181,transport,LinkedIn,2315026635,Teamleader Warehouse Air,PEfx0D0/10q3cSzsclpfAg==,GEODIS,"SchipholRijk, North Holland, Netherlands","['Logistics and Supply Chain', 'Transportation/', 'Trucking/', 'Railroad', 'Import and Export']","Geodis is n van de grootste Supply Chain organisaties in de wereld Als onderdeel van SNCF Logistics, is Geodis nr 1 in Frankrijk en nr 4 in Europa Met meer dan 40000 professionals zijn wij aanwezig in 67 landen en hebben we een global netwerk in 120 landen Met 5 business lines, Supply Chain Optimization, Freight Forwarding, Contract Logistics, Distribution  Express en Road Transport, managen wij dagelijks vol passie en commitment de supply chain van onze klanten Onze missie we help our clients succeed by overcoming logistical constraints Onze visie we logistic their growth Of in dit geval we logistic your career",Full-time,,https://nl.linkedin.com/jobs/view/teamleader-warehouse-air-at-geodis-2315026635?refId=a3f0824d-7648-438b-9b4a-7d5d62ef78a8&trackingId=PEfx0D0%2F10q3cSzsclpfAg%3D%3D&position=6&pageNum=7&trk=public_jobs_job-result-card_result-card_full-click,2 weeks ago,2 weeks ago,2020-11-23,2020-12-07
182,transport,LinkedIn,2329727230,Rangeerder Den Bosch | Transport People,FCBKRHPaCzla60KgJKZSvg==,Werkzoekennl,"sHertogenbosch, North Brabant, Netherlands","['Sports', 'Health, Wellness and Fitness']","Vacature van Transport People, locatie Den Bosch, , Transport People Tilburg zoekt een nieuwe heftruckchauffeur die ook wil rangeren in de omgeving van Den Bosch Je begint je werkdag rond 1500 uur en bent rond middernacht ben je klaar Je werkt van maandag tot en met vrijdag, , , , , 5cd8a0b9cc68f9ffa4c9253553278a55",Full-time,https://www.linkedin.com/jobs/view/externalApply/2329727230?url=https%3A%2F%2Fwww%2Ewerkzoeken%2Enl%2F5839_transport-people%2Fvacatures%2F5019798_rangeerder-den-bosch%2F%3Fsource%3D5cd8a0b9cc68f9ffa4c9253553278a55%26utm_source%3Dlinkedin%26utm_medium%3Dreferral%26utm_campaign%3Dlinkedin_referral_vertical_vac_feed%26utm_term%3Dtransport%2Bden%2Bbosch&urlHash=nGvY&refId=a3f0824d-7648-438b-9b4a-7d5d62ef78a8&trackingId=FCBKRHPaCzla60KgJKZSvg%3D%3D&trk=public_jobs_apply-link-offsite,https://nl.linkedin.com/jobs/view/rangeerder-den-bosch-transport-people-at-werkzoeken-nl-2329727230?refId=a3f0824d-7648-438b-9b4a-7d5d62ef78a8&trackingId=FCBKRHPaCzla60KgJKZSvg%3D%3D&position=7&pageNum=7&trk=public_jobs_job-result-card_result-card_full-click,2 weeks ago,2 weeks ago,2020-11-23,2020-12-07
184,transport,LinkedIn,2330309471,Assistent Teamleider Warehouse,cdT35R+XlRLtHJ3xny8+tA==,SelectPro LLC,"Utrecht, Utrecht, Netherlands",['Construction'],"Assistent Teamleider Warehouse 32  40 uur, , Ben je een aanpakker met leidinggevende kwaliteiten en wil je in een gezellig team werken Dan is de functie van Assistent Teamleider Warehouse echt iets voor jou, , Als Assistent Teamleider geef je leiding aan een team van circa 6 tot 15 medewerkers die je begeleidt en traint, het aantal medewerkers is afhankelijk van de drukte, , De werkgebieden zijn onder andere orderpicken, inpakken of machinale verwerking en sorteren, je werkt veel samen met de andere teamleiders en andere assistent teamleiders op de afdeling en samen zorg je voor een efficinte afhandeling van alle uitgaande orders Daarnaast voer je ook nog extra taken uit zoals het uitdragen en controleren van de procedures, 5S en denk je mee over procesverbetering, , Je rapporteert aan je teamleider een functie waar je in de toekomst naar door kan groeien De functie van assistent teamleider is een uitdagende functie met veel contact met je eigen team en samen ga je voor het beste en hoogst haalbare resultaat, , Je bent binnen je afdelinggroep verantwoordelijk voor, , , , De Assistent Teamleider is een meewerkend voorman  vrouw Het doel is dus zelf meewerken terwijl je het overzicht bewaard, , Functieeisen, , , , Bedrijfsomschrijving, , Dit bedrijf verzorgt de complete logistieke en financile afhandeling van de bestellingen van haar opdrachtgevers webwinkels nationaal en internationaal Als efulfilment bedrijf heeft dit bedrijf sinds 2011 een onstuimige groei meegemaakt Inmiddels werken er 400 mensen en 180 robots verdeeld over 2 vestigingen in Nederland Nieuwegein en EttenLeur, , Met een concept van hoge automatisering, slimme robots, robots die samenwerken met mensen, artificile intelligentie, tevreden klanten en een gezond bedrijfsresultaat, , Ze zijn 7 dagen per week, 24 uur per dag actief om het beste ecommerce logistieke bedrijf van Europa te worden, , Een goede werksfeer vinden wij belangrijk, dus naast bijvoorbeeld teamuitjes hebben ze elke een vrijdagmiddag borrel samen met je collegas, , Arbeidsvoorwaarden, , Salaris is conform cao Transport  Logistiek Afhankelijk van leeftijd en ervaring is er recht op het volgende Bruto salaris vanaf  2500, per maand, 833 vakantiegeld, 25 vakantiedagen en een reiskostenvergoeding, tevens is een auto van de zaak in overleg mogelijk",Full-time,https://www.linkedin.com/jobs/view/externalApply/2330309471?url=https%3A%2F%2Fjoblift%2Enl%2Fdetails%2Fb1a2e153-957c-4c50-aa9e-bf598cd0c930%3Fjid%3D121d23fecef9155f399ebc6783d867178e5d542119ce50bbde0c349d84a7fe52%26utm_source%3Dlinkedin_nl%26utm_medium%3Dexternal_feed%26utm_campaign%3D385&urlHash=Uf_f&refId=a3f0824d-7648-438b-9b4a-7d5d62ef78a8&trackingId=cdT35R%2BXlRLtHJ3xny8%2BtA%3D%3D&trk=public_jobs_apply-link-offsite,https://nl.linkedin.com/jobs/view/assistent-teamleider-warehouse-at-selectpro-llc-2330309471?refId=a3f0824d-7648-438b-9b4a-7d5d62ef78a8&trackingId=cdT35R%2BXlRLtHJ3xny8%2BtA%3D%3D&position=9&pageNum=7&trk=public_jobs_job-result-card_result-card_full-click,2 weeks ago,2 weeks ago,2020-11-23,2020-12-07
185,transport,LinkedIn,2330263605,Intercedent Transport en Logistiek,7hice0Z9KcFsOqPWAr2KqQ==,ABAZ,"Haarlem, North Holland, Netherlands",['Information Services'],"Als intercedent ben je de schakel tussen vraag en aanbod Je communiceert makkelijk en bent de hele dag op zoek naar mogelijkhedenJe denkt in oplossingen, niet in problemen Je bent nieuwsgierig van aard en weet je eigen netwerk op en uit te bouwen Je kan resultaatgericht werken en je bent gefocusd op groei en resultaat je runt als het ware je eigen toko en durft daar ook de verantwoordelijkheid voor te nemen, , Functieeisen, , , , Bedrijfsomschrijving, , ABAZ is een bekende, lokale speler in uitzenden, detacheren en werving en selectie Met het platform banenintransportnl werft zij voor haar vaste klantenkring kwaliteitspersoneel Met een klein team wordt gewerkt voor klanten die al jaren naar volle tevredenheid worden bediend, , Arbeidsvoorwaarden",Full-time,https://www.linkedin.com/jobs/view/externalApply/2330263605?url=https%3A%2F%2Fjoblift%2Enl%2Fdetails%2Fc5ab6e20-578b-4c88-abd5-65bac4156c7a%3Fjid%3Dd2be9f7a3a2d99a0b7bcd75d9dc10f2ca21cf5eb4c37493ee9ae3544e7d07b0f%26utm_source%3Dlinkedin_nl%26utm_medium%3Dexternal_feed%26utm_campaign%3D385&urlHash=CExf&refId=a3f0824d-7648-438b-9b4a-7d5d62ef78a8&trackingId=7hice0Z9KcFsOqPWAr2KqQ%3D%3D&trk=public_jobs_apply-link-offsite,https://nl.linkedin.com/jobs/view/intercedent-transport-en-logistiek-at-abaz-2330263605?refId=a3f0824d-7648-438b-9b4a-7d5d62ef78a8&trackingId=7hice0Z9KcFsOqPWAr2KqQ%3D%3D&position=10&pageNum=7&trk=public_jobs_job-result-card_result-card_full-click,2 weeks ago,2 weeks ago,2020-11-23,2020-12-07
188,transport,LinkedIn,2330347268,Transportplanner,lOzIscMndLioBPGaDJQyag==,Transport People,"Ridderkerk, South Holland, Netherlands","['Logistics and Supply Chain', 'Financial Services', 'Transportation/', 'Trucking/', 'Railroad']","In deze functie verzorg je het inkomende en uitgaande transport van groente en fruit Het is jouw verantwoordelijkheid dat de producten tijdig in het eigen distributiecentrum of bij de klant op locatie arriveren Daarbij zijn kwaliteit en service de belangrijkste onderdelen Je behoud controle over de stand van zaken door contact te onderhouden met chauffeurs, leveranciers en klanten Problemen heb jij al opgelost voordat ze zijn ontstaan Je stelt prioriteiten door de invloeden van jouw beslissingen te managen en door stappen vooruit te denken Door snel te schakelen bij onverwachte situaties ben jij elk mogelijk probleem de baas Je voert de planning zelfstandig uit maar je bent daarbij een onderdeel van het team Samen verzorgen jullie de nationale en internationale planning Het bedrijf stelt hoge eisen aan de medewerkers Dit is nodig om binnen een professionele en hectische omgeving goed werk te kunnen leveren Het DNA bestaat uit 3 eigenschappen klantgericht, samenwerken en stressbestendig Je werkt in ploegendiensten Dit betekent dat je ook nachtdiensten en in weekenden werkt",Full-time,https://www.linkedin.com/jobs/view/externalApply/2330347268?url=https%3A%2F%2Fwww%2Evacatures%2Enl%2Fvacature%2Ftransportplanner%3A44482309%2F&urlHash=8X8j&refId=a3f0824d-7648-438b-9b4a-7d5d62ef78a8&trackingId=lOzIscMndLioBPGaDJQyag%3D%3D&trk=public_jobs_apply-link-offsite,https://nl.linkedin.com/jobs/view/transportplanner-at-transport-people-2330347268?refId=a3f0824d-7648-438b-9b4a-7d5d62ef78a8&trackingId=lOzIscMndLioBPGaDJQyag%3D%3D&position=13&pageNum=7&trk=public_jobs_job-result-card_result-card_full-click,2 weeks ago,2 weeks ago,2020-11-23,2020-12-07
2,transport,LinkedIn,2318719876,(Junior) Transport Planner,gr13ZuPMnH/PRJ8fQBYrLg==,Life Recruitment BV,"Schiedam, South Holland, Netherlands","['Transportation/', 'Trucking/', 'Railroad', 'Import and Export', 'Logistics and Supply Chain']",Voor een internationaal organisatie in Schiedam zijn wij op zoek naar een Junior Transport Planner In deze functie ben je fulltime beschikbaar en wordt je samen met jouw collegas verantwoordelijk voor het inplannen van nationale en internationale transportorders Ben je op zoek naar een zelfstandige en veelzijdige rol binnen een groeiende organisatie Lees dan gauw verder voor meer informatie over deze functie,Full-time,,https://nl.linkedin.com/jobs/view/junior-transport-planner-at-life-recruitment-bv-2318719876?refId=39a6c759-44a6-40a1-a951-1a14c1bf97d8&trackingId=gr13ZuPMnH%2FPRJ8fQBYrLg%3D%3D&position=2&pageNum=0&trk=public_jobs_job-result-card_result-card_full-click,2 weeks ago,2 weeks ago,2020-11-23,2020-12-07
3,transport,LinkedIn,2335300104,Freight Transport Dispatcher,CvhrfjI1xd9pCkcfVNU5EA==,Talent,"RotterdamThe Hague metropolitan area, South Holland, Netherlands",['Logistics and Supply Chain'],"Job Context  Duties, , Keep task records, , Communicate verbal instructions, , Make independent operating decisions, , , , , Openness and interest in learning and further development, , , Accuracy and attention to details, , Experience of having worked in a similar role, , Ability to work effectively in an international or multicultural environment",Full-time,https://www.linkedin.com/jobs/view/externalApply/2335300104?url=https%3A%2F%2Fjoblift%2Enl%2Fdetails%2F585aef91-20db-4a1e-96c9-af6b335608cd%3Fjid%3D52e16bf0bdcacac81fdaa7d01b18872a5aa0d8199c350cbc006c830fb73824e5%26utm_source%3Dlinkedin_nl%26utm_medium%3Dexternal_feed%26utm_campaign%3D126&urlHash=_zY3&refId=39a6c759-44a6-40a1-a951-1a14c1bf97d8&trackingId=CvhrfjI1xd9pCkcfVNU5EA%3D%3D&trk=public_jobs_apply-link-offsite,https://nl.linkedin.com/jobs/view/freight-transport-dispatcher-at-talent-2335300104?refId=39a6c759-44a6-40a1-a951-1a14c1bf97d8&trackingId=CvhrfjI1xd9pCkcfVNU5EA%3D%3D&position=3&pageNum=0&trk=public_jobs_job-result-card_result-card_full-click,2 weeks ago,2 weeks ago,2020-11-23,2020-12-07
5,transport,LinkedIn,2289660368,Specialist Transport,eAjjvG03Pj4E2rB5Ww8IhA==,Uitzendbureaunl,"Zaanstad, North Holland, Netherlands","['Internet', 'Machinery', 'Staffing and Recruiting']","ALBERT HEIJN  TRANSPORT  40 UUR, Ben je toe aan een volgende stap binnen de wereld van transport, ben jij flexibel qua werklocatie en ben jij op korte termijn beschikbaar Lees dan snel verder, wat bieden wij jou, , , , Je bent een transport topper, staat stevig in je schoenen en bent analytisch, communicatief vaardig, zelfstartend en proactief, , , , Je bent gemiddeld 2 dagen in de week op locatie op het Distrubutiecentrum te Geldermalsen en zult een bijdrage leveren aan het proces gericht op het continue verbeteren en optimaliseren van de tactische en operationele transportplanning, , , , Albert Heijn Transport valt onder de vlag van het Ahold Delhaize hoofdkantoor en is primair verantwoordelijk voor het realiseren van een effectieve inzet van transportcapaciteit voor goederenstromen van leveranciers, via Distributiecentra naar winkels en vice versa Naast het realiseren van effectief transport op tactisch en operationeel niveau is de afdeling ook gericht op continue optimalisatie en innovatie van het transport van goederenstromen Hierbij spelen vele overwegingen een rol denk aan oa kosten, kwaliteit, effectiviteit, capaciteit, voedselveiligheid, duurzaamheid en technologische ontwikkelingen, , , Enthousiast geworden en herken je jezelf in het profiel Solliciteer dan snel via de online Solliciteren button, Uiteraard staat deze vacature open voor iedereen die zich hierin herkent, , Opleiding, , HBO  bachelor",Full-time,https://www.linkedin.com/jobs/view/externalApply/2289660368?url=https%3A%2F%2Fnl%2Ejooble%2Eorg%2Fexternal%2F9147363106245858953%3Futm_campaign%3DNL%26utm_medium%3Dsocial%26utm_source%3Dlinkedin%26JobSource%3DBoard&urlHash=zqNa&refId=39a6c759-44a6-40a1-a951-1a14c1bf97d8&trackingId=eAjjvG03Pj4E2rB5Ww8IhA%3D%3D&trk=public_jobs_apply-link-offsite,https://nl.linkedin.com/jobs/view/specialist-transport-at-uitzendbureau-nl-2289660368?refId=39a6c759-44a6-40a1-a951-1a14c1bf97d8&trackingId=eAjjvG03Pj4E2rB5Ww8IhA%3D%3D&position=5&pageNum=0&trk=public_jobs_job-result-card_result-card_full-click,2 weeks ago,2 weeks ago,2020-11-23,2020-12-07
9,transport,LinkedIn,2329404635,Coördinator transport,wTM8qJVHb8/rMx/hi6iNkA==,Uitzendbureaunl,"Breda, North Brabant, Netherlands","['Automotive', 'Machinery', 'Staffing and Recruiting']","Draag jij straks de verantwoordelijkheid voor het maken van een efficinte planning waarmee je ervoor zorgt dat onze klanten tijdig en goed beleverd worden, , Wij zoeken iemand die het leuk vindt transport van ons product te plannen er organiseren vanuit diverse magazijnen in Europa naar de lokale klant Je hebt veel verschillende internationale contacten tussen magazijnen, transporteurs en klanten, , Daarnaast mag je onderhandelen met verschillende transporteurs en is het jouw sport telkens weer te zorgen voor een tijdige en goede levering, , , Vaardigheden, , , , , , Opleiding, , MBO werk en denkniveau, , Over de werkgever, , Onze opdrachtgever in regio Breda koopt grondstoffen in, verkoopt deze aan de eindgebruiker en zorgt voor het transport, , Je hebt 2 directe collegas in Nederland en je rapporteert rechtstreeks aan de Transport Manager Het Sales team waar je veel mee te maken bestaat uit 5 mensen in Nederland en 7 in het buitenland",Full-time,https://www.linkedin.com/jobs/view/externalApply/2329404635?url=https%3A%2F%2Fnl%2Ejooble%2Eorg%2Fexternal%2F-8093836229576812526%3Futm_campaign%3DNL%26utm_medium%3Dsocial%26utm_source%3Dlinkedin%26JobSource%3DBoard&urlHash=sq_-&refId=39a6c759-44a6-40a1-a951-1a14c1bf97d8&trackingId=wTM8qJVHb8%2FrMx%2Fhi6iNkA%3D%3D&trk=public_jobs_apply-link-offsite,https://nl.linkedin.com/jobs/view/co%C3%B6rdinator-transport-at-uitzendbureau-nl-2329404635?refId=39a6c759-44a6-40a1-a951-1a14c1bf97d8&trackingId=wTM8qJVHb8%2FrMx%2Fhi6iNkA%3D%3D&position=9&pageNum=0&trk=public_jobs_job-result-card_result-card_full-click,2 weeks ago,2 weeks ago,2020-11-23,2020-12-07
11,transport,LinkedIn,2319318412,Low Carbon Transport Consultant,V64NK6ZX5jX8Hhldxq4djA==,ISR Recruitment,"Amsterdam, North Holland, Netherlands","['Renewables & Environment', 'Electrical/', 'Electronic Manufacturing', 'Research']","Low Carbon Transport Consultant, Amsterdam, Netherlands, Competitive salary and excellent company benefits,  The Opportunity",Full-time,,https://nl.linkedin.com/jobs/view/low-carbon-transport-consultant-at-isr-recruitment-2319318412?refId=39a6c759-44a6-40a1-a951-1a14c1bf97d8&trackingId=V64NK6ZX5jX8Hhldxq4djA%3D%3D&position=11&pageNum=0&trk=public_jobs_job-result-card_result-card_full-click,2 weeks ago,2 weeks ago,2020-11-23,2020-12-07
12,transport,LinkedIn,2309037761,Consultant Start People Transport,f9EnRmEAAQlAPvenKVA93A==,Uitzendbureaunl,"Amsterdam, North Holland, Netherlands","['Automotive', 'Machinery', 'Staffing and Recruiting']","Blij met je baan Dat is zeker wanneer je begint als consultant bij Start People Transport Wij zijn op zoek naar een nieuwe collega voor ons team in Amsterdam, , Hoe ziet je dag eruit Als we dat konden voorspellen, zou het maar saai zijn Geen dag is hetzelfde Wel zijn er werkzaamheden die regelmatig terugkomen Elke dag start je met een werkoverleg met je collegas Na het werkoverleg weet iedereen wat de prioriteiten en uitdagingen voor die dag zijn Zo kan je vandaag een bedrijfsbezoek hebben gepland bij een van jouw klanten Samen bespreek je de behoefte aan chauffeurs voor de komende tijd Of ga je naar een prospect toe om de diensten van Start People Transport te verkopen In de middag kan je je bezig houden met het schrijven van vacatures, het begeleiden van de chauffeurs en de uren en loonadministratie, , Wat de functie zo leuk maakt is dat je veel vrijheid krijgt Het is aan jou om nieuwe klanten binnen te halen, relaties te onderhouden en kandidaten te helpen Je krijgt alle ruimte om jouw ondernemerschap te ontwikkelen en initiatief te tonen Omdat het een krappe arbeidsmarkt is houd jij je bezig met uitdagende vraagstukken Klinkt dit als een functie waar jij voldoening uit haalt en energie van krijgt Heb jij affiniteit met transport en logistiek en spreek je de taal van de doelgroep Wij komen graag met jou in contact om de mogelijkheden te bespreken, Ons team in Amsterdam bestaat uit 2 consultants, 2 recruiters en een manager We zoeken iemand die een teamplayer is, want succes behalen we in ons team met elkaar Je komt te werken in ons pand aan de Paalbergweg in Amsterdam waar ook andere Start People XL, ASA, Secretary Plus en Unique zijn gevestigd Leuk om te weten we sluiten onze werkweek graag met elkaar af onder het genot van een drankje al dan niet via Teams en heb je ook veel contact met de recruiters van onze andere vestigingen, , , , , Vaardigheden, , , , Opleiding, , HBO, , Over de werkgever, , Start People Transport is gespecialiseerd in het werven, selecteren en bemiddelen van vrachtwagenchauffeurs Onze consultants kennen de transportsector door en door wij zijn al 25 jaar specialist in arbeidsbemiddeling in deze mooie en uitdagende sector We vinden het belangrijk om echte aandacht te hebben voor de mens achter de chauffeur en investeren we veel in vakopleidingen en nascholing Vanuit onze vestigingen in Amsterdam, Rotterdam, Eindhoven en Zwolle bedienen we onze klanten door het hele land heen, , Voor meer informatie over deze baan kun je contact opnemen met Ivo van den Akker via tel click apply",Full-time,https://www.linkedin.com/jobs/view/externalApply/2309037761?url=https%3A%2F%2Fnl%2Ejooble%2Eorg%2Fexternal%2F5246453318682718018%3Futm_campaign%3DNL%26utm_medium%3Dsocial%26utm_source%3Dlinkedin%26JobSource%3DBoard&urlHash=IdbV&refId=39a6c759-44a6-40a1-a951-1a14c1bf97d8&trackingId=f9EnRmEAAQlAPvenKVA93A%3D%3D&trk=public_jobs_apply-link-offsite,https://nl.linkedin.com/jobs/view/consultant-start-people-transport-at-uitzendbureau-nl-2309037761?refId=39a6c759-44a6-40a1-a951-1a14c1bf97d8&trackingId=f9EnRmEAAQlAPvenKVA93A%3D%3D&position=12&pageNum=0&trk=public_jobs_job-result-card_result-card_full-click,2 weeks ago,2 weeks ago,2020-11-23,2020-12-07
14,transport,LinkedIn,2335295810,Road Transport Maintenance Scheduler,6fX4ReZ7RTS5MPoLqEk/Zw==,Talent,"RotterdamThe Hague metropolitan area, South Holland, Netherlands",['Logistics and Supply Chain'],"Job Context  Duties, , Comply with schedule, , Programme work according to incoming orders, , Manage backlogs, , , , , Experience of having worked in a similar role, , , The ability to deal with a range of tasks at the same time, , The ability to carry out work efficiently and accurately, even under pressure, , Ability to work autonomously",Full-time,https://www.linkedin.com/jobs/view/externalApply/2335295810?url=https%3A%2F%2Fjoblift%2Enl%2Fdetails%2Fa0b9ddf7-537c-457e-8a95-b96807726f3c%3Fjid%3Dfea3e148d72bb85231f7274defc38e158a834d51dee9b3f1ecfa487bda7eb1f8%26utm_source%3Dlinkedin_nl%26utm_medium%3Dexternal_feed%26utm_campaign%3D126&urlHash=3Cf9&refId=39a6c759-44a6-40a1-a951-1a14c1bf97d8&trackingId=6fX4ReZ7RTS5MPoLqEk%2FZw%3D%3D&trk=public_jobs_apply-link-offsite,https://nl.linkedin.com/jobs/view/road-transport-maintenance-scheduler-at-talent-2335295810?refId=39a6c759-44a6-40a1-a951-1a14c1bf97d8&trackingId=6fX4ReZ7RTS5MPoLqEk%2FZw%3D%3D&position=14&pageNum=0&trk=public_jobs_job-result-card_result-card_full-click,2 weeks ago,2 weeks ago,2020-11-23,2020-12-07
