Data Row,Search Keyword,Platform,Job ID,Job Title,Tracking ID,Company Name,Location,Industry,Job Description,Employment Type,Company URL,Job URL,Job Age,Job Age Number,Job Date,Collection Date
42,social worker,LinkedIn,2317659866,Een bijbaan als Social Work Studenten in Den Haag Start datum 09-11-2020,yJhcmyFvQsOt7kAeRX2UVg==,XL Studenten Uitzendbureau,"Utrecht, Utrecht, Netherlands",['Legal Services'],In de functie van maatschappelijk werker dagnachtopvang medewerker werk je in de maatschappelijke opvang op verschillende locaties in de regio Den Haag Je komt in onze vaste pool terecht wat betekent dat jij elke week benaderd wordt voor diensten Je komt alleen in onze pool terecht wanneer jij flexibel inzetbaar bent dus ook in de avond en in de nachtAls dagnachtopvang medewerker ben je verantwoordelijk voor de ontvangst en opvang van de dak en thuislozen sommigen hiervan hebben een verslaving enof een psychiatrische achtergrond Naast de opvang draag jij zorg voor de schoonmaak van de ruimtes en help je mee met het gereed maken van de maaltijdenDeze doelgroep is pittig en je kan eventueel te maken krijgen met lichte agressie Het is daarom essentieel dat jij sterk in je schoenen staat en dat jij ervaring hebt met een soortgelijke volwassen doelgroep vanuit jouw opleiding enof stagesNaast het volgen van de juiste opleiding of vergelijkbaar ben jij op oproepbasis beschikbaar minimaal 8 uur per week en flexibel inzetbaar voor in ieder geval een half jaarVoldoe jij aan bovenstaande eisen ben jij woonachtig in regio Den Haag Reageer dan snel op deze vacature en wij nemen contact met je op,Full-time,https://www.linkedin.com/jobs/view/externalApply/2317659866?url=https%3A%2F%2Fjoblift%2Enl%2Fdetails%2F1aca07d6-b509-45df-ac80-7eea3f64d603%3Fjid%3Dc31be5ee6e1bbbf484dbd011969270225b37ff222668e6e88faad7dbeeb1647d%26utm_source%3Dlinkedin_nl%26utm_medium%3Dexternal_feed%26utm_campaign%3D567&urlHash=_8PA&refId=5a53f53c-c3b4-4709-b61a-c27d3e1f9dea&trk=public_jobs_apply-link-offsite,https://nl.linkedin.com/jobs/view/een-bijbaan-als-social-work-studenten-in-den-haag-start-datum-09-11-2020-at-xl-studenten-uitzendbureau-2317659866?refId=5a53f53c-c3b4-4709-b61a-c27d3e1f9dea&position=17&pageNum=1&trk=public_jobs_job-result-card_result-card_full-click,1 week ago,1 week ago,2020-11-13,2020-11-22
43,social worker,LinkedIn,2282124668,Case Manager I,8IUiebDwTn+nQYbWRst/TQ==,"Palladia, Inc","Haarlem, North Holland, Netherlands","['Nonprofit Organization Management', 'Individual & Family Services', 'Mental Health Care']","Position OverviewUnder the supervision of the Clinical Supervisor, provide intensive case management for program participants and their familiesAA degree in related field and two years of qualifying experience",Full-time,https://www.linkedin.com/jobs/view/externalApply/2282124668?url=https%3A%2F%2Fchu%2Etbe%2Etaleo%2Enet%2Fchu03%2Fats%2Fcareers%2Frequisition%2Ejsp%3Forg%3DPALLADIAINC%26cws%3D1%26rid%3D1435&urlHash=RQaF&refId=5a53f53c-c3b4-4709-b61a-c27d3e1f9dea&trk=public_jobs_apply-link-offsite,https://nl.linkedin.com/jobs/view/case-manager-i-at-palladia-inc-2282124668?refId=5a53f53c-c3b4-4709-b61a-c27d3e1f9dea&position=18&pageNum=1&trk=public_jobs_job-result-card_result-card_full-click,1 week ago,1 week ago,2020-11-13,2020-11-22
44,social worker,LinkedIn,2256027417,Gezocht! Social Workers,7en60k7gQbus8g12U+Wqtw==,Pears,"Assen, Drenthe, Netherlands",None,"Voor verschillende organisaties zoeken wij mensen met een afgeronde opleiding Social Work of SPH Ben jij op zoek naar een nieuwe uitdaging, een eerste stap in je carrire Wij gaan graag met je in gesprek om je wensen en de mogelijkheden te besprekenBij Pears draait het om jou Betrouwbaarheid en transparantie staat altijd voorop We willen jou leren kennen, om je vervolgens zo goed mogelijk te ondersteunen We hechten waarde aan jouw wensen en ambities, zodat jij op je plek zit en het maximale uit je werk kunt halenWij zijn nieuwsgierig naar jou Jij ook naar ons Neem dan contact met ons",Full-time,https://www.linkedin.com/jobs/view/externalApply/2256027417?url=https%3A%2F%2Fnl%2Ejooble%2Eorg%2Fexternal%2F3397117501717330387%3Futm_campaign%3DNL%26utm_medium%3Dsocial%26utm_source%3Dlinkedin%26JobSource%3DBoard&urlHash=GP_N&refId=5a53f53c-c3b4-4709-b61a-c27d3e1f9dea&trk=public_jobs_apply-link-offsite,https://nl.linkedin.com/jobs/view/gezocht%21-social-workers-at-pears-2256027417?refId=5a53f53c-c3b4-4709-b61a-c27d3e1f9dea&position=19&pageNum=1&trk=public_jobs_job-result-card_result-card_full-click,1 week ago,1 week ago,2020-11-13,2020-11-22
45,social worker,LinkedIn,2282124669,Case Manager I,953DPbFqQ+6tT+2GUvypQw==,"Palladia, Inc","Haarlem, North Holland, Netherlands","['Nonprofit Organization Management', 'Individual & Family Services', 'Mental Health Care']","Position OverviewUnder the supervision of the Program Supervisor, provide intensive case management for program participants and their familiesAA degree in related field and two years of qualifying experience",Full-time,https://www.linkedin.com/jobs/view/externalApply/2282124669?url=https%3A%2F%2Fchu%2Etbe%2Etaleo%2Enet%2Fchu03%2Fats%2Fcareers%2Frequisition%2Ejsp%3Forg%3DPALLADIAINC%26cws%3D1%26rid%3D1448&urlHash=1IUi&refId=5a53f53c-c3b4-4709-b61a-c27d3e1f9dea&trk=public_jobs_apply-link-offsite,https://nl.linkedin.com/jobs/view/case-manager-i-at-palladia-inc-2282124669?refId=5a53f53c-c3b4-4709-b61a-c27d3e1f9dea&position=20&pageNum=1&trk=public_jobs_job-result-card_result-card_full-click,1 week ago,1 week ago,2020-11-13,2020-11-22
46,social worker,LinkedIn,2278435393,Maatschappelijk werker,/1p8DUUhQyaHGe/09zvSNg==,PDZ Uitzendbureau,"Amsterdam, North Holland, Netherlands",['Religious Institutions'],"Over de functieVoor onze opdrachtgever in Amsterdam zijn wij op zoek naar een ervaren maatschappelijk werker die die zichzelf een generalist kan noemen De voorziening waar je komt te werken is bedoeld om mensen met psychiatrische problemen enof verslaving te ondersteunen op meerdere gebieden Het is belangrijk dat je hebt van juridische, financile en maatschappelijke vraagstukken Zo zul je ondersteuning bieden bij het aanvragen van regelingen op het gebied van inkomen, schulden, huisvesting en dagbesteding Belangrijk hierin is dat je bemoeizorg kun leverenUiteraard ben je verantwoordelijk voor je eigen caseload Maar je werkt niet alleen en je kunt altijd sparren met collegas Zo werken er ook verpleegkundigen, artsen, budgetconsulenten en klantmanagers Ook administratieve taken zullen tot je werkzaamheden behoren en wordt verwacht dat je deelneemt aan werkoverleggen Zo zorgen jullie samen dat de clinten niet tussen wal en schip belandenOver het bedrijfDe organisatie waar je komt te werken is samen met de gemeente Amsterdam verantwoordelijk voor het welzijn van de inwoners van Amsterdam Zo hebben ze een plek gecreerd waar kwetsbare burgers met psychiatrische enof verslavingsproblemen terecht kunnen In deze voorziening kunnen zij ook gecontroleerd medische herone gebruiken en kunnen zij een beroep doen op hulpverleningWat wij vragenWat wij bieden",Full-time,https://www.linkedin.com/jobs/view/externalApply/2278435393?url=https%3A%2F%2Fjoblift%2Enl%2Fdetails%2F6ceb21b9-c6fc-4eb3-9c24-fd4152817a73%3Fjid%3Db82b8111b8b8dd5a41d86b06ffeeb9127c7128c8dc9b7158660dbd3a3ae6015b%26utm_source%3Dlinkedin_nl%26utm_medium%3Dexternal_feed%26utm_campaign%3D126&urlHash=jmDn&refId=5a53f53c-c3b4-4709-b61a-c27d3e1f9dea&trk=public_jobs_apply-link-offsite,https://nl.linkedin.com/jobs/view/maatschappelijk-werker-at-pdz-uitzendbureau-2278435393?refId=5a53f53c-c3b4-4709-b61a-c27d3e1f9dea&position=21&pageNum=1&trk=public_jobs_job-result-card_result-card_full-click,1 week ago,1 week ago,2020-11-13,2020-11-22
47,social worker,LinkedIn,2270403426,"Uitdagende HBO-stageplekken Social Work, beschikbaar per februari 2021 (min. 24 uur)",yZGLptrJTcCJS8ICZIMhUg==,Leger des Heils,"Utrecht, Utrecht, Netherlands",None,"Ben je op zoek naar een zinvolle stage Het Leger des Heils MiddenNederland biedt vanaf februari HBOstageplaatsen aan minimaal 24 uur per week en voor studenten vanaf jaar 2, op afdelingen met jeugd of volwassen clinten of buiten de intramurale setting Ambulant Geef in je motivatiebrief aan welke voorkeur jij hebt en waarom Onze afdelingen staan omschreven op de website wwwlegerdesheilsnlmiddennederland  Wat je doet De werkzaamheden die je uitvoert, zijn als volgt te omschrijven  zorg dragen voor de persoonlijk begeleiding van clinten, gesprekken voeren  zorgplannen schrijven  praktische hulpverlening op gebied van onder andere financin en zelfzorg  samenwerken met diverse externe instanties  Wij vragen Wij zoeken een enthousiaste en gedreven stagiaire  die een HBO opleiding Social Work volgt  plekken beschikbaar voor diverse uitstroomprofielen  die minimaal 24 uur per week inzetbaar is in onregelmatige diensten  inclusief weekenden  die zelf verantwoordelijkheid neemt voor zijnhaar leerproces en opdrachten  die als voorbeeld kan fungeren voor onze clinten, goede sociale vaardigheden zijn dan ook een must  met goede mondelinge en schriftelijke uitdrukkingsvaardigheden  die een betrokken christen is en vanuit deze levensovertuiging onze doelstelling kan onderschrijven Een verklaring omtrent gedrag VOG is vereist voor alle stages De kosten hiervoor worden vergoed Op sommige afdelingen kunnen vaccinaties nodig zijn en is het verplicht deel te nemen aan TBCcontroles Kosten hiervoor worden ook vergoed  Wij bieden Duur Wij bieden de stageplaats aan voor de duur van een heel of half schooljaar Begeleiding Wij bieden een werkbegeleider aan die jou zal begeleiden en stimuleren in je leerproces Stagevergoeding Je ontvangt een stagevergoeding De hoogte hiervan is afhankelijk van het aantal uur dat je stageloopt en de CAO waar de afdeling onder valt  Over het Leger des Heils Leger des Heils MiddenNederland is onderdeel van de Stichting Leger des Heils Welzijns en Gezondheidszorg en zet zich vanuit een positief christelijke levensovertuiging in voor kwetsbare mensen die ondersteuning nodig hebben bij het leven, wonen en maatschappelijk participeren Leger des Heils MiddenNederland is een professionele organisatie met een laagdrempelig, gevarieerd en samenhangend aanbod van hulp en zorg, waarbij de wensen en behoeften van onze clinten uitgangspunt zijn Bijna 1500 medewerkers zetten zich dagelijks in voor mensen zonder helper Ze zijn actief binnen diverse vormen van maatschappelijke opvang en dienstverlening, jeugdzorg, ouderenzorg en thuiszorg Hierbij is de deskundigheid, gedrevenheid, vasthoudendheid en het respect van onze medewerkers van cruciaal belang  Lijkt dit je wat Enthousiast geworden na het lezen van de vacature Reageer dan, uiterlijk 22 november 2020, via de solliciteerbutton met je CV en motivatiebrief en geef daarin duidelijk aan naar welke afdeling je voorkeur uitgaat en waarom Onze afdelingen staan omschreven op de website wwwlegerdesheilsnlmiddennederland Contactpersoon en informatie Mocht je na het lezen van de vacature vragen hebben over het stagetraject, dan kan je contact opnemen met afdeling HR Ciska Meijer is de praktijkopleider van het Leger des Heils MiddenNederland en te bereiken via stagemiddennederlandlegerdesheilsnl Ben je geschikt voor de functie, dan zoeken wij een plek voor je die past bij je voorkeur voor doelgroep en brengen we je in contact met de leidinggevende van die locatie",Full-time,https://www.linkedin.com/jobs/view/externalApply/2270403426?url=https%3A%2F%2Fwww%2Evacatures%2Enl%2Fvacature%2Fuitdagende-hbo-stageplekken-social-work-beschikbaar-per-februari-2021-min-24-uur%3A44081984%2F&urlHash=VmJi&refId=5a53f53c-c3b4-4709-b61a-c27d3e1f9dea&trk=public_jobs_apply-link-offsite,https://nl.linkedin.com/jobs/view/uitdagende-hbo-stageplekken-social-work-beschikbaar-per-februari-2021-min-24-uur-at-leger-des-heils-2270403426?refId=5a53f53c-c3b4-4709-b61a-c27d3e1f9dea&position=22&pageNum=1&trk=public_jobs_job-result-card_result-card_full-click,1 week ago,1 week ago,2020-11-13,2020-11-22
48,social worker,LinkedIn,2262882641,Child Care Supervisor,iIYkeL25SiaAeOCTyCg99Q==,"Palladia, Inc","Haarlem, North Holland, Netherlands","['Nonprofit Organization Management', 'Individual & Family Services', 'Mental Health Care']","Position OverviewUnder the supervision of the Program Director, the Child Care Supervisor is responsible for and develops The Childrens Program The program is oriented to developmentally sound teaching, nonviolent conflict resolution and parent and child bonding",Full-time,https://www.linkedin.com/jobs/view/externalApply/2262882641?url=https%3A%2F%2Fchu%2Etbe%2Etaleo%2Enet%2Fchu03%2Fats%2Fcareers%2Frequisition%2Ejsp%3Forg%3DPALLADIAINC%26cws%3D1%26rid%3D1425&urlHash=lPdL&refId=5a53f53c-c3b4-4709-b61a-c27d3e1f9dea&trk=public_jobs_apply-link-offsite,https://nl.linkedin.com/jobs/view/child-care-supervisor-at-palladia-inc-2262882641?refId=5a53f53c-c3b4-4709-b61a-c27d3e1f9dea&position=23&pageNum=1&trk=public_jobs_job-result-card_result-card_full-click,1 week ago,1 week ago,2020-11-13,2020-11-22
49,social worker,LinkedIn,2317359936,Junior Case Manager Verzuim,LvEwuq4qQFW1WiXdHbk18Q==,ArboTriple One BV,"Utrecht, Utrecht, Netherlands",['Mining & Metals'],"Junior C ase M anager V erzuim 32  40 uur per week Wie zijn wij Arbo Triple One   is een in Zeist gevestigde ISO 9001 gecertificeerde arbodienst Wij zijn een no nonsense en slagvaardige arbodienst waar gezond verstand en eigen initiatief hoog in het vaandel staan In verband met onze groei zoeken wij meerdere junior casemanagers Ook ervaren casemanagers worden uitgenodigd te reageren Wat ga je doen Als junior case manager verzuim assisteer je werkgevers bij het begeleiden van verzuimende medewerkers Dit doe je door intensief telefonisch contact te houden met verzuimende medewerkers van onze klanten Daarnaast heb je veelvuldig contact met leidinggevenden, PO functionarissen en Bedrijfsartsen Tevens zorg je voor een adequate dossieropbouw conform de Wet Verbetering Poortwachter Functie eisen MBO werkdenk niveau Goede kennis van de Nederlandse taal in woord en geschrift Bereidheid tot het volgen van externe casemanagement opleidingen Ervaring met het werken met computers 3240 uur Competenties Het nemen van initiatief Kunnen multitasken Het werken onder druk Organisatie en planmatig vermogen Zelfstandig kunnen werken, maar ook kunnen samenwerken Communicatief vermogen Wat bieden wij Een startsalaris van bruto  per maand op fulltime basis, met de mogelijkheid van doorgroei naar de functie van case manager en senior case manager Interne opleiding casemanagement alsmede externe opleidingen Relevante werkervaring en opleiding zijn minder belangrijk dan levenservaring en de juiste instelling en mentaliteit Werken in een dynamische omgeving met eigen verantwoordelijkheden Interesse Stuur een handgeschreven motivatiebrief  CV naar onder vermelding sollicitatie junior casemanager",Full-time,https://www.linkedin.com/jobs/view/externalApply/2317359936?url=https%3A%2F%2Fjoblift%2Enl%2Fjoblink%3Fto%3DeyJ0eXAiOiJKV1QiLCJhbGciOiJIUzI1NiJ9%2EeyJvZmZlcklkIjoiMzVlOTI4ZTktNTk2OC00NGU5LTlhMmItZWI0M2JjYTQxNjAyIn0%2E20EPjBCnyMRDux87OWWle5ukcs_dXGVeXuoGnky6L9o%26jid%3D5f027460877571e36c3b99a85152a19080df2bf387f6b72676493df782274ee3%26utm_source%3Dlinkedin_nl%26utm_medium%3Dexternal_feed%26utm_campaign%3D38&urlHash=u716&refId=5a53f53c-c3b4-4709-b61a-c27d3e1f9dea&trk=public_jobs_apply-link-offsite,https://nl.linkedin.com/jobs/view/junior-case-manager-verzuim-at-arbotriple-one-b-v-2317359936?refId=5a53f53c-c3b4-4709-b61a-c27d3e1f9dea&position=24&pageNum=1&trk=public_jobs_job-result-card_result-card_full-click,1 week ago,1 week ago,2020-11-13,2020-11-22
25,social worker,LinkedIn,2316262936,Developer IBM Case Manager,/eMaoh5lSDebHhG2MSJ7JQ==,ITStaffing,"Den Haag, South Holland, Netherlands","['Information Technology and Services', 'Computer Software', 'Internet']","TitelDeveloper IBM Case ManagerOrganisatieHet Shared Service Centrum ICT SSCICT  van en voor het rijk, is onderdeel van het ministerie van Binnenlandse Zaken en Koninkrijksrelaties Een van de grootste fullservice ICTdienstverleners binnen het rijk Zij servicen de gehele rijksdienst met onder meer rijksbrede ITservices SSCICT ondersteunt meer dan 50000 werkplekken en mobiele devices in Nederland en op 160 ambassadeposten over de gehele wereld Daarnaast beheren en ontwikkelen zij ruim 1000 applicaties, verzorgen housing en hosting in het state of the art overheidsdatacenter ODC, bieden ITdiensten met extra hoge beveiligingsniveaus en voeren jaarlijks zon 260 ICTprojecten uit, waaronder internationale evenementen als het EUvoorzitterschap Zo zorgen zij dat ambtenaren hun belangrijke werk in dienst van de samenleving altijd, overal en veilig kunnen doenDe FileNet Case Manager Ontwikkelaar levert een bijdrage aan de inrichting de ontwikkeling van het zaaksysteem van het Ministerie van Veiligheid en Justitie Dit systeem is gebaseerd op FileNet Content Navigator en Case Manager",Full-time,https://www.linkedin.com/jobs/view/externalApply/2316262936?url=https%3A%2F%2Fwww%2Edestaffinggroep%2Enl%2Fopdracht%2Fdeveloper-ibm-case-manager-anr-27645%2F&urlHash=bQwb&refId=9796c7da-5b4b-4baa-80ed-74bbead1b3f6&trk=public_jobs_apply-link-offsite,https://za.linkedin.com/jobs/view/developer-ibm-case-manager-at-it-staffing-2316262936?refId=9796c7da-5b4b-4baa-80ed-74bbead1b3f6&position=25&pageNum=0&trk=public_jobs_job-result-card_result-card_full-click,1 day ago,1 day ago,2020-11-21,2020-11-22
44,social worker,LinkedIn,2282150933,Maatschappelijk werkers,MtbL2GymQP2MkJnWRxKH5Q==,Zorg  Welzijn,"Den Haag, South Holland, Netherlands",None,"BedrijfsprofielXL Studenten Uitzendbureau is voor haar opdrachtgever op zoek naarMaatschappelijk werkers  16 tot 36 uurOnze opdrachtgever is een hulporganisatie die zorg biedt aan kwetsbare mensenVacature informatieIn de functie van maatschappelijk werker werk je in de maatschappelijke opvang in Den Haag Je komt in onze vaste pool terecht wat inhoudt dat jij elke week benaderd wordt voor dienstenAls medewerker kan je verschillende werkzaamheden krijgen denk aan ontvangst en opvang van de dak en thuislozen, helpen bij dagactiviteiten, opruimwerkzaamheden, klaarmaken van maaltijdenkoffie Afhankelijk van de locaties heb je te maken met verschillende doelgroepen, denk aan jongeren, clinten met een verslaving enof een psychiatrische achtergrond, clinten die langdurig onder toezicht wonen op locatie etc Hierdoor is het een ideale studie gerelateerde bijbaan omdat je met diverse doelgroepen en locaties in aanraking komtDeze doelgroep is pittig en je kan eventueel te maken krijgen met lichte agressie Het is daarom essentieel dat jij sterk in je schoenen staat en dat jij ervaring hebt met een soortgelijke volwassen doelgroep vanuit jouw opleiding enof stagesNaast het volgen van de juiste opleiding zie hierboven ben jij parttime op doordeweekse dagen en weekenden beschikbaarVoldoe jij aan bovenstaande eisen ben jij woonachtig in regio Den Haag Reageer dan snel en wij nemen contact met je opWerkzaamhedenWij zoekenWij biedenDeel deze vacature met je vrienden",Full-time,https://www.linkedin.com/jobs/view/externalApply/2282150933?url=https%3A%2F%2Fnl%2Ejooble%2Eorg%2Fexternal%2F6316232445500160850%3Futm_campaign%3DNL%26utm_medium%3Dsocial%26utm_source%3Dlinkedin%26JobSource%3DBoard&urlHash=A0es&refId=08ba36b9-3d31-4e0e-be89-a001d0bf2d6e&trk=public_jobs_apply-link-offsite,https://nl.linkedin.com/jobs/view/maatschappelijk-werkers-at-zorg-welzijn-2282150933?refId=08ba36b9-3d31-4e0e-be89-a001d0bf2d6e&position=19&pageNum=1&trk=public_jobs_job-result-card_result-card_full-click,1 day ago,1 day ago,2020-11-21,2020-11-22
46,social worker,LinkedIn,2305859223,Child Care Supervisor,/xG2u+U9R/KhsmhkKf7O2g==,"Palladia, Inc","Haarlem, North Holland, Netherlands","['Nonprofit Organization Management', 'Individual & Family Services', 'Mental Health Care']","Position OverviewUnder the supervision of the Program Director, the Child Care Supervisor is responsible for and develops The Childrens Program The program is oriented to developmentally sound teaching, nonviolent conflict resolution and parent and child bonding",Full-time,https://www.linkedin.com/jobs/view/externalApply/2262882641?url=https%3A%2F%2Fchu%2Etbe%2Etaleo%2Enet%2Fchu03%2Fats%2Fcareers%2Frequisition%2Ejsp%3Forg%3DPALLADIAINC%26cws%3D1%26rid%3D1425&urlHash=lPdL&refId=08ba36b9-3d31-4e0e-be89-a001d0bf2d6e&trk=public_jobs_apply-link-offsite,https://nl.linkedin.com/jobs/view/schoolmaatschappelijk-werkers-utrecht-at-mee-ln-2305859223?refId=08ba36b9-3d31-4e0e-be89-a001d0bf2d6e&position=21&pageNum=1&trk=public_jobs_job-result-card_result-card_full-click,1 day ago,1 day ago,2020-11-21,2020-11-22
48,social worker,LinkedIn,2279375644,Maatschappelijk Werker (GGZ-agoog),YSval/W4SLa4fck2SllidA==,Verslavingszorg,"Heerenveen, Friesland, Netherlands",['Religious Institutions'],"Waar ga je aan de slagBinnen de polikliniek Heerenveen worden diverse vormen van begeleiding en behandeling gegeven aan clinten met verslavingsproblemen en psychosociale problemen De verslavingsproblematiek varieert van licht tot ernstig De poliklinische behandeling is vooral gericht op genezing herstel naar volwaardige participatie in de samenleving In de behandeling is er ook aandacht voor het systeem van de clint Poliklinische hulpverlening bestaat voornamelijk uit Specialistische GGZ en in mindere mate Generalistische Basis GGZ GBGGZHet team bestaat uit verschillende disciplines en is gericht op samenwerkingWat ga je doenJe voert intakegesprekken, je houdt je bezig met diagnostiek, Samen met collegas maak je de behandelplannen van de clinten Je geeft individuele en groepsgerichte begeleiding aan clinten Je verricht crisisinterventie en zo nodig verwijs je door voor crisisopname Je neemt deel aan diverse interne overleggen en zo nodig aan overleggen met ketenpartners Uiteraard denk je op afdelingsniveau mee aan de verdere ontwikkeling van het behandelbeleid en verbetering van de kwaliteit van de zorgverleningJe werkt binnen kantoortijden van 830 tot 1700 uur en niet in het weekendWat vragen wij van jeWat bieden wij je",Full-time,https://www.linkedin.com/jobs/view/externalApply/2279375644?url=https%3A%2F%2Fjoblift%2Enl%2Fdetails%2F1c4a02bd-d376-4b19-962c-de3d695a21c9%3Fjid%3D42f14504b9418de75875ec5a24bbd59ad30f690ec4afbf40768f0e1fc3deb25c%26utm_source%3Dlinkedin_nl%26utm_medium%3Dexternal_feed%26utm_campaign%3D126&urlHash=q88D&refId=08ba36b9-3d31-4e0e-be89-a001d0bf2d6e&trk=public_jobs_apply-link-offsite,https://nl.linkedin.com/jobs/view/maatschappelijk-werker-ggz-agoog-at-verslavingszorg-2279375644?refId=08ba36b9-3d31-4e0e-be89-a001d0bf2d6e&position=23&pageNum=1&trk=public_jobs_job-result-card_result-card_full-click,1 day ago,1 day ago,2020-11-21,2020-11-22
