Data Row,Search Keyword,Platform,Job ID,Job Title,Tracking ID,Company Name,Location,Industry,Job Description,Employment Type,Company URL,Job URL,Job Age,Job Age Number,Job Date,Collection Date
254,sale,LinkedIn,2326365008,New Business Development Manager,fvPqP5igQWe2yHTZwB6aQA==,SelectPro LLC,"Hoogezand, Groningen, Netherlands",['Marketing and Advertising'],"New Business Development Manager gezocht voor een bedrijf in Hoogezand  Sappemeer, , De New Business Development Manager richt zich vooral op marktontwikkeling en de positionering van de ondernemingen binnen en buiten de organisatie Ben jij de gene die zich identificeert, definieert en op zoek gaat naar nieuw business en realiseert op deze wijze een significante toename van de omzet Ook participeert je in verkoop en pricingstrategien en werk je nauw samen met customer service, marketing en operations, , De New Business Development Manager richt zich vooral op marktontwikkeling en de positionering van de ondernemingen binnen en buiten de organisatie Ben jij de gene die zich identificeert, definieert en op zoek gaat naar nieuw business en realiseert op deze wijze een significante toename van de omzet Ook participeert je in verkoop en pricingstrategien en werk je nauw samen met customer service, marketing en operations, , , , Functieeisen, , , , Bedrijfsomschrijving, , Dit bedrijf is een moderne en innovatieve producent van exclusieve potplanten Vanuit het omvangrijk kassencomplex ca 15 ha rond Hoogezand  Sappemeer en met meer dan 200 medewerkers, leveren zij aan klanten door geheel Europa Daarbij is dit bedrijf toonaangevend op het gebied van groene potplanten, die hoofdzakelijk voortkomen uit eigen ontwikkeling, , Arbeidsvoorwaarden, , Salaris is conform cao Glastuinbouw Afhankelijk van ervaring is er recht op het volgende Bruto salaris vanaf 3000, per maand, 833 vakantiegeld, 25 vakantiedagen en je krijgt per dag een vast bedrag aan reiskosten, tevens is een auto van de zaak in overleg mogelijk",Full-time,https://www.linkedin.com/jobs/view/externalApply/2326365008?url=https%3A%2F%2Fjoblift%2Enl%2Fdetails%2Fae20e8fa-7f76-443f-b696-b4dacbdbe0a5%3Fjid%3D842f3d762b081b3f1ee4fbd8fea0ff569a2ca71772639be99fbc91e3f39cb9ce%26utm_source%3Dlinkedin_nl%26utm_medium%3Dexternal_feed%26utm_campaign%3D385&urlHash=mYOC&refId=38bf6c94-43c9-492a-9f24-854e0a8c48fc&trk=public_jobs_apply-link-offsite,https://nl.linkedin.com/jobs/view/new-business-development-manager-at-selectpro-llc-2326365008?refId=38bf6c94-43c9-492a-9f24-854e0a8c48fc&position=4&pageNum=10&trk=public_jobs_job-result-card_result-card_full-click,2 days ago,2 days ago,2020-11-28,2020-11-30
255,sale,LinkedIn,2282678418,After Sales Manager Consumables and Spare Parts,ZqPOIpT3QwiJjGhCi1l+ng==,Page Executive,"Amsterdam, North Holland, Netherlands",['Industrial Automation'],"New position, Dynamic, growing organization, , About Our Client, Manufacturer withing the Agricultural Industry",Full-time,https://www.linkedin.com/jobs/view/externalApply/2282678418?url=https%3A%2F%2Fwww%2Epageexecutive%2Ecom%2Fjob-detail%2Fafter-sales-manager-consumables-and-spare-parts%2Fref%2F196182%3Futm_source%3Dlinkedin%26utm_medium%3Djobboard%26utm_campaign%3Djobad&urlHash=k-tH&refId=38bf6c94-43c9-492a-9f24-854e0a8c48fc&trk=public_jobs_apply-link-offsite,https://nl.linkedin.com/jobs/view/after-sales-manager-consumables-and-spare-parts-at-page-executive-2282678418?refId=38bf6c94-43c9-492a-9f24-854e0a8c48fc&position=5&pageNum=10&trk=public_jobs_job-result-card_result-card_full-click,2 days ago,2 days ago,2020-11-28,2020-11-30
256,sale,LinkedIn,2261054046,Medewerker planning en export,d40fj0Q6Rz+28fLxQzWaoA==,PP personeelsdiensten,"Boxmeer, North Brabant, Netherlands","['Biotechnology', 'Farming']","Voor een organisatie in Boxmeer waar het fokproces van pluimvee centraal staat, ben ik op zoek naar een medewerker planning en export Het is een fulltime functie en je komt direct bij het bedrijf in dienst,  Wat ga je doen",Full-time,https://www.linkedin.com/jobs/view/externalApply/2261054046?url=https%3A%2F%2Fwww%2Epponline%2Enl%2Fvacature%2Fmedewerker-planning-en-export-fulltime-vaste-baan%2F&urlHash=ixd3&refId=38bf6c94-43c9-492a-9f24-854e0a8c48fc&trk=public_jobs_apply-link-offsite,https://nl.linkedin.com/jobs/view/medewerker-planning-en-export-at-pp-personeelsdiensten-2261054046?refId=38bf6c94-43c9-492a-9f24-854e0a8c48fc&position=6&pageNum=10&trk=public_jobs_job-result-card_result-card_full-click,2 days ago,2 days ago,2020-11-28,2020-11-30
257,sale,LinkedIn,2320512502,Commercieel medewerker,KtX7SqJWSQa8td8G+EdknA==,Artiflex  Recruitmentspecialist,"Waalwijk, North Brabant, Netherlands","['Electrical/', 'Electronic Manufacturing', 'Information Technology and Services', 'Mechanical or Industrial Engineering']","Wat ga je doen, , Een commercieel medewerker voor onze vacature in Waalwijk Gaat jouw hart sneller kloppen van autos Ben jij op zoek naar een fulltime baan voor langere tijd met uitzicht op een vast contract Goed dat je deze vacature leest Vanwege groei binnen dit bedrijf zijn wij op zoek naar iemand die het team wil versterken Heb jij al enige commercile ervaring opgedaan in een autobedrijf en ligt je hart bij occasions Dan zijn wij op zoek naar jou, , , , Je gaat aan de slag bij het grootste autobedrijf van Nederland Als remarketing medewerker ga je aan de slag op de remarketing vestiging in Waalwijk Op deze vestiging worden autos die terugkomen uit de lease klaargemaakt voor de verkoop Je werkt samen in een team van gedreven collegas waar hard gewerkt wordt, maar waar er ook zeker ruimte is voor plezier, , Jij kunt laten zien wat je in je mars hebt als commercieel medewerker, bij, , , Wat vragen wij, , Voor deze vacature in Waalwijk is het volgende van belang, , , Wat bieden wij, , Word jij onze nieuwe commercieel medewerker in Waalwijk Stuur dan nu je cv naar cknookartiflexcom Wij nemen dan gegarandeerd contact met je op Met vragen kun je ons ook bereiken op 0162 420280 of via WhatsApp op 06 11450172, , Bezoek ook onze Facebookpagina httpswwwfacebookcomArtiflexbv, , Solliciteren",Full-time,https://www.linkedin.com/jobs/view/externalApply/2320512502?url=https%3A%2F%2Fartiflex%2Ecom%2Fik-zoek-werk%2Fvacatures%2Fcommercieel-medewerker-5&urlHash=vZRm&refId=38bf6c94-43c9-492a-9f24-854e0a8c48fc&trk=public_jobs_apply-link-offsite,https://nl.linkedin.com/jobs/view/commercieel-medewerker-at-artiflex-recruitmentspecialist-2320512502?refId=38bf6c94-43c9-492a-9f24-854e0a8c48fc&position=7&pageNum=10&trk=public_jobs_job-result-card_result-card_full-click,2 days ago,2 days ago,2020-11-28,2020-11-30
258,sale,LinkedIn,2306185297,Inside Sales - Amsterdam,eB3tHJE/SC2vG+pz9CG5/Q==,ProSpex,"Amsterdam, North Holland, Netherlands",['Marketing and Advertising'],"Heb jij commercieel talent en grote ambities, , Prospex is creatief specialist in B2Bleadgeneratie We werken samen met lokale en internationale opdrachtgevers en creren voor hen een constante stroom van new business Onze aanpak daarin is uniek We geloven namelijk dat verkoop het resultaat is van een relatie Daarom zorgen wij voor een contactstrategie waarmee onze opdrachtgevers doorlopend op de radar staan bij de voor hen relevante doelgroep Door relevante informatie op het juiste moment en met de juiste doelgroep te delen, maken we van een koud contact een warme relatie En zorgen we dat onze opdrachtgevers altijd aan tafel zitten bij een reeds opgewarmde lead, , , , Onze opdrachtgever is een toonaangevend producent en leverancier van diverse bekende AMerk frisdranken Bij onze opdrachtgever werken dagelijks 350 enthousiaste collegas, , De markt waarin onze opdrachtgever opereert is de horeca Hier kan het er nog wel eens stevig aan toe gaan Wij zoeken daarom een lead developer met de nodige B2B ervaring Je moet tegen een stootje kunnen Commercieel gevoel is daarbij ook belangrijk, maar zeker geen pusher Horecaondernemers zijn verder vaak gevoelsmensen Empathisch vermogen is een vereiste om succesvol te kunnen zijn, , Je maakt onderdeel uit van het Sales Team Nederland, bestaande uit 2 accountmanagers en 1 sales manager Onze opdrachtgever is een team van Inside Sales aan het bouwen en jij bent de eerste, , , , , , Prospex professionals leidt de nieuwe generatie Sales tijgers op Met een uniek programma gericht op het leren van geavanceerde sales skills en jouw persoonlijke ontwikkelplan, wordt jij klaargestoomd voor de volgende stap in jouw carrire, , , , , , , , Vindt jij sales leuk Wil je werken bij een marktleider Solliciteer direct en we nemen zo snel mogelijk contact met je op",Full-time,https://www.linkedin.com/jobs/view/externalApply/2306185297?url=https%3A%2F%2Fneuvoo%2Enl%2Fjob%2Ephp%3Fid%3Da36de5266a3e%26source%3Dlinkedin%26utm_source%3Dpartner%26utm_medium%3Dlinkedin%26puid%3Dfadfcddd8ddafadc9adbaddbaddegddaaddafadf3dedcacbfec3ddcg3e&urlHash=9Y48&refId=38bf6c94-43c9-492a-9f24-854e0a8c48fc&trk=public_jobs_apply-link-offsite,https://nl.linkedin.com/jobs/view/inside-sales-amsterdam-at-prospex-2306185297?refId=38bf6c94-43c9-492a-9f24-854e0a8c48fc&position=8&pageNum=10&trk=public_jobs_job-result-card_result-card_full-click,2 days ago,2 days ago,2020-11-28,2020-11-30
259,sale,LinkedIn,2261035958,Accountmanager,86ovSSxrS9Ws5iqcM/LrZg==,OptiVolt BV,"Brielle, South Holland, Netherlands","['Oil & Energy', 'Electrical/', 'Electronic Manufacturing']","Wij zoeken jou, Vind je verkoop een sport Wil je ook graag meedelen in je eigen succes Reageer dan op onze vacature, Als accountmanager van OptiVolt ben je verantwoordelijk voor de bestaande relaties en het aanleveren van nieuwe relaties voor ons bedrijf Je brengt de nieuwste producten van OptiVolt op het gebied van energiebesparing onder de aandacht Je ontwikkelt, samen met je collegas, aantrekkelijke voorstellen afgestemd op de behoefte van de klant Je bent in staat om zelf je agenda te vullen en je kunt goed organiseren Je wilt je graag profileren binnen de wereld van energiebesparing Je hebt geen bezwaar tegen het bezoeken van klanten in de gehele Benelux",Full-time,,https://nl.linkedin.com/jobs/view/accountmanager-at-optivolt-b-v-2261035958?refId=38bf6c94-43c9-492a-9f24-854e0a8c48fc&position=9&pageNum=10&trk=public_jobs_job-result-card_result-card_full-click,2 days ago,2 days ago,2020-11-28,2020-11-30
260,sale,LinkedIn,2298636468,Rayonmanager,JMEYSiaFRdaHJhCzZcsl+g==,MotracLinde,"South Holland, Netherlands",['Logistics and Supply Chain'],"Klanttevredenheid hoog in het vaandel  Resultaatgericht Commercieel  Overtuigingskracht  Vastbijter  Past dit bij jou MotracLinde zoekt een, Rayon Manager Regio ZuidHolland,  Wat ga je doen",Full-time,https://www.linkedin.com/jobs/view/externalApply/2298636468?url=https%3A%2F%2Fwww%2Ewerkenbijroyalreesink%2Ecom%2Fnl%2Fvacancies%2F1528%2Fmotraclinde%2Frayonmanager-zuid-holland&urlHash=fV7h&refId=38bf6c94-43c9-492a-9f24-854e0a8c48fc&trk=public_jobs_apply-link-offsite,https://nl.linkedin.com/jobs/view/rayonmanager-at-motraclinde-2298636468?refId=38bf6c94-43c9-492a-9f24-854e0a8c48fc&position=10&pageNum=10&trk=public_jobs_job-result-card_result-card_full-click,2 days ago,2 days ago,2020-11-28,2020-11-30
261,sale,LinkedIn,2305804626,Commercieel medewerker binnendienst,69seFsd2SfaGrTqd+zp1jQ==,Konecranes,"Hoogvliet, South Holland, Netherlands",['Machinery'],"At Konecranes, we believe that great customer experience is built on the people behind the Konecranes name  people committed to providing our customers with lifting equipment and services that lift their businesses Everything we do, we do with passion and drive, , We believe diversity drives business success and is the foundation for our growth We welcome different backgrounds and skills that enrich our community and we promote a place where we can ALL be ourselves This is what makes Konecranes a unique place to work, , De business area maintenance service biedt service en onderhoud oplossingen voor alle kraanmerken, havenapparatuur en werktuigmachines Wij zijn de oorspronkelijke serviceprovider voor zowel Konecranes als Demagapparatuur, , Op dit moment zijn we op zoek naar een Inside Sales om ons team in Hoogvliet te versterken Als Inside Sales ben je verantwoordelijk voor het offreren en verkopen van serviceoplossingen en onderhoud in Belgi en Nederland De leads komen voort uit preventief onderhoud op advies van onze servicemonteurs, alsmede door actieve verkoop, , Wil jij werken in een internationale organisatie waar veel kansen zijn om jezelf verder te ontwikkelen, lees dan snel verder, , , , In deze functie heb je regelmatig overleg met onze klanten In Nederland en Belgi Je belt klanten, na afloop van geplande preventieve onderhoudsbezoeken om de service beoordeling door te nemen, uit dit gesprek komen vaak technische vragen vanuit de klant We verwachten niet dat je gelijk een expert bent en dat je alle vragen kan beantwoorden, maar het is wel van belang dat je kan verkopen waarom een reparatie wordt aangeboden en wat de gevolgen zijn voor de kraan als de reparatie niet wordt uitgevoerd Ook de offertes die hieruit voortvloeien maak je op, , Daarnaast houd je je bezig om met de klant de aanbevelingen van de monteurs te bespreken, , Met behulp van onze CRM software houd je alle verkoopcases uptodate, zodat alle collegas weten in welke fase de case zich bevindt In deze functie ben je verantwoordelijk voor vooraf gestelde verkoopdoelstellingen Dit vereist een nauwe samenwerking tussen onze branches in Nederland en Belgi Na overleg met de klant wijs je de sales lead toe aan de juiste persoon voor verdere afhandeling Ook houd je je bezig met het vernieuwen van bestaande overeenkomsten met klanten met behulp van onze ROC configurator, , , , , , , , , , , , , , Wil je meer weten over Konecranes als werkgeverga naar , , Herken jij jezelf in dit profiel en ben je genteresseerd, , , , Acquisitie nav deze vacature wordt niet op prijs gesteld, , Konecranes, Inc and its affiliates will not accept resumes from external recruiters or agencies without a Service Agreement and Agency Portal submission Any resumes sent without a Service Agreement and Agency Portal submission with Konecranes, Inc are void of any fees and free for internal use Applicable Konecranes data protection obligations are the responsibility of the agency, , Konecranes is a worldleading group of Lifting Businesses, serving a broad range of customers We are truly a global company with 18,000 employees at 600 locations in 50 countries For over 80 years, we have been dedicated to improving the efficiency and performance of businesses in all types of industries We believe that sustainable growth is a result of a strong responsible performance Equal Opportunity Employer MinoritiesWomenProtected VeteransDisabledOther Protected Category",Full-time,https://www.linkedin.com/jobs/view/externalApply/2305804626?url=https%3A%2F%2Fcareers%2Ekonecranes%2Ecom%2FKonecranes%2Fjob%2FHoogvliet-Inside-Sales%2F622388901%2F&urlHash=ch9T&refId=38bf6c94-43c9-492a-9f24-854e0a8c48fc&trk=public_jobs_apply-link-offsite,https://nl.linkedin.com/jobs/view/commercieel-medewerker-binnendienst-at-konecranes-2305804626?refId=38bf6c94-43c9-492a-9f24-854e0a8c48fc&position=11&pageNum=10&trk=public_jobs_job-result-card_result-card_full-click,2 days ago,2 days ago,2020-11-28,2020-11-30
262,sale,LinkedIn,2252627125,Senior Accountmanager Food,1qFqtjPIQw6YVfw8xzsHsw==,Synerlogic BV,"Duiven, Gelderland, Netherlands","['Food & Beverages', 'Chemicals', 'Logistics and Supply Chain']","Wij zijn een uniek familiebedrijf met een eigen RD, productiefaciliteit en eigen logistiek apparaat Een bedrijf dat wereldwijd distribueert en klanten bedient varirend van een melkveehouderij tot aan multinationals in de Food  Beverage en chemische industrie Wij zijn bezig met een professionaliseringsslag en hebben een ambitieuze groeidoelstelling Daarom zijn we op zoek naar een senior Accountmanager Food  Beverage Een senior accountmanager die zorgt voor het beheren en uitbreiden van meerdere accountklanten Heb jij interesse in een functie van senior accountmanager waarbij jij ervoor zorgt dat we naast de zuivelindustrie ook new business gaan generen binnen een nieuwe markt Dan zijn wij op zoek naar jou",Full-time,,https://nl.linkedin.com/jobs/view/senior-accountmanager-food-at-synerlogic-b-v-2252627125?refId=38bf6c94-43c9-492a-9f24-854e0a8c48fc&position=12&pageNum=10&trk=public_jobs_job-result-card_result-card_full-click,2 days ago,2 days ago,2020-11-28,2020-11-30
263,sale,LinkedIn,2307856572,Channel Planner,5nxdFeQtScW+LvTrzYL1Ig==,America Today,"Diemen, North Holland, Netherlands",['Apparel & Fashion'],"America Today is altijd op zoek naar Energetic, Approachable en Responsible crew die ons team helpt versterken Je bent altijd customer focused, een echte team player met passie voor America Today, , Voor onze afdeling ECOMMERCE  MARKETING zijn ter vervanging van zwangerschapsverlof op zoek naar een fulltime",Full-time,https://www.linkedin.com/jobs/view/externalApply/2307856572?url=http%3A%2F%2Fjob%2Eamerica-today%2Ecom%2Findex%2Ephp%2Fpage%2Fapplicants%2Fcommand%2Fapplyforjob%2Fvid%2F401374%2Fbb%2F1&urlHash=xN2X&refId=38bf6c94-43c9-492a-9f24-854e0a8c48fc&trk=public_jobs_apply-link-offsite,https://nl.linkedin.com/jobs/view/channel-planner-at-america-today-2307856572?refId=38bf6c94-43c9-492a-9f24-854e0a8c48fc&position=13&pageNum=10&trk=public_jobs_job-result-card_result-card_full-click,2 days ago,2 days ago,2020-11-28,2020-11-30
264,sale,LinkedIn,2246354682,Technical Sales Professional Sustainable Plastics,2P/hxyXfQP2Qv9CfW/3EWA==,Morssinkhof Plastics Heerenveen,"Zeewolde, Flevoland, Netherlands",['Plastics'],"Momenteel is er ruimte voor een betrouwbare, gemotiveerde sales professional In deze veelzijdige, afwisselende functie, ben je de spin in het web tussen klanten, de interne verkoopafdelingen en de diverse fabrieken",Full-time,https://www.linkedin.com/jobs/view/externalApply/2246354682?url=https%3A%2F%2Feasyapply%2Ejobs%2Fr%2FL6pfG9L1TgsDELZBAEE&urlHash=TvyW&refId=38bf6c94-43c9-492a-9f24-854e0a8c48fc&trk=public_jobs_apply-link-offsite,https://nl.linkedin.com/jobs/view/technical-sales-professional-sustainable-plastics-at-morssinkhof-plastics-heerenveen-2246354682?refId=38bf6c94-43c9-492a-9f24-854e0a8c48fc&position=14&pageNum=10&trk=public_jobs_job-result-card_result-card_full-click,2 days ago,2 days ago,2020-11-28,2020-11-30
265,sale,LinkedIn,2304728891,Junior sales manager export,dOtdTheQSVGBIZGW6vzwUA==,Unilac Holland BV,"Amersfoort, Utrecht, Netherlands",['Dairy'],"Junior sales manager export, Amersfoort, 40 uur per week, , Wat hebben grote bedrijven als Carrefour, Metro en Royal Caribbean Cruises met elkaar gemeen Ze hebben allen de producten van Unilac Holland in het assortiment Of het nu gaat om kaas, lang houdbare zuivelproducten of roomboter Afrika Ook daar eten ze graag kaas Een pittige Belprado LeChevre, mild en zacht, of stevig en gerijpt Voordat consumenten in Europa of overzee van onze producten kunnen genieten, moet er wel het een en ander geregeld worden Dat doe jij Voor het hele salesproces ben jij in the lead",Full-time,https://www.linkedin.com/jobs/view/externalApply/2304728891?url=https%3A%2F%2Fltpx%2Enl%2F2ierPXc&urlHash=ctBo&refId=38bf6c94-43c9-492a-9f24-854e0a8c48fc&trk=public_jobs_apply-link-offsite,https://nl.linkedin.com/jobs/view/junior-sales-manager-export-at-unilac-holland-bv-2304728891?refId=38bf6c94-43c9-492a-9f24-854e0a8c48fc&position=15&pageNum=10&trk=public_jobs_job-result-card_result-card_full-click,2 days ago,2 days ago,2020-11-28,2020-11-30
266,sale,LinkedIn,2258073768,Sales Consultant of accountmanager,xyfbmT0pSAitE3mzkpZIcQ==,StudentenBureau,"Amsterdam, North Holland, Netherlands",['Staffing and Recruiting'],"Dit ga je leren, Ben jij onze nieuwe consultant Na je inwerkperiode van 4 a 5 weken, waarin je de kneepjes van het vak leert, krijg je een eigen auto tot je beschikking, een eigen rayon en een eigen target Je runt je eigen BV als consultant, , Je gaat aan de slag als accountmanager voor Studentenbureau waarbij je enerzijds een grote sales rol hebt en anderzijds een recruitment rol om zo stageplekken en bijbanen bij bedrijven te vervullen Je overtuigt bedrijven waarom ze met ons samen moeten gaan werken en haalt zo die opdrachten binnen, , Aan jou de taak om de leukste stagebedrijven binnen te halen met jouw salespitch, , , , Al onze collegas kunnen ontzettend goed met elkaar overweg en daarnaast prijzen zij de fijne werkomgeving en het betrokken management Kortom StudentenBureau biedt je een 360 graden functie waarbij je alle aspecten mee krijgt op het gebied van sales en recruitment Dit is de ideale stap als young professional in de start van jouw carrire, Zo ziet jouw dag eruit, Elke dag is anders Er zijn drie vaste momenten per week wanneer je met je team zit, dat zijn de maandagochtend vergadering, dinsdagmiddag sales en donderdagochtend sales In het begin van je loopbaan als accountmanager, zal je veel koud moeten gaan bellen naar potentile klanten, om zo je salestechniek te verfijnen en je klantenportefeuille uit te breiden, De rest van de week is vrij in te vullen, , Heb je dan die afspraak gemaakt bij een potentile klant, dan ga je die vervolgens ook zelf bezoeken Je rijdt dus behoorlijk wat kilometers per week om bij al je klanten langs te gaan, De andere dag ben je bezig met de werving van de studenten voor de opdrachten die je die week hebt teruggehaald, , Je hebt flexibele werktijden en bepaalt zelf hoe je week er uit komt te zien, Dit ben jij, Word jij onze nieuwe accountmanager Kan jij je vinden in deze omschrijving Dan zoeken wij jou, , Startdatum is bespreekbaar, Over dit bedrijf, Wij zijn 50 enthousiaste medewerkers met een gemiddelde leeftijd van 26 jaar, , Vanuit 3 kantoren, 1 in Amsterdam, 1 in Rotterdam en 1 in Den Bosch, crossen wij het hele land door met als doel zoveel mogelijk leuke stages, afstudeeropdrachten en bijbanen terug te halen, , De ene dag sta je te pitchen bij de Rabobank, het andere moment nodig je enthousiaste studenten uit en loop je lekker op je sneakers rond, , We vinden persoonlijke ontwikkeling en groei zeer belangrijk en we bieden dan ook alle mogelijkheid om hier mee aan de slag te gaan denk aan coaches, mentoring, trainingen et cetera, Daarnaast staan flexibel werken en autonomie centraal bij ons",Full-time,https://www.linkedin.com/jobs/view/externalApply/2258073768?url=https%3A%2F%2Fnl%2Ejooble%2Eorg%2Fexternal%2F3641814839965277290%3Futm_campaign%3DNL%26utm_medium%3Dsocial%26utm_source%3Dlinkedin%26JobSource%3DBoard&urlHash=9Hbi&refId=38bf6c94-43c9-492a-9f24-854e0a8c48fc&trk=public_jobs_apply-link-offsite,https://nl.linkedin.com/jobs/view/sales-consultant-of-accountmanager-at-studentenbureau-2258073768?refId=38bf6c94-43c9-492a-9f24-854e0a8c48fc&position=16&pageNum=10&trk=public_jobs_job-result-card_result-card_full-click,2 days ago,2 days ago,2020-11-28,2020-11-30
267,sale,LinkedIn,2193825752,"Faillissementsmedewerker (0,8-1,0 fte)",t6ZPuFjRSMaw2k78fWTpag==,Wijn  Stael Advocaten NV,"Houten, Utrecht, Netherlands",['Law Practice'],"Heb jij het in je om mee te draaien aan de top van de advocatuur, , Wijn  Stael is een middelgroot kantoor voor mensen met ambities, Ons pand ligt midden in de prachtige binnenstad van Utrecht, met uitzicht op de singel De mensen op ons kantoor werken met passie voor hun vak en dat is goed merkbaar in de onderling plezierige sfeer waar veel wordt samengewerkt Wij behandelen veel complexe zaken die regelmatig ook de landelijke media halen Dat biedt volop mogelijkheden voor mensen die aan de top van de advocatuur willen meedraaien Daarbij is veel aandacht voor ieders persoonlijke ontwikkeling Het is een kantoor met grote onderlinge verbondenheid en fijne werksfeer We organiseren geregeld sociale activiteiten soms sportieve, zoals een tweejaarlijkse wintersport en jaarlijks tennistoernooi",Part-time,https://www.linkedin.com/jobs/view/externalApply/2193825752?url=https%3A%2F%2Fwww%2Ewijnenstael%2Enl%2Fwerken-bij&urlHash=cyd8&refId=38bf6c94-43c9-492a-9f24-854e0a8c48fc&trk=public_jobs_apply-link-offsite,https://nl.linkedin.com/jobs/view/faillissementsmedewerker-0-8-1-0-fte-at-wijn-stael-advocaten-n-v-2193825752?refId=38bf6c94-43c9-492a-9f24-854e0a8c48fc&position=17&pageNum=10&trk=public_jobs_job-result-card_result-card_full-click,2 days ago,2 days ago,2020-11-28,2020-11-30
268,sale,LinkedIn,2215555180,Junior Sales Consultant,RbYY4DpxTCyZb/8MYGmhRg==,Netcompany,"Delft, South Holland, Netherlands","['Information Technology and Services', 'Computer Software']","Wil je werken bij n van de meest succesvolle ITbedrijven van Nederland en NoordEuropa, waarbij jij samen met het sales team zorgt voor nieuwe en innovatieve ITprojecten met een maatschappelijk karakter Doe je dit graag in een omgeving waar persoonlijke ontwikkeling centraal staat Solliciteer dan nu bij Netcompany",Full-time,https://www.linkedin.com/jobs/view/externalApply/2215555180?url=https%3A%2F%2Fsmrtr%2Eio%2F4xL2T%3Fsource%3DLinkedin&urlHash=YZeB&refId=38bf6c94-43c9-492a-9f24-854e0a8c48fc&trk=public_jobs_apply-link-offsite,https://nl.linkedin.com/jobs/view/junior-sales-consultant-at-netcompany-2215555180?refId=38bf6c94-43c9-492a-9f24-854e0a8c48fc&position=18&pageNum=10&trk=public_jobs_job-result-card_result-card_full-click,2 days ago,2 days ago,2020-11-28,2020-11-30
