Data Row,Search Keyword,Platform,Job ID,Job Title,Tracking ID,Company Name,Location,Industry,Job Description,Employment Type,Company URL,Job URL,Job Age,Job Age Number,Job Date,Collection Date
1,career development specialist,LinkedIn,2290186654,"Advisor - Non-Degreed Specialist, Work from Home",dpoHNbSsQwOF2s6f9MmPvg==,Becht,"The Hague, South Holland, Netherlands","['Information Technology and Services', 'Computer Software', 'Oil & Energy']","PartTime  Contingent, Flexible Location, , Becht is a 5 STAR rated Glassdoor company and a Top 100 Best Places to Work in New Jersey according to NJBIZ, , , Founded in 1964, Becht is a rapidlygrowing, multidiscipline consulting firm relied on by customers to relentlessly solve their most difficult and entrenched problems We combine vast experience through our network of over 1200 technical experts with both engineering expertise and professional experience Becht is a company founded on excellence, and as such we seek individuals who want to be part of our passionate and energetic team, , , Are you a candidate with 20 years owneroperator experience in a refining or petrochemical organization seeking engagement on a parttime, contingent basis We invite you to join our network of over 1200 Specialists and Advisors who work for Becht Once you join our network, youll have the ability to apply only for projects that interest you and fit your schedule, , Becht provides specialty consulting typically serving as the owners representative on capital projects and turnarounds We are seeking those with significant experience in the refining and petrochemical industry Areas of interest include Field Supervisors, Planners, Schedulers, Turnaround Managers, Construction Managers, Cost Specialists, Operators, Machinery Specialist, Inspection Supervisors and many others These roles could involve a mix of remote and onsite work depending on the candidates preference and the needs of the project Becht advisors generally work from a home office but may travel to client sites or Bechts offices, as required Becht frequently combines expertise in multi discipline teams to support resolution of client issues Bechts mission is to , , , A creative and innovative work environment isnt all we have to offer When you join Becht, you can expect, , , , , , All functions will be performed under the direction of the Division Manager one for each functional discipline Advisors working over 1000 hours during a calendar year are eligible for matching 401k contributions Advisors are eligible to enroll in medical, dental, vision, life and disability insurance if they are expected to work an average of 30 hours per week for one year Eligibility is monitored on an annual basis advisors may become eligible later if eligibility requirements are met, , Becht is an Equal Opportunity Employer",Part-time,https://www.linkedin.com/jobs/view/externalApply/2290186654?url=https%3A%2F%2Fworkforcenow%2Eadp%2Ecom%2Fmascsr%2Fdefault%2Fmdf%2Frecruitment%2Frecruitment%2Ehtml%3Fcid%3D0894d882-3d5f-4cce-b9f2-fa6a17b60eb5%26source%3DIN%26selectedMenuKey%3DCareerCenter%26jobId%3D372531&urlHash=VFcU&refId=9ae54ec1-e0e9-495e-a29f-4ee3baa075c2&trk=public_jobs_apply-link-offsite,https://nl.linkedin.com/jobs/view/advisor-non-degreed-specialist-work-from-home-at-becht-2290186654?refId=9ae54ec1-e0e9-495e-a29f-4ee3baa075c2&position=1&pageNum=0&trk=public_jobs_job-result-card_result-card_full-click,1 month ago,1 month ago,2020-10-14,2020-11-28
2,career development specialist,LinkedIn,2324373147,Commercieel Loopbaanadviseur,ijhmE2R2QlaZKX8dqB3P+Q==,NCOI Opleidingen,"Hilversum, North Holland, Netherlands",['Education Management'],"Wil jij commercie en advies combineren in n functie Krijg jij er energie van om de kwaliteiten van werknemers in kaart te brengen Wil jij organisaties adviseren over de duurzame inzetbaarheid van hun medewerkers Wij zijn op zoek naar een Commercieel loopbaanadviseur EVC Adviseur voor 28 tot 36 uur per week Solliciteer vr 4 december via button, , Locatie Hilversum, , Vakgebied Sales, , Werkweek 32  40 uur, , Opleidingsniveau HBO, , Dit zijn je werkzaamheden, , EVC staat voor Erkenning van Verworven Competenties Dit betekent dat wat iemand geleerd heeft op school, in het werk of priv wordt beoordeeld en erkend EVC maakt zichtbaar welke kennis, inzichten en ervaringen iemand heeft opgedaan Daartoe wordt op een gestructureerde wijze informatie verzameld Het resultaat wordt vastgelegd in een Ervaringscertificaat Dit is zinvol wanneer iemand zich verder wilt ontwikkelen in een vervolgopleiding of bij een sollicitatie duidelijk wilt aangeven over welke competenties hij of zij beschikt, Dit resultaat bestaat voor de kandidaat uit een Ervaringscertificaat, waarmee opgedane werkervaring objectief in een certificaat wordt vastgelegd, , In deze veelzijdige, commercile rol ben jij ht visitekaartje van EVC Centrum Nederland bij onze klanten Je voert zowel telefonisch als op locatie adviesgesprekken met potentile en bestaande deelnemers over hun loopbaantraject Je geeft inhoudelijk advies over EVC of EVP trajecten, verzorgt voorlichtingen en verzorgt de project cordinatie van de aan jou toegewezen key accounts, Naast het adviseren van deelnemers geef je ook voorlichting aan werkgevers over onze trajecten Je gaat actief het gesprek aan en signaleert verkoopkansen, , EVC Centrum Nederland valt onder de NCOI Groep, Het team van EVC Centrum Nederland bestaat uit 11 collegas, waaronder de directeur, 2 accountmanagers, 1 projectmanager, 2 cordinatoren, 1 redacteur, 2 commercieel loopbaanadviseurs en 2 administratief medewerkers, , Wat maakt het leuk om voor EVC Centrum Nederland te werken, , , Ons aanbod, , , Jouw profiel, , De ideale kandidaat voor deze vacature heeft HBOwerk en denkniveau aangevuld met ongeveer 3 jaar relevante werkervaring in een adviesfunctie binnen een professionele en commercile organisatie Bij voorkeur in HRM of de hospitality branche Jouw energieke, professionele persoonlijkheid maakt je een prettige gesprekspartner Je hebt ervaring in het voeren van commercile adviesgesprekken en vindt het leuk om met creatieve oplossingen te komen, , Stuur jouw sollicitatie Leuk dat je bij ons wilt komen werken We nemen telefonisch of per mail contact met je op Eerste Kennismaking We selecteren de beste kandidaten en nodigen je uit voor een kennismaking Door naar de 2e ronde Je behoort tot de beste kandidaten We doen je graag een voorstel Alles is geregeld Wat leuk Je komt bij ons werken Tot snel Aan de slag Maak al je ambities waar bij de NCOI Groep Ben jij een leider, beschik je over natuurlijk overwicht en sta je stevig in je schoenen Dan is nu je kans Wij zijn op zoek naar een Teamleider op Heb jij ruime ervaring met zorgadministratiezorgcontrol Wil je bijdragen aan het op hoog niveau brengen en houden van onze nieuwe geaccrediteerde Is het jouw doel om medewerkers het beste uit zichzelf en hun rol te laten halen Heb je een goed ontwikkeld commercieel gevoel En weet jij",Full-time,https://www.linkedin.com/jobs/view/externalApply/2324373147?url=https%3A%2F%2Fwww%2Ewerkenbijncoi%2Enl%2FItems%2Fnl%2FVacatures%2FSales%2Fcommercieel-loopbaanadviseur&urlHash=TOay&refId=9ae54ec1-e0e9-495e-a29f-4ee3baa075c2&trk=public_jobs_apply-link-offsite,https://nl.linkedin.com/jobs/view/commercieel-loopbaanadviseur-at-ncoi-opleidingen-2324373147?refId=9ae54ec1-e0e9-495e-a29f-4ee3baa075c2&position=2&pageNum=0&trk=public_jobs_job-result-card_result-card_full-click,1 month ago,1 month ago,2020-10-14,2020-11-28
3,career development specialist,LinkedIn,2324409328,Commercieel Loopbaanadviseur,2n00+t+eRGe74MtVEH1SQw==,NCOI Groep,"Hilversum, North Holland, Netherlands",['Education Management'],"Dit zijn je werkzaamheden, EVC staat voor Erkenning van Verworven Competenties Dit betekent dat wat iemand geleerd heeft op school, in het werk of priv wordt beoordeeld en erkend EVC maakt zichtbaar welke kennis, inzichten en ervaringen iemand heeft opgedaan Daartoe wordt op een gestructureerde wijze informatie verzameld Het resultaat wordt vastgelegd in een Ervaringscertificaat Dit is zinvol wanneer iemand zich verder wilt ontwikkelen in een vervolgopleiding of bij een sollicitatie duidelijk wilt aangeven over welke competenties hij of zij beschikt, Dit resultaat bestaat voor de kandidaat uit een Ervaringscertificaat, waarmee opgedane werkervaring objectief in een certificaat wordt vastgelegd, , In deze veelzijdige, commercile rol ben jij ht visitekaartje van EVC Centrum Nederland bij onze klanten Je voert zowel telefonisch als op locatie adviesgesprekken met potentile en bestaande deelnemers over hun loopbaantraject Je geeft inhoudelijk advies over EVC of EVP trajecten, verzorgt voorlichtingen en verzorgt de project cordinatie van de aan jou toegewezen key accounts, Naast het adviseren van deelnemers geef je ook voorlichting aan werkgevers over onze trajecten Je gaat actief het gesprek aan en signaleert verkoopkansen, , EVC Centrum Nederland valt onder de NCOI Groep, Het team van EVC Centrum Nederland bestaat uit 11 collegas, waaronder de directeur, 2 accountmanagers, 1 projectmanager, 2 cordinatoren, 1 redacteur, 2 commercieel loopbaanadviseurs en 2 administratief medewerkers, , Wat maakt het leuk om voor EVC Centrum Nederland te werken, , , Ons aanbod, Jouw profiel, De ideale kandidaat voor deze vacature heeft HBOwerk en denkniveau aangevuld met ongeveer 3 jaar relevante werkervaring in een adviesfunctie binnen een professionele en commercile organisatie Bij voorkeur in HRM of de hospitality branche Jouw energieke, professionele persoonlijkheid maakt je een prettige gesprekspartner Je hebt ervaring in het voeren van commercile adviesgesprekken en vindt het leuk om met creatieve oplossingen te komen",Full-time,https://www.linkedin.com/jobs/view/externalApply/2324409328?url=https%3A%2F%2Fneuvoo%2Enl%2Fjob%2Ephp%3Fid%3Db61be88f8c49%26source%3Dlinkedin%26utm_source%3Dpartner%26utm_medium%3Dlinkedin%26puid%3Dfadecddagddf7ade7adbcdd8add8gadaadd8fadd3deccdc7fec3ddcg3e&urlHash=n34t&refId=9ae54ec1-e0e9-495e-a29f-4ee3baa075c2&trk=public_jobs_apply-link-offsite,https://nl.linkedin.com/jobs/view/commercieel-loopbaanadviseur-at-ncoi-groep-2324409328?refId=9ae54ec1-e0e9-495e-a29f-4ee3baa075c2&position=3&pageNum=0&trk=public_jobs_job-result-card_result-card_full-click,1 month ago,1 month ago,2020-10-14,2020-11-28
4,career development specialist,LinkedIn,2274565539,Verzorgende IG - Loopbaanadvies gesprek,hGTzZoTxRSW0yuEIu00hxg==,Akkolade,"Amstelveen, North Holland, Netherlands",['Human Resources'],"Ben jij een Verzorgende IG Zoek je een droombaan, maar kan je hierbij wat hulp gebruiken Dan ben je bij Akkolade in Amstelveen aan het goede adres Wij bieden je namelijk een gratis loopbaanadvies aan, Standplaats Amstelveen, , Jouw functie, , Hierbij bieden wij je een gratis loopbaanadvies gesprek aan Heb je soms het gevoel nog niet helemaal op de juiste plek te zitten Met ons netwerk en expertise binnen de Verpleging, Verzorging en Thuiszorg, gaan wij deze plek samen voor je vinden Als Verzorgende IG ben je namelijk zeer waardevol voor onze gezondheidszorg en verdien je het op de voor jouw juiste plek te zitten, , Voel je vrij om al je wensen met ons te delen, zodat we samen op zoek kunnen gaan naar jouw nieuwe droombaan Niets moet na dit gesprek, maar alles mag Wij gaan geheel vrijblijvend samen kijken wat het beste bij jou past De kans is groot dat wij vele openstaande vacatures hebben die voor jou nieuwe deuren openen, , Onze missie is zorgprofessionals helpen gelukkig te blijven in hun werk Ben je klaar om een volgende stap in je loopbaan te nemen Neem dan snel contact op Wij staan voor je klaar, , , , , , , , , , Onze missie is zorgprofessionals helpen gelukkig te blijven in hun werk Dit doen we door jou te verbinden aan de juiste werkgever in de zorg en welzijn sector, waar jij een vaste baan krijgt Na jouw vrijblijvende reactie nodigen we je graag uit voor een kennismaking met ons Tijdens de kennismaking vertellen we jou alles over het team, de functie en de voorwaarden, maar bespreken we vooral ook jouw wensen en kwaliteiten Jij staat centraal in deze procedure, , Door het Coronavirus hebben wij onze procedure aangepast Kennismaken zal zoveel mogelijk plaatsvinden via videobellen Als je positief bent over het team word je uitgenodigd voor het arbeidsvoorwaardengesprek Je komt dan in dienst bij de zorgorganisatie Wij ondersteunen jou met maar n doel dat jij gelukkig wordt in je nieuwe vaste baan",Full-time,https://www.linkedin.com/jobs/view/externalApply/2274565539?url=https%3A%2F%2Fwww%2Eadzuna%2Enl%2Fdetails%2F1654083104%3Fv%3D2386FB32B605B0B70D7DB21212A801CC46139890%26utm_source%3Dlinkedin2%26utm_medium%3Dorganic%26chnlid%3D880&urlHash=GQBm&refId=9ae54ec1-e0e9-495e-a29f-4ee3baa075c2&trk=public_jobs_apply-link-offsite,https://nl.linkedin.com/jobs/view/verzorgende-ig-loopbaanadvies-gesprek-at-akkolade-2274565539?refId=9ae54ec1-e0e9-495e-a29f-4ee3baa075c2&position=4&pageNum=0&trk=public_jobs_job-result-card_result-card_full-click,1 month ago,1 month ago,2020-10-14,2020-11-28
5,career development specialist,LinkedIn,2293485204,Loopbaanadviseur als ZZP-er door heel Nederland,fsv32IauTfWGVwSV2XI+AQ==,Flex Advieshuis BV,"Duiven, Gelderland, Netherlands",['Public Relations and Communications'],"Wilt u ons team versterken met uw uitzonderlijke kwaliteiten  Solliciteer dan direct als loopbaanadviseur als zzper Ons team van loopbaanadviseurs maakt een snelle groei door en moet dringend versterkt worden met echte pros in loopbaanadvisering, , Wie zoeken wij, , Het Flex Advieshuis BV zoekt enthousiaste mensgerichte loopbaanadviseurs De zzpformule van Flex Advieshuis BV biedt het persoonlijke en zelfstandige van ondernemer zijn en de voordelen van een professionele organisatie De kwaliteit en professionaliteit van Flex Advieshuis BV combineer je met je betrokkenheid en persoonlijke aandacht als lokale loopbaancoach, , De Loopbaanadviseur inventariseert in gesprekken met de clint hun mogelijkheden Wanneer hijzij in kaart heeft gebracht wat de clint kan en wil, koppelt de loonbaanadviseur deze informatie aan opleidings en functiemogelijkheden Hijzij stelt samen met de clint een persoonlijk actie en ontwikkelingsplan op, welke moet leiden naar een functie die bij de wensen van de clint pas Hijzij bewaakt hierbij de opvolging om tot de best mogelijke carrire kansen voor de clint te komen, , Spreekt je dit aan en ben jij, , , , En bezit je, , , , Een afgeronde HBO opleiding richting personeel en arbeid, , Flex Advieshuis BV heeft zich gespecialiseerd in de begeleiding van werkzoekenden op weg naar een geschikte baan Dit doen wij door middel van individuele maatwerk trajecten, of in groepsverband dmv verschillende workshops Wij voeren onze diensten uit, in tegenstelling tot veel andere loopbaanprofessionals, vanuit het oogpunt van een recruiter Door onze jarenlange ervaring in de uitzendbranche weet Flex Advieshuis BV als geen ander waarop gelet wordt tijdens sollicitaties en kan daarmee helpen succesvoller te solliciteren",Full-time,https://www.linkedin.com/jobs/view/externalApply/2293485204?url=https%3A%2F%2Fjoblift%2Enl%2Fdetails%2Fd2f09054-6397-494d-af73-268f117ec29d%3Fjid%3D889e6b7c8549bc2ed7ce218e5bc3e9246b7b1b9b39710ce634d3aa58b88407ac%26utm_source%3Dlinkedin_nl%26utm_medium%3Dexternal_feed%26utm_campaign%3D126&urlHash=yBw4&refId=9ae54ec1-e0e9-495e-a29f-4ee3baa075c2&trk=public_jobs_apply-link-offsite,https://nl.linkedin.com/jobs/view/loopbaanadviseur-als-zzp-er-door-heel-nederland-at-flex-advieshuis-b-v-2293485204?refId=9ae54ec1-e0e9-495e-a29f-4ee3baa075c2&position=5&pageNum=0&trk=public_jobs_job-result-card_result-card_full-click,1 month ago,1 month ago,2020-10-14,2020-11-28
6,career development specialist,LinkedIn,2279289567,Loopbaanadviseur als zzp-er door heel Nederland,Lv31nt3ATXykrJReTZDvqg==,Uitzendbureaunl,"Nederland, Overijssel, Netherlands",['Public Relations and Communications'],"Wilt u ons team versterken met uw uitzonderlijke kwaliteiten  Solliciteer dan direct als loopbaanadviseur als zzper Ons team van loopbaanadviseurs maakt een snelle groei door en moet dringend versterkt worden met echte pros in loopbaanadvisering, , Wie zoeken wij, , Het Flex Advieshuis BV zoekt enthousiaste mensgerichte loopbaanadviseurs De zzpformule van Flex Advieshuis BV biedt het persoonlijke en zelfstandige van ondernemer zijn en de voordelen van een professionele organisatie De kwaliteit en professionaliteit van Flex Advieshuis BV combineer je met je betrokkenheid en persoonlijke aandacht als lokale loopbaancoach, , De Loopbaanadviseur inventariseert in gesprekken met de client hun mogelijkheden Wanneer hijzij in kaart heeft gebracht wat de client kan en wil, koppelt de loonbaanadviseur deze informatie aan opleidings en functiemogelijkheden Hijzij stelt samen met de client een persoonlijk actie en ontwikkelingsplan op, welke moet leiden naar een functie die bij de wensen van de client pas Hijzij bewaakt hierbij de opvolging om tot de best mogelijke carrierekansen voor de client te komen, , Spreekt je dit aan en ben jij, , , , En bezit je, , , , Over de werkgever, , Flex Advieshuis BV heeft zich gespecialiseerd in de begeleiding van werkzoekenden op weg naar een geschikte baan Dit doen wij door middel van individuele maatwerk trajecten, of in groepsverband dmv verschillende workshops Wij voeren onze diensten uit, in tegenstelling tot veel andere loopbaanprofessionals, vanuit het oogpunt van een recruiter Door onze jarenlange ervaring in de uitzendbranche weet Flex Advieshuis BV als geen ander waarop gelet wordt tijdens sollicitaties en kan daarmee helpen succesvoller te solliciteren",Full-time,https://www.linkedin.com/jobs/view/externalApply/2279289567?url=https%3A%2F%2Fjoblift%2Enl%2Fdetails%2F89e936e8-6423-4434-bb44-b3f3f015f89e%3Fjid%3Da64c193eaf900940979f25e341cc8f7286b4374279dee8feb786bc9ee04d3036%26utm_source%3Dlinkedin_nl%26utm_medium%3Dexternal_feed%26utm_campaign%3D321&urlHash=ZTEQ&refId=9ae54ec1-e0e9-495e-a29f-4ee3baa075c2&trk=public_jobs_apply-link-offsite,https://nl.linkedin.com/jobs/view/loopbaanadviseur-als-zzp-er-door-heel-nederland-at-uitzendbureau-nl-2279289567?refId=9ae54ec1-e0e9-495e-a29f-4ee3baa075c2&position=6&pageNum=0&trk=public_jobs_job-result-card_result-card_full-click,1 month ago,1 month ago,2020-10-14,2020-11-28
7,career development specialist,LinkedIn,2253943611,Verzorgende IG - Loopbaanadvies gesprek | Hoofddorp | Akkolade,gNC9dPDCRQ+jqp07oZTe2A==,Werkzoekennl,"Hoofddorp, North Holland, Netherlands","['Hospital & Health Care', 'Mental Health Care']","Vacature van Akkolade, locatie Hoofddorp, , Ben jij een Verzorgende IG Zoek je een droombaan, maar kan je hierbij wat hulp gebruiken Dan ben je bij Akkolade in Hoofddorp aan het goede adres Wij bieden je namelijk een gratis loopbaanadvies aan, , , Onze missie is zorgprofessionals helpen gelukkig te blijven in hun werk Ben je klaar om een volgende stap in je loopbaan te nemen, , Voel je vrij om al je wensen met ons te delen, zodat we samen op zoek kunnen gaan naar jouw nieuwe droombaan Niets moet na dit gesprek, maar alles mag Wij gaan geheel vrijblijvend samen kijken wat het beste bij jou past De kans is groot dat wij vele openstaande vacatures hebben die voor jou nieuwe deuren openen, , Hierbij bieden wij je een gratis loopbaanadvies gesprek aan Heb je soms het gevoel nog niet helemaal op de juiste plek te zitten Met ons netwerk en expertise binnen de Verpleging, Verzorging en Thuiszorg, gaan wij deze plek samen voor je vinden Als Verzorgende IG ben je namelijk zeer waardevol voor onze gezondheidszorg en verdien je het op de voor jouw juiste plek te zitten, , Neem snel contact op Wij staan voor je klaar, , , , , , Onze missie is zorgprofessionals helpen gelukkig te blijven in hun werk Dit doen we door jou te verbinden aan de juiste werkgever in de zorg en welzijn sector, waar jij een vaste baan krijgt Na jouw vrijblijvende reactie nodigen we je graag uit voor een kennismaking met ons Tijdens de kennismaking vertellen we jou alles over het team, de functie en de voorwaarden, maar bespreken we vooral ook jouw wensen en kwaliteiten Jij staat centraal in deze procedure, , Door het Coronavirus hebben wij onze procedure aangepast Kennismaken zal zoveel mogelijk plaatsvinden via videobellen Als je positief bent over het team word je uitgenodigd voor het arbeidsvoorwaardengesprek Je komt dan in dienst bij de zorgorganisatie Wij ondersteunen jou met maar n doel dat jij gelukkig wordt in je nieuwe vaste baan, , 5cd8a0b9cc68f9ffa4c9253553278a55",Full-time,https://www.linkedin.com/jobs/view/externalApply/2253943611?url=https%3A%2F%2Fwww%2Ewerkzoeken%2Enl%2F3404_akkolade%2Fvacatures%2F4537875_verzorgende-ig-loopbaanadvies-gesprek%2F%3Fsource%3D5cd8a0b9cc68f9ffa4c9253553278a55%26utm_source%3Dlinkedin%26utm_medium%3Dreferral%26utm_campaign%3Dlinkedin_referral_vertical_vac_feed%26utm_term%3Dhealth%2Bhoofddorp&urlHash=NMzt&refId=9ae54ec1-e0e9-495e-a29f-4ee3baa075c2&trk=public_jobs_apply-link-offsite,https://nl.linkedin.com/jobs/view/verzorgende-ig-loopbaanadvies-gesprek-hoofddorp-akkolade-at-werkzoeken-nl-2253943611?refId=9ae54ec1-e0e9-495e-a29f-4ee3baa075c2&position=7&pageNum=0&trk=public_jobs_job-result-card_result-card_full-click,1 month ago,1 month ago,2020-10-14,2020-11-28
8,career development specialist,LinkedIn,2286686312,Verzorgende IG - Loopbaanadvies,IuzqZpIMTkiWLR7ppCKYRA==,Akkolade,"Veenendaal, Utrecht, Netherlands",['Human Resources'],"Ben jij Verzorgende IG niveau 3 en toe aan een nieuwe uitdaging in de zorg Middels een loopbaanadviesgesprek gaan we samen op zoek naar jouw kwaliteiten, drijfveren en wensen ten aanzien van een nieuwe baan in de zorg, Standplaats Veenendaal, , , , , Ben jij Verzorgende IG niveau 3 en toe aan een nieuwe uitdaging in de zorg Middels een loopbaanadviesgesprek gaan we samen op zoek naar jouw kwaliteiten, drijfveren en wensen ten aanzien van een nieuwe baan in de zorg Vervolgens ondersteunen wij jou volledig in het mogelijke vervolgtraject naar jouw droombaan binnen ons uitgebreide netwerk, , Binnen ons brede zorgnetwerk werken wij samen met diverse organisaties in de verpleeghuiszorg, thuiszorg en gehandicaptenzorg waardoor wij samen een grote variatie aan mogelijkheden kunnen bespreken Daarnaast denken wij graag in mogelijkheden en maatwerk die aansluiten bij jouw persoonlijke behoeften en wensen, , , , , , , , , , Onze missie is zorgprofessionals helpen gelukkig te blijven in hun werk Dit doen we door jou te verbinden aan de juiste werkgever in de zorg en welzijn sector, waar jij een vaste baan krijgt Na jouw vrijblijvende reactie nodigen we je graag uit voor een kennismaking met ons Tijdens de kennismaking vertellen we jou alles over het team, de functie en de voorwaarden, maar bespreken we vooral ook jouw wensen en kwaliteiten Jij staat centraal in deze procedure, , Door het Coronavirus hebben wij onze procedure aangepast Kennismaken zal zoveel mogelijk plaatsvinden via videobellen Als je positief bent over het team word je uitgenodigd voor het arbeidsvoorwaardengesprek Je komt dan in dienst bij de zorgorganisatie Wij ondersteunen jou met maar n doel dat jij gelukkig wordt in je nieuwe vaste baan",Full-time,https://www.linkedin.com/jobs/view/externalApply/2286686312?url=https%3A%2F%2Fwww%2Eadzuna%2Enl%2Fdetails%2F1466000422%3Fv%3D2482612DB3DDF4E5DC2739B67FF08A1DC239BC73%26utm_source%3Dlinkedin2%26utm_medium%3Dorganic%26chnlid%3D880&urlHash=gbTS&refId=9ae54ec1-e0e9-495e-a29f-4ee3baa075c2&trk=public_jobs_apply-link-offsite,https://nl.linkedin.com/jobs/view/verzorgende-ig-loopbaanadvies-at-akkolade-2286686312?refId=9ae54ec1-e0e9-495e-a29f-4ee3baa075c2&position=8&pageNum=0&trk=public_jobs_job-result-card_result-card_full-click,1 month ago,1 month ago,2020-10-14,2020-11-28
