Data Row,Search Keyword,Platform,Job ID,Job Title,Tracking ID,Company Name,Location,Industry,Job Description,Employment Type,Company URL,Job URL,Job Age,Job Age Number,Job Date,Collection Date
86,social worker,LinkedIn,2271611441,Campaign Manager based in Amsterdam,cOnwj2UXSROHTOKMXuscUA==,International People Solutions BV,"Amsterdam, North Holland, Netherlands","['Marketing and Advertising', 'Online Media', 'Internet']","You will manage campaigns from advertisers around the globe Part of your job is to set up, test, analyse and optimize social media campaigns together with the international strategy teamYou",Full-time,https://www.linkedin.com/jobs/view/externalApply/2271611441?url=https%3A%2F%2Fwww%2Einternationalpeoplesolutions%2Ecom%2Fjobs%2Fjob-campaign-manager-based-in-amsterdam-amsterdam-27921-31%2Ehtml&urlHash=zXAY&refId=197e5d67-6153-4998-9288-4c60b1a10556&trk=public_jobs_apply-link-offsite,https://nl.linkedin.com/jobs/view/campaign-manager-based-in-amsterdam-at-international-people-solutions-b-v-2271611441?refId=197e5d67-6153-4998-9288-4c60b1a10556&position=11&pageNum=3&trk=public_jobs_job-result-card_result-card_full-click,1 day ago,1 day ago,2020-11-21,2020-11-22
90,social worker,LinkedIn,2226368761,Product Manager Neuroscience,VrNDRx2iS/aVD9HH6z1xdQ==,Takeda,"Hoofddorp, North Holland, Netherlands",['Pharmaceuticals'],"By clicking the Apply button, I understand that my employment application process with Takeda will commence and that I agree with Takedas Privacy Notice, Privacy Policy and Terms of UseJob DescriptionAre you ready for a next step in your career Are you looking for a patientfocused, innovation driven company that will empower you to shine Join us as a in our Dutch affiliateWe are looking for a marketing professional who has experience within healthcare, knows the value of customer and patient insights and is keen to deliver effective campaigns You have understood that marketing nowadays is not about sitting behind a desk filling in templates and creating brochures You also learned that digital engagement is an essential part of a successful strategy and not a standalone process Marketing for you is about understanding the market, the needs of patients and healthcare professionals, its about working with your colleagues in a cross functional business teamIn the Neuroscience business team you will be working closely with the other product manager and key account managers to drive our business Furthermore you will be working cross functional with market access, medical affairs, business intelligence, supply chain, finance and many other colleagues Not only in the Netherlands but also within our international organizationAt Takeda we offer you a stimulating career, we encourage outofthebox thinking and acting We work as a team to deliver to people around the worldWhat is expected from you in this roleWhat is your background to fill this roleHoofddorp, NetherlandsEmployeeFixed Term Fixed TermFull time",Full-time,https://www.linkedin.com/jobs/view/externalApply/2226368761?url=https%3A%2F%2Fad%2Edoubleclick%2Enet%2Fddm%2Fclk%2F477638375%3B283784093%3Bd%3Fhttps%3A%2F%2Fwww%2Etakedajobs%2Ecom%2Fjob%2F-%2F-%2F1113%2F17584060%3Fsource%3DLINKEDINMEDIA%3Fsource%3Dtmp_takeda_linkedin_wrapping%26utm_source%3Dlinkedin%2Ecom%26utm_medium%3Djob_posting%26utm_campaign%3DEnterprise%26utm_content%3Dsocial_media%26utm_term%3D283784093%26ss%3Dpaid&urlHash=I9ll&refId=197e5d67-6153-4998-9288-4c60b1a10556&trk=public_jobs_apply-link-offsite,https://nl.linkedin.com/jobs/view/product-manager-neuroscience-at-takeda-2226368761?refId=197e5d67-6153-4998-9288-4c60b1a10556&position=15&pageNum=3&trk=public_jobs_job-result-card_result-card_full-click,1 day ago,1 day ago,2020-11-21,2020-11-22
91,social worker,LinkedIn,2304070285,Sales Executive Safer@Work,dJXNTSkvSZacPuC5xOKShw==,Eurofins,"Amsterdam, North Holland, Netherlands","['Information Technology and Services', 'Computer Software', 'Financial Services']","Company DescriptionEurofins Scientific is an international life sciences company which performs more than 400 million tests each year within its 800 laboratories across over 50 countries with more than 48000 staff expected 5 billion Euros revenue in 2020As a world leader in the provision of clinical diagnostics, forensic, pharmaceutical, food and environmental laboratory testing services, Eurofins has been able to draw on its scientific experience to develop a range of SARSCoV2 tests in response to the Coronavirus pandemicThe Eurofins SAFERWORK programme is designed to help companies set up advanced risk management protocols and contributes to limiting the impact of COVID19 in the workplace Eurofins SAFERWORK program combines workplace surfaces and wastewater testing together with riskbased clinical testing, as well as relevant consultative, audit, and assurance services to assess and focus on areas where virus presence is likelier This approach reduces cost and supports health authorities to allocate capacity constrained human COVID19 testing where it is most neededWithin its SaferWork division, Eurofins is looking for experienced sales executives to support the growth of our COVID19 customer base with governments, airports, sport leagues, etcThe Sales Executive will develop and manage customers as well as ensure a planned approach to Customer Relationship Management in terms of identifying and strengthening revenue, relationship building and ensuring customer retention and customer visits The successful candidate will generate profitable new business and exceed new business targets in line with business plansAdditional Information",Full-time,,https://nl.linkedin.com/jobs/view/sales-executive-safer%40work-at-eurofins-2304070285?refId=197e5d67-6153-4998-9288-4c60b1a10556&position=16&pageNum=3&trk=public_jobs_job-result-card_result-card_full-click,1 day ago,1 day ago,2020-11-21,2020-11-22
93,social worker,LinkedIn,2271611430,French speaking Social Media Marketer based in Amsterdam,6UmmrErfTKKE5lSn6X2zaA==,International People Solutions BV,"Amsterdam, North Holland, Netherlands","['Marketing and Advertising', 'Online Media', 'Internet']",You will be responsible for all global social media campaigns for global advertisers with the focus on creating long term and profitable relationshipsMinimum 1 year of social media or performance marketing experienceCopywriting skills HUGE ,Full-time,https://www.linkedin.com/jobs/view/externalApply/2271611430?url=https%3A%2F%2Fwww%2Einternationalpeoplesolutions%2Ecom%2Fjobs%2Fjob-french-speaking-social-media-marketer-based-in-amsterdam-amsterdam-29960-31%2Ehtml&urlHash=Q4Fi&refId=197e5d67-6153-4998-9288-4c60b1a10556&trk=public_jobs_apply-link-offsite,https://nl.linkedin.com/jobs/view/french-speaking-social-media-marketer-based-in-amsterdam-at-international-people-solutions-b-v-2271611430?refId=197e5d67-6153-4998-9288-4c60b1a10556&position=18&pageNum=3&trk=public_jobs_job-result-card_result-card_full-click,1 day ago,1 day ago,2020-11-21,2020-11-22
94,social worker,LinkedIn,2202430156,Junior Enterprise Architect,JEYs4eDITvGr0rvHmPJa9A==,NXP Semiconductors,"Eindhoven, North Brabant, Netherlands",['Semiconductors'],"NXP Semiconductors NV NASDAQ NXPI enables secure connections and infrastructure for a smarter world, advancing solutions that make lives easier, better, and safer As the world leader in secure connectivity solutions for embedded applications, NXP is driving innovation in the automotive, industrial  IoT, mobile, and communication infrastructure markets Built on more than 60 years of combined experience and expertise, the company has over 29,000 employees in more than 30 countries and posted revenue of 888 billion in 2019",Full-time,https://www.linkedin.com/jobs/view/externalApply/2202430156?url=https%3A%2F%2Fnxp%2Ewd3%2Emyworkdayjobs%2Ecom%2Fcareers%2Fjob%2FEindhoven%2FJunior-Enterprise-Architect_R-10023937&urlHash=I-4G&refId=197e5d67-6153-4998-9288-4c60b1a10556&trk=public_jobs_apply-link-offsite,https://nl.linkedin.com/jobs/view/junior-enterprise-architect-at-nxp-semiconductors-2202430156?refId=197e5d67-6153-4998-9288-4c60b1a10556&position=19&pageNum=3&trk=public_jobs_job-result-card_result-card_full-click,1 day ago,1 day ago,2020-11-21,2020-11-22
96,social worker,LinkedIn,2309731644,Digital B2C Marketing Senior Specialist,MsYbwoCvRSmocqsnm4tolw==,Eurofins,"Amsterdam, North Holland, Netherlands","['Information Technology and Services', 'Computer Software', 'Financial Services']","Company DescriptionEurofins Scientific is an international life sciences company which performs more than 400 million tests each year within its 800 laboratories across over 50 countries with more than 48000 staff expected 5 billion Euros revenue in 2020As a world leader in the provision of clinical diagnostics, forensic, pharmaceutical, food and environmental laboratory testing services, Eurofins has been able to draw on its scientific experience to develop a range of SARSCoV2 tests in response to the Coronavirus pandemicThe Eurofins SAFERWORK programme is designed to help companies set up advanced risk management protocols and contributes to limiting the impact of COVID19 in the workplace Eurofins SAFERWORK program combines workplace surfaces and wastewater testing together with riskbased clinical testing, as well as relevant consultative, audit, and assurance services to assess and focus on areas where virus presence is likelier This approach reduces cost and supports health authorities to allocate capacity constrained human COVID19 testing where it is most neededWithin its SaferWork division, Eurofins is looking for experienced onlinedigital marketing professionals to support the growth of our COVID19 portfolio expanding our customer base and salesThe Digital B2C Marketing Specialist will be responsible for developing and driving the execution of digital marketing strategies within the country in scope in full alignment and partnership with his her counterparts in Europe and the Sales team This role is responsible for leveraging digital channels to drive traffic and sales to both to our broad network of labs and online via our new eCommerce initiativesOverall purpose of the role to deliver multimillion monthly online sales of our B2C offers scaling the business up radically You will be singlemindedly focused on expanding our digital footprint to drive our marketing and business development ambitionsWe look for people who apply deep analysis and logic to their thinking while backing it all up with data We look for natural selfstarters who roll their sleeves up and see things through from start to finish We look for disruptors that will try new ideas and learn from every mistake in the pursuit of global brand recognition and customer acquisitionQualificationsAdditional Information",Full-time,,https://nl.linkedin.com/jobs/view/digital-b2c-marketing-senior-specialist-at-eurofins-2309731644?refId=197e5d67-6153-4998-9288-4c60b1a10556&position=21&pageNum=3&trk=public_jobs_job-result-card_result-card_full-click,1 day ago,1 day ago,2020-11-21,2020-11-22
98,social worker,LinkedIn,2271610577,German speaking Social Media Marketer based in Amsterdam,iooU9FmgTWCCTeuYyXHYyA==,International People Solutions BV,"Amsterdam, North Holland, Netherlands","['Marketing and Advertising', 'Online Media', 'Internet']",You will be responsible for all global social media campaigns for global advertisers with the focus on creating long term and profitable relationshipsMinimum 1 year of social media or performance marketing experience,Full-time,https://www.linkedin.com/jobs/view/externalApply/2271610577?url=https%3A%2F%2Fwww%2Einternationalpeoplesolutions%2Ecom%2Fjobs%2Fjob-german-speaking-social-media-marketer-based-in-amsterdam-amsterdam-29963-31%2Ehtml&urlHash=zzAx&refId=197e5d67-6153-4998-9288-4c60b1a10556&trk=public_jobs_apply-link-offsite,https://nl.linkedin.com/jobs/view/german-speaking-social-media-marketer-based-in-amsterdam-at-international-people-solutions-b-v-2271610577?refId=197e5d67-6153-4998-9288-4c60b1a10556&position=23&pageNum=3&trk=public_jobs_job-result-card_result-card_full-click,1 day ago,1 day ago,2020-11-21,2020-11-22
101,social worker,LinkedIn,2271610356,German speaking Campaign Manager based in Amsterdam,hOtxZMaJQN6s0y+gZy+Zow==,International People Solutions BV,"Amsterdam, North Holland, Netherlands","['Marketing and Advertising', 'Online Media', 'Internet']","You will manage all social media campaigns from advertisers in the DACH region Part of your job is to set up, test, analyse and optimize social media campaigns together with the international strategy team",Full-time,https://www.linkedin.com/jobs/view/externalApply/2271610356?url=https%3A%2F%2Fwww%2Einternationalpeoplesolutions%2Ecom%2Fjobs%2Fjob-german-speaking-campaign-manager-based-in-amsterdam-amsterdam-323733-31%2Ehtml&urlHash=YywN&refId=87a0afd2-5ff5-4b77-a7dd-f904ee1e7aa0&trk=public_jobs_apply-link-offsite,https://nl.linkedin.com/jobs/view/german-speaking-campaign-manager-based-in-amsterdam-at-international-people-solutions-b-v-2271610356?refId=87a0afd2-5ff5-4b77-a7dd-f904ee1e7aa0&position=1&pageNum=4&trk=public_jobs_job-result-card_result-card_full-click,1 day ago,1 day ago,2020-11-21,2020-11-22
103,social worker,LinkedIn,2311598255,Digital B2C Marketing Senior Specialist,ssKdv5fvQQ2l9YcvgpTDrg==,Eurofins,"Amsterdam, North Holland, Netherlands","['Research', 'Biotechnology', 'Pharmaceuticals']","Company DescriptionEurofins Scientific is an international life sciences company which performs more than 400 million tests each year within its 800 laboratories across over 50 countries with more than 48000 staff expected 5 billion Euros revenue in 2020As a world leader in the provision of clinical diagnostics, forensic, pharmaceutical, food and environmental laboratory testing services, Eurofins has been able to draw on its scientific experience to develop a range of SARSCoV2 tests in response to the Coronavirus pandemicThe Eurofins SAFERWORK programme is designed to help companies set up advanced risk management protocols and contributes to limiting the impact of COVID19 in the workplace Eurofins SAFERWORK program combines workplace surfaces and wastewater testing together with riskbased clinical testing, as well as relevant consultative, audit, and assurance services to assess and focus on areas where virus presence is likelier This approach reduces cost and supports health authorities to allocate capacity constrained human COVID19 testing where it is most neededWithin its SaferWork division, Eurofins is looking for experienced onlinedigital marketing professionals to support the growth of our COVID19 portfolio expanding our customer base and salesThe Digital B2C Marketing Specialist will be responsible for developing and driving the execution of digital marketing strategies within the country in scope in full alignment and partnership with his her counterparts in Europe and the Sales team This role is responsible for leveraging digital channels to drive traffic and sales to both to our broad network of labs and online via our new eCommerce initiativesOverall purpose of the role to deliver multimillion monthly online sales of our B2C offers scaling the business up radically You will be singlemindedly focused on expanding our digital footprint to drive our marketing and business development ambitionsWe look for people who apply deep analysis and logic to their thinking while backing it all up with data We look for natural selfstarters who roll their sleeves up and see things through from start to finish We look for disruptors that will try new ideas and learn from every mistake in the pursuit of global brand recognition and customer acquisitionAdditional Information",Full-time,https://www.linkedin.com/jobs/view/externalApply/2311598255?url=http%3A%2F%2Fwww%2Eexperteer%2Enl%2Fcareer%2Flp%2Fsignup_vertical_full_job%2F1_2018%3Fjob_id%3D23771195%26affiliate%3Daffnl_131%26utm_medium%3Dmetasearch%26utm_source%3Dlinkedin%26utm_content%3Djob&urlHash=VMVH&refId=87a0afd2-5ff5-4b77-a7dd-f904ee1e7aa0&trk=public_jobs_apply-link-offsite,https://nl.linkedin.com/jobs/view/digital-b2c-marketing-senior-specialist-at-eurofins-2311598255?refId=87a0afd2-5ff5-4b77-a7dd-f904ee1e7aa0&position=3&pageNum=4&trk=public_jobs_job-result-card_result-card_full-click,1 day ago,1 day ago,2020-11-21,2020-11-22
124,social worker,LinkedIn,2305965002,Social Media & Content internship at The OTC Lab,pAtx/t/RQr2hx8RKWWb8RQ==,Stageplaza,"Amsterdam, North Holland, Netherlands","['Marketing and Advertising', 'Computer Software', 'Internet']","TaakomschrijvingTheOTCLab is a Dutch company based in downtown Amsterdam At TheOTCLab, we focus on developing effective, nontoxic medical devices for everyday health issues Why Because we are passionate about giving people, worldwide, access to natural, easytouse and safe treatment solutionsAs of 1 September 2020, we are looking for a intern Are you good in communication, digital minded and have a CAN DO mentality Do you find it a great challenge to work in a small team and do you want to get to know all facets in the field of communication within an international market Then we are looking for you We are looking for an expert that can drive our strategic brand plans, has a handson approach, and possesses the ability to work with an international teamA varied internship where you come into contact with the various work fields of International Communication In the internship you have contact with all divisions within the company eg Marketing and Sales In addition, this internship is of course the perfect opportunity to participate in a small team where you can see all ins and outs of a fastgrowing company During the period you work 5 days a week at the head office and you receive excellent guidance This work placement offers the possibility for a graduation assignment for 1 day a weekAlbert Swane infotheotclabcomorTheOTCLabFred Roeskestraat 115 1076 EE AmsterdamWil je graag meer zien Log in of schrijf je inNu solliciteren",Internship,https://www.linkedin.com/jobs/view/externalApply/2305965002?url=https%3A%2F%2Fneuvoo%2Enl%2Fjob%2Ephp%3Fid%3D3eea533175df%26source%3Dlinkedin%26utm_source%3Dpartner%26utm_medium%3Dlinkedin%26puid%3Dfdddcadb8adb7adfaddb7dddbdddgddfadd9fddb3aeccacafec3ddcg3e&urlHash=Bi5Z&refId=87a0afd2-5ff5-4b77-a7dd-f904ee1e7aa0&trk=public_jobs_apply-link-offsite,https://nl.linkedin.com/jobs/view/social-media-content-internship-at-the-otc-lab-at-stageplaza-2305965002?refId=87a0afd2-5ff5-4b77-a7dd-f904ee1e7aa0&position=24&pageNum=4&trk=public_jobs_job-result-card_result-card_full-click,1 day ago,1 day ago,2020-11-21,2020-11-22
126,social worker,LinkedIn,2273922021,Security Analyst - Mobile Security,E0MZhwsQSX6KB6s9h5D5hw==,Riscure,"Delft, South Holland, Netherlands","['Marketing and Advertising', 'Information Technology and Services', 'Computer Software']","This vacancy is open in our HQ in Delft, The Netherlands Do you like analyzing complex security issues Riscure is a young, ambitious organization specializing in embedded security testing for leading international clients from the semiconductor, payment, Pay TV, mobile, and smart metering industry In addition, Riscure is the leading vendor of specialist security testing products We have 60 employees with mixed technical and academic backgrounds working from offices in Delft, The Netherlands and San Francisco, USA Riscure is organized in three units Security Lab, Inspector, and Riscure North America We are looking for Experienced Security Analysts who like to use a variety of techniques for instance source code review, software reverse engineering and exploitation to discover a products fraud risk profile in order to improve its security The position is mainly for Mobile security assessments in the payment market, but hardware projects, or any other type of project may come your way if you are up for it Do you get excited over software reversing Or how about analyzing a Trusted Applications Does the prospect of using libFuzzer or AFL on a Trusted Application give you goosebumps Do you call IDA Pro or radare2 your friends Do you dream in hex Even more reasons to come aboard What does a day at Riscure look like We evaluate the security of products that use embedded, smart card, and mobile technologies usually in teams of 24 security analysts The main activities of the evaluation process include analysing threats and weaknesses by taking apart a devices specifications, code or hardware, and then developing the necessary tools to attack the security Results of this go into a report, and we give recommendations for solving these problems In addition to evaluation work we carry out other projects, including consultancy work, research, tool development, and training As a stateoftheart lab, our internal research and development process is a necessity to remain competitive We record the knowledge we gain during our projects to ensure it is preserved and shared within Riscure We mainly work at our office in Delft Parts of a project may require working at the customers premises Depending on the type of assignment and your level of experience you are in regular contact with a customers technical liaison during a project All communications with our customers are in English What skills should I have to be able to join You have successfully completed an academic course in Information Technology or Electrical Engineering You have 1 to 5 years work experience You have a good understanding of the following",Full-time,https://www.linkedin.com/jobs/view/externalApply/2273922021?url=https%3A%2F%2Fwww%2Evacatures%2Enl%2Fvacature%2Fsecurity-analyst-software%3A44091553%2F&urlHash=SzWn&refId=2057de87-1f42-444d-8aa8-75894d954668&trk=public_jobs_apply-link-offsite,https://nl.linkedin.com/jobs/view/security-analyst-mobile-security-at-riscure-2273922021?refId=2057de87-1f42-444d-8aa8-75894d954668&position=1&pageNum=5&trk=public_jobs_job-result-card_result-card_full-click,1 day ago,1 day ago,2020-11-21,2020-11-22
127,social worker,LinkedIn,2257820913,Sales Executive Safer@Work,Tht9MEfJSBmpWZMEliEYew==,Eurofins,"Amsterdam, North Holland, Netherlands","['Research', 'Biotechnology', 'Pharmaceuticals']","Company DescriptionEurofins Scientific is an international life sciences company which performs more than 400 million tests each year within its 800 laboratories across over 50 countries with more than 48000 staff expected 5 billion Euros revenue in 2020As a world leader in the provision of clinical diagnostics, forensic, pharmaceutical, food and environmental laboratory testing services, Eurofins has been able to draw on its scientific experience to develop a range of SARSCoV2 tests in response to the Coronavirus pandemicThe Eurofins SAFERWORK programme is designed to help companies set up advanced risk management protocols and contributes to limiting the impact of COVID19 in the workplace Eurofins SAFERWORK program combines workplace surfaces and wastewater testing together with riskbased clinical testing, as well as relevant consultative, audit, and assurance services to assess and focus on areas where virus presence is likelier This approach reduces cost and supports health authorities to allocate capacity constrained human COVID19 testing where it is most neededWithin its SaferWork division, Eurofins is looking for experienced sales executives to support the growth of our COVID19 customer base with governments, airports, sport leagues, etcThe Sales Executive will develop and manage customers as well as ensure a planned approach to Customer Relationship Management in terms of identifying and strengthening revenue, relationship building and ensuring customer retention and customer visits The successful candidate will generate profitable new business and exceed new business targets in line with business plansAdditional Information",Full-time,https://www.linkedin.com/jobs/view/externalApply/2257820913?url=http%3A%2F%2Fwww%2Eexperteer%2Enl%2Fcareer%2Flp%2Fsignup_vertical_full_job%2F1_2018%3Fjob_id%3D23457019%26affiliate%3Daffnl_131%26utm_medium%3Dmetasearch%26utm_source%3Dlinkedin%26utm_content%3Djob&urlHash=ZFEF&refId=2057de87-1f42-444d-8aa8-75894d954668&trk=public_jobs_apply-link-offsite,https://nl.linkedin.com/jobs/view/sales-executive-safer%40work-at-eurofins-2257820913?refId=2057de87-1f42-444d-8aa8-75894d954668&position=2&pageNum=5&trk=public_jobs_job-result-card_result-card_full-click,1 day ago,1 day ago,2020-11-21,2020-11-22
