Data Row,Search Keyword,Platform,Job ID,Job Title,Tracking ID,Company Name,Location,Industry,Job Description,Employment Type,Company URL,Job URL,Job Age,Job Age Number,Job Date,Collection Date
88,primary school teacher,LinkedIn,2312375424,Enthousiaste docent Engels die out of the box kan denken,ShvOAiF6QyCCLzVRSk1+AQ==,The School Factory,"Sassenheim, South Holland, Netherlands","['Marketing and Advertising', 'Information Technology and Services', 'Financial Services']","Functieomschrijving, , Enthousiaste docent Engels die out of the box kan denken, , Wil jij van betekenis zijn voor leerlingen in het VSO, , De instelling verzorgt voortgezet speciaal onderwijs vso aan jongeren van 12 tot 24 jaar, die verblijven in een forensisch centrum Na een orintatieperiode van veertien dagen, weet een leerling wat zij talenten en ontwikkelingskansen zijn, , Wij bieden daarna competentiegericht onderwijs, in een mix van theorie, praktijk en sport Elke lesweek beginnen en eindigen wij met studieloopbaanbegeleiding Wij doen er alles aan om jongeren zonder leerachterstand en mt certificaten of diplomas meer kansen te bieden in vervolgonderwijs of werk, , Wat doe je, , Dan zoeken we jou, , Wat breng je mee, , , , Het betreft een tijdelijke vacature voor wtf0,61 met een uitzicht op een vast aanstelling, evt aangevuld met andere taken, , Arbeidsvoorwaarden, , Onze medewerkers kunnen op allerlei manieren blijven leren Wij werken vanuit onze kernwaarden Kracht, Onvoorwaardelijkheid en Passie en een positieve onderwijsvisie, , Ons doel leerlingen perspectief bieden op een betekenisvolle toekomst Om dit te bereiken, werken we nauw samen met netwerkpartners in onder meer onderwijs, jeugdhulp, zorg, arbeid en justitie, , CAO Primair onderwijs, L11, , Bij interesse ontvangen wij graag een korte motivatiebrief met CV per email tav Monique Huizinga, click apply, Het aanvragen van een Verklaring omtrent Gedrag VOG is onderdeel van de sollicitatieprocedure",Full-time,https://www.linkedin.com/jobs/view/externalApply/2312375424?url=https%3A%2F%2Fnl%2Ejooble%2Eorg%2Fexternal%2F6804163932422111005%3Futm_campaign%3DNL%26utm_medium%3Dsocial%26utm_source%3Dlinkedin%26JobSource%3DBoard&urlHash=GXw2&refId=052d70b2-39e2-48dc-86e9-46879577f1ac&trk=public_jobs_apply-link-offsite,https://nl.linkedin.com/jobs/view/enthousiaste-docent-engels-die-out-of-the-box-kan-denken-at-the-school-factory-2312375424?refId=052d70b2-39e2-48dc-86e9-46879577f1ac&position=13&pageNum=3&trk=public_jobs_job-result-card_result-card_full-click,2 months ago,2 months ago,2020-10-11,2020-11-30
89,primary school teacher,LinkedIn,2298708589,Docent Engels,H2VxY9vRSh+49I8y9gtz/g==,Randstad Nederland,"Nijmegen, Gelderland, Netherlands","['Primary/', 'Secondary Education']","Functieomschrijving, , Engeland is een land met veel typerende blikvangers en gewoonten Denk aan de dubbeldekker bussen, rode telefooncellen de thee en niet te vergeten het koningshuis Daarnaast heeft Engeland ook prachtige bouwwerken zoals Buckingham Palace, London Bridge en de Big Ben, , Ben jij de docent die al deze prachtige blikvangers en gewoonten met passie kan meenemen binnen je lessen Dan ben jij de docent die de belevingswereld van jouw leerlingen vergroot Jij vindt het vast leuk om lessen te ontwikkelen die de leerlingen meer aanspreken dan alleen de lesstof uit het boek Jij hebt een oog voor de verschillende leerstijlen van leerlingen en spreekt leerlingen hierdoor op verschillende manieren aan Jij hebt een talent om af te wisselen tussen een docenten en coachende rol, , Randstad Onderwijs is op zoek naar docenten zoals jij Wij ontvangen regelmatig vacatures van verschillende scholen binnen het Voortgezet Onderwijs VO en het Middelbaar Beroepsonderwijs MBO, , , , , , , Zowel het bovengenoemde salaris als de uren zijn een indicatie, in een persoonlijk gesprek bespreken we samen al jouw wensen en mogelijkheden, , In case of application, please note that advanced knowledge of Dutch language is required, , We zien je sollicitatie graag tegemoet, solliciteer via onderstaande button solliciteren, Uiteraard staat deze vacature open voor iedereen die zich hierin herkent, , , Je maakt een mijn Randstad account aan om te kunnen reageren op onze vacatures Dit doe je automatisch wanneer je voor het eerst een sollicitatie afrond bij Randstad, heel eenvoudig dus Via je mijn Randstad account beheer je gemakkelijk je gegevens en gaan je volgende sollicitaties nog sneller",Full-time,https://www.linkedin.com/jobs/view/externalApply/2298708589?url=https%3A%2F%2Feasyapply%2Ejobs%2Fr%2Fj6TWh2j1TPmd6jydzN2&urlHash=m1ex&refId=052d70b2-39e2-48dc-86e9-46879577f1ac&trk=public_jobs_apply-link-offsite,https://nl.linkedin.com/jobs/view/docent-engels-at-randstad-nederland-2298708589?refId=052d70b2-39e2-48dc-86e9-46879577f1ac&position=14&pageNum=3&trk=public_jobs_job-result-card_result-card_full-click,2 months ago,2 months ago,2020-10-11,2020-11-30
90,primary school teacher,LinkedIn,2324788336,Docent Engels (HBO),VEQtgQ7fR12RM7WWalNfwQ==,"Devocare, werkt voor onderwijs","sHertogenbosch, North Brabant, Netherlands",['Education Management'],"Functieomschrijving, , Bevoegd tot het lesgeven op HAVOVWObovenbouw en HBO, , Ben jij die docent die op zoek is naar een nieuwe uitdaging Reageer dan snel op deze vacature, Wil je meer informatie over de vacature Bel dan met Devocare, click apply Wil je meer informatie over onze organisatie Kijk dan op voor al onze onderwijs vacatures, , Functieeisen, Beschik jij over een eerstegraads bevoegdheid voor het vak Engels en is lesgeven helemaal jouw cup of tea Dan zijn wij op zoek naar jou We zoeken doorlopend docenten Engels voor het HBO in de regio Den Bosch Het aantal lesuren is bespreekbaar en afhankelijk van jouw beschikbaarheid De omvang van de vacatures die we van onderwijsinstellingen ontvangen zijn divers, van 1 tot 5 dagen, Ons referentienummer 1839126",Full-time,https://www.linkedin.com/jobs/view/externalApply/2324788336?url=https%3A%2F%2Fnl%2Ejooble%2Eorg%2Fexternal%2F7933400874572454661%3Futm_campaign%3DNL%26utm_medium%3Dsocial%26utm_source%3Dlinkedin%26JobSource%3DBoard&urlHash=Gyi_&refId=052d70b2-39e2-48dc-86e9-46879577f1ac&trk=public_jobs_apply-link-offsite,https://nl.linkedin.com/jobs/view/docent-engels-hbo-at-devocare-werk-t-voor-onderwijs-2324788336?refId=052d70b2-39e2-48dc-86e9-46879577f1ac&position=15&pageNum=3&trk=public_jobs_job-result-card_result-card_full-click,2 months ago,2 months ago,2020-10-11,2020-11-30
91,primary school teacher,LinkedIn,2289652635,Docent Engels,PtyO/wPeQpuycVu9AltnOA==,Uitzendbureaunl,"sHertogenbosch, North Brabant, Netherlands","['Internet', 'Machinery', 'Staffing and Recruiting']","Zon vijfhonderd jaar geleden spraken ongeveer tussen de vijf en zeven miljoen mensen Engels Nu spreken nagenoeg 1,8 miljard mensen over de hele wereld Engels Engels wordt gezien als een van de wereldtalen Met zicht op de toekomst is het dus voor leerlingen belangrijk dat ze de Engelse taal kunnen spreken, begrijpen en schrijven, , Als docent Engels wil jij leerlingen graag helpen zich te ontwikkelingen in de Engelse taal Wellicht gebruik je series van Netflix om de Engelse taal meer naar de belevingswereld van de leerlingen te halen Jij bent een docent die door jouw aanpak leerlingen weet te boeien en te motiveren, , Herken jij jezelf in het bovenstaande Dan komen wij graag in contact met jou Wij zijn op zoek naar 1e en 2e graads docenten Engels, die op een motiverende manier de leerlingen coachen naar het best haalbare resultaat Ook als je bijna klaar bent met de opleiding kunnen wij jou bemiddelen, , In de regio Den Bosch ontvangen we namelijk met regelmaat vacatures van verschillende scholen, zowel in het Voortgezet Onderwijs VO als in het Middelbaar Beroepsonderwijs MBO, , , , , , , Zowel het bovengenoemde salaris als de uren zijn een indicatie, in een persoonlijk gesprek bespreken we samen al jouw wensen en mogelijkheden, , In case of application, please note that advanced knowledge of Dutch language is required, , We zien je sollicitatie graag tegemoet, solliciteer via onderstaande button solliciteren, Uiteraard staat deze vacature open voor iedereen die zich hierin herkent, , Opleiding, , HBO  bachelor",Full-time,https://www.linkedin.com/jobs/view/externalApply/2289652635?url=https%3A%2F%2Fnl%2Ejooble%2Eorg%2Fexternal%2F-66421833046646953%3Futm_campaign%3DNL%26utm_medium%3Dsocial%26utm_source%3Dlinkedin%26JobSource%3DBoard&urlHash=HOJ1&refId=052d70b2-39e2-48dc-86e9-46879577f1ac&trk=public_jobs_apply-link-offsite,https://nl.linkedin.com/jobs/view/docent-engels-at-uitzendbureau-nl-2289652635?refId=052d70b2-39e2-48dc-86e9-46879577f1ac&position=16&pageNum=3&trk=public_jobs_job-result-card_result-card_full-click,2 months ago,2 months ago,2020-10-11,2020-11-30
92,primary school teacher,LinkedIn,2277958313,Docent Engels in Regio Noord-Holland,dSpg/o3XStKXwxjmqjHSzQ==,Daan BV,"Schagen, North Holland, Netherlands","['Primary/', 'Secondary Education']","Wij zoeken jou, , Ben jij een gedreven, enthousiaste docent met een passie voor de Engelse taal Dan ben ik op zoek naar jou Its your time to teach taught, taught, , Waar ga je werken, , Als jij nog op zoek bent naar een baan in het voortgezet onderwijs en je bent bijna bevoegd als docent Engels, dan heb ik de uitdaging die je zoekt Voor het resterende schooljaar zoek ik namelijk een docent Engels voor een leuke school in regio NoordHolland Je gaat lesgeven aan leerlingen van het vmbo, havo en vwo Daarbij kom je in dienst van de leukste werkgever van Nederland Daan Daan staat voor een wereld vol leuke banen en gelooft in uitmuntend werkgeverschap, , Wat ga je doen, , Je reist met je leerlingen door de Engelse culturen en leert hen alle insenouts van de taal Met jouw kennis en enthousiasme weet je de leerlingen te boeien en te motiveren voor je vak Het aantal FTE is in overleg bespreekbaar, , Wat verwachten we van jou, , , , Wat kun je van ons verwachten",Full-time,https://www.linkedin.com/jobs/view/externalApply/2277958313?url=https%3A%2F%2Fjoblift%2Enl%2Fdetails%2F51e27325-7c92-433a-840a-1fac6355071f%3Fjid%3D4e4fbc3a1aba5143b48c01a2822e96f1f1720089808664fadcfdb390b125264d%26utm_source%3Dlinkedin_nl%26utm_medium%3Dexternal_feed%26utm_campaign%3D126&urlHash=EF9C&refId=052d70b2-39e2-48dc-86e9-46879577f1ac&trk=public_jobs_apply-link-offsite,https://nl.linkedin.com/jobs/view/docent-engels-in-regio-noord-holland-at-daan-bv-2277958313?refId=052d70b2-39e2-48dc-86e9-46879577f1ac&position=17&pageNum=3&trk=public_jobs_job-result-card_result-card_full-click,2 months ago,2 months ago,2020-10-11,2020-11-30
93,primary school teacher,LinkedIn,2312392025,Docent Engels 1e graads,r0ymJ/V5QmSqYYjVkBp8Tw==,Onze Leerkracht,"Rotterdam, South Holland, Netherlands","['Primary/', 'Secondary Education']","Je gaat zo snel mogelijk voor 08 fte aan de slag, Je gaat Engelse lessen geven aan HAVOVWO klassen in de bovenbouw inclusief examenklassen, Je daagt de leerlingen uit en je stoomt ze klaar voor het centraal examen, Het gaat om een vervanging die tot het einde van het schooljaar kan duren, , Functieeisen, , , , Bedrijfsomschrijving, , Geef jij als 1e graads docent Engels graag les aan examenklassen en wil jij in Rotterdam werken Dan hebben wij een interessante vacature voor jou, , Je gaat werken op een middelgrote HAVOVWO school die goed aangeschreven staat De school is vooruitstrevend en ze blijven altijd bezig met onderwijsinnovatie, , Arbeidsvoorwaarden, , Onze Leerkracht is ht detacheringsbureau gespecialiseerd in het bemiddelen van docenten in het onderwijs Wij luisteren naar jouw wensen en zetten ons in om voor jou een baan te vinden bij een school die bij jou past, , Wij bieden jou",Full-time,https://www.linkedin.com/jobs/view/externalApply/2312392025?url=https%3A%2F%2Fjoblift%2Enl%2Fdetails%2Fb8a5e0fb-ccdd-4a08-ab13-aacd2ab1b081%3Fjid%3D995597418f6d569f436e7ddc648654c40b401db4e27bdb6085cc64dcd3ce08df%26utm_source%3Dlinkedin_nl%26utm_medium%3Dexternal_feed%26utm_campaign%3D385&urlHash=5ylT&refId=052d70b2-39e2-48dc-86e9-46879577f1ac&trk=public_jobs_apply-link-offsite,https://nl.linkedin.com/jobs/view/docent-engels-1e-graads-at-onze-leerkracht-2312392025?refId=052d70b2-39e2-48dc-86e9-46879577f1ac&position=18&pageNum=3&trk=public_jobs_job-result-card_result-card_full-click,2 months ago,2 months ago,2020-10-11,2020-11-30
94,primary school teacher,LinkedIn,2286366768,Docent Engels,UokQbPGCQdSGwQTvAIu1Yw==,Maandag,"Arnhem, Gelderland, Netherlands",['Staffing and Recruiting'],"Over de functie, , Het lesgeven in het voorgezet onderwijs heeft iedere dag weer nieuwe uitdagingen Zijn je leerlingen me het juiste been uit bed gestapt Hoe zorg je ervoor dat je lessen elke dag weer tip top in orde zijn De voorbereiding is dan ook de sleutel tot succes en dat weet jij als geen ander, , Als docent Engels via Maandag ben jij verantwoordelijk voor, , , , Met jouw enthousiasme weet jij je leerlingen te motiveren en zorg jij dat ze het onderste uit de kan halen Daarnaast heb je affiniteit met lesgeven op verschillende niveaus, denk hierbij aan, , , , Lijkt het je leuk om op de verschillende niveaus van het voortgezet onderwijs les te geven Dan is Maandag wellicht de juiste stap Wacht niet langer en neem contact op met mij via 0682527169 of stuur een mail naar laurensroordamaandagnl, , , , Wat vragen wij van jou, , , Wat biedt Maandag jou, , , , Solliciteren, , Herken jij jezelf in dit profiel En lijkt werken bij Maandag je een mooie stap Solliciteer dan meteen Wie weet ziet jouw maandag er binnenkort dan net zo tof uit als die van ons",Full-time,https://www.linkedin.com/jobs/view/externalApply/2286366768?url=https%3A%2F%2Fwww%2Emaandag%2Enl%2Fapplyjob%2F100288238%3Futm_campaign%3Djobslot%25257Cdo%25257Ca%25257Cao%26utm_content%3DOnderwijs%26utm_source%3Dlinkedin%26utm_medium%3Djobboard-cpt%26utm_term%3D&urlHash=ayiU&refId=052d70b2-39e2-48dc-86e9-46879577f1ac&trk=public_jobs_apply-link-offsite,https://nl.linkedin.com/jobs/view/docent-engels-at-maandag%C2%AE-2286366768?refId=052d70b2-39e2-48dc-86e9-46879577f1ac&position=19&pageNum=3&trk=public_jobs_job-result-card_result-card_full-click,2 months ago,2 months ago,2020-10-11,2020-11-30
96,primary school teacher,LinkedIn,2318005147,Leraar Engels 2e gr Zwij202121 - Veghel,/Sk/DSuTSMaqzYKDrqNYYA==,Zwijsen College,"Veghel, North Brabant, Netherlands",['Education Management'],"Ben jij op zoek naar een inspirerende werkomgeving waar je continu uitgedaagd wordt om jezelf te ontwikkelen, Dan zit je bij VO Veghel op de juiste plek, , Voortgezet Onderwijs Veghel bestaat uit het Zwijsen College havo en vwo en het Fioretti College mavo, vmbo en pro Vanuit twee moderne gebouwen bieden we eigentijds onderwijs aan bijna 3000 leerlingen Leerlingen werken op maat met behulp van devices Leerlingen en leraren ervaren onze scholen als een veilige gemeenschap waar het vanzelfsprekend is dat je er voor elkaar bent De Inspectie voor Onderwijs geeft beide scholen de waardering Excellent, , Het Zwijsen College gaat uit van de individuele behoeften en talenten van de leerling met de slogan Ieder zijn Zwijsen Onderwijs op maat krijgt vorm door Fast Lane vwo en digitale leerroutes via Google Classroom Er is veel aandacht voor bta, een gezonde leefstijl en burgerschapsvorming Een eigen havoaanpak staat in de steigers, , Het Fioretti College heeft als onderwijsmotto praktisch en persoonlijk Praktisch staat voor levensecht onderwijs samen met lokale bedrijven Persoonlijk staat voor weten wat je kunt, gezien worden en gewaardeerd worden om wie je bent Dit krijgt onder meer gestalte in een goed opgezette leerlingbegeleiding, , Beide scholen worden ondersteund door een team bedrijfsvoering dat bijdraagt aan een goed verloop van het onderwijs, , Als academische opleidingsscholen bieden wij een begeleidingstraject voor startende leraren en stimuleren wij ervaren leraren onderzoek te blijven doen binnen de school Werken binnen VO Veghel betekent voor alle medewerkers samenwerken in een inspirerende en stimulerende werkomgeving en zo uitgedaagd worden jouw talenten continu te ontwikkelen, , Wij zetten als Gezonde School in op een gezonde leefstijl van onze leerlingen en collegas Wij richten ons op bewegen, niet roken, gezonde voeding, voldoende ontspanning en veiligheid, , , , Leraar Engels 2e graads, , Wij zijn per medio januari 2021 op zoek naar een leraar Engels 2e graads De omvang is 0,5 fte, , Profiel, Wij zoeken een leraar Engels met oog en hart voor de leerlingen U biedt eigentijds onderwijs, waarbij u continu op zoek bent naar vernieuwing en optimalisering van de lessen met behulp van ICT U kijkt hierbij naar de verschillende behoeften die er zijn binnen de klas en speelt daarop in met passende werkvormen, zodat leerlingen in hun eigen tempo kunnen werken U creert een veilige en uitdagende leeromgeving, die aansluit bij de huidige generatie U werkt hierbij graag samen met leerlingen, ouders en collegas U gaat een uitdaging niet uit de weg en bent positiefkritisch over de organisatie en het eigen handelen, , Kennis en vaardigheden",Full-time,https://www.linkedin.com/jobs/view/externalApply/2318005147?url=https%3A%2F%2Fneuvoo%2Enl%2Fjob%2Ephp%3Fid%3D6498b36440cf%26source%3Dlinkedin%26utm_source%3Dpartner%26utm_medium%3Dlinkedin%26puid%3Dfddacddc8dd7fdd89adeadddaddagddcaddcfddg3aedcacafec3ddcg3e&urlHash=-_s9&refId=052d70b2-39e2-48dc-86e9-46879577f1ac&trk=public_jobs_apply-link-offsite,https://nl.linkedin.com/jobs/view/leraar-engels-2e-gr-zwij202121-veghel-at-zwijsen-college-2318005147?refId=052d70b2-39e2-48dc-86e9-46879577f1ac&position=21&pageNum=3&trk=public_jobs_job-result-card_result-card_full-click,2 months ago,2 months ago,2020-10-11,2020-11-30
97,primary school teacher,LinkedIn,2326351395,Docent Engels - Gymnasium Camphusianum,78Y121seTomtOg5Fwb12xg==,ROOZZIT,"Gorinchem, South Holland, Netherlands","['Primary/', 'Secondary Education']","Roozz zoekt een Docent Engels  Gymnasium Camphusianum te Gorinchem HBO geplaatst op, , docent Engels, , ContactpersoonM van Amersfoort, teamleider leerjaren I en II, , , , SectorVO Voortgezet Onderwijs, , Uren20, , , dinsdag, donderdag, vrijdag, , Bevoegdheid1e graad of 2e graad, Aanvangsdatumzo spoedig mogelijk, , Extra informatie, , Wegens de vervanging van een zieke collega zijn wij per direct op zoek naar een docent Engels met een tweede of eerstegraads bevoegdheid Start op korte termijn, , Als je interesse hebt, stuur dan zsm een korte motivatie en CV, via deze vacaturesite naar mevr M van Amersfoort, teamleider leerjaar 12 Voor meer informatie over de vacature kun je contact opnemen met mevr M van Amersfoort via tel, , Interesse in de functie van Docent Engels  Gymnasium Camphusianum bij Roozz regio GorinchemReageer nu met je CV en motivatie via de solliciteer button, Acquisitie naar aanleiding van deze vacature wordt niet op prijs gesteld",Full-time,https://www.linkedin.com/jobs/view/externalApply/2326351395?url=https%3A%2F%2Fjoblift%2Enl%2Fdetails%2Fd789f796-72e5-4618-9ca9-a94aaede5c6b%3Fjid%3D3227999d03198c73e28dd71343e54bc55600b66a1eb3cd8505dd890b64d22873%26utm_source%3Dlinkedin_nl%26utm_medium%3Dexternal_feed%26utm_campaign%3D404&urlHash=VBzA&refId=052d70b2-39e2-48dc-86e9-46879577f1ac&trk=public_jobs_apply-link-offsite,https://nl.linkedin.com/jobs/view/docent-engels-gymnasium-camphusianum-at-roozz-it-2326351395?refId=052d70b2-39e2-48dc-86e9-46879577f1ac&position=22&pageNum=3&trk=public_jobs_job-result-card_result-card_full-click,2 months ago,2 months ago,2020-10-11,2020-11-30
98,primary school teacher,LinkedIn,2299313253,Docent Engels eerstegraads,ilPlglONRIKLwgf4oMx88Q==,OnderwijsPost,"Tilburg, North Brabant, Netherlands",['Staffing and Recruiting'],"Over deze vacature, , Its always the goals that are counting  The three points are inside  We are running after the facts Deze fouten maken jouw bovenbouw leerlingen vast niet meer Wil jij als eerstegraads docent Engels de verdieping in met je klas Dan kennen wij een school die graag met jou in contact komt, , De scholen waar wij mee samenwerken staan voor kwalitatief hoogwaardig, inspirerend en innoverend onderwijs Ze zoeken eerstegraads docenten Engels die warm, open, energiek en doelgericht zijn Als eerstegraads docent Engels heb je te maken met leerlingen van havovwo 4 tm 6 Het is onwijs spannend richting die eindstreep, dit gaat steeds meer meespelen in de lessen Je kunt dus hoogwaardige en kwalitatieve lessen ontwikkelen en geven, , Belangrijk hiervoor is dat er een bevoegdheid is en ervaring met het voortgezet onderwijs in Nederland Als eerstegraads docent Engels ben je namelijk niet alleen docent maar ook een rolmodel die de leerlingen helpt naar de eindstreep richting hun examens Tijdelijk Een formatieplek Of als ZZPer aan de slag Alles is mogelijk We bespreken graag de opties met jou, , Wil jij graag de leerlingen uitdagen Ben jij bevoegd docent eerstegraads Engels Wil jij graag lesgeven aan bovenbouw havovwo en gymnasium Dan zoeken wij jou Solliciteer direct en wij nemen snel contact met je op om alle details te bespreken, , Daar tegenover staat, , , , Wie zijn wij, , OnderwijsPost is een arbeidsbemiddelingsbureau gespecialiseerd in het onderwijs Wij brengen al jaren op succesvolle wijze opdrachtgevers en professionals bij elkaar binnen alle lagen van het onderwijs en de kinderopvang Hierbij gaat het om zowel kortdurende vervangingen als vaste dienstverbanden Persoonlijke aandacht is voor ons erg belangrijk om de wensen van onze professionals en opdrachtgevers goed in kaart te brengen Veel van onze recruiters en accountmanagers hebben zelf een achtergrond in het onderwijs en begrijpen hierdoor het werkveld Met onze OnderwijsPost Academy trainingen kunnen professionals zich blijven ontwikkelen en gezellige uitjes zorgen voor een groot onderwijs netwerk, , Functie eisen",Full-time,https://www.linkedin.com/jobs/view/externalApply/2299313253?url=https%3A%2F%2Fonderwijspost%2Enl%2Fvacatures%2Fdocent-engels-eerstegraads&urlHash=gTye&refId=052d70b2-39e2-48dc-86e9-46879577f1ac&trk=public_jobs_apply-link-offsite,https://nl.linkedin.com/jobs/view/docent-engels-eerstegraads-at-onderwijspost-2299313253?refId=052d70b2-39e2-48dc-86e9-46879577f1ac&position=23&pageNum=3&trk=public_jobs_job-result-card_result-card_full-click,2 months ago,2 months ago,2020-10-11,2020-11-30
99,primary school teacher,LinkedIn,2322231186,MLC_2010-2021 docent Engels ter vervanging in Oss - Maaslandcollege,vHclOtZzQryqCVo4imuyyQ==,Maaslandcollege,"Oss, North Brabant, Netherlands",['Education Management'],"Het Maaslandcollege te Oss is per 4 januari 2021 op zoek naar een, Docent Engels onderbouw ter vervanging 05 fte  Het betreft een zwangerschapsvervanging tm in ieder geval 30 april 2021, Profiel, Je biedt eigentijds onderwijs met oog en hart voor de leerlingen, waarbij u continu op zoek bent naar vernieuwing en optimalisering van de lessen U kijkt hierbij naar de verschillende behoeften die er zijn binnen de klas en speelt daarop in met passende werkvormen, zodat leerlingen in hun eigen tempo kunnen werken Je creert een veilige en uitdagende leeromgeving, die aansluit bij de huidige generatie Je werkt hierbij graag samen met leerlingen, ouders en collegas Je gaat een uitdaging niet uit de weg en bent positiefkritisch over de organisatie en het eigen handelen, Over het Maaslandcollege, Het Maaslandcollege is een dynamische school waarin het goed leven, leren en werken is, We geloven dat we samen de school zijn en vanuit die hoedanigheid een gemeenschap vormen waarin zorg en aandacht voor elkaar een vanzelfsprekend onderdeel is van ons onderwijs Als school blijven we in beweging en open naar de buitenwereld Iedereen krijgt volop de ruimte om te groeien, te leren en te ervaren Dit alles binnen een persoonlijk en warm schoolklimaat, , , , Wat vragen wij, , Informatie, , Reacties op deze vacature graag alleen via de website van OMO wwwomonl of via meesterbaannl Reageren kan tm 1 december 2020, Voor eventuele vragen kun je je richten tot Paola van der Linde, PO via email pvanderlindemaaslandcollegenl, , Acquisitie nav deze advertentie wordt niet op prijs gesteld",Full-time,https://www.linkedin.com/jobs/view/externalApply/2322231186?url=https%3A%2F%2Fneuvoo%2Enl%2Fjob%2Ephp%3Fid%3D6a777fdb5f7d%26source%3Dlinkedin%26utm_source%3Dpartner%26utm_medium%3Dlinkedin%26puid%3Dfddacadf8dd9fdd99dd9aadaaadcgadeaddbfada3de9caccfec3ddcg3e&urlHash=QOc2&refId=052d70b2-39e2-48dc-86e9-46879577f1ac&trk=public_jobs_apply-link-offsite,https://nl.linkedin.com/jobs/view/mlc-2010-2021-docent-engels-ter-vervanging-in-oss-maaslandcollege-at-maaslandcollege-2322231186?refId=052d70b2-39e2-48dc-86e9-46879577f1ac&position=24&pageNum=3&trk=public_jobs_job-result-card_result-card_full-click,2 months ago,2 months ago,2020-10-11,2020-11-30
