Data Row,Search Keyword,Platform,Job ID,Job Title,Tracking ID,Company Name,Location,Industry,Job Description,Employment Type,Company URL,Job URL,Job Age,Job Age Number,Job Date,Collection Date
92,electrical engineer,LinkedIn,2325403052,Technisch Tekenaar / Electrical Design Engineer - Rotterdam,z1fDw/jodcM7J0OutFwLEw==,Alphatron Marine BV,"Rotterdam, South Holland, Netherlands",None,"Technisch Tekenaar  Electrical Design EngineerRotterdam, NLAlphatron Marine is importeur, leverancier, installateur en serviceverlener van hoogwaardige navigatie en communicatieapparatuur aan boord van schepen Als Project Engineer ben je de spin in het web tussen Sales, de klant, Logistiek en de interne werkplaats en ben je van tekening tot eindresultaat betrokken bij de tailormade implementatie van de systemen die door onze klanten zijn aangekocht Een dynamische baan met veel internationale contacten op ons hoofdkantoor in RotterdamTechnisch Tekenaar  Electrical Design EngineerRotterdam, 40 uur per weekDit ga je doenZodra je collegas van de afdeling Sales een van onze systemen aan een klant hebben verkocht, gaat de Project Manager  Engineer aan de slag Dat is jouw interne opdrachtgever Jij gaat hem met jouw tekenvaardigheden ondersteunen om samen te komen tot een optimaal ontwerp voor onze klant Door middel van het tekeningenpakket maak je duidelijk waar en hoe de apparatuur geplaatst moet worden, elk systeem en schip is immers anders Je houdt hierbij, als het nodig is, ook rekening met de wet en regelgeving, die per land verschillend kan zijn Ervaring in maritieme techniek is fijn maar niet perse noodzakelijkJe werkt tekeningen uit op elektrotechnisch gebied van verkochte systemen2D3D Je houdt goed contact met je opdrachtgever over de ontwikkelingen in de opdrachtJe reviseert tekeningenJe bereid werkplaatsinstallaties voorJe bereid het overdracht protocol voorEen opdracht kan bijvoorbeeld zijn dat je een compleet tekeningenpakket gaat uitwerken van een navigatie en communicatiesysteem aan boord van verschillende typen schepen voor toonaangevende scheepswervenJe maakt onderdeel uit van een team van professionals dat  naast jou  bestaat uit 11 collegas 3 Project Managers, 4 Project Engineers, 2 Project Support Engineers een Project Database EngineerJe rapporteert aan de Manager Installation  EngineeringDit ben jijDiploma Elektrotechniek op MBO niveau 4Goed met MsOffice programmasKennis van AutoCAD, See Electrical en EPlanGoede kennis van de Nederlandse en Engelse taalSterk in planning en het op tijd nakomen van afsprakenCommunicatiefAccuraatFlexibelOns aanbodPrettige werksfeer Samen werken we hard om onze klanten zo goed mogelijk van dienst te zijn en voor het succes van ons bedrijf Afhankelijk van je ambities zijn er mogelijkheden je verder te ontwikkelen in je rol en de organisatie Verder bieden we jeeen brutosalaris van  2200, tot  2950, per maand Inschaling is afhankelijk van ervaring en opleidingminimaal 25 vakantiedagenNatuurlijk een reiskostenvergoeding Er is parkeergelegenheid maar we zijn ook met het OV goed bereikbaarRegelmatig worden er leuke activiteiten met collegas georganiseerdEnthousiast geworden over deze veelzijdige baanZou jij wel als Technisch Tekenaar  Electrical Design Engineer bij ons aan de slag willen en voldoe je aan de meeste eisen, solliciteer dan meteen via de solliciteer button Heb je nog vragen over de baan of over het sollicitatieproces, neem dan contact op met Gerda Timmermans, HR Adviseur, tel 0104534000Over Alphatron MarineAlphatron Marine is een gerenommeerde leverancier van gentegreerde brugoplossingen, vertegenwoordiger van de belangrijkste merken in de industrie en producent van unieke aanvullende producten op het Japan Radio Company Ltd JRC portfolio Diverse expertisecentra in Tokyo, Singapore, Houston en Rotterdam ondersteunen Alphatron Marine een synergie die zorgt voor kwaliteit en innovatie voor eigenaren, operators en scheepswerven De toekomst van de oceaan, offshore en riviernavigatie wordt hierdoor volledig geherdefinieerdAcquisitie naar aanleiding van deze vacature wordt niet op prijs gesteld",Full-time,https://www.linkedin.com/jobs/view/externalApply/2325403052?url=https%3A%2F%2Fneuvoo%2Enl%2Fjob%2Ephp%3Fid%3D193a662d8c13%26source%3Dlinkedin%26utm_source%3Dpartner%26utm_medium%3Dlinkedin%26puid%3Dfddfcdd7adddcadfcdda8ddaaddegadcadd8fadd3defcdcdfec3ddcg3e&urlHash=ohAL&trk=public_jobs_apply-link-offsite,https://nl.linkedin.com/jobs/view/technisch-tekenaar-electrical-design-engineer-rotterdam-at-alphatron-marine-b-v-2325403052?refId=65f24760-1e9b-4988-bb29-12d4811fc588&trackingId=z1fDw%2FjodcM7J0OutFwLEw%3D%3D&position=17&pageNum=3&trk=public_jobs_job-result-card_result-card_full-click,6 days ago,6 days ago,2020-11-26,2020-12-01
93,electrical engineer,LinkedIn,2321458750,Lead Electrical Engineer,5iU5Pz7EPtBsgd2zw1T35w==,Dosign Engineering,"Rotterdam, South Holland, Netherlands","['Electrical/', 'Electronic Manufacturing']","Over de vacature Ben jij een Senior Electrical Engineer met Lead ervaring of zou je een stap willen maken richting lead engineering Dan zoeken wij jou In de functie van Lead Engineer Electrical ben je verantwoordelijk voor diverse projecten binnen de industrie Je werkt inhoudelijk mee op de afdeling Electrial Daarnaast begeleid, coach en geef je leiding aan het team van engineers en designers De opdrachtgever is een ingenieursbureau dat projecten uitvoert voor industrile klanten Taken en werkzaamheden Het leiden van projecten op het gebied van electrical engineering binnen het team van senior, medior en junior engineers Verantwoordelijk voor alle facetten van basic en detailengineering Je coacht, begeleidt en stuurt het engineeringsteam Zorgdragen voor een goede afstemming met opdrachtgevers Meewerken aan diverse multidisciplinaire projecten Bijdragen aan het opgebouwde professionele imago van het bedrijf Functieeisen Je bent in het bezit van een HTSHBO diploma Je hebt minimaal 8 jaar ervaring, waarvan 4 jaar in een soortgelijke rol Je spreekt Nederlands en Engels Je hebt ruime kennis op het gebied van Electrical Je bent proactief en bent communicatief vaardig Kennis van NEN 1010 en NEN 3140 is een pr Je hebt kennis van Eplan, AutoCAD of Elcad Arbeidsvoorwaarden Bruto maandsalaris tussen 4800 en 5800 8 vakantiegeld 33 vrije dagen per jaar Beroepskosten vergoeding van 500 per jaar Een reiskosten vergoeding of inzet van lease auto Collectieve zorgverzekering bij CZ 7 korting op de premie Gratis trainingen en opleidingen bij Dosign Academy",Full-time,https://www.linkedin.com/jobs/view/externalApply/2321458750?url=https%3A%2F%2Fjoblift%2Enl%2Fdetails%2Ff667e315-0437-41a9-ad3a-b8d223f58d8a%3Fjid%3D5a5a5819c3c8bbedffccc9cc80a0317d0f10803d50ead84dde07829953bd50be%26utm_source%3Dlinkedin_nl%26utm_medium%3Dexternal_feed%26utm_campaign%3D126&urlHash=DvIA&trk=public_jobs_apply-link-offsite,https://nl.linkedin.com/jobs/view/lead-electrical-engineer-at-dosign-engineering-2321458750?refId=65f24760-1e9b-4988-bb29-12d4811fc588&trackingId=5iU5Pz7EPtBsgd2zw1T35w%3D%3D&position=18&pageNum=3&trk=public_jobs_job-result-card_result-card_full-click,6 days ago,6 days ago,2020-11-26,2020-12-01
94,electrical engineer,LinkedIn,2327227471,Lead Electrical Engineer | Rotterdam | FRAME Recruitment,ykL6gjUtGBxpCnQ4oO+SUw==,Werkzoekennl,"Rotterdam, South Holland, Netherlands",['Mechanical or Industrial Engineering'],"Vacature van FRAME Recruitment, locatie Rotterdam, , 40 uur  HBO  5 jaar ervaring  Scheepsbouw Offshore, , In de functie van Lead Electrical Engineer ben je verantwoordelijk voor het ontwerpen van elektrotechnische installaties, gerelateerd aan aandrijfsystemen voor schepen, , , , Als Lead Electrical Engineer draag je zorg voor het ontwerp van diverse elektrotechnische installaties Je vertaalt de vraag van de klant naar praktische, technische oplossingen waarbij je op technisch vlak sturing geeft aan Tekenaars enEngineers, , , , , , , , , 5cd8a0b9cc68f9ffa4c9253553278a55",Full-time,https://www.linkedin.com/jobs/view/externalApply/2327227471?url=https%3A%2F%2Fwww%2Ewerkzoeken%2Enl%2F514_frame-recruitment%2Fvacatures%2F4790538_lead-electrical-engineer%2F%3Fsource%3D5cd8a0b9cc68f9ffa4c9253553278a55%26utm_source%3Dlinkedin%26utm_medium%3Dreferral%26utm_campaign%3Dlinkedin_referral_vertical_vac_feed%26utm_term%3Dengineer%2Brotterdam&urlHash=tM4T&trk=public_jobs_apply-link-offsite,https://nl.linkedin.com/jobs/view/lead-electrical-engineer-rotterdam-frame-recruitment-at-werkzoeken-nl-2327227471?refId=65f24760-1e9b-4988-bb29-12d4811fc588&trackingId=ykL6gjUtGBxpCnQ4oO%2BSUw%3D%3D&position=19&pageNum=3&trk=public_jobs_job-result-card_result-card_full-click,6 days ago,6 days ago,2020-11-26,2020-12-01
95,electrical engineer,LinkedIn,2317611211,Senior Electrical Engineer (medium voltage systems),vp5hNLBvgFZewddxF+Gahw==,Siemens Nederland BV,"Amsterdam, North Holland, Netherlands","['Electrical/', 'Electronic Manufacturing']","Als Senior Electrical Engineer ben je verantwoordelijk voor de realisatie van onze middenspanningsdistributie systemen, specifiek voor de data center branche De ideale kandidaat combineert technische skills met een talent voor plannen en organiseren van alle werkzaamhedenWe make real what mattersTaco is op zoek naar een Senior Lead Engineer Electrical die past in zijn enthousiaste en relatief jonge team binnen een afdeling van zon 40 engineers Hij is een ervaren team manager binnen Siemens Onder zijn leiding is het team het afgelopen jaar verdubbeld in omvang De groei zet door, waardoor hij op zoek is naar een enthousiaste electrical engineer Wat zijn je verantwoordelijkhedenJe bent ervaren in je vakgebied en als technisch expert binnen onze afdeling verantwoordelijk voor de uitwerking van de technische ontwerpen binnen de energie distributie De nadruk zal liggen op realisatie van projecten en in minder mate op offertetrajecten Als Senior Lead Engineer Electrical heb je nauw contact met de opdrachtgever en met internationale collegas die de detailengineering uitwerken onder jouw verantwoordelijkheid Je adviseert je klanten op technisch gebied en stemt binnen een project het technisch ontwerp met de klant af, rekening houdend met de commercile impact Binnen onze projecten wordt er intensief samengewerkt onder leiding van een projectmanager en lead engineerOok ben je verantwoordelijk voor de project afwikkeling voor de medium voltage scope, waaronder de contacten met de fabrieken voor zowel technisch, planning als commercieel zaken De korte doorlooptijden en hoge eisen van onze klanten zorgen voor veel dynamiek tijdens de realisatie van de projecten Werkzaamheden binnen je functie zijn onder eisen vanuit de specificaties omzetten naar een passend switchboard basis ontwerpReviewen technische basis en detailontwerpen en afstemmen interfacesBeoordelen commercile impact van ontwerpkeuzesAansturen en begeleiden van collega engineers binnen het projectteamProactief contact onderhouden met de klant, fabriek en het verkoop en offerteteamOrganiseren en bijwonen van fabriekstesten FAT met de klantOndersteuning leveren vanuit kantoor tijdens de montage en inbedrijfstellingIn jouw rol van Senior Electrical Engineer heb je 25 directe collegas Zo heb je contact met Barry die als lead engineer een belangrijke rol speelt binnen het team en met Gayatri die in samenwerking met jou zorgt voor het beste technische ontwerp Daarnaast heb je veelvuldig contact met onze klanten waaronder de grote spelers binnen de datacenter wereld Onderdeel van de functie is het regelmatig bezoeken van klanten of andere Siemens locatiesDe afdeling is onderdeel van Smart Infrastructure, n van s werelds grootste leveranciers van producten, systemen, oplossingen en diensten voor een duurzame, betrouwbare en efficinte transmissie en distributie van energie Dit team is gespecialiseerd in het op maat ontwerpen en bouwen van energieoplossingen voor veeleisende klanten in de datacenter branche zowel in het binnen als buitenland Meer informatie over de dynamische werkomgeving en projecten is te vinden op ElectricityMattersWhat do you need to make real what mattersAfgeronde HBO of WO opleiding Elektrotechniek met minimaal 8 jaar werkervaring als engineerKennis van elektrische verdelers, distributieborden, transformatoren en elektrische beveiligingen Ervaring met het aansturen en coachen van collega engineersJe bent creatief en in staat ideen over te brengen en mensen te enthousiasmerenNauwkeurig, kritisch, flexibele werkinstelling, praktisch en resultaatgerichtJe vindt het leuk om goed te presteren in een hectische omgevingVloeiend schrijven en spreken van de Nederlandse en Engelse taalWhats in it for meWij bieden een fulltime baan in een informele geen jasjedasje cultuur en professionele werkomgeving met veel ruimte jezelf te ontwikkelen Je werkt bij een afdeling die heel snel groeit, die autonoom opereert en projecten realiseert van ontwerpfase tot en met oplevering fijn salaris plus winstdeling40 verlofdagen per jaarVeel technische trainingen en opleidingsprogramma op maatMooie projecten, nononsence cultuur, dynamiekJe werkt bij een sterk merk en maakt deel uit van een internationaal netwerkFitness mogelijkheden tijdens of na je werkWe dont need superheroes, but super minds  Wij zoeken jouWacht niet langer, druk op de Solliciteer knop, wij willen je graag ontmoeten Zou je naast je cv ook je motivatiebrief willen uploadenVragen Neem contact op met Marianne van Ruyven van Talent Acquisition, tel 06 Siemens Nederland NV is an equal opportunityemployerScreening en een assessment maakt deel uit van de sollicitatieprocedureAcquisitie naar aanleiding van deze vacature wordt niet op prijs gesteldSiemens is an equal opportunity employerOrganization Smart InfrastructureCompany Siemens Nederland NVExperience Level Midlevel ProfessionalJob Type Fulltime",Full-time,https://www.linkedin.com/jobs/view/externalApply/2317611211?url=https%3A%2F%2Fjoblift%2Enl%2Fdetails%2Fa13782bc-0311-4b95-8570-f23922378486%3Fjid%3D0630f8b506c1dbfa2f711bea3698e6178d67e2cef030579371de3257cea12a90%26utm_source%3Dlinkedin_nl%26utm_medium%3Dexternal_feed%26utm_campaign%3D126&urlHash=-v0d&trk=public_jobs_apply-link-offsite,https://nl.linkedin.com/jobs/view/senior-electrical-engineer-medium-voltage-systems-at-siemens-nederland-b-v-2317611211?refId=65f24760-1e9b-4988-bb29-12d4811fc588&trackingId=vp5hNLBvgFZewddxF%2BGahw%3D%3D&position=20&pageNum=3&trk=public_jobs_job-result-card_result-card_full-click,6 days ago,6 days ago,2020-11-26,2020-12-01
96,electrical engineer,LinkedIn,2291024214,Senior Electrical Engineer,lFWvCueUMN8sli8lRv3jlg==,Arup,"Nederland, Overijssel, Netherlands","['Information Technology and Services', 'Computer Software', 'Management Consulting']","A career at Arup offers you the chance to make a positive difference in the world Independently owned and independently minded, Arup is the creative force at the heart of many of the worlds most prominent projects in the built environment We offer a broad range of professional services that combine to make a real difference to our clients and the communities in which we work For more than 70 years, we have helped bring to life groundbreaking projects across the globe, , We are truly global, and our 15,000 planners, designers, engineers and consultants around the world deliver innovative projects with creativity and passion, , , , , We are looking to add a Senior Electrical Engineer to our multidisciplinary team We unite a global network of inventive and highly skilled building engineers and design specialists Together, we are best known for helping to shape ambitious buildings But while our most recognizable work is in complex, groundbreaking structures, many of which Arups input made possible, it is better building performance that drives us, , , , , , You can identify yourself with our values and you want to collaborate with us in shaping a better world with iconic and innovative projects, , , , We offer you a job in a multicultural and informal international working environment with good and lucrative conditions, both primary and secondary, , , For more information about this vacancy please contact John Meijdam, recruitment business partner at Arup in The Netherlands or by telephone 31652473072",Full-time,https://www.linkedin.com/jobs/view/externalApply/2291024214?url=http%3A%2F%2Fwww%2Eexperteer%2Enl%2Fcareer%2Flp%2Fsignup_vertical_full_job%2F1_2018%3Fjob_id%3D23675274%26affiliate%3Daffnl_131%26utm_medium%3Dmetasearch%26utm_source%3Dlinkedin%26utm_content%3Djob&urlHash=DCMw&trk=public_jobs_apply-link-offsite,https://nl.linkedin.com/jobs/view/senior-electrical-engineer-at-arup-2291024214?refId=65f24760-1e9b-4988-bb29-12d4811fc588&trackingId=lFWvCueUMN8sli8lRv3jlg%3D%3D&position=21&pageNum=3&trk=public_jobs_job-result-card_result-card_full-click,6 days ago,6 days ago,2020-11-26,2020-12-01
97,electrical engineer,LinkedIn,2317608839,Senior Electrical Engineer (medium voltage systems),xnPn/EnCtuHw0mKRRns4cg==,Siemens Nederland BV,"The Hague, South Holland, Netherlands","['Electrical/', 'Electronic Manufacturing']","Als Senior Electrical Engineer ben je verantwoordelijk voor de realisatie van onze middenspanningsdistributie systemen, specifiek voor de data center branche De ideale kandidaat combineert technische skills met een talent voor plannen en organiseren van alle werkzaamhedenWe make real what mattersTaco is op zoek naar een Senior Lead Engineer Electrical die past in zijn enthousiaste en relatief jonge team binnen een afdeling van zon 40 engineers Hij is een ervaren team manager binnen Siemens Onder zijn leiding is het team het afgelopen jaar verdubbeld in omvang De groei zet door, waardoor hij op zoek is naar een enthousiaste electrical engineer Wat zijn je verantwoordelijkhedenJe bent ervaren in je vakgebied en als technisch expert binnen onze afdeling verantwoordelijk voor de uitwerking van de technische ontwerpen binnen de energie distributie De nadruk zal liggen op realisatie van projecten en in minder mate op offertetrajecten Als Senior Lead Engineer Electrical heb je nauw contact met de opdrachtgever en met internationale collegas die de detailengineering uitwerken onder jouw verantwoordelijkheid Je adviseert je klanten op technisch gebied en stemt binnen een project het technisch ontwerp met de klant af, rekening houdend met de commercile impact Binnen onze projecten wordt er intensief samengewerkt onder leiding van een projectmanager en lead engineerOok ben je verantwoordelijk voor de project afwikkeling voor de medium voltage scope, waaronder de contacten met de fabrieken voor zowel technisch, planning als commercieel zaken De korte doorlooptijden en hoge eisen van onze klanten zorgen voor veel dynamiek tijdens de realisatie van de projecten Werkzaamheden binnen je functie zijn onder eisen vanuit de specificaties omzetten naar een passend switchboard basis ontwerpReviewen technische basis en detailontwerpen en afstemmen interfacesBeoordelen commercile impact van ontwerpkeuzesAansturen en begeleiden van collega engineers binnen het projectteamProactief contact onderhouden met de klant, fabriek en het verkoop en offerteteamOrganiseren en bijwonen van fabriekstesten FAT met de klantOndersteuning leveren vanuit kantoor tijdens de montage en inbedrijfstellingIn jouw rol van Senior Electrical Engineer heb je 25 directe collegas Zo heb je contact met Barry die als lead engineer een belangrijke rol speelt binnen het team en met Gayatri die in samenwerking met jou zorgt voor het beste technische ontwerp Daarnaast heb je veelvuldig contact met onze klanten waaronder de grote spelers binnen de datacenter wereld Onderdeel van de functie is het regelmatig bezoeken van klanten of andere Siemens locatiesDe afdeling is onderdeel van Smart Infrastructure, n van s werelds grootste leveranciers van producten, systemen, oplossingen en diensten voor een duurzame, betrouwbare en efficinte transmissie en distributie van energie Dit team is gespecialiseerd in het op maat ontwerpen en bouwen van energieoplossingen voor veeleisende klanten in de datacenter branche zowel in het binnen als buitenland Meer informatie over de dynamische werkomgeving en projecten is te vinden op ElectricityMattersWhat do you need to make real what mattersAfgeronde HBO of WO opleiding Elektrotechniek met minimaal 8 jaar werkervaring als engineerKennis van elektrische verdelers, distributieborden, transformatoren en elektrische beveiligingen Ervaring met het aansturen en coachen van collega engineersJe bent creatief en in staat ideen over te brengen en mensen te enthousiasmerenNauwkeurig, kritisch, flexibele werkinstelling, praktisch en resultaatgerichtJe vindt het leuk om goed te presteren in een hectische omgevingVloeiend schrijven en spreken van de Nederlandse en Engelse taalWhats in it for meWij bieden een fulltime baan in een informele geen jasjedasje cultuur en professionele werkomgeving met veel ruimte jezelf te ontwikkelen Je werkt bij een afdeling die heel snel groeit, die autonoom opereert en projecten realiseert van ontwerpfase tot en met oplevering fijn salaris plus winstdeling40 verlofdagen per jaarVeel technische trainingen en opleidingsprogramma op maatMooie projecten, nononsence cultuur, dynamiekJe werkt bij een sterk merk en maakt deel uit van een internationaal netwerkFitness mogelijkheden tijdens of na je werkWe dont need superheroes, but super minds  Wij zoeken jouWacht niet langer, druk op de Solliciteer knop, wij willen je graag ontmoeten Zou je naast je cv ook je motivatiebrief willen uploadenVragen Neem contact op met Marianne van Ruyven van Talent Acquisition, tel 06 Siemens Nederland NV is an equal opportunityemployerScreening en een assessment maakt deel uit van de sollicitatieprocedureAcquisitie naar aanleiding van deze vacature wordt niet op prijs gesteldSiemens is an equal opportunity employerOrganization Smart InfrastructureCompany Siemens Nederland NVExperience Level Midlevel ProfessionalJob Type Fulltime",Full-time,https://www.linkedin.com/jobs/view/externalApply/2317608839?url=https%3A%2F%2Fjoblift%2Enl%2Fdetails%2Fd5e918c6-991a-4e86-ad7b-28ed739005c4%3Fjid%3D6ab52ad4a8f9575feeda50c055b9eb5d6ea41323a97edd39ff147f7050ebee32%26utm_source%3Dlinkedin_nl%26utm_medium%3Dexternal_feed%26utm_campaign%3D126&urlHash=E88y&trk=public_jobs_apply-link-offsite,https://nl.linkedin.com/jobs/view/senior-electrical-engineer-medium-voltage-systems-at-siemens-nederland-b-v-2317608839?refId=65f24760-1e9b-4988-bb29-12d4811fc588&trackingId=xnPn%2FEnCtuHw0mKRRns4cg%3D%3D&position=22&pageNum=3&trk=public_jobs_job-result-card_result-card_full-click,6 days ago,6 days ago,2020-11-26,2020-12-01
