Data Row,Search Keyword,Platform,Job ID,Job Title,Tracking ID,Company Name,Location,Industry,Job Description,Employment Type,Company URL,Job URL,Job Age,Job Age Number,Job Date,Collection Date
243,primary school teacher,LinkedIn,2313652804,Docent Engels 1e gr.,L8RPNlq0Qz2f6tIb3379qw==,Baudartius College,"Zutphen, Gelderland, Netherlands",None,"Vind jij het leuk om inspirerende en uitdagende lessen Engels aan te bieden aan leerlingen van de bovenbouw havovwo Ben jij een kei in het leveren van maatwerk zodat elke leerling zich maximaal kan ontwikkelen Ben jij de docent die lesgeeft met plezier en breng je dat ook over aan je leerlingen en is samenwerken met leerlingen, ouders en collegas voor jou vanzelfsprekend Dan is het Baudartius op zoek naar jou Ben je momenteel studerend voor je eerste graad dan nodigen wij je ook van harte uit om te solliciteren Het betreft een tijdelijke vervangingsaanstelling met ingangsdatum eind januari tm einde schooljaar De functie wordt gewaardeerd op basis van de CAO VO Daarnaast heeft Achterhoek VO een aantal aantrekkelijke secundaire arbeidsvoorwaarden voor haar medewerkers vastgelegd en wij bieden goede begeleiding voor nieuwe en startende docenten",Full-time,https://www.linkedin.com/jobs/view/externalApply/2313652804?url=https%3A%2F%2Fwww%2Evacatures%2Enl%2Fvacature%2Fdocent-engels-1e-gr%3A44267541%2F&urlHash=t7Zg&refId=9dd30374-1a1f-43dd-8163-289d7ab25d0e&trk=public_jobs_apply-link-offsite,https://nl.linkedin.com/jobs/view/docent-engels-1e-gr-at-baudartius-college-2313652804?refId=9dd30374-1a1f-43dd-8163-289d7ab25d0e&position=18&pageNum=9&trk=public_jobs_job-result-card_result-card_full-click,2 months ago,2 months ago,2020-10-11,2020-11-30
244,primary school teacher,LinkedIn,2278713632,Docent Engels,12UJevZORNCZvfG082vtew==,Randstad Groep Nederland BV,"Eindhoven, North Brabant, Netherlands","['Primary/', 'Secondary Education']","Roep jij altijd dat je nearnative bent en wil jij graag het Engels van jouw leerlingen naar een hoger niveau tillen Dat komt goed uit Randstad zoekt docenten die graag als docent Engels aan de slag willen met de huidige jeugd Bevoegde of bijna bevoegde docenten voor het vak Engels mogen altijd bij ons aankloppen We ontvangen namelijk met regelmaat vacatures van verschillende scholen in het Voortgezet Onderwijs VO en het Middelbaar Beroepsonderwijs MBO Ben je een bevlogen, bevoegde",Full-time,https://www.linkedin.com/jobs/view/externalApply/2278713632?url=https%3A%2F%2Fjoblift%2Enl%2Fdetails%2F34e0b767-6aec-4b18-91b3-ea4ba721ba73%3Fjid%3D6b9a31c128481c3e6fae4eeca2cd01cbb2b129ee7e29f495de951c0bfce86f43%26utm_source%3Dlinkedin_nl%26utm_medium%3Dexternal_feed%26utm_campaign%3D126&urlHash=9MpA&refId=9dd30374-1a1f-43dd-8163-289d7ab25d0e&trk=public_jobs_apply-link-offsite,https://nl.linkedin.com/jobs/view/docent-engels-at-randstad-groep-nederland-bv-2278713632?refId=9dd30374-1a1f-43dd-8163-289d7ab25d0e&position=19&pageNum=9&trk=public_jobs_job-result-card_result-card_full-click,2 months ago,2 months ago,2020-10-11,2020-11-30
245,primary school teacher,LinkedIn,2322260994,Docent Engels (2e graads) in Utrecht,+tAsx+YUT3y273y77Vy3XA==,Randstad Onderwijs,"Utrecht, Utrecht, Netherlands",None,"The English language is funny  a fat chance and a slim chance are the same thingRoep jij altijd dat je nearnative bent, en wil jij graag het Engels van jouw leerlingen naar een hoger niveau tillen Komt dat even goed uit Als docent Engels zit jij namelijk bij ons op de goede plek Jij bent de docent Engels die de leerlingen weet te motiveren en net zo enthousiast te krijgen over de nummer n wereldtaal als jijzelfWij zijn regelmatig op zoek naar een docenten Engels voor grote onderwijsorganisaties in de regio West Brabant Is je studie inmiddels afgerond f zit je er nog middenin Geen punt Bij ons ben je van harte welkom Wij kunnen samen met jou kijken naar passend werk aanvullend lesgeven naast je studie, flexwerk, een jaarcontract of bemiddeling naar een vaste baan bij een school behoort tot de mogelijkheden Maak gebruik van ons netwerk en expertise en vindt de baan die bij JOU past, , , , , , , Op dit moment zoeken we voor maar liefst 2 scholen docenten Engels Je gaat lesgeven aan vmbo TL en havo niveau Het betreft ziektevervangingen van ongeveer 2 maanden, met kans op langer De dagen zijn in overleg met jou, dus je kunt je voorkeur opgevenLijkt je het leuk om te starten als docent Engels in Tilburg We horen het graag, , , De vacatures die op dit moment openstaan zijn op 2 reguliere VO scholen in Tilburg, , Spreekt dit je aan Of heb je wellicht nog vragen Gebruik dan nu de sollicitatiebutton en wij gaan graag met jou in gesprekIn case of application, please note that advanced knowledge of Dutch language is required, Uiteraard staat deze vacature open voor iedereen die zich hierin herkent",Full-time,https://www.linkedin.com/jobs/view/externalApply/2322260994?url=https%3A%2F%2Fneuvoo%2Enl%2Fjob%2Ephp%3Fid%3Dadd63bdfcbd2%26source%3Dlinkedin%26utm_source%3Dpartner%26utm_medium%3Dlinkedin%26puid%3Dfadfcadc8adcfdda9dddaadeaadcgadaaaddfade3aeccdcefec3ddcg3e&urlHash=6RF_&refId=9dd30374-1a1f-43dd-8163-289d7ab25d0e&trk=public_jobs_apply-link-offsite,https://nl.linkedin.com/jobs/view/docent-engels-2e-graads-in-utrecht-at-randstad-onderwijs-2322260994?refId=9dd30374-1a1f-43dd-8163-289d7ab25d0e&position=20&pageNum=9&trk=public_jobs_job-result-card_result-card_full-click,2 months ago,2 months ago,2020-10-11,2020-11-30
246,primary school teacher,LinkedIn,2318506596,Docent Engels,jx+wsBKfQBShi9S9AW2g3w==,Carriere in Limburg,"Hoensbroek, Limburg, Netherlands","['Information Technology and Services', 'Logistics and Supply Chain', 'Staffing and Recruiting']","Functie beschrijving, , Het geven van lessen Engels, Het betreft een ziektevervanging Einddatum onbekend, , Functie eisen, , 2e graads bevoegdheid, Ervaring met de doelgroep, breed inzetbaar, , Wij bieden, , We bieden goede primaire en secundaire arbeidsvoorwaarden, zoals een brede cafetariaregeling en opleidingsmogelijkheden Meer weten over het CAO VO Op de website van de VOraad staat de meest actuele informatie over deze CAO voor het voortgezet onderwijs Je kunt daar de CAO downloaden, , Overige opmerkingen, Inlichtingen bij, Camiel Krutzen, click apply, Email sollicitatie, click apply",Full-time,https://www.linkedin.com/jobs/view/externalApply/2318506596?url=https%3A%2F%2Fnl%2Ejooble%2Eorg%2Fexternal%2F2734954338315792631%3Futm_campaign%3DNL%26utm_medium%3Dsocial%26utm_source%3Dlinkedin%26JobSource%3DBoard&urlHash=pRYt&refId=9dd30374-1a1f-43dd-8163-289d7ab25d0e&trk=public_jobs_apply-link-offsite,https://nl.linkedin.com/jobs/view/docent-engels-at-carriere-in-limburg-2318506596?refId=9dd30374-1a1f-43dd-8163-289d7ab25d0e&position=21&pageNum=9&trk=public_jobs_job-result-card_result-card_full-click,2 months ago,2 months ago,2020-10-11,2020-11-30
247,primary school teacher,LinkedIn,2317394155,Docent Engels,gon+ix+jRFmthpfd2fbziw==,Carriere in Limburg,"Hoensbroek, Limburg, Netherlands","['Information Technology and Services', 'Logistics and Supply Chain', 'Staffing and Recruiting']","Functie beschrijving, , Het geven van lessen Engels, Het betreft een ziektevervanging Einddatum onbekend, , Functie eisen, , 2e graads bevoegdheid, Ervaring met de doelgroep, breed inzetbaar, , Wij bieden, , We bieden goede primaire en secundaire arbeidsvoorwaarden, zoals een brede cafetariaregeling en opleidingsmogelijkheden Meer weten over het CAO VO Op de website van de VOraad staat de meest actuele informatie over deze CAO voor het voortgezet onderwijs Je kunt daar de CAO downloaden, , Overige opmerkingen, Inlichtingen bij, Camiel Krutzen, click apply, Email sollicitatie, click apply",Full-time,https://www.linkedin.com/jobs/view/externalApply/2317394155?url=https%3A%2F%2Fnl%2Ejooble%2Eorg%2Fexternal%2F-8999205681864897783%3Futm_campaign%3DNL%26utm_medium%3Dsocial%26utm_source%3Dlinkedin%26JobSource%3DBoard&urlHash=xFcE&refId=9dd30374-1a1f-43dd-8163-289d7ab25d0e&trk=public_jobs_apply-link-offsite,https://nl.linkedin.com/jobs/view/docent-engels-at-carriere-in-limburg-2317394155?refId=9dd30374-1a1f-43dd-8163-289d7ab25d0e&position=22&pageNum=9&trk=public_jobs_job-result-card_result-card_full-click,2 months ago,2 months ago,2020-10-11,2020-11-30
248,primary school teacher,LinkedIn,2278713625,Docent Engels,lQsXYHrYS2ihUppdNF3WUw==,Randstad Groep Nederland BV,"Nijmegen, Gelderland, Netherlands","['Primary/', 'Secondary Education']","Engeland is een land met veel typerende blikvangers en gewoonten Denk aan de dubbeldekker bussen, rode telefooncellen de thee en niet te vergeten het koningshuis Daarnaast heeft Engeland ook prachtige bouwwerken zoals Buckingham Palace, London Bridge en de Big Ben Ben jij de docent die al deze prachtige blikvangers en gewoonten met passie kan meenemen binnen je lessen Dan ben jij de docent die de belevingswereld van jouw leerlingen vergroot Jij vindt het vast leuk om lessen te",Full-time,https://www.linkedin.com/jobs/view/externalApply/2278713625?url=https%3A%2F%2Fjoblift%2Enl%2Fdetails%2F30effcc9-f6f2-477f-b592-a08c62e08a2e%3Fjid%3D2ec14d56acd225e87b2c9984a09493fba7bc94449b7b94d9f4ed4058aa991af8%26utm_source%3Dlinkedin_nl%26utm_medium%3Dexternal_feed%26utm_campaign%3D126&urlHash=qXbI&refId=9dd30374-1a1f-43dd-8163-289d7ab25d0e&trk=public_jobs_apply-link-offsite,https://nl.linkedin.com/jobs/view/docent-engels-at-randstad-groep-nederland-bv-2278713625?refId=9dd30374-1a1f-43dd-8163-289d7ab25d0e&position=23&pageNum=9&trk=public_jobs_job-result-card_result-card_full-click,2 months ago,2 months ago,2020-10-11,2020-11-30
249,primary school teacher,LinkedIn,2307353081,"Docent Engels, 1e graad",8K9wRt/tQTiwI8Ug/sicjA==,Thomas a Kempis College,"Zwolle, Overijssel, Netherlands","['Primary/', 'Secondary Education']","Wat ga je doen, , Wil jij Engels geven in Zwolle Ben je sportief in jouw denken en ben je creatief Houd je ervan vernieuwend bezig te zijn met je vak Heb je een passie voor onderwijs en lerende jongeren Houd je van samenwerken en ben je gewend om te denken in kansen en mogelijkheden, , Wat breng je mee, , Denk je te voldoen aan hetgeen wij vragen en beschik je over een passende bevoegdheid, dan nodigen we jou uit om een motivatiebrief te sturen vergezeld van een actueel curriculum vitae In deze brief lezen we aan de hand van voorbeelden graag waarom jij past binnen onze school, , Arbeidsvoorwaarden, , Dit is wat wij je kunnen bieden, , een inspirerende werkomgeving, , een tijdelijk contract in de cao mbo met uitzicht op vast bij goed functioneren, , salaris afhankelijk van ervaring en bevoegdheid",Full-time,https://www.linkedin.com/jobs/view/externalApply/2307353081?url=https%3A%2F%2Fjoblift%2Enl%2Fdetails%2Fd28db978-9500-48e8-b5ed-20068dcf549d%3Fjid%3Db87c422800d1ea9542821299c0ef7780a09fb7ed23a7a152210d8a3630eb86b9%26utm_source%3Dlinkedin_nl%26utm_medium%3Dexternal_feed%26utm_campaign%3D126&urlHash=XfyR&refId=9dd30374-1a1f-43dd-8163-289d7ab25d0e&trk=public_jobs_apply-link-offsite,https://nl.linkedin.com/jobs/view/docent-engels-1e-graad-at-thomas-a-kempis-college-2307353081?refId=9dd30374-1a1f-43dd-8163-289d7ab25d0e&position=24&pageNum=9&trk=public_jobs_job-result-card_result-card_full-click,2 months ago,2 months ago,2020-10-11,2020-11-30
250,primary school teacher,LinkedIn,2260390370,Docent Engels,ZNFuN3QGTcu6ALOpfUUD9g==,Matchpartner,"Tilburg, North Brabant, Netherlands","['Staffing and Recruiting', 'Mental Health Care', 'Hospital & Health Care']","Staat een collegiale sfeer voor jouw ook bovenaan je wensenlijstje bij het vinden van een nieuwe baan Dan heb je geluk Deze school heeft zowel met leerlingen als collegas het streven naar een ongedwongen gezellige sfeer Matchpartner Onderwijs zoekt per direct een docent Engels tweedegraads voor het voortgezet onderwijs in de omgeving van Tilburg In deze functie geef je les aan de klassen van het vmbo Je geeft 14 lessen per week 0,5  0,6 fte De werkdagen kunnen in overleg worden bepaald Bij voorkeur ben tweedegraads bevoegd Indien je in opleiding bent voor je tweedegraads bevoegdheid ontvangen wij ook graag je sollicitatie",Full-time,https://www.linkedin.com/jobs/view/externalApply/2260390370?url=https%3A%2F%2Fwww%2Evacatures%2Enl%2Fvacature%2Fdocent-engels%3A44036458%2F&urlHash=FHnD&refId=9dd30374-1a1f-43dd-8163-289d7ab25d0e&trk=public_jobs_apply-link-offsite,https://nl.linkedin.com/jobs/view/docent-engels-at-matchpartner-2260390370?refId=9dd30374-1a1f-43dd-8163-289d7ab25d0e&position=25&pageNum=9&trk=public_jobs_job-result-card_result-card_full-click,2 months ago,2 months ago,2020-10-11,2020-11-30
251,primary school teacher,LinkedIn,2326313528,"Docent LB Engels, 2e graads - SG Gerrit Rietveld",XN2qS3SFSsC93AqaJfgrYg==,Nederland Onderwijs Vacature,"Purmerend, North Holland, Netherlands","['Primary/', 'Secondary Education']","Taken en verantwoordelijkheden, Bedrijfsprofiel, De Purmerendse ScholenGroep PSG is een samenwerkingsverband van zes scholen voor voortgezet onderwijs in de regio Waterland en omliggende gemeenten De organisatie kent een campus havovwo het Jan van Egmond Lyceum en het Da Vinci College, een campus vmbopro SG Antoni Gaud, SG Nelson Mandela, SG WJ Bladergroen, het SG Gerrit Rietveld en ondersteunende diensten, , Binnen onze scholengroep liggen er kansen voor zowel eerste als tweedegraads docenten De grote verscheidenheid aan scholen binnen onze groep staat garant voor een zeer afwisselende baan, , De Purmerendse ScholenGroep heeft voor de vestiging SG Gerrit Rietveld per direct een vacature voor een, , Docent LB Engels, 2e graads, , , , Naar wie zijn wij op zoek, Als docent Engels ga je lesgeven aan de bovenbouw vmboleerlingen Je verzorgt lessen op het gebied van de Engelse taalkunde en bent goed op de hoogte van de ontwikkelingen binnen jouw vakgebied Je weet de lesstof goed over te brengen en je begeleidt en coacht leerlingen bij hun leerdoelen Je onderhoudt contacten met ouders enof verzorgers over de voortgang Daarnaast zorg je voor een veilige leeromgeving en ben je in staat om het maximale uit een leerling te halen, , Wat breng jij mee, , Je bent in bezit van een tweedegraads bevoegdheid Engels of je bent studerend hiervoor Je beschikt over goede pedagogische en didactische vaardigheden en je hebt affiniteit met lesgeven aan vmboleerlingen Je bent enthousiast, oplossingsgericht en bovenal een teamspeler Onderwijsvernieuwingen volg je op de voet en je bent vaardig met nieuwe interactieve media, , Wat bieden wij, , Een leuke en dynamische leeromgeving met bevlogen en betrokken collegas De functie is gewaardeerd in schaal LB, maximaal  4301,00 bruto per maand bij een fulltime dienstverband Daarnaast biedt de Purmerendse ScholenGroep bovenop de aantrekkelijke arbeidsvoorwaarden uit de CAO een op ontwikkeling gericht taakbeleid, een collectieve arbeidsongeschiktheidsverzekering en korting op diverse ziektekostenverzekeringen Je ontvangt een MacBook in bruikleen voor gebruik in de interne digitale schoolomgeving Het betreft een tijdelijke vacature ter vervanging van een afwezige medewerker, , Solliciteren, , Je kunt hieronder via de button Solliciteren jouw gegevens achterlaten en jouw CV en motivatiebrief uploaden Uitsluitend rechtstreekse reacties van sollicitanten via onze website of via de site van meesterbaan worden door ons in behandeling genomen Acquisitie of bemiddeling wordt niet op prijs gesteld, Profiel kandidaat, , Geboden wordt",Full-time,https://www.linkedin.com/jobs/view/externalApply/2326313528?url=https%3A%2F%2Fjoblift%2Enl%2Fdetails%2F24241edd-f840-4507-874a-8f6110f3305e%3Fjid%3Da48062da35ee15dc24e6adc652abe50c83b2e6053637f9d2a9d9695157a99b7d%26utm_source%3Dlinkedin_nl%26utm_medium%3Dexternal_feed%26utm_campaign%3D126&urlHash=N8bY&refId=be48cca9-19a8-46cc-b8ce-4416b9ea4ed0&trk=public_jobs_apply-link-offsite,https://nl.linkedin.com/jobs/view/docent-lb-engels-2e-graads-sg-gerrit-rietveld-at-nederland-onderwijs-vacature-2326313528?refId=be48cca9-19a8-46cc-b8ce-4416b9ea4ed0&position=1&pageNum=10&trk=public_jobs_job-result-card_result-card_full-click,2 months ago,2 months ago,2020-10-11,2020-11-30
252,primary school teacher,LinkedIn,2325850837,Docent Engels 2e graads,qPt+DDrIThWBdER4WKRahg==,Flexibility onderwijs,"Alkmaar, North Holland, Netherlands","['Higher Education', 'Education Management', 'Staffing and Recruiting']","Functieomschrijving, , Voor onze scholengemeenschap in de regio Alkmaar, zoeken wij een docent Engels 2e graads, die 3 tot 4 dagen op onze VMBO TL afdeling aan de slag wil Je bent een gepassioneerde docent, die graag met de Engelse taal onze leerlingen wil enthousiasmeren, waarbij de doeltaal zo veel mogelijk als voertaal wordt aangeboden Naast de lesmethode Stepping Stones, weet je met activerende werkvormen de prachtige taal over te brengen Tenslotte is Engels de belangrijkste wereldtaal, zowel in de luchtvaart, als zakenleven, als in het toerisme, , Je bent bovendien digitaal onderlegd en kan met bijvoorbeeld kahoot leerlingen spelenderwijs ondersteunen, Je bent collegiaal, hebt een hart voor onze leerlingen, je bent flexibel en goed pedagogisch en didactisch onderlegd, Je bent enthousiast, communicatief, bevlogen en weet te inspireren, , Arbeidsvoorwaarden, Flexibility Onderwijs wil een dynamische docentenorganisatie zijn, waarbij docent en school centraal staan, Wij zorgen dat de saliring conform CAO VO wordt uitbetaald, met de daarbij behorende secundaire arbeidsvoorwaarden zoals pensioen, vakantiegeld, verlofdagen en reiskosten, , Ben jij de professional die wij zoeken, en ben je bijna afgestudeerd en wil je graag binnenkort aan de slag Dan zijn wij op zoek naar jou Reageer dan vandaag en stuur jouw CV naar click apply of bel click apply, , Mailen, bellen, appen het kan allemaal, , Volg ons ook op Twitter  Onderwijsflex, , , , We vragen iemand met een tweede graads lerarenopleiding Engels, of nog studerend, Enige relevante werkervaring in het voortgezet onderwijs, zien wij als een pr, Je hebt affiniteit met VMBO TL leerlingen en weet je ook te redden met een examenklas, Je beschikt over voldoende ICT vaardigheden",Full-time,https://www.linkedin.com/jobs/view/externalApply/2325850837?url=https%3A%2F%2Fnl%2Ejooble%2Eorg%2Fexternal%2F-2332128805393508105%3Futm_campaign%3DNL%26utm_medium%3Dsocial%26utm_source%3Dlinkedin%26JobSource%3DBoard&urlHash=xY8r&refId=be48cca9-19a8-46cc-b8ce-4416b9ea4ed0&trk=public_jobs_apply-link-offsite,https://nl.linkedin.com/jobs/view/docent-engels-2e-graads-at-flexibility-onderwijs-2325850837?refId=be48cca9-19a8-46cc-b8ce-4416b9ea4ed0&position=2&pageNum=10&trk=public_jobs_job-result-card_result-card_full-click,2 months ago,2 months ago,2020-10-11,2020-11-30
253,primary school teacher,LinkedIn,2321607311,Teacher of Polish,tTw2daWdR5+kTbv39vT8Yg==,Rijnlands Lyceum,"Den Haag, South Holland, Netherlands","['Primary/', 'Secondary Education', 'Higher Education', 'Education Management']","The European School The Hague ESDH is an officially accredited European School providing multilingual and multicultural education, offering complete Early Years, Primary and Secondary education leading to the European Baccalaureate Our Secondary School has a temporary job opening for Teacher of Polish  0292 FTE 1FTE corresponds with a fulltime job Requirements",Full-time,https://www.linkedin.com/jobs/view/externalApply/2321607311?url=https%3A%2F%2Fwww%2Evacatures%2Enl%2Fvacature%2Fteacher-of-polish%3A44368290%2F&urlHash=i98J&refId=be48cca9-19a8-46cc-b8ce-4416b9ea4ed0&trk=public_jobs_apply-link-offsite,https://nl.linkedin.com/jobs/view/teacher-of-polish-at-rijnlands-lyceum-2321607311?refId=be48cca9-19a8-46cc-b8ce-4416b9ea4ed0&position=3&pageNum=10&trk=public_jobs_job-result-card_result-card_full-click,2 months ago,2 months ago,2020-10-11,2020-11-30
254,primary school teacher,LinkedIn,2296854768,Docent Engels,BpAlZgcpRrSNX448l2fshw==,Onze Leerkracht,"Tilburg, North Brabant, Netherlands",None,"Hoe zit dat ook alweer There, their of theyre An English teacher of A English teacher Kun jij het verschil kenbaar maken aan je leerlingen Voel jij je aangesproken en ben jij de bevlogen, ambitieuze en bevoegde Docent Engels 2e graads die wij zoeken Lees verder en reageer snel De werkplek Wat kun jij verwachten Je gaat werken op een kleine VMBO school in Tilburg, , De functie Wat ga jij doen",Full-time,https://www.linkedin.com/jobs/view/externalApply/2296854768?url=https%3A%2F%2Fwww%2Evacatures%2Enl%2Fvacature%2Fdocent-engels%3A43928936%2F&urlHash=YAac&refId=be48cca9-19a8-46cc-b8ce-4416b9ea4ed0&trk=public_jobs_apply-link-offsite,https://nl.linkedin.com/jobs/view/docent-engels-at-onze-leerkracht-2296854768?refId=be48cca9-19a8-46cc-b8ce-4416b9ea4ed0&position=4&pageNum=10&trk=public_jobs_job-result-card_result-card_full-click,2 months ago,2 months ago,2020-10-11,2020-11-30
255,primary school teacher,LinkedIn,2317459634,Docent Engels - Franois Vatelschool,BFSARosKSQWZ6YPAiRtrfw==,Nederland Onderwijs Vacature,"The Hague, South Holland, Netherlands","['Primary/', 'Secondary Education']","Taken en verantwoordelijkheden, Bedrijfsprofiel, Franois Vatel is de school in de gemeente Den Haag als het gaat om de profielen horeca, bakkerij en toerisme HBR en media, vormgeving en ict MVI, Leren in de praktijk staat in ons onderwijs centraal Dat maakt dat wij vakmensen afleveren voor onze twee profielen Dit doen wij door het bieden van een contextrijke en toekomstgerichte onderwijs omgeving die basis, kader en gtl leerlingen verder helpt in hun ontwikkeling en bij het maken van keuzes, Dit alles gebeurt in een veilige omgeving waar je leert van je fouten, waarbij de leerling inziet dat leren nodig is om verder te komen in het leven, Het personeel van de school handelt vanuit een besef dat je voor leerlingen het verschil maakt en daarin een voorbeeldfunctie hebt Leerlingen op Franois Vatel leren door middel van loopbaan orintatie hun eigen toekomst vorm te geven en leren hun keuzes te overzien, , Op Franois Vatel werken docenten en leerlingen samen aan onderwijs dat recht doet aan de individuele verschillen van leerlingen op sociaal en cognitief vlak Dit zien we terug in maatwerk op alle niveaus Daar waar mogelijk laten we leerlingen leren door te doen, praktijkleren staat daarin centraal De school doet dit door het onderwijsprogramma te toetseninnoveren met feedback van leerlingen, oudersverzorgers en belanghebbenden, , WIE WIJ ZIJN, , Franois Vatel is d school in de gemeente Den Haag als het gaat om de profielen Horeca, Bakkerij en Recreatie HBR en Media, Vormgeving en ICT MVI Leren in de praktijk staat in ons onderwijs centraal Dat maakt dat wij vakmensen afleveren voor onze twee profielen Dit doen wij door het bieden van een contextrijke en toekomstgerichte onderwijsomgeving die basis, kader en gtl leerlingen verder helpt in hun ontwikkeling en bij het maken van keuzes Dit gebeurt in een veilige omgeving waar je leert van je fouten, waarbij de leerling inziet dat leren nodig is om verder te komen in het leven Personeel handelt vanuit een besef dat je voor leerlingen het verschil maakt en daarin een voorbeeldfunctie hebt Leerlingen op Franois Vatel leren door middel van loopbaanorintatie hun eigen toekomst vorm te geven en leren hun keuzes te overzien, , WAT WIJ ZOEKEN, , De Francois Vatel is op zoek naar een enthousiaste docent ivm ziektevervanging die voor onze vmboleerlingen graag Engels wil leren Dit doen wij niet standaard uit een boek maar met zelfgeschreven projecten Je werkt in een kleine sectie aan vernieuwend onderwijs voor de niveaus basis, kader en de gemengdtheoretische leerweg in alle leerjaren van onze school, Als aanvulling op het team zoeken wij zoeken een docent die out of the box kan denken, creatief is en zowel leerlingen als docenten weet te enthousiasmeren, Profiel kandidaat, PAST DIT ZELFPORTET BIJ JOU, , Wat breng je mee, , , , ONS AANBOD",Full-time,https://www.linkedin.com/jobs/view/externalApply/2317459634?url=https%3A%2F%2Fjoblift%2Enl%2Fdetails%2Fa15f8cc0-8622-49ba-9a27-7d736ba0f961%3Fjid%3Dba96f11936edab161d0a0784f0f827159932141de5cd76bfa55f7c84a548a28c%26utm_source%3Dlinkedin_nl%26utm_medium%3Dexternal_feed%26utm_campaign%3D126&urlHash=Ptm_&refId=be48cca9-19a8-46cc-b8ce-4416b9ea4ed0&trk=public_jobs_apply-link-offsite,https://nl.linkedin.com/jobs/view/docent-engels-fran%C3%A7ois-vatelschool-at-nederland-onderwijs-vacature-2317459634?refId=be48cca9-19a8-46cc-b8ce-4416b9ea4ed0&position=5&pageNum=10&trk=public_jobs_job-result-card_result-card_full-click,2 months ago,2 months ago,2020-10-11,2020-11-30
256,primary school teacher,LinkedIn,2312438796,Docent Engels,4n4ZnB2dTdGbvSQ8P+hr1Q==,CSG Augustinus,"Groningen, Groningen, Netherlands",None,"De Christelijke Scholengemeenschap Groningen CSG bestaat uit meerdere onderwijsvestigingen en een bestuursbureau De vestigingen functioneren als herkenbare locaties van de CSG en verschillen onderling waar het gaat om het soort onderwijs, de sfeer en de cultuur Voor onze vestiging CSG Augustinus zijn we op zoek naar een DOCENT ENGELS Ben jij een docent die uitdaging leuk vindt maar ook jongeren weet uit te dagen Heb jij kennis van andere onderwijsvormen en is jouw les uniek Op CSG Augustinus kun je doen waar je goed in bent Combineer je kennis en vaardigheden, geef inhoud en vorm aan je lessen en boor de talenten van onze leerlingen aan Oftewel, word docent Engels op CSG Augustinus Functieeisen Ons nieuwe teamlid, docent Engels kan",Full-time,https://www.linkedin.com/jobs/view/externalApply/2312438796?url=https%3A%2F%2Fwww%2Evacatures%2Enl%2Fvacature%2Fdocent-engels%3A44254640%2F&urlHash=KoQH&refId=be48cca9-19a8-46cc-b8ce-4416b9ea4ed0&trk=public_jobs_apply-link-offsite,https://nl.linkedin.com/jobs/view/docent-engels-at-csg-augustinus-2312438796?refId=be48cca9-19a8-46cc-b8ce-4416b9ea4ed0&position=6&pageNum=10&trk=public_jobs_job-result-card_result-card_full-click,2 months ago,2 months ago,2020-10-11,2020-11-30
