Data Row,Search Keyword,Platform,Job ID,Job Title,Tracking ID,Company Name,Location,Industry,Job Description,Employment Type,Company URL,Job URL,Job Age,Job Age Number,Job Date,Collection Date
165,primary school teacher,LinkedIn,2321449465,Secondary Teacher French (maternity leave cover),5EO5xjViTDSmJxFDDxFRHA==,Amity International School,"Amsterdam, North Holland, Netherlands","['Primary/', 'Secondary Education']","THIS IS A TEMPORARY FULLTIME POSITION, START DATE 1 FEBRUARY 2021, , Amity International School is a dynamic and exciting school environment We are looking for an enthusiastic and passionate Secondary French Teacher to cover a maternity leave until the end of this school year The role also involves some teaching of French in the Primary School for our native French speaking students and for students who are learning French as a second or third language This will be in collaboration with the Primary School French Teacher, , You have a unique opportunity to join an exceptional and hardworking team with the united goal of ensuring that every child reaches their potential both academically and socially, by pushing boundaries and broadening horizons, , Established more than 25 years ago, the notforprofit Amity Education Group has an enrolment of 150,000 students, 4500 faculty, 17 topranked schools and preschools, 5 universities with campuses in Dubai, Abu Dhabi, India, London, Singapore, Mauritius, China and Romania, offering globally benchmarked education from nursery to PhD level Amity International School Amsterdam is the companys flagship European school, , Amity International School Amsterdam is an educational institution in a scaleup phase seeking IB accreditation during the coming year Whilst having big ambitions for the future, the school is operating on a small scale at the present time Our vision is, Empowering each individual to thrive and make a positive difference, , Teaching staff, , We are seeking an enthusiastic professional with experience of delivering a conceptdriven, inquirybased curriculum, preferably with experience of the International Baccalaureate The successful applicant will have a strong understanding of the needs of Middle School education and heshe will have the capability to deliver a high standard of education aligned with the Schools Mission, Vision and Values, , The successful candidate will, , , , Candidate requirements, , , , Remuneration, , We are offering a competitive salary to successful candidates If you are located , internationally minded, permitted to work in the European Union and have the desire to help shape the exciting future of our school, we would be delighted to hear from you, , To apply, , Please click on the APPLY NOW button to complete our online application form and upload your CV and Supporting Statement, , Safeguarding, , Amity International School is committed to safeguarding and promoting the welfare of our students and expect all employees to share this commitment All applications should read the Schools child protection policy and are required to declare any information as requested on the application form Enhanced disclosure with the Disclosure and Barring Service DBS in the UK and a local police certificate will be requested for the successful candidate All staff are expected to update their child protection training each year, , Apply by 30th of November, , We advise applicants to apply early to avoid disappointment The school will review applications as they are received and reserves the right to appoint before the closing date",Temporary,https://www.linkedin.com/jobs/view/externalApply/2321449465?url=https%3A%2F%2Fjoblift%2Enl%2Fdetails%2Fa7ccde31-9c69-43bc-bbca-dbc79dbf49ef%3Fjid%3D0f403f6e8ab5a006260685224e6d53c26b5fc0658e3be72e75aabaecfae59bcb%26utm_source%3Dlinkedin_nl%26utm_medium%3Dexternal_feed%26utm_campaign%3D126&urlHash=z2e3&refId=99c3572d-dfdb-4471-a41f-fc6848ad7fb0&trk=public_jobs_apply-link-offsite,https://nl.linkedin.com/jobs/view/secondary-teacher-french-maternity-leave-cover-at-amity-international-school-2321449465?refId=99c3572d-dfdb-4471-a41f-fc6848ad7fb0&position=15&pageNum=6&trk=public_jobs_job-result-card_result-card_full-click,2 months ago,2 months ago,2020-10-11,2020-11-30
166,primary school teacher,LinkedIn,2324505317,Docent Engels (HBO) | Nijmegen | Devocare B.V.,XKXaG2g5RjKawuR/Zxf+1w==,Werkzoekennl,"Nijmegen, Gelderland, Netherlands","['Primary/', 'Secondary Education', 'Higher Education', 'Education Management']","Vacature van Devocare BV, locatie Nijmegen, , Bevoegd tot het lesgeven op HAVOVWObovenbouw en HBO, , Ben jij die docent die op zoek is naar een nieuwe uitdaging Reageer dan snel op deze vacature, , Wil je meer informatie over de vacature Bel dan met Devocare, 0850471700 Wil je meer informatie over onze organisatie Kijk dan op voor al onze onderwijs vacatures, , , , Beschik jij over een eerstegraads bevoegdheid voor het vak Engels en is lesgeven helemaal jouw cup of tea Dan zijn wij op zoek naar jou We zoeken doorlopend docenten Engels voor het HBO in de regio Nijmegen Het aantal lesuren is bespreekbaar en afhankelijk van jouw beschikbaarheid De omvang van de vacatures die we van onderwijsinstellingen ontvangen zijn divers, van 1 tot 5 dagen, , 5cd8a0b9cc68f9ffa4c9253553278a55",Full-time,https://www.linkedin.com/jobs/view/externalApply/2324505317?url=https%3A%2F%2Fwww%2Ewerkzoeken%2Enl%2F1857_devocare-bv%2Fvacatures%2F5006045_docent-engels-hbo%2F%3Fsource%3D5cd8a0b9cc68f9ffa4c9253553278a55%26utm_source%3Dlinkedin%26utm_medium%3Dreferral%26utm_campaign%3Dlinkedin_referral_vertical_vac_feed%26utm_term%3Deducation%2Bnijmegen&urlHash=QJlh&refId=99c3572d-dfdb-4471-a41f-fc6848ad7fb0&trk=public_jobs_apply-link-offsite,https://nl.linkedin.com/jobs/view/docent-engels-hbo-nijmegen-devocare-b-v-at-werkzoeken-nl-2324505317?refId=99c3572d-dfdb-4471-a41f-fc6848ad7fb0&position=16&pageNum=6&trk=public_jobs_job-result-card_result-card_full-click,2 months ago,2 months ago,2020-10-11,2020-11-30
167,primary school teacher,LinkedIn,2320869299,Docent Engels - Bonhoeffer College,EvFQbnWuSxujvPRVsCIA/Q==,Nederland Vacature Groep,"Enschede, Overijssel, Netherlands","['Nonprofit Organization Management', 'Higher Education', 'Education Management']","Bedrijfsprofiel, Meer informatie over het Bonhoeffer College in Enschede vind je op wwwbcenschedenl, , Bonhoeffer College is een Carmelschool Stichting Carmelcollege verbindt VOscholen in heel Nederland, Alle vacatures bij deze stichting vind je hier, , , , Je geeft lessen Engels aan leerlingen van het vmbo op locatie Wethouder Beversstraat in Enschede, Op onze locatie bieden we DOENonderwijs De theorielessen proberen we zoveel mogelijk aan te passen aan de leefwereld van onze leerlingen, , , Je beschikt over een tweedegraads onderwijsbevoegdheid voor het vak Engels Je hebt affiniteit met onze doelgroep vmbo en vindt het een uitdaging om met deze leerlingen te werken De Wethouder Beverstraat daagt jongeren uit in haar DOEN onderwijs Maar de leerlingen, de docenten ook Daarom is het zeer belangrijk dat je stevig in je schoenen staat en beschikt over uitstekende pedagogische en didactische vaardigheden, , Je bent flexibel, geduldig en in staat om leerlingen positief te benaderen Je bent resultaatgericht en hebt gevoel voor humor Door jouw manier van lesgeven weet je leerlingen te boeien en te inspireren voor het vak Engels, Je hebt affiniteit met jongeren en vindt het leuk om hen op een afwisselende manier mee te nemen in je vak Je bent in staat om de lesstof af te stemmen op het tempo en het niveau van de leerlingen Doordat je je goed kunt verplaatsen in de belevingswereld van de leerlingen ontstaat er bovendien een prettige leer en werksfeer Je hebt een enthousiaste persoonlijkheid, je denkt in mogelijkheden en oplossingen en bent een teamplayer, , , Het Bonhoeffer College is een interconfessionele scholengemeenschap die alle onderwijsvormen aanbiedt De school is gevestigd op zes locaties in Enschede Hierdoor zijn kleinschaligheid en persoonlijke aandacht voor elke leerling gewaarborgd, , Het Bonhoeffer College biedt onderwijs van hoge kwaliteit waarin het optimale uit leerlingen wordt gehaald We zien onze taak en opdracht breder dan alleen het overdragen van kennis, inzicht en vaardigheden We willen in het belang van de leerling n docent een school zijn met een inspirerend leer en leefklimaat waarin leerlingen zich breed kunnen ontwikkelen en uitgedaagd worden tot actief en zelfstandig leren, , Op de Wethouder Beversstraat wordt vmbo BK onderwijs verzorgd De Wethouder Beversstraat is onderverdeeld in de sectoren Techniek, Zorg en Welzijn, MT, MVI, HBR en Economie, , , Het betreft een tijdelijke, parttime baan 0,7 fte Ingangsdatum per direct Aangezien we jou optimaal willen begeleiden en ondersteunen in de eerste fase van je dienstverband, stellen we een begeleidingstraject op maat vast en sluiten de duur van het dienstverband hier op aan, , De arbeidsvoorwaarden zijn overeenkomstig de CAO VO Je ontvangt een salaris van maximaal 4301 euro bruto per maand bij een volledige werkweek schaal LB, , Daarnaast ontvang je een eindejaarsuitkering, 8 vakantietoeslag, pensioenregeling, reiskostenvergoeding, korting op premie ziektekostenverzekering en diverse andere voordelen, , Het Bonhoeffer College maakt deel uit van Stichting Carmelcollege Werken bij Carmel betekent werken bij een werkgever met een aantrekkelijk loopbaanbeleid, , , Meer informatie over de inhoud van de functie is te verkrijgen bij, Contactpersoon Dhr Stephan Steunenberg, Functie Teamleider, Telefoon 053  750 47 00, , , Wij ontvangen jouw sollicitatie graag zo spoedig mogelijk bij voldoende reacties wordt de vacature offline gehaald en is het niet meer mogelijk te reageren, , 2e graadsSchaal LB, maximaal 4301, euro bruto per maand bij een volledige baan, Voor meer informatie bekijk onze bedrijfspagina klik op ons logo bovenaan de vacature, , , Solliciteer direct, , ",Full-time,https://www.linkedin.com/jobs/view/externalApply/2320869299?url=https%3A%2F%2Fnederlandvacature%2Enl%2Fvacature%2Fdocent-engels-bonhoeffer-college-in-enschede%2F251401%2F%3Futm_source%3Dxmlfeed_linkedin%26utm_medium%3Dwebsite%26utm_campaign%3D33903&urlHash=_P5b&refId=99c3572d-dfdb-4471-a41f-fc6848ad7fb0&trk=public_jobs_apply-link-offsite,https://nl.linkedin.com/jobs/view/docent-engels-bonhoeffer-college-at-nederland-vacature-groep-2320869299?refId=99c3572d-dfdb-4471-a41f-fc6848ad7fb0&position=17&pageNum=6&trk=public_jobs_job-result-card_result-card_full-click,2 months ago,2 months ago,2020-10-11,2020-11-30
168,primary school teacher,LinkedIn,2307392247,Docent Engels,XyYyjaJxSD+NGofx3i3kLA==,de Detacheerders,"Amsterdam, North Holland, Netherlands","['Primary/', 'Secondary Education']","Functie, , In deze functie ga je circa 12 uren les geven aan 2 havo 5, 1 vwo 5 en 1 vwo 6 klas De lessen staan ingeroosterd op de maandag, woensdag en donderdag Deze functie betreft een ziektevervanging De verwachting is dat de vervanging in elk geval nodig is tot 22 januari 2021, , Functieeisen, , , , Aanbod, , De Detacheerders biedt uitstekende arbeidsvoorwaarden afhankelijk van je leeftijd en ervaring In overleg met jou zorgen we ervoor dat je goed wordt ingeschaald conform de CAO Onderwijs Daarnaast vinden wij een goede samenwerking met zowel onze docenten als onze opdrachtgevers belangrijk Dit doen we door korte lijntjes, persoonlijk contact en werken we op basis van wederzijds vertrouwen",Full-time,https://www.linkedin.com/jobs/view/externalApply/2307392247?url=https%3A%2F%2Fjoblift%2Enl%2Fdetails%2F08357b13-0037-4c4c-8819-61bf0dc287fd%3Fjid%3Df3504312533ee7bb20ff57d0e46ff2f769652b70b867c567526c7f30e08e3d44%26utm_source%3Dlinkedin_nl%26utm_medium%3Dexternal_feed%26utm_campaign%3D126&urlHash=79EW&refId=99c3572d-dfdb-4471-a41f-fc6848ad7fb0&trk=public_jobs_apply-link-offsite,https://nl.linkedin.com/jobs/view/docent-engels-at-de-detacheerders-2307392247?refId=99c3572d-dfdb-4471-a41f-fc6848ad7fb0&position=18&pageNum=6&trk=public_jobs_job-result-card_result-card_full-click,2 months ago,2 months ago,2020-10-11,2020-11-30
169,primary school teacher,LinkedIn,2323559421,Docent Engels | Doetinchem | Derec,LibbrXwzT5aoeR9hGFKM4Q==,Werkzoekennl,"Doetinchem, Gelderland, Netherlands","['Primary/', 'Secondary Education', 'Higher Education', 'Education Management']","Vacature van Derec, locatie Doetinchem, , Als docent op deze school heb je echt hart voor het onderwijs Je houdt te allen tijde de persoonlijke ontwikkeling van de leerlingen in het zicht en begeleidt hen in dit proces Je weet de leerlingen het onderwijs op maat te bieden waardoor zij echt op hun eigen tempo aan het werk kunnen Je komt terecht in een hecht team van betrokken collegas en bent dan ook sterk in teamverband Je gaat voor 0,60,8 fte aan de slag met de verschillende jaarlagen van het vmbo en ervaring met deze leerlingen is een pre, , , , , 5cd8a0b9cc68f9ffa4c9253553278a55",Full-time,https://www.linkedin.com/jobs/view/externalApply/2323559421?url=https%3A%2F%2Fwww%2Ewerkzoeken%2Enl%2F3049_derec%2Fvacatures%2F5001131_docent-engels%2F%3Fsource%3D5cd8a0b9cc68f9ffa4c9253553278a55%26utm_source%3Dlinkedin%26utm_medium%3Dreferral%26utm_campaign%3Dlinkedin_referral_vertical_vac_feed%26utm_term%3Deducation%2Bdoetinchem&urlHash=hg6R&refId=99c3572d-dfdb-4471-a41f-fc6848ad7fb0&trk=public_jobs_apply-link-offsite,https://nl.linkedin.com/jobs/view/docent-engels-doetinchem-derec-at-werkzoeken-nl-2323559421?refId=99c3572d-dfdb-4471-a41f-fc6848ad7fb0&position=19&pageNum=6&trk=public_jobs_job-result-card_result-card_full-click,2 months ago,2 months ago,2020-10-11,2020-11-30
170,primary school teacher,LinkedIn,2326772932,Docent Engels 1e gr. - Baudartius College,KjFlUv5UQ1OZAvWFbHtK5g==,Nederland Vacature Groep,"Zutphen, Gelderland, Netherlands","['Nonprofit Organization Management', 'Higher Education', 'Education Management']","Bedrijfsprofiel, Het Baudartius College is een christelijke scholengemeenschap voor mavo, havo, atheneum en gymnasium met het predikaat Bta Excellent, CultuurProfielschool en SportAccentschool In het kader van de Wet Passend Onderwijs heeft school het profiel Begeleidingsschool Het BC biedt een respectvolle, veilige, uitdagende en zorgzame leeromgeving, waarin zowel leerlingen als medewerkers hun talenten kunnen ontwikkelen en zich kunnen onderscheiden, Vind jij het leuk om inspirerende en uitdagende lessen Engels aan te bieden aan leerlingen van de bovenbouw havovwo Ben jij een kei in het leveren van maatwerk zodat elke leerling zich maximaal kan ontwikkelen Ben jij de docent die lesgeeft met plezier en breng je dat ook over aan je leerlingen en is samenwerken met leerlingen, ouders en collegas voor jou vanzelfsprekend, Dan is het Baudartius op zoek naar jou, , Ben je momenteel studerend voor je eerste graad dan nodigen wij je ook van harte uit om te solliciteren, , Het betreft een tijdelijke vervangingsaanstelling met ingangsdatum eind januari tm einde schooljaar, De functie wordt gewaardeerd op basis van de CAO VO Daarnaast heeft Achterhoek VO een aantal aantrekkelijke secundaire arbeidsvoorwaarden voor haar medewerkers vastgelegd en wij bieden goede begeleiding voor nieuwe en startende docenten, Voor meer informatie bekijk onze bedrijfspagina klik op ons logo bovenaan de vacature, , , Solliciteer direct, , ",Full-time,https://www.linkedin.com/jobs/view/externalApply/2326772932?url=https%3A%2F%2Fnederlandvacature%2Enl%2Fvacature%2Fdocent-engels-1e-gr-baudartius-college-in-zutphen%2F252693%2F%3Futm_source%3Dxmlfeed_linkedin%26utm_medium%3Dwebsite%26utm_campaign%3D33903&urlHash=3JgU&refId=99c3572d-dfdb-4471-a41f-fc6848ad7fb0&trk=public_jobs_apply-link-offsite,https://nl.linkedin.com/jobs/view/docent-engels-1e-gr-baudartius-college-at-nederland-vacature-groep-2326772932?refId=99c3572d-dfdb-4471-a41f-fc6848ad7fb0&position=20&pageNum=6&trk=public_jobs_job-result-card_result-card_full-click,2 months ago,2 months ago,2020-10-11,2020-11-30
171,primary school teacher,LinkedIn,2323851869,"Docent Engels 2e graads 0,8 fte",P8R7K2zDT6yV2AOLRta3VA==,Kennemer College,"Heemskerk, North Holland, Netherlands",None,"Wij zijn de school waar je wilt zijn Voor na de kerstvakantie zijn we op zoek naar een enthousiaste docent Engels 2e graads voor 0,8 fte verdeeld over vier dagen Je bent inzetbaar in de onder en bovenbouw en maakt deel uit van een vaksectie en een afdelingsteam Afhankelijk van je ervaring kan je worden gevraagd voor een mentoraat van een klas Je hebt een passie voor het onderwijs, een grote betrokkenheid bij de leeftijdsgroep en bent in het bezit van een relevante onderwijsbevoegdheid of in opleiding hiervoor Daarbij heb je affiniteit met ICT en digitaal lesmateriaal We gaan ervan uit dat je graag samenwerkt en wil werken aan je eigen ontwikkeling in samenspraak met je teamleider, vaksectie en coach Meer informatie over de school vind je op beroepsgerichtkennemercollegenl Wij bieden een tijdelijk dienstverband met uitzicht op een vaste aanstelling Het salaris is conform de cao vo",Full-time,https://www.linkedin.com/jobs/view/externalApply/2323851869?url=https%3A%2F%2Fwww%2Evacatures%2Enl%2Fvacature%2Fdocent-engels-2e-graads-0-8-fte%3A44401040%2F&urlHash=HlDv&refId=99c3572d-dfdb-4471-a41f-fc6848ad7fb0&trk=public_jobs_apply-link-offsite,https://nl.linkedin.com/jobs/view/docent-engels-2e-graads-0-8-fte-at-kennemer-college-2323851869?refId=99c3572d-dfdb-4471-a41f-fc6848ad7fb0&position=21&pageNum=6&trk=public_jobs_job-result-card_result-card_full-click,2 months ago,2 months ago,2020-10-11,2020-11-30
172,primary school teacher,LinkedIn,2323563009,Docent Engels | Doetinchem | Derec,Q8MKV+EUQ+6BsZcOSOvm+A==,Werkzoekennl,"Doetinchem, Gelderland, Netherlands","['Primary/', 'Secondary Education', 'Higher Education', 'Education Management']","Vacature van Derec, locatie Doetinchem, , Voor de onderbouwklassen van de havo zijn op zoek naar een tweedegraads docent Engels die vanaf augustus kan beginnen Je gaat hier voor 0,4 fte aan de slag en en weet de lesstof goed op maat aan te bieden Omdat jij oog hebt voor de individuele ontwikkeling van de leerlingen is dit voor jou een eitje Binnen het team is er altijd ruimte om met elkaar te sparren en te overleggen Zo sta je er dan ook nooit alleen voor, , , , , 5cd8a0b9cc68f9ffa4c9253553278a55",Full-time,https://www.linkedin.com/jobs/view/externalApply/2323563009?url=https%3A%2F%2Fwww%2Ewerkzoeken%2Enl%2F3049_derec%2Fvacatures%2F5001004_docent-engels%2F%3Fsource%3D5cd8a0b9cc68f9ffa4c9253553278a55%26utm_source%3Dlinkedin%26utm_medium%3Dreferral%26utm_campaign%3Dlinkedin_referral_vertical_vac_feed%26utm_term%3Deducation%2Bdoetinchem&urlHash=sKsb&refId=99c3572d-dfdb-4471-a41f-fc6848ad7fb0&trk=public_jobs_apply-link-offsite,https://nl.linkedin.com/jobs/view/docent-engels-doetinchem-derec-at-werkzoeken-nl-2323563009?refId=99c3572d-dfdb-4471-a41f-fc6848ad7fb0&position=22&pageNum=6&trk=public_jobs_job-result-card_result-card_full-click,2 months ago,2 months ago,2020-10-11,2020-11-30
173,primary school teacher,LinkedIn,2312726978,Docent Engels - SG De Waerdenborch,1ASupdH4S6i7KCfN1rLJ3A==,Nederland Vacature Groep,"Holten, Overijssel, Netherlands","['Nonprofit Organization Management', 'Higher Education', 'Education Management']","Bedrijfsprofiel, De Waerdenborch is een openbare scholengemeenschap voor Vwo, Havo, en Vmbo De hoofdvestiging is in Holten, de nevenvestiging is in Goor De Waerdenborch vervult een streekfunctie De beide vestigingen zijn vanuit de regio bereikbaar met de bus en de trein Veel leerlingen komen op de fiets naar school Binnen De Waerdenborch zijn acht afdelingen te onderscheiden Elke afdeling kan worden gezien als een kleine school waarbinnen het dagelijks onderwijs voor de leerling wordt verzorgd De afdelingen zijn weer ondergebracht in drie sectoren, die worden geleid door een lid van de schoolleiding Op deze manier kan het onderwijs in de verschillende afdelingen en sectoren goed op elkaar worden afgestemd De schoolleiding verricht haar werkzaamheden onder verantwoordelijkheid van het bevoegd gezag van de school Stichting Openbaar Voortgezet Onderwijs De Waerdenborch, Scholengemeenschap De Waerdenborch is vanaf januari 2021 op zoek naar een, , , , , , , De lessen worden gegeven in Holten, Aan de klassen havo onderbouw, Inschaling vindt plaats conform CAO VO, , Goede docenten zijn en blijven de kwaliteitsbepalers voor goed onderwijs Daarom zoeken wij docenten die leerlingen weten te stimuleren, een rolmodel zijn, oog hebben voor individuele talenten en bijdragen aan de persoonlijke groei en ontwikkeling van leerlingen, , , Voor meer informatie bekijk onze bedrijfspagina klik op ons logo bovenaan de vacature, , , Solliciteer direct, , ",Full-time,https://www.linkedin.com/jobs/view/externalApply/2312726978?url=https%3A%2F%2Fnederlandvacature%2Enl%2Fvacature%2Fdocent-engels-sg-de-waerdenborch-in-holten%2F252522%2F%3Futm_source%3Dxmlfeed_linkedin%26utm_medium%3Dwebsite%26utm_campaign%3D33903&urlHash=WqCA&refId=99c3572d-dfdb-4471-a41f-fc6848ad7fb0&trk=public_jobs_apply-link-offsite,https://nl.linkedin.com/jobs/view/docent-engels-sg-de-waerdenborch-at-nederland-vacature-groep-2312726978?refId=99c3572d-dfdb-4471-a41f-fc6848ad7fb0&position=23&pageNum=6&trk=public_jobs_job-result-card_result-card_full-click,2 months ago,2 months ago,2020-10-11,2020-11-30
174,primary school teacher,LinkedIn,2309146395,Docent Engels,wiXEODpNS96ED7l5/ut9mg==,Maris College,"Den Haag, South Holland, Netherlands",None,In verband met zwangerschapsvervanging zijn wij voor onze locatie Belgisch Park op zoek naar een 1ste2de graads docent Engels bovenbouw havovwo voor 21 lesuren,Full-time,https://www.linkedin.com/jobs/view/externalApply/2309146395?url=https%3A%2F%2Fwww%2Evacatures%2Enl%2Fvacature%2Fdocent-engels%3A44233624%2F&urlHash=4L0D&refId=99c3572d-dfdb-4471-a41f-fc6848ad7fb0&trk=public_jobs_apply-link-offsite,https://nl.linkedin.com/jobs/view/docent-engels-at-maris-college-2309146395?refId=99c3572d-dfdb-4471-a41f-fc6848ad7fb0&position=24&pageNum=6&trk=public_jobs_job-result-card_result-card_full-click,2 months ago,2 months ago,2020-10-11,2020-11-30
175,primary school teacher,LinkedIn,2324508271,Docent Engels (HBO) | Den Bosch | Devocare B.V.,Zs1Ygq3kS7e0MM5ziSSAiA==,Werkzoekennl,"sHertogenbosch, North Brabant, Netherlands","['Primary/', 'Secondary Education', 'Higher Education', 'Education Management']","Vacature van Devocare BV, locatie Den Bosch, , Bevoegd tot het lesgeven op HAVOVWObovenbouw en HBO, , Ben jij die docent die op zoek is naar een nieuwe uitdaging Reageer dan snel op deze vacature, , Wil je meer informatie over de vacature Bel dan met Devocare, 0850471700 Wil je meer informatie over onze organisatie Kijk dan op voor al onze onderwijs vacatures, , , , Beschik jij over een eerstegraads bevoegdheid voor het vak Engels en is lesgeven helemaal jouw cup of tea Dan zijn wij op zoek naar jou We zoeken doorlopend docenten Engels voor het HBO in de regio Den Bosch Het aantal lesuren is bespreekbaar en afhankelijk van jouw beschikbaarheid De omvang van de vacatures die we van onderwijsinstellingen ontvangen zijn divers, van 1 tot 5 dagen, , 5cd8a0b9cc68f9ffa4c9253553278a55",Full-time,https://www.linkedin.com/jobs/view/externalApply/2324508271?url=https%3A%2F%2Fwww%2Ewerkzoeken%2Enl%2F1857_devocare-bv%2Fvacatures%2F5005850_docent-engels-hbo%2F%3Fsource%3D5cd8a0b9cc68f9ffa4c9253553278a55%26utm_source%3Dlinkedin%26utm_medium%3Dreferral%26utm_campaign%3Dlinkedin_referral_vertical_vac_feed%26utm_term%3Deducation%2Bden%2Bbosch&urlHash=c40K&refId=99c3572d-dfdb-4471-a41f-fc6848ad7fb0&trk=public_jobs_apply-link-offsite,https://nl.linkedin.com/jobs/view/docent-engels-hbo-den-bosch-devocare-b-v-at-werkzoeken-nl-2324508271?refId=99c3572d-dfdb-4471-a41f-fc6848ad7fb0&position=25&pageNum=6&trk=public_jobs_job-result-card_result-card_full-click,2 months ago,2 months ago,2020-10-11,2020-11-30
