Data Row,Search Keyword,Platform,Job ID,Job Title,Tracking ID,Company Name,Location,Industry,Job Description,Employment Type,Company URL,Job URL,Job Age,Job Age Number,Job Date,Collection Date
125,sale,LinkedIn,2261161625,Category Manager | 40 uur,Hqi1olWQScWSxZOFvHBMqw==,Nederland Vacature Groep,"Valkenswaard, North Brabant, Netherlands",['Human Resources'],"The gap between whats expected and what you deliver is where the magic happens, , Het leven is zo mooi, daar wil je toch zoveel mogelijk van genieten Van lk moment dus, ook van de dagelijkse klusjes Brabantia helpt daar graag bij, met prachtige producten die prettig in gebruik n duurzaam zijn Zo maken we het leven, maar ook onze planeet een beetje mooier En carrires trouwens ook, , Met ongeveer 1000 Brabantianen zorgen we voor de wereldwijde productie, marketing, verkoop en distributie van onze Designed for Living producten In onze Value Factory creren we de inspirerende en verrassende concepten, die de kwaliteit van het alledaagse leven keer op keer een beetje beter en leuker maken De Value Factory bestaat uit 25 diverse brand, marketing en productinnovatie enthousiastelingen en is gevestigd in Valkenswaard We hebben versterking nodig en kijken dan ook uit naar de komst van een, , , , Category Manager ofwel DE functie als je van entreployeeship, verbeteren, vernieuwen, proactiviteit en strategie warm wordt Verbeteren van de kwaliteit van het alledaagse leven is niet gemakkelijk, maar toch krijgen we het al meer dan 100 jaar voor elkaar Hoe kunnen we onze consument verleiden Dat doen we door te kijken naar de vraag achter de vraag we geven de consumenten wat zij willen, niet wat jij denkt dat ze willen Onderzoeken, creren, communiceren, vermarkten en plezier zijn de kernwoorden van deze functie Je bent medeverantwoordelijk voor het strategische plan van een van de categorien Je identificeert trends, marktkansen, klantbehoeften en wensen, die aansluiten bij de visie en missie van ons bedrijf Je vertaalt deze behoeften naar originele product en marketingconcepten om vervolgens tot een compleet businessplan te komen Van strategisch conceptueel tot pragmatisch operationeel, het werkgebied van een ambitieuze ondernemer, , Om dit plan uit te voeren heb je steeds wisselende projectteams tot je beschikking designers, engineers, sales, inkoop, productie Ook werk je samen met externe bureaus Je rapporteert aan de Lead Category Manager, die je sparringpartner is, maar die ook door jou uitgedaagd wil worden, Je bent duidelijk een conceptdenker met een ondernemende geest, die een beetje eigenwijs is Niet te eigenwijs, want daarvan hebben we er al voldoende Je bruist van ideen om onze concepten verleidelijker te maken Je hebt minimaal een HBO opleiding in een commercieel gerelateerde opleiding en een crush voor lifestyle producten en je wilt net als de rest van ons het leven wat aangenamer en plezierig maken met prachtige producten Je bent nieuwsgierig, kijkt verder dan je neus lang is en durft kritische vragen te stellen Je bent bevlogen, je doorziet problemen en je weet je ideen krachtig met lef en met veel enthousiasme te brengen, Wij bieden je een kans om een zichtbare bijdrage te leveren aan het vernieuwende Brabantia We betalen je voor je lef en je eigenwijsheid, om slimme en duurzame concepten te ontwikkelen en iedere dag te leren in een omgeving die stimuleert en motiveert en waarin je net zoveel verantwoordelijkheid krijgt als JIJ aankunt Onze cultuur is open, eerlijk en direct, met ruimte voor bijna alles, , , , Denk je de juiste persoon te zijn voor deze functie, overtuig ons en mail je CV en motivatie naar hrmbrabantiacom Voor meer informatie over de functie kun je contact opnemen met de Lead Category Manager, Robert Engels robertengelsbrabantiacom Voor meer informatie verwijzen wij je naar onze website wwwbrabantiacom",Full-time,https://www.linkedin.com/jobs/view/externalApply/2261161625?url=https%3A%2F%2Fnederlandvacature%2Enl%2Fvacature%2Fcategory-manager-40-uur-in-valkenswaard%2F248080%2F%3Futm_source%3Dxmlfeed_linkedin%26utm_medium%3Dwebsite%26utm_campaign%3D40356&urlHash=Je1W&refId=cb359075-5f93-4faa-9deb-162a463b2af6&trk=public_jobs_apply-link-offsite,https://nl.linkedin.com/jobs/view/category-manager-40-uur-at-nederland-vacature-groep-2261161625?refId=cb359075-5f93-4faa-9deb-162a463b2af6&position=25&pageNum=4&trk=public_jobs_job-result-card_result-card_full-click,2 days ago,2 days ago,2020-11-28,2020-11-30
126,sale,LinkedIn,2305249498,Commercieel medewerker binnendienst,AfUOR4MwSUmMgUHo8POsbg==,KeenDelivery,"Veenendaal, Utrecht, Netherlands","['Transportation/', 'Trucking/', 'Railroad', 'Retail']","Heb jij een vlotte babbel, ben je enthousiast en schuilt er een echte verkoper in jou Dan is de functie van commercieel medewerker binnendienst bij KeenDelivery jou op het lijf geschreven, , Commercieel medewerker binnendienst bij KeenDelivery",Full-time,,https://nl.linkedin.com/jobs/view/commercieel-medewerker-binnendienst-at-keendelivery-2305249498?refId=c8c07874-9014-4d46-9a4a-1d989477c1d6&position=1&pageNum=5&trk=public_jobs_job-result-card_result-card_full-click,2 days ago,2 days ago,2020-11-28,2020-11-30
127,sale,LinkedIn,2295034505,Assistant Countermanager - Bijenkorf Amsterdam,6BHyZBRzQMW0ggKWKhg/TA==,Rituals,"Amsterdam, North Holland, Netherlands","['Internet', 'Retail', 'Financial Services']","ASSISTANT COUNTER MANAGER DE BIJENKORF AMSTERDAM, , DOEL VAN DE FUNCTIE, , Om ervoor te zorgen dat elke klant van onze stijlvolle shop midden in de Bijenkorf een rode loper behandeling krijgt en ons merk ten volle ervaart Die ambitie bereik jij door de ultieme leader by example te zijn Jij bent degene die ervoor zorgt dat jouw team op hoog niveau presteert, door hen  samen met je Counter Manager  in staat te stellen om een excellente service aan onze klanten te bieden Jij stimuleert hun groei en creert een sfeer waarin commercile successen als team worden gevierd, , , , Als Assistant Counter Manager de Bijenkorf Amsterdam zorg jij voor een gezonde dosis klantobsessie in jouw team van retailprofessionals Hoe kunnen jullie de klantervaring naar een hoger niveau tillen En wat is daarna nog meer mogelijk Met welke acties en manieren van werken kan het team de commercile doelstellingen waarmaken of zelfs overtreffen Samen met de Counter Manager bedenk je manieren om de verkoop te stimuleren, de KPIresultaten te verbeteren en onze merkbekendheid te vergroten binnen de Bijenkorf In afwezigheid van de Counter Manager ben jij degene die contact onderhoudt met de Bijenkorf Ook leid je het team door een sterk voorbeeld te zijn en creer je daarmee een sterk gevoel van medeeigenaarschap onder jouw teamgenoten Jij maakt van successen champagnemomenten en gebruikt eerder gemaakte fouten als leerervaringen, om zo het team te inspireren continu te blijven groeien en te verbeteren, , Over continue verbetering gesproken het is aan jullie als management team om een stimulerende leeromgeving te creren waar constructieve feedback de norm is Hierin ben jij als Assistant Counter Manager de echte schakel tussen strategie en praktijk Jij bent degene die de commercile doelstellingen vertaalt naar de vloer Tijdens de dagstart bepaal je uitdagende  maar haalbare  doelen voor de teamleden en moedig je hen gedurende de dag aan om van verkopen een hartverwarmend ritueel te maken Kortom je coacht, inspireert en bekrachtigt het team waar n wanneer je maar kunt Ook ben je samen met de Counter Manager verantwoordelijk voor de Teamsessies en Enopn gesprekken om vertrouwen te kweken en persoonlijke connecties te leggen Daarnaast ben jij degene die de boodschap van Rituals verspreid en zorg je ervoor dat onze principes zoals de stijlrichtlijnen en manier van werken zoals de winkelrituelen en onze verkoopceremonie, maar ook die van de Bijenkorf begrepen, geliefd en opgevolgd worden Tenslotte ondersteun je de Counter Manager met de administratieve processen in de backoffice sorry, maar we kunnen helaas niet zonder, voorraadbeheer en personeelsplanning, , , , , , Were not here to sell you beauty we are here to make you feel good Raymond Cloosterman, CEO Rituals, , Wij zijn een sinds het jaar 2000, opgericht in Amsterdam Het is onze ambitie om op duurzame wijze door te groeien tot de nummer n wereldwijd in luxe cosmetica en deze positie te behouden Vandaag de dag zijn er meer dan 730 winkels gevestigd in 29 landen in Europa, Azi, het MiddenOosten en Noord en ZuidAmerika Ons doel is om 1000 winkels te hebben in 2020, , Door onderdeel te worden van Rituals, zal je een sterke bedrijfscultuur en een ondernemersgeest gaan ervaren, wat jou in staat stelt om een waardevolle carrire op te bouwen Wij geven net zoveel om het welzijn van onze werknemers als die van onze aarde Door hier gepassioneerd naar om te kijken geloven wij oprecht dat we kunnen bijdragen aan een duurzame wereld en zetten wij stappen om onze footprint te beperken Het is onze missie om mensen zich goed te laten voelen en een unieke ervaring te geven Ongeacht welke rol je bij Rituals vervult, lever je een positieve bijdrage aan onze dagelijkse bedrijfsvoering, , , , Als jij degene bent die wij zoeken, twijfel dan niet en verstuur jouw sollicitatie Wij zullen spoedig contact met je opnemen, , , , Acquisitie wordt niet op prijs gesteld, , , , Slow down video",Full-time,https://www.linkedin.com/jobs/view/externalApply/2295034505?url=https%3A%2F%2Fcareers%2Erituals%2Ecom%2Fen-nl%2Fjobs%2Fassistant-countermanager-bijenkorf-amsterdam-4%2F&urlHash=277z&refId=c8c07874-9014-4d46-9a4a-1d989477c1d6&trk=public_jobs_apply-link-offsite,https://nl.linkedin.com/jobs/view/assistant-countermanager-bijenkorf-amsterdam-at-rituals-2295034505?refId=c8c07874-9014-4d46-9a4a-1d989477c1d6&position=2&pageNum=5&trk=public_jobs_job-result-card_result-card_full-click,2 days ago,2 days ago,2020-11-28,2020-11-30
128,sale,LinkedIn,2326695776,Export Cordinator | Leiden | HBO Young Professionals,EUXbTcldSPip+s1dNn0MQg==,Technicusnl,"Leiden, South Holland, Netherlands",['Architecture & Planning'],"Vacature van HBO Young Professionals, locatie Leiden, , Export Cordinator, , Locatie Leiden, ZuidHolland, Vaste baan, 2200  2700, , , , , , , , , , , , Binnen deze handelsorganisatie verbind jij de afdelingen verkoop, inkoop en logistiek De organisatie koopt wereldwijd producten in die zij wereldwijd weer verkopen jij cordineert de complete supply chain Onder je takenpakket vallen oa de volgende werkzaamheden, , , , Onze opdrachtgever is een jonge en snel groeiende internationale handelsorganisatie Zij kopen producten in over heel de wereld en verkopen deze producten ook wereldwijd Ze zijn altijd in beweging en daardoor veranderen processen continue, jij gaat hier op inspelen door actief bezig te zijn met het optimaliseren van het in en verkoopproces, , , Ben jij op zoek naar een gave vervolgstap in jouw commercile loopbaan en wil jij 40 uur aan de slag Voldoe jij aan alle bovenstaande eisen Twijfel dan niet en solliciteer door je CV in Word en salarisindicatie op te sturen via WhatsApp naar 0640100902 of per email naar via de button Solliciteer nu op deze pagina, , 5cd8a0b9cc68f9ffa4c9253553278a55",Full-time,https://www.linkedin.com/jobs/view/externalApply/2326695776?url=https%3A%2F%2Fwww%2Etechnicus%2Enl%2Ftechnische-baan%2F2961_289389_export-cordinator%2F%3Fsource%3D5cd8a0b9cc68f9ffa4c9253553278a55%26utm_source%3Dlinkedin%26utm_medium%3Dreferral%26utm_campaign%3Dlinkedin_referral_vertical_vac_feed%26utm_term%3Darchitecture%2Bleiden&urlHash=6CoZ&refId=c8c07874-9014-4d46-9a4a-1d989477c1d6&trk=public_jobs_apply-link-offsite,https://nl.linkedin.com/jobs/view/export-co%C3%B6rdinator-leiden-hbo-young-professionals-at-technicus-nl-2326695776?refId=c8c07874-9014-4d46-9a4a-1d989477c1d6&position=3&pageNum=5&trk=public_jobs_job-result-card_result-card_full-click,2 days ago,2 days ago,2020-11-28,2020-11-30
129,sale,LinkedIn,2301729321,Accountmanager,raZYbGyITrKLsVS4WbrO9w==,123inktnl,"Nederhorst den Berg, North Holland, Netherlands",['Business Supplies and Equipment'],"123inktnl zoekt een Accountmanager te Nederhorst den Berg MBO geplaatst op 11112020, Word jij onze nieuwe accountmanager, , Met jouw enthousiasme en gedrevenheid kom jij altijd enorm ver Wij zijn binnen 123inktnl op zoek naar een echte doorzetter die de koude acquisitie gaat opzetten en inrichten Jouw voornaamste taak Het genereren van nieuwe business om ons klantenbestand B2B uitbreiden, , , , Het verkoopteam bestaat uit zon 30 commercieel medewerkers binnendienst De buitendienst daarentegen is nog redelijk nieuw Momenteel hebben wij drie accountmanagers die zich bezighouden met onze bestaande, grootste klanten Het doel is het opzetten van een goed accountmanagers team voor zowel de warme als de koude acquisitie De warme acquisitie loopt goed, aan jou de taak om de koude acquisitie vorm te geven Als jij hier al enige korte ervaring in hebt en dit bij 123inktnl wilt gaan uitbreiden, ontvangen wij jou met open armen, , De eerste periode zal je nog voornamelijk op kantoor aan het werk zijn Hier leer jij niet alleen al jouw collegas kennen, maar nemen wij je ook mee in onze manier van werken Je leert op deze manier niet alleen onze systemen, maar ook onze klanten en producten kennen Zodra jij dit onder de knie hebt, ga jij op pad, , In samenwerking met jouw vaste collega op de binnendienst waar jij veel mee schakelt ben jij veel op pad Na een relatiebezoek laat jij jouw collega weten welke afspraken er zijn gemaakt en vraagt naar de juiste informatie voor het volgende bezoek Je bent immers graag onderweg, , , , , , , , , 123inktnl is een bedrijf met veel jonge en ambitieuze medewerkers en een bijzondere bedrijfscultuur Ons team van meer dan 400 mensen werkt hard om onze leidende positie te behouden en te verstevigen Je voelt je bij ons snel op je gemak, want de werksfeer binnen het team van 123inktnl is toegankelijk en informeel En we maken regelmatig tijd vrij voor gezellige borrels en uitjes, , , , Al onze klanten, dat zijn er nogal wat Want 123inktnl is met ruim 2,5 miljoen klanten marktleider als het gaat om de online verkoop van inktcartridges, toners en fotopapier Het gaat dan zowel om particulieren als grote en kleine bedrijven 123inktnl heeft het grootste assortiment printer supplies op voorraad en een enorm snelle levering Onze klanten krijgen de allerbeste service en de voordeligste prijzen, dat dit gewaardeerd wordt blijkt wel uit de beoordelingen die wij jaarlijks van hen ontvangen tijdens de Nationale Thuiswinkel Awards Dit is het resultaat van een beleid waarbij customer service centraal staat bij alles wat we ondernemen Sinds de start van onze webwinkel in 2000 groeiden we explosief We mogen ons n van de succesvolste webwinkels van Nederland noemen Maar we zitten niet stil en zoeken constant naar vernieuwing en verbetering Daar kunnen we jouw hulp en deskundigheid maar al te goed bij gebruiken, , Interesse in de functie van Accountmanager bij 123inktnl regio Nederhorst den Berg, , Reageer nu met je CV en motivatie via de solliciteer button, , Acquisitie naar aanleiding van deze vacature wordt niet op prijs gesteld",Full-time,https://www.linkedin.com/jobs/view/externalApply/2301729321?url=https%3A%2F%2Fwww%2Edebanensite%2Enl%2Fvacature%2Faccountmanager-nederhorst-den-berg%2F235367%2F&urlHash=NDVY&refId=c8c07874-9014-4d46-9a4a-1d989477c1d6&trk=public_jobs_apply-link-offsite,https://nl.linkedin.com/jobs/view/accountmanager-at-123inkt-nl-2301729321?refId=c8c07874-9014-4d46-9a4a-1d989477c1d6&position=4&pageNum=5&trk=public_jobs_job-result-card_result-card_full-click,2 days ago,2 days ago,2020-11-28,2020-11-30
130,sale,LinkedIn,2314428977,Commercieel medewerker,i6wgJWZIT0KEb3MTZ3y6pw==,"Green Career Consult Recruitment en Loopbaancoaching voor Agri, Food en Groene Ruimte","sGravenpolder, Zeeland, Netherlands","['Food & Beverages', 'Food Production', 'Consumer Goods']","Info over het bedrijf, , Voor haar client is Green Career Consult op zoek naar een Commercieel medewerker, , , , Standplaats sGravenpolder  maximaal 1uur reisafstand, , Vakmanschap, ambachtelijkheid en grote betrokkenheid Dat kenmerkt de medewerkers van de TOP Groep Zij zijn een internationaal actieve familieonderneming met een kern van zon 150 vaste medewerkers, verdeeld over 6 bedrijven Top Fresh Service is een groeiende tak binnen de groep en is d leverancier voor geschilde uien binnen de Europese markt aan horeca, groothandel en industrie, , Ben jij de kandidaat waar wij voor TOP Fresh Service naar op zoek zijn, of herken jij je in het vacatureprofiel Wellicht ben je genteresseerd en wil je meer weten over deze uitdagende baan, stuur dan je CV met korte motivatie naar tav de heer Bart van Eikema Hommes senior consultant Agribusiness via mailadres click apply enof neem voor meer informatie telefonisch contact op middels click apply, , Voor meer informatie over Top Fresh Service kijk je op, , , , Functieomschrijving, , Binnen de organisatie ga jij je richten op de onderstaande taken, , Functieeisen, , , , Aanbod, , Een uitdagende baan binnen een groeiende, dynamische en internationale organisatie, Uiteraard wordt een uitstekend salaris en een goed pakket aan secundaire arbeidsvoorwaarden geboden",Full-time,https://www.linkedin.com/jobs/view/externalApply/2314428977?url=https%3A%2F%2Fnl%2Ejooble%2Eorg%2Fexternal%2F6185393826665158994%3Futm_campaign%3DNL%26utm_medium%3Dsocial%26utm_source%3Dlinkedin%26JobSource%3DBoard&urlHash=QkwK&refId=c8c07874-9014-4d46-9a4a-1d989477c1d6&trk=public_jobs_apply-link-offsite,https://nl.linkedin.com/jobs/view/commercieel-medewerker-at-green-career-consult-recruitment-en-loopbaancoaching-voor-agri-food-en-groene-ruimte-2314428977?refId=c8c07874-9014-4d46-9a4a-1d989477c1d6&position=5&pageNum=5&trk=public_jobs_job-result-card_result-card_full-click,2 days ago,2 days ago,2020-11-28,2020-11-30
131,sale,LinkedIn,2279179102,Export Manager,Lig+2fVBTFakW5QfKt9qkQ==,TechMatch BV,"Beesd, Gelderland, Netherlands",['Import and Export'],"Als exportmanager ben je verantwoordelijk voor de verkoop van onze sorteer en verpakinstallaties Je bent in staat om je technische kennis om te zetten in commercile successen, je bent een sterke onderhandelaar, sales gedreven en je adviseert creatieve maatwerkoplossingen aan onze klanten Je bent bereid om regelmatig te reizen om de bestaande relaties te onderhouden en op zoek te gaan naar nieuwe markten en verkoopmogelijkheden",Full-time,https://www.linkedin.com/jobs/view/externalApply/2279179102?url=https%3A%2F%2Fjoblift%2Enl%2Fdetails%2F87d1a44a-1291-4896-a6ec-d4585b59e4a1%3Fjid%3D706f7cd042ec32872659a7447854618f8f763dca916457fe44792a0651ce756d%26utm_source%3Dlinkedin_nl%26utm_medium%3Dexternal_feed%26utm_campaign%3D126&urlHash=XUXJ&refId=c8c07874-9014-4d46-9a4a-1d989477c1d6&trk=public_jobs_apply-link-offsite,https://nl.linkedin.com/jobs/view/export-manager-at-techmatch-b-v-2279179102?refId=c8c07874-9014-4d46-9a4a-1d989477c1d6&position=6&pageNum=5&trk=public_jobs_job-result-card_result-card_full-click,2 days ago,2 days ago,2020-11-28,2020-11-30
132,sale,LinkedIn,2307833937,Sales Manager,bFnmbBZBRmGHmGm0rcrWZw==,Toogethr,"Utrecht, Netherlands",['Information Technology and Services'],De ochtendfile voor velen een standaard begin van de dag Eenmaal op kantoor is het ook vaak zoeken naar een parkeerplaats Herkenbaar Niet als het aan onze toekomstige Sales Business Developer ligt Voor iemand met een ondernemende geest ligt hier een prachtige kans in het verschiet om een mobielere en groenere samenleving te creren,Full-time,,https://nl.linkedin.com/jobs/view/sales-manager-at-toogethr-2307833937?refId=c8c07874-9014-4d46-9a4a-1d989477c1d6&position=7&pageNum=5&trk=public_jobs_job-result-card_result-card_full-click,2 days ago,2 days ago,2020-11-28,2020-11-30
133,sale,LinkedIn,2297798244,Key Account Manager Retail,fj46lx3yRi2lerTGgVsLRw==,Bickery Food Group BV,"sGraveland, North Holland, Netherlands",['Food & Beverages'],"Bickery Food Group BV zoekt een Key Account Manager Retail te HBO geplaatst op 26102020, Ben jij gedreven, resultaatgericht, stressbestendig en ambitieus Heb jij talent voor Sales, een gunfactor, passie voor Food en Drinks en een netwerk binnen Retail, , Bickery Food Group BV is per direct op zoek naar, , FULLTIME Key Account Manager Retail, , Wie zijn wij, , Bickery Food Group BV verzorgt succesvol de verkoop, marketing en distributie van Europese Premium Food  Drink Brands op de Nederlandse markt Tevens zijn we de grootste toeleverancier van innovatieve foodconcepten voor de Kerstpakkettenmarkt Ons hele team bestaat uit 80 enthousiaste collegas Via een eigen distributiecentrum levert Bickery haar afnemers en bedient hiermee de gehele Food  Drinks markt in Retail en Out of Home, , Bekende merken die Bickery vertegenwoordigt zijn oa Tabasco, Bonne Maman, Daim, Vita Coco, Propercorn, Solan de Cabras, Swiss, Maaza en De Olmenhorst Wij bestaan al meer dan 35 jaar, maar dat betekent niet dat alles al vast ligt in standaard processen en verouderde regeltjes Sterker nog, je zult terechtkomen in een team waar creativiteit en het nemen van initiatief en verantwoordelijkheid de norm zijn, , Wat wordt van je verwacht, , Voldoe je aan de volgende voorwaarden, , Wat bieden wij, , , , , Bij vragen kun je contact opnemen met Shella Blancaflor via 035  656 02 44 of 06  23258053, , Interesse in de functie van Key Account Manager Retail bij Bickery Food Group BV regio , , Reageer nu met je CV en motivatie via de solliciteer button, , Acquisitie naar aanleiding van deze vacature wordt niet op prijs gesteld",Full-time,https://www.linkedin.com/jobs/view/externalApply/2297798244?url=https%3A%2F%2Fwww%2Edebanensite%2Enl%2Fvacature%2Fkey-account-manager-retail-s-graveland%2F237236%2F&urlHash=LH2O&refId=c8c07874-9014-4d46-9a4a-1d989477c1d6&trk=public_jobs_apply-link-offsite,https://nl.linkedin.com/jobs/view/key-account-manager-retail-at-bickery-food-group-b-v-2297798244?refId=c8c07874-9014-4d46-9a4a-1d989477c1d6&position=8&pageNum=5&trk=public_jobs_job-result-card_result-card_full-click,2 days ago,2 days ago,2020-11-28,2020-11-30
134,sale,LinkedIn,2316446657,Partner Sales Manager EMEA,d10OPuscSpqnEvI0y06q9A==,Glocomms,"Amsterdam, North Holland, Netherlands",['Information Technology and Services'],"A marketleading Sales Performance Management company, named as a Gartner Magic Quadrant Leader is seeking a Partner Sales Manager to join its team in the Netherlands, , As a Partner Sales Manager, you will be an influential member of their EMEA sales team and be responsible for driving forward business opportunities, as well as building and developing relationships The EMEA team is a tightknit and quickly growing team with diverse backgrounds, that supports each other and achieves common goals as a real team",Full-time,,https://nl.linkedin.com/jobs/view/partner-sales-manager-emea-at-glocomms-2316446657?refId=c8c07874-9014-4d46-9a4a-1d989477c1d6&position=9&pageNum=5&trk=public_jobs_job-result-card_result-card_full-click,2 days ago,2 days ago,2020-11-28,2020-11-30
135,sale,LinkedIn,2320672216,Ecommerce Manager,OcDbxYxFTlmufwjbnUGT+A==,Castelijn  Beerens,"Waalwijk, North Brabant, Netherlands",['Apparel & Fashion'],"Sinds 1945 ontwerpt en produceert Castelijn  Beerens lederwaren in het hart van De Langstraat Inmiddels wordt het familiebedrijf gerund door de 3e generatie Beerens, Babette en Martijn Beerens Het middelgrote bedrijf  gevestigd in Waalwijk  staat bekend om haar vakmanschap en hoogwaardige producten van leer",Full-time,,https://nl.linkedin.com/jobs/view/ecommerce-manager-at-castelijn-beerens-2320672216?refId=c8c07874-9014-4d46-9a4a-1d989477c1d6&position=10&pageNum=5&trk=public_jobs_job-result-card_result-card_full-click,2 days ago,2 days ago,2020-11-28,2020-11-30
136,sale,LinkedIn,2273988986,"Sales Manager - Netherlands, Belgium, Nordics (M/W)",uTTVTLhJTkOGoS0h3MMXgQ==,Abbott,"Hoofddorp, North Holland, Netherlands",['Hospital & Health Care'],"Abbott Making An Everlasting Impact on Human Health for 125 Years, , Abbott is a global health care company devoted to improving life through the development of products and technologies that span the breadth of health care With a portfolio of leading, sciencebased offerings in diagnostics, medical devices, nutritionals and branded generic pharmaceuticals, Abbott serves people in more than 160 countries and employs approximately 107,000 people In 2019, the companys sales exceeded US316 billion, , , , Abbott Point of Care APOC, a 600 million division of Abbott NYSE ABT, enables health care professionals to accurately achieve realtime, labquality diagnostic results at the point of care within minutes Testing at the point of care enables health care professionals to make rapid triage and treatment decisions when diagnosing a patients condition or monitoring a treatment response By simplifying the testing process, clinicians can focus on what matters mostcaring for the patient, , We have an opportunity for a This position impacts Divisions sales, profits and growth goals This position has full commercial responsibility, lead, motivate and drive activities of the sales team to ensure delivery of all identified financial metrics Key responsible and contact person for all issues related to APOC business in the territories assigned, as well as ensuring quality and regulatory compliance",Full-time,https://www.linkedin.com/jobs/view/externalApply/2273988986?url=https%3A%2F%2Fwww%2Ejobs%2Eabbott%2Fus%2Fen%2Fjob%2FABLAUS30961848ENUSEXTERNAL%2FSales-Manager-Netherlands-Belgium-Nordics-M-W%3Futm_source%3Dlinkedin%26utm_medium%3Dphenom-feeds&urlHash=pVJ0&refId=c8c07874-9014-4d46-9a4a-1d989477c1d6&trk=public_jobs_apply-link-offsite,https://nl.linkedin.com/jobs/view/sales-manager-netherlands-belgium-nordics-m-w-at-abbott-2273988986?refId=c8c07874-9014-4d46-9a4a-1d989477c1d6&position=11&pageNum=5&trk=public_jobs_job-result-card_result-card_full-click,2 days ago,2 days ago,2020-11-28,2020-11-30
