Data Row,Search Keyword,Platform,Job ID,Job Title,Tracking ID,Company Name,Location,Industry,Job Description,Employment Type,Company URL,Job URL,Job Age,Job Age Number,Job Date,Collection Date
103,transport,LinkedIn,2309599522,Controller Transport en Logistiek,7KH0/OG9RTafSxf0Lesaxg==,James Woodman,"Amsterdam, North Holland, Netherlands","['Commercial Real Estate', 'Real Estate', 'Investment Management']","Ben jij op zoek naar een uitdaging binnen een internationaalgeorinteerde organisatie Wil jij directrapporteren aan de CFO en doorgroeien binnen een bedrijf Werk jij graag binnen een gezellig team met een informelewerksfeer Aarzel dan niet en solliciteer direct, , , , Voor mijn klant zoek ik een  Mijn klant zit in de wereldwijde transport en logistiek, gevestigd in de regio van Amsterdam Dit bedrijf heeft een waar je met met je collegas Zij bestaan al meer dan 75 jaar en zijn sterk gegroeid en daarom zoeken zij naar jou",Full-time,https://www.linkedin.com/jobs/view/externalApply/2309599522?url=http%3A%2F%2Fwww%2Eexperteer%2Enl%2Fcareer%2Flp%2Fsignup_vertical_full_job%2F1_2018%3Fjob_id%3D23742190%26affiliate%3Daffnl_131%26utm_medium%3Dmetasearch%26utm_source%3Dlinkedin%26utm_content%3Djob&urlHash=aguC&refId=33514f0b-bcd7-40ca-96b8-44cc306847ff&trk=public_jobs_apply-link-offsite,https://nl.linkedin.com/jobs/view/controller-transport-en-logistiek-at-james-woodman-2309599522?refId=33514f0b-bcd7-40ca-96b8-44cc306847ff&position=3&pageNum=4&trk=public_jobs_job-result-card_result-card_full-click,3 days ago,3 days ago,2020-11-26,2020-11-30
104,transport,LinkedIn,2309414412,Customer Service manager Transport,oPEGGLRbTA+1SKlidS/87Q==,KuehneNagel,"Veghel, North Brabant, Netherlands","['Logistics and Supply Chain', 'Package/', 'Freight Delivery', 'Transportation/', 'Trucking/', 'Railroad']","In de functie van Customer Service Manager Logistics acteer je in een Multiclient warehouseomgeving met internationale contacten in de FMCG business en ben je verantwoordelijk voor alle customer service activiteiten ten behoeve van je klanten, Je functie, Je geeft leiding aan een team van 3 FTE De dagelijkse processen worden door de collegas van het customer service team opgepakt van de site specifieke customer service teams en dragen zij uiteindelijk zorg voor tijdige, correcte en juiste administratieve en ondersteunende werkzaamheden ten behoeve van de diverse logistieke processen met als doel een effectieve en efficinte dienstverlening aan onze klanten Standplaats Veghel  36u of 40u, Je verantwoordelijkheden, , , Jouw skills en ervaringen, , , Redenen om bij ons te komen werken, Werken met plezier bij Kuehne  Nagel betekent voor iedere werknemer iets anders, daarom bieden wij een ambitieuze werkomgeving waarin ondernemerschap, ontwikkeling en vooruitgang voorop staan Naast een prima salaris bieden wij ook een reiskostenvergoeding en een goede pensioenregeling Je hebt 24 vakantiedagen en 3,5 atv dagen en je hebt de mogelijkheid om dagen bij te kopen We hanteren flexibele werktijden waardoor je werkprivbalans optimaal is Daarnaast bieden we ook een collectiviteitskorting op je zorgverzekering bij CZ Je start met een jaarcontract met uitzicht op een vast dienstverband Kuehne  Nagel is een goed bedrijf en zoekt betrouwbare medewerkers, daarom screenen wij onze medewerkers aan WLS en vragen wij een VOG",Full-time,https://www.linkedin.com/jobs/view/externalApply/2309414412?url=https%3A%2F%2Fjobs%2Ekuehne-nagel%2Ecom%2Fglobal%2Fen%2Fjob%2Freq65362%3Futm_source%3Dlinkedin&urlHash=LRHg&refId=33514f0b-bcd7-40ca-96b8-44cc306847ff&trk=public_jobs_apply-link-offsite,https://nl.linkedin.com/jobs/view/customer-service-manager-transport-at-kuehne%2Bnagel-2309414412?refId=33514f0b-bcd7-40ca-96b8-44cc306847ff&position=4&pageNum=4&trk=public_jobs_job-result-card_result-card_full-click,3 days ago,3 days ago,2020-11-26,2020-11-30
105,transport,LinkedIn,2285712364,Transport / distributie / multi-temp Planner,c9LpUCOiTvC92hvwH73Rew==,Mller Fresh Food Logistics,"Lekkerkerk, South Holland, Netherlands",None,"Vestiging Lekkerkerk Prins Transport en Prins Op en Overslag Lekkerkerk maakt sinds februari 2018 onderdeel uit van Mller Fresh Food Logistics Prins Transport is een logistieke dienstverlener met specialismen als transport, opslag, handling, orderpicken, VAL activiteiten waaronder invriezen, verpakken, strippen, stuffen van containers en douaneactiviteiten Daarnaast is XDocking en het vervoer van goederen onder geconditioneerde omstandigheden koel, diepvries en licht gekoeld core business De organisatie bestaat uit twee bedrijven, Prins Transport en Prins Op en Overslag en omvat hiermee de gehele fysieke distributieketen Vacature, , Wat bieden wij Werken bij Mller Fresh Food Logistics betekent werken bij een dynamische, ondernemende en snelgroeiende organisatie Onze medewerkers hebben passie voor wat ze doen en zijn gedreven om het onze klanten naar de zin te maken Plezier in het werk, klanten voorthelpen, ontwikkelen en ondernemen typeert de organisatie De werkzaamheden zijn zeer afwisselend en een flexibele instelling is kenmerkend voor onze organisatie Meer impressies vind je op wwwmullernl Wat zijn je werkzaamheden Als planner ben je samen met collega planners verantwoordelijk voor het zo efficint mogelijk inzetten van de chauffeurs, charters en transportmiddelen Je stelt ritten samen op de meest bedrijfseconomische wijze rekening houdend met de klant specifieke eisen en beschikbaarheid van mensen en middelen Daarnaast behoort de controle op de dagelijkse uitvoering en voortgang van de transporten en de begeleiding van de chauffeurs en charters tot je verantwoordelijkheden De werkzaamheden kunnen worden verricht in verschoven diensten met wisselende aanvangstijden, , Wat verwachten wij van je",Full-time,https://www.linkedin.com/jobs/view/externalApply/2285712364?url=https%3A%2F%2Fwww%2Evacatures%2Enl%2Fvacature%2Ftransport-distributie-multi-temp-planner%3A44139524%2F&urlHash=aRS2&refId=33514f0b-bcd7-40ca-96b8-44cc306847ff&trk=public_jobs_apply-link-offsite,https://nl.linkedin.com/jobs/view/transport-distributie-multi-temp-planner-at-m%C3%BCller-fresh-food-logistics-2285712364?refId=33514f0b-bcd7-40ca-96b8-44cc306847ff&position=5&pageNum=4&trk=public_jobs_job-result-card_result-card_full-click,3 days ago,3 days ago,2020-11-26,2020-11-30
106,transport,LinkedIn,2243576118,General Manager,ad+fMKjsSfC9rWHv3z/yCQ==,AGRO Merchants Group,"Westland, South Holland, Netherlands","['Logistics and Supply Chain', 'Food Production', 'Import and Export']","Job summary, The General Manager will be accountable to the Managing Director Netherlands and works closely and effectively together with local team, Managing Director NL, other departmentsfunctions and individuals across the company to ensure that the way of working is in line with AGROs strategy and guidelines",Full-time,,https://nl.linkedin.com/jobs/view/general-manager-at-agro-merchants-group-2243576118?refId=33514f0b-bcd7-40ca-96b8-44cc306847ff&position=6&pageNum=4&trk=public_jobs_job-result-card_result-card_full-click,3 days ago,3 days ago,2020-11-26,2020-11-30
107,transport,LinkedIn,2288367548,Service Delivery Manager (logistics),rRE+s82ISqSKdZNQoqjuLQ==,Uit de Kunst werving  selectie,"Bergen op Zoom, North Brabant, Netherlands","['Apparel & Fashion', 'Import and Export', 'Transportation/', 'Trucking/', 'Railroad']","The Service Delivery Manager is responsible for initially contributing to the defining of a service level agreement with the customers and the subsequent delivery of the services agreed, ensuring agreed transport related objectives, targets and SLAs are achieved The Service Delivery Manager is the first point of contact for customers to simplify communication and ensure maximum customer satisfaction The Service Delivery Manager is directly responsible for managing a small team comprising of operational support, customer service and transport colleagues The location for the Service Delivery Manager is Bergen op Zoom Netherlands",Full-time,,https://nl.linkedin.com/jobs/view/service-delivery-manager-logistics-at-uit-de-kunst-werving-selectie-2288367548?refId=33514f0b-bcd7-40ca-96b8-44cc306847ff&position=7&pageNum=4&trk=public_jobs_job-result-card_result-card_full-click,3 days ago,3 days ago,2020-11-26,2020-11-30
108,transport,LinkedIn,2278720641,Teambegeleider Transport,YOxmZ8eAQRKjnsN/oXNh4A==,Randstad Groep Nederland BV,"Utrecht, Utrecht, Netherlands",['Human Resources'],"Teambegeleider Transport gezocht Een snel groeiend aantal bestellingen foutloos laten picken en bij de online klanten afleveren Als jij denkt dat dat beter kan, dan zoeken we jou als onze nieuwe Teambegeleider Transport bij Jumbo wat bieden wij jou 14 euro bruto per uur Jezelf ontwikkelen binnen de logistiek Fulltime aan het werk wie ben jij Chauffeurs kunnen bij jou terecht Jij beschikt over de",Full-time,https://www.linkedin.com/jobs/view/externalApply/2278720641?url=https%3A%2F%2Fjoblift%2Enl%2Fdetails%2Fed452ea3-06be-4af5-9762-7a71e5742291%3Fjid%3D67a5c8ae7250d8e5c21f4bbaa6e6c6e9fece14b47372eef50826d64f911d54b5%26utm_source%3Dlinkedin_nl%26utm_medium%3Dexternal_feed%26utm_campaign%3D126&urlHash=EAIP&refId=33514f0b-bcd7-40ca-96b8-44cc306847ff&trk=public_jobs_apply-link-offsite,https://nl.linkedin.com/jobs/view/teambegeleider-transport-at-randstad-groep-nederland-bv-2278720641?refId=33514f0b-bcd7-40ca-96b8-44cc306847ff&position=8&pageNum=4&trk=public_jobs_job-result-card_result-card_full-click,3 days ago,3 days ago,2020-11-26,2020-11-30
109,transport,LinkedIn,2325401894,Road Operations Manager - Amsterdam Metropolitan Area,7/eABYt4RTuChKv91VuC5Q==,Talent,"RotterdamThe Hague metropolitan area, South Holland, Netherlands","['Computer Networking', 'Computer & Network Security', 'Telecommunications']","Job Context  Duties, , Manage the customer experience, , Analyse reports provided by passengers, , Implement efficiency plans for logistics operations, , Make independent operating decisions, , Manage computerbased transport operation control systems, , , , Commitment to providing high quality support to colleagues and to meeting deadlines, , Drive for results Ability to take personal responsibility and initiative for delivering work to a high standard of quality within set procedures, , Analysis and Problem Solving Ability to identify the critical facts in difficult issues and develop creative and practical solutions, , Experience of having worked in a similar role, , Working with others Ability to work cooperatively with others in teams and across organisational boundaries and respects differences between people",Full-time,https://www.linkedin.com/jobs/view/externalApply/2325401894?url=https%3A%2F%2Fneuvoo%2Enl%2Fjob%2Ephp%3Fid%3D2e24a7f2b323%26source%3Dlinkedin%26utm_source%3Dpartner%26utm_medium%3Dlinkedin%26puid%3Dfddecadb8ddefddc9adfadd9aadagddeaadefddd3deecdcdfec3ddcg3e&urlHash=Gsne&refId=33514f0b-bcd7-40ca-96b8-44cc306847ff&trk=public_jobs_apply-link-offsite,https://nl.linkedin.com/jobs/view/road-operations-manager-amsterdam-metropolitan-area-at-talent-2325401894?refId=33514f0b-bcd7-40ca-96b8-44cc306847ff&position=9&pageNum=4&trk=public_jobs_job-result-card_result-card_full-click,3 days ago,3 days ago,2020-11-26,2020-11-30
110,transport,LinkedIn,2326814826,OPERATIONS ENGINEER (Sevenstar Yacht Transport) - Amsterdam,HHubvxfqTP++djJ1jHKfPQ==,Spliethoff,"Amsterdam, North Holland, Netherlands",None,"OPERATIONS ENGINEER, , Wie zijn wij, , De Spliethoff Groep, bestaande uit Spliethoff, BigLift Shipping, Transfennica, Sevenstar Yacht Transport, Wijnne  Barends en Bore, is n van de grootste rederijen in Nederland Sinds de oprichting in 1921 heeft Spliethoff binnen de scheepvaartsector een uitstekende reputatie opgebouwd als betrouwbare en innovatieve partner met een enorme kennis en ervaring Ons hoofdkantoor is gevestigd in Amsterdam, , Onze medewerkers, werkzaam op onze kantoren over de hele wereld, aan boord van onze schepen en in de havens zorgen ervoor dat we aan de hoogste eisen voldoen Door deze expertise zijn wij in staat onze klantenservice op maat te bieden, of het nu gaat om het maken van een optimaal stuwplan, supervisie bij het laden en lossen of complexe ladingoperaties, , , , Als Operations Engineer bij Sevenstar Yacht Transport, ben je verantwoordelijk voor alle engineeringactiviteiten van Sevenstar Je bekijkt of aanvragen technisch mogelijk zijn op het gebied van stabiliteit, ruimte, gewicht, hijsmogelijkhedencapaciteit, , , , , , , , Naast een goed salaris en uitstekende secundaire arbeidsvoorwaarden biedt deze baan je een prettige werksfeer binnen een open en positieve bedrijfscultuur",Full-time,https://www.linkedin.com/jobs/view/externalApply/2326814826?url=https%3A%2F%2Fneuvoo%2Enl%2Fjob%2Ephp%3Fid%3D3bf4b0896a12%26source%3Dlinkedin%26utm_source%3Dpartner%26utm_medium%3Dlinkedin%26puid%3Dfdddcade8adafddc9adeaddgadd8gdd7addafadf3defcdcefec3ddcg3e&urlHash=D0lM&refId=33514f0b-bcd7-40ca-96b8-44cc306847ff&trk=public_jobs_apply-link-offsite,https://nl.linkedin.com/jobs/view/operations-engineer-sevenstar-yacht-transport-amsterdam-at-spliethoff-2326814826?refId=33514f0b-bcd7-40ca-96b8-44cc306847ff&position=10&pageNum=4&trk=public_jobs_job-result-card_result-card_full-click,3 days ago,3 days ago,2020-11-26,2020-11-30
111,transport,LinkedIn,2321497322,EMEA Director of Logistics,PUZ7GVgWQr+2ewO9XU1QvA==,Lucid Motors,"Amsterdam, North Holland, Netherlands",['Mining & Metals'],"Leading the future of luxury mobilityLucids mission is to inspire the adoption of sustainable energy by creating the most captivating luxury electric vehicles, centered around the human experience Working at Lucid Motors means having a shared vision to power the future in revolutionary ways Be part of a onceinalifetime opportunity to transform the automotive industryWe are currently seeking a Director of Logistics, EMEA This position requires an experienced professional with the ability to manage, improve and drive the inbound and outbound logistics process, whilst covering customs  trade regulatory environment in the regions The successful candidate will have spent considerable time launching new plants andor new products in an automotive manufacturing environment This position requires partnership with Retail Sales, Service, Supply Chain, QAQC, Manufacturing, Packaging, Engineering, Finance, and Regulatory Affairs to implement new processes and manage changes Our ideal candidate exhibits a cando attitude and approaches his or her work with vigor and determination Candidates will be expected to demonstrate excellence in their respective fields, to possess the ability to learn quickly and to strive for perfection within a fastpaced environment, , The Role",Full-time,https://www.linkedin.com/jobs/view/externalApply/2321497322?url=https%3A%2F%2Fjoblift%2Enl%2Fdetails%2F0911a7c7-daf3-4728-af59-7514c0ea5803%3Fjid%3D13bc1ff684fa83fee2773ccaf67ed22475d94f6a4efb1a5aeaf3c948d841cfcb%26utm_source%3Dlinkedin_nl%26utm_medium%3Dexternal_feed%26utm_campaign%3D126&urlHash=g6o-&refId=33514f0b-bcd7-40ca-96b8-44cc306847ff&trk=public_jobs_apply-link-offsite,https://nl.linkedin.com/jobs/view/emea-director-of-logistics-at-lucid-motors-2321497322?refId=33514f0b-bcd7-40ca-96b8-44cc306847ff&position=11&pageNum=4&trk=public_jobs_job-result-card_result-card_full-click,3 days ago,3 days ago,2020-11-26,2020-11-30
112,transport,LinkedIn,2274024291,Carrier Manager (Fulltime/ 70K),0+4+KHjLTJWeEZiM9ls1Rw==,Suc6 Recruitment,"Venlo, Limburg, Netherlands","['Logistics and Supply Chain', 'Staffing and Recruiting', 'Consumer Goods']","Bachelormasters degree in related field such as Supply Chain Management, Transport, Econometrics or Economics, Over 5 years of work experience, Comfortable with hands on managerial style, but also able to effectively delegate",Full-time,https://www.linkedin.com/jobs/view/externalApply/2274024291?url=https%3A%2F%2Fwww%2Evacatures%2Enl%2Fvacature%2Ftransport-engineer-fulltime%3A43502614%2F&urlHash=Mt_N&refId=33514f0b-bcd7-40ca-96b8-44cc306847ff&trk=public_jobs_apply-link-offsite,https://nl.linkedin.com/jobs/view/carrier-manager-fulltime-70k-at-suc6%21-recruitment-2274024291?refId=33514f0b-bcd7-40ca-96b8-44cc306847ff&position=12&pageNum=4&trk=public_jobs_job-result-card_result-card_full-click,3 days ago,3 days ago,2020-11-26,2020-11-30
113,transport,LinkedIn,2225819395,Director,0i6A6qFvQm6Q8/DcZIn1GA==,Rabobank,"Utrecht, Utrecht, Netherlands",['Banking'],"Director Rabo Corporate Investments  Direct Investments Netherlands, , Imagine, , Our Rabo Corporate Investments RCI department is part of the Global Corporate Clients business unit, within the Wholesale  Rural division of Rabobank RCI currently has circa EUR 1 billion assets under management and has the ambition to grow the asset base to EUR 22 billion in 2023 Direct Investments actively originates transactions in the Netherlands and monitors, adds value and creates cross sell to its existing portfolio of Dutch SME enterprises Being a longterm and sustainable partner for our Dutch and global FA clients we help them transform through growth and innovation with our capital solutions, leveraging on Rabobanks knowledge and network As Director, you will be responsible for originating and executing Direct Investments in the Netherlands ranging from straight equity to subordinated debt A responsibility with impact, which you shape with high energy, work ethic, and desire for excellent execution and team work, , , , , , , , Collaboration is at the heart of everything we do With you as Director and part of the Rabo Corporate Investments RCI department with 30 colleagues in the Netherlands, you will cooperate with diverse colleagues in a variety of roles The team has a hands on approach, focussing on extending our network and cooperating with various teams outside RCI, , , , Being able to work in a complex and matrix environment with a strong market  customer focus and having a strong personality are clearly essential for the role of Director As a senior within Rabobank you take responsibility, facilitate and inspire other team members, you actively seek for in and external collaboration with stakeholders and you make the difference for the community Proactively goes the extra mile, and demonstrates good communication skills In addition, its important that you recognise everything in the checklist below, , , , , Youll already be aware that Rabobank is a financial services provider for more than 85 million customers in 40 countries But did you know that we aim to contribute to real change with our Growing a better world together mission As an equity investor, we leverage and monetise Rabobanks comprehensive, broad and deep expertise and network to support the success of such relevant companies Hence, being an added value partner beyond bringing along capital, , , , Do you want to become the best version of yourself We would love to help you achieve this by continuously focusing on your growth, development and investing in an environment where you keep learning every day We create an environment to innovate and initiate This way, we offer you numerous opportunities to grow, exceed your expectations and to do the right thing exceptionally well In addition, you can also expect on the basis of a 40 hour working week, , , , , , , Are you the person were looking for Are you ready to join Rabobankour team as Director and make a difference to yourself, our customers and to society We look forward to receiving your application for this vacancy in Utrecht",Full-time,https://www.linkedin.com/jobs/view/externalApply/2225819395?url=https%3A%2F%2Frabobank%2Ejobs%2Fen%2Fjob%2Fdirector%2FJR_00033848%2F%3Futm_source%3Dlinkedin%26utm_medium%3Djob_slot%26utm_content%3DJR_00033848%23application-procedure&urlHash=AWxi&refId=33514f0b-bcd7-40ca-96b8-44cc306847ff&trk=public_jobs_apply-link-offsite,https://nl.linkedin.com/jobs/view/director-at-rabobank-2225819395?refId=33514f0b-bcd7-40ca-96b8-44cc306847ff&position=13&pageNum=4&trk=public_jobs_job-result-card_result-card_full-click,3 days ago,3 days ago,2020-11-26,2020-11-30
114,transport,LinkedIn,2326343742,Teambegeleider Transport,ZZSmxmvlSsWfiQRmDinGBA==,Randstad Recruitment Center,"Woerden, Utrecht, Netherlands",['Logistics and Supply Chain'],"FunctieomschrijvingTeambegeleider Transport gezocht Een snel groeiend aantal bestellingen foutloos laten picken en bij de online klanten afleveren Als jij denkt dat dat beter kan, dan zoeken we jou als onze nieuwe Teambegeleider Transport bij Jumbowat bieden wij jou14 euro bruto per uurJezelf ontwikkelen binnen de logistiekFulltime aan het werkwie ben jijChauffeurs kunnen bij jou terecht Jij beschikt over de persoonlijkheid om in een hectische omgeving het volledige overzicht te behouden en de juiste keuzes te maken met betrekking tot risicos en kansen Communicatief ben je sterk en weet je klachten op een zeer goede manier af te handelen Samen met de chauffeurs kom je altijd tot een oplossing Je hebt een handson mentaliteit en bent goed in plannen Je maakt onderdeel uit van het team Site Support  TransportJe bent stressbestendigen communicatief vaardigJe beschik je over de capaciteiten om goed samen te werkenNederlandse taal in woord en geschrift is een must Engels is een preBereid tot werken in ploegendienstenMinimaal 2 zaterdagen beschikbaar per periodeMinimaal 1 zondag beschikbaar per periodeMBO4HBO werk en denkniveauwat ga je doenAls transportbegeleider ben je verantwoordelijk voor de uitvoering en bijsturing van transportplanningen die op tactisch niveau worden gepland voor het distributiecentrum De transportplanningen hebben een horizon van een week en jij zorgt ervoor dat er voor die dag een juiste planning ligt Je bent de vraagbaak voor chauffeurs en helpt hen bij calamiteiten Het uitgeven van ritten, registreren van vertragingen en administratieve afhandeling behoren eveneens tot je takenAls je bij Jumbo werkt, werk je bij een ambitieus en ondernemend familiebedrijf Ze bieden je een zeer uitdagende baan Je krijgt alle ruimte voor eigen initiatief, alle ruimte om jouw kennis en ervaring te benutten Ook geven ze je de kans om jezelf te ontwikkelen in je vakgebied en als persoonwaar ga je werkenVia Jumbo Online kunnen de klanten online boodschappen bestellen en deze ophalen of laten thuis bezorgen Het gemak voor de klant, dat is de toekomst Het magazijn van Jumbo Online is daarin een belangrijke schakel Voor Jumbo is het een relatief nieuwe, zich snel ontwikkelende vorm van logistiek Het warehouse is feitelijk een grote winkel van Jumbo, waar de online bestelde boodschappen verzameld worden Boodschappen doen voor duizenden klanten tegelijk, op een manier zoals de klant het zelf ook zou doen En dat in een logistiek jasje verpakt Stukspicking met grote volumes en een warehouse dat volop meegroeit met de wensen van de klantenPionieren in optima forma dus Een startup dynamiek maar dan met een enorme bestaande klantenbase Daar kan jij een bijdrage aan leveren en helpen vormgeven Ben jij de sleutel tot het realiseren van onze ambities en geef je daarmee een boost aan je eigen ontwikkelingSamen ondernemen winnen Voel jij je hiertoe aangetrokken Dan zijn we heel benieuwd naar jouw sollicitatie Uiteraard staat deze vacature open voor iedereen die zich hierin herkent SollicitatieprocedureJe maakt een mijn Randstad account aan om te kunnen reageren op onze vacatures Dit doe je automatisch wanneer je voor het eerst een sollicitatie afrond bij Randstad, heel eenvoudig dus Via je mijn Randstad account beheer je gemakkelijk je gegevens en gaan je volgende sollicitaties nog sneller",Full-time,https://www.linkedin.com/jobs/view/externalApply/2326343742?url=https%3A%2F%2Fjoblift%2Enl%2Fjoblink%3Fto%3DeyJ0eXAiOiJKV1QiLCJhbGciOiJIUzI1NiJ9%2EeyJvZmZlcklkIjoiMDE5OTIyZjUtZDk5MS00NmFkLThhODgtYWFiZTBhMTQ4NjdkIn0%2EXm0IHLKon-2sZPoQGqOVWfdDmUZf80fhfJT-vR1mtdc%26jid%3D0b2d7fdba47d98c0b61aab9d9e82089193b73c0feff2faf6c73f8fec063d313b%26utm_source%3Dlinkedin_nl%26utm_medium%3Dexternal_feed%26utm_campaign%3D621&urlHash=-ZLJ&refId=33514f0b-bcd7-40ca-96b8-44cc306847ff&trk=public_jobs_apply-link-offsite,https://nl.linkedin.com/jobs/view/teambegeleider-transport-at-randstad-recruitment-center-2326343742?refId=33514f0b-bcd7-40ca-96b8-44cc306847ff&position=14&pageNum=4&trk=public_jobs_job-result-card_result-card_full-click,3 days ago,3 days ago,2020-11-26,2020-11-30
115,transport,LinkedIn,2304644954,Freight Forwarder Export Air,bce4qqwHQBycT5XaYTrSMw==,GEODIS,"SchipholRijk, North Holland, Netherlands","['Logistics and Supply Chain', 'Import and Export']","Geodis is n van de grootste Supply Chain organisaties in de wereld Als onderdeel van SNCF Logistics, is Geodis nr 1 in Frankrijk en nr 4 in Europa Met meer dan 40000 professionals zijn wij aanwezig in 67 landen en hebben we een global netwerk in 120 landen Met 5 business lines, Supply Chain Optimization, Freight Forwarding, Contract Logistics, Distribution  Express en Road Transport, managen wij dagelijks vol passie en commitment de supply chain van onze klanten Onze missie we help our clients succeed by overcoming logistical constraints Onze visie we logistic their growth Of in dit geval we logistic your career",Full-time,,https://nl.linkedin.com/jobs/view/freight-forwarder-export-air-at-geodis-2304644954?refId=33514f0b-bcd7-40ca-96b8-44cc306847ff&position=15&pageNum=4&trk=public_jobs_job-result-card_result-card_full-click,3 days ago,3 days ago,2020-11-26,2020-11-30
