Data Row,Search Keyword,Platform,Job ID,Job Title,Tracking ID,Company Name,Location,Industry,Job Description,Employment Type,Company URL,Job URL,Job Age,Job Age Number,Job Date,Collection Date
63,career development specialist,LinkedIn,2253942570,Verzorgende IG - Nieuwe uitdaging - Loopbaanadvies | Zoetermeer | Akkolade,/k39bajcSVOXKrqnmtBpmQ==,Werkzoekennl,"Zoetermeer, South Holland, Netherlands","['Hospital & Health Care', 'Mental Health Care']","Vacature van Akkolade, locatie Zoetermeer, , Ben jij als een Verzorgende IG toe aan een nieuwe uitdaging in de regio Zoetermeer Akkolade denkt graag met je mee en biedt een gratis loopbaanadvies aan, , , Akkolade biedt graag een luisterend oor, , Voel je vrij om al je wensen met ons te delen, zodat we samen op zoek kunnen gaan naar jouw nieuwe droombaan Met onze expertise in de zorg en welzijn sector en een zeer groot netwerk VVT, Ziekenhuizen en de GGZ kunnen wij jou als geen ander begeleiden naar een nieuwe baan Niets moet na dit gesprek, maar alles mag Wij gaan samen kijken wat het beste bij jou past De kans is groot dat wij vele openstaande vacatures hebben die tot jou nieuwe mogelijkheden behoren, , Raak je al genspireerd om een volgende stap in je loopbaan te nemen Dan staat de koffie of thee klaar en spreken wij je vast snel, , , , , , Onze missie is zorgprofessionals helpen gelukkig te blijven in hun werk Dit doen we door jou te verbinden aan de juiste werkgever in de zorg en welzijn sector, waar jij een vaste baan krijgt Na jouw vrijblijvende reactie nodigen we je graag uit voor een kennismaking met ons Tijdens de kennismaking vertellen we jou alles over het team, de functie en de voorwaarden, maar bespreken we vooral ook jouw wensen en kwaliteiten Jij staat centraal in deze procedure, , Door het Coronavirus hebben wij onze procedure aangepast Kennismaken zal zoveel mogelijk plaatsvinden via videobellen Als je positief bent over het team word je uitgenodigd voor het arbeidsvoorwaardengesprek Je komt dan in dienst bij de zorgorganisatie Wij ondersteunen jou met maar n doel dat jij gelukkig wordt in je nieuwe vaste baan, , 5cd8a0b9cc68f9ffa4c9253553278a55",Full-time,https://www.linkedin.com/jobs/view/externalApply/2253942570?url=https%3A%2F%2Fwww%2Ewerkzoeken%2Enl%2F3404_akkolade%2Fvacatures%2F4542047_verzorgende-ig-nieuwe-uitdaging-loopbaanadvies%2F%3Fsource%3D5cd8a0b9cc68f9ffa4c9253553278a55%26utm_source%3Dlinkedin%26utm_medium%3Dreferral%26utm_campaign%3Dlinkedin_referral_vertical_vac_feed%26utm_term%3Dhealth%2Bzoetermeer&urlHash=EKYJ&refId=4d1b9544-09bd-4d46-ba6c-82c8f00b44cd&trk=public_jobs_apply-link-offsite,https://nl.linkedin.com/jobs/view/verzorgende-ig-nieuwe-uitdaging-loopbaanadvies-zoetermeer-akkolade-at-werkzoeken-nl-2253942570?refId=4d1b9544-09bd-4d46-ba6c-82c8f00b44cd&position=13&pageNum=2&trk=public_jobs_job-result-card_result-card_full-click,1 month ago,1 month ago,2020-10-14,2020-11-28
64,career development specialist,LinkedIn,2299056393,Verzorgende IG - Loopbaanadvies met een kopje koffie,4+X++XdhRQa6UhEcg51q6w==,Akkolade,"Horn, Limburg, Netherlands",['Human Resources'],"Ben jij zoekende naar voldoende afwisseling als Verzorgende IG, het internet staat vol met kansen Maar welke kans is nou geschikt voor jou Wij helpen je graag een keuze maken, Standplaats Horn, , Jouw functie, , Ben jij als Verzorgende IG toe aan een nieuwe uitdaging Wanneer jij je wensen aangeeft, kijken wij wat het beste bij je past Bij onze klanten in zowel de Thuiszorg als de particuliere verpleeghuiszorg is veel mogelijk, , Eerst kennismaken voor je een definitieve overstap maakt van werkgever Dat kan Kom gerust een keer meelopen, je bent overal van harte welkom Niets moet en alles mag Je maakt samen met ons als sparringpartner pas een overstap als je er helemaal aan toe bent en wij begeleiden je graag in deze zoektocht, , Het werk bij onze Thuiszorg instellingen en kleinschalige Verpleeghuizen is divers, van het aantrekken van een steunkous tot het verlenen van de ADL tot katheteriseren in de zorg doe je als Verzorgende IG veel en zelfstandig Wij hebben mooie opties en vacatures voor jou als Verzorgende IG en houden rekening met jouw wensen Samen met een bevlogen team bied je hartverwarmende, kleinschalige, specialistische zorg op maat aan de kwetsbaren in de samenleving Bij de zorginstellingen waar wij mee samenwerken staat zorg op maat voorop Samen met familie en mantelzorgers zorg je ervoor dat clinten de beste zorg krijgen die ze verdienen, Zin om eens verder te praten De koffie staat klaar, , , , , , , , , , Onze missie is zorgprofessionals helpen gelukkig te blijven in hun werk Dit doen we door jou te verbinden aan de juiste werkgever in de zorg en welzijn sector, waar jij een vaste baan krijgt Na jouw vrijblijvende reactie nodigen we je graag uit voor een kennismaking met ons Tijdens de kennismaking vertellen we jou alles over het team, de functie en de voorwaarden, maar bespreken we vooral ook jouw wensen en kwaliteiten Jij staat centraal in deze procedure, Door het Coronavirus hebben wij onze procedure aangepast Kennismaken zal zoveel mogelijk plaatsvinden via videobellen Als je positief bent over het team word je uitgenodigd voor het arbeidsvoorwaardengesprek Je komt dan in dienst bij de zorgorganisatie Wij ondersteunen jou met maar n doel dat jij gelukkig wordt in je nieuwe vaste baan",Contract,https://www.linkedin.com/jobs/view/externalApply/2299056393?url=https%3A%2F%2Fnl%2Ejooble%2Eorg%2Fexternal%2F-1774454158221350231%3Futm_campaign%3DNL%26utm_medium%3Dsocial%26utm_source%3Dlinkedin%26JobSource%3DBoard&urlHash=AuSA&refId=4d1b9544-09bd-4d46-ba6c-82c8f00b44cd&trk=public_jobs_apply-link-offsite,https://nl.linkedin.com/jobs/view/verzorgende-ig-loopbaanadvies-met-een-kopje-koffie-at-akkolade-2299056393?refId=4d1b9544-09bd-4d46-ba6c-82c8f00b44cd&position=14&pageNum=2&trk=public_jobs_job-result-card_result-card_full-click,1 month ago,1 month ago,2020-10-14,2020-11-28
65,career development specialist,LinkedIn,2322642721,Verzorgende IG - Loopbaanadvies gesprek (gratis) | Zoetermeer | Akkolade,7AIukJy4S2SJ9/xmpT7NIQ==,Werkzoekennl,"Zoetermeer, South Holland, Netherlands","['Hospital & Health Care', 'Mental Health Care']","Vacature van Akkolade, locatie Zoetermeer, , Ben jij als Verzorgende IG werkzaam in de zorg en ben jij eraan toe jezelf verder te ontwikkelen in een nieuwe uitdaging Wij ondersteunen jou graag in dit traject en bieden een gratis loopbaan advies gesprek aan, , , Ben je toe aan een nieuwe stap in je loopbaan, maar twijfel je al tijden over jouw kansen en mogelijkheden Wij ondersteunen jou graag in dit traject Middels een loopbaanadviesgesprek gaan we samen op zoek naar jouw kwaliteiten, drijfveren en wensen ten aanzien van een nieuwe baan in de zorg Vervolgens ondersteunen wij jou volledig en zonder kosten in het mogelijke vervolgtraject naar jouw droombaan binnen ons uitgebreide netwerk, , Binnen ons brede zorgnetwerk werken wij samen met diverse organisaties in de verpleeghuiszorg, thuiszorg en gehandicaptenzorg waardoor wij samen een grote variatie aan mogelijkheden kunnen bespreken Daarnaast denken wij graag in mogelijkheden en maatwerk die aansluiten bij jouw persoonlijke behoeften en wensen, , Niets moet na dit gesprek, maar alles mag Wij zijn met onze expertise jouw personal guide naar de nieuwe stap en zoeken net zolang samen door tot we dit gevonden hebben, , PS ivm de Corona Maatregelen kan dit gesprek online gepland worden Dus gewoon thuis achter je laptop of mobiele telefoon, , , , , , Onze missie is zorgprofessionals helpen gelukkig te blijven in hun werk Dit doen we door jou te verbinden aan de juiste werkgever in de zorg en welzijn sector, waar jij een vaste baan krijgt Na jouw vrijblijvende reactie nodigen we je graag uit voor een kennismaking met ons Tijdens de kennismaking vertellen we jou alles over het team, de functie en de voorwaarden, maar bespreken we vooral ook jouw wensen en kwaliteiten Jij staat centraal in deze procedure, , Door het Coronavirus hebben wij onze procedure aangepast Kennismaken zal zoveel mogelijk plaatsvinden via videobellen Als je positief bent over het team word je uitgenodigd voor het arbeidsvoorwaardengesprek Je komt dan in dienst bij de zorgorganisatie Wij ondersteunen jou met maar n doel dat jij gelukkig wordt in je nieuwe vaste baan, , 5cd8a0b9cc68f9ffa4c9253553278a55",Full-time,https://www.linkedin.com/jobs/view/externalApply/2322642721?url=https%3A%2F%2Fwww%2Ewerkzoeken%2Enl%2F3404_akkolade%2Fvacatures%2F4867149_verzorgende-ig-loopbaanadvies-gesprek-gratis%2F%3Fsource%3D5cd8a0b9cc68f9ffa4c9253553278a55%26utm_source%3Dlinkedin%26utm_medium%3Dreferral%26utm_campaign%3Dlinkedin_referral_vertical_vac_feed%26utm_term%3Dhealth%2Bzoetermeer&urlHash=ROjs&refId=4d1b9544-09bd-4d46-ba6c-82c8f00b44cd&trk=public_jobs_apply-link-offsite,https://nl.linkedin.com/jobs/view/verzorgende-ig-loopbaanadvies-gesprek-gratis-zoetermeer-akkolade-at-werkzoeken-nl-2322642721?refId=4d1b9544-09bd-4d46-ba6c-82c8f00b44cd&position=15&pageNum=2&trk=public_jobs_job-result-card_result-card_full-click,1 month ago,1 month ago,2020-10-14,2020-11-28
66,career development specialist,LinkedIn,2286019780,Verzorgende IG - Nieuwe start - Loopbaanadvies,32gkGc2iTTePaSZdKm471A==,Akkolade,"Rotterdam, South Holland, Netherlands",['Human Resources'],Ben jij als een Verzorgende IG toe aan een nieuwe uitdaging in de regio Rotterdam Akkolade denkt graag met je mee en biedt een gratis loopbaanadvies aan,Full-time,https://www.linkedin.com/jobs/view/externalApply/2286019780?url=https%3A%2F%2Fnl%2Ejooble%2Eorg%2Fexternal%2F981677173634741682%3Futm_campaign%3DNL%26utm_medium%3Dsocial%26utm_source%3Dlinkedin%26JobSource%3DBoard&urlHash=PTGV&refId=4d1b9544-09bd-4d46-ba6c-82c8f00b44cd&trk=public_jobs_apply-link-offsite,https://nl.linkedin.com/jobs/view/verzorgende-ig-nieuwe-start-loopbaanadvies-at-akkolade-2286019780?refId=4d1b9544-09bd-4d46-ba6c-82c8f00b44cd&position=16&pageNum=2&trk=public_jobs_job-result-card_result-card_full-click,1 month ago,1 month ago,2020-10-14,2020-11-28
67,career development specialist,LinkedIn,2322611095,Verzorgende IG - Loopbaanadvies Verpleeghuis | Deventer | Akkolade,YC+Rr6KWTm2TsgrnaRVsEw==,Werkzoekennl,"Deventer, Overijssel, Netherlands","['Hospital & Health Care', 'Mental Health Care']","Vacature van Akkolade, locatie Deventer, , Ben jij Verzorgende IG en denk je er wel eens over om op zoek te gaan naar een andere baan Maar hoe weet je wat bij jou past, Akkolade denkt graag met je mee en biedt je een vrijblijvende mogelijkheid voor een orinterend gesprek, , , We zoeken Verzorgenden IG die zich orinteren op een nieuwe baan Of mensen die al langer uit de zorg zijn maar graag weer hun vak willen oppakken Onze missie is jou helpen gelukkig te blijven in je werk We denken daarbij in kansen en mogelijkheden en kennen de zorg goed en actief met 85 verschillende zorgteams in de regio Waar pas jij het beste, , Wij kijken in een gratis en vrijblijvend loopbaangesprek naar wie jij bent en hoe jouw baan eruit zou moeten zien, zodat die past bij jouw persoonlijke situatie En de uitdaging biedt die jij nodig hebt om voldoening uit je werk te halen Wij denken met jou mee, , Je kunt nu vrijblijvend een afspraak maken voor een gratis loopbaan gesprek Je kunt reageren via deze vacature of even bellen naar 0558434921, , , , , , Onze missie is zorgprofessionals helpen gelukkig te blijven in hun werk Dit doen we door jou te verbinden aan de juiste werkgever in de zorg en welzijn sector, waar jij een vaste baan krijgt Na jouw vrijblijvende reactie nodigen we je graag uit voor een kennismaking met ons Tijdens de kennismaking vertellen we jou alles over het team, de functie en de voorwaarden, maar bespreken we vooral ook jouw wensen en kwaliteiten Jij staat centraal in deze procedure, , Door het Coronavirus hebben wij onze procedure aangepast Kennismaken zal zoveel mogelijk plaatsvinden via videobellen Als je positief bent over het team word je uitgenodigd voor het arbeidsvoorwaardengesprek Je komt dan in dienst bij de zorgorganisatie Wij ondersteunen jou met maar n doel dat jij gelukkig wordt in je nieuwe vaste baan, , 5cd8a0b9cc68f9ffa4c9253553278a55",Full-time,https://www.linkedin.com/jobs/view/externalApply/2322611095?url=https%3A%2F%2Fwww%2Ewerkzoeken%2Enl%2F3404_akkolade%2Fvacatures%2F4130060_verzorgende-ig-loopbaanadvies-verpleeghuis%2F%3Fsource%3D5cd8a0b9cc68f9ffa4c9253553278a55%26utm_source%3Dlinkedin%26utm_medium%3Dreferral%26utm_campaign%3Dlinkedin_referral_vertical_vac_feed%26utm_term%3Dhealth%2Bdeventer&urlHash=Swcg&refId=4d1b9544-09bd-4d46-ba6c-82c8f00b44cd&trk=public_jobs_apply-link-offsite,https://nl.linkedin.com/jobs/view/verzorgende-ig-loopbaanadvies-verpleeghuis-deventer-akkolade-at-werkzoeken-nl-2322611095?refId=4d1b9544-09bd-4d46-ba6c-82c8f00b44cd&position=17&pageNum=2&trk=public_jobs_job-result-card_result-card_full-click,1 month ago,1 month ago,2020-10-14,2020-11-28
68,career development specialist,LinkedIn,2253037372,Verzorgende IG - Loopbaanadvies gesprek (gratis),pAQ7NxOtToGZXzvMXXOKsA==,Akkolade,"Zoetermeer, South Holland, Netherlands",['Human Resources'],"Ben jij als Verzorgende IG werkzaam in de zorg en ben jij eraan toe jezelf verder te ontwikkelen in een nieuwe uitdaging Wij ondersteunen jou graag in dit traject en bieden een gratis loopbaan advies gesprek aan, Standplaats Zoetermeer, , Jouw functie, , Ben je toe aan een nieuwe stap in je loopbaan, maar twijfel je al tijden over jouw kansen en mogelijkheden Wij ondersteunen jou graag in dit traject Middels een loopbaanadviesgesprek gaan we samen op zoek naar jouw kwaliteiten, drijfveren en wensen ten aanzien van een nieuwe baan in de zorg Vervolgens ondersteunen wij jou volledig en zonder kosten in het mogelijke vervolgtraject naar jouw droombaan binnen ons uitgebreide netwerk, , Binnen ons brede zorgnetwerk werken wij samen met diverse organisaties in de verpleeghuiszorg, thuiszorg en gehandicaptenzorg waardoor wij samen een grote variatie aan mogelijkheden kunnen bespreken Daarnaast denken wij graag in mogelijkheden en maatwerk die aansluiten bij jouw persoonlijke behoeften en wensen, , Niets moet na dit gesprek, maar alles mag Wij zijn met onze expertise jouw personal guide naar de nieuwe stap en zoeken net zolang samen door tot we dit gevonden hebben, , PS ivm de Corona Maatregelen kan dit gesprek online gepland worden Dus gewoon thuis achter je laptop of mobiele telefoon, , , , , , , , , , Onze missie is zorgprofessionals helpen gelukkig te blijven in hun werk Dit doen we door jou te verbinden aan de juiste werkgever in de zorg en welzijn sector, waar jij een vaste baan krijgt Na jouw vrijblijvende reactie nodigen we je graag uit voor een kennismaking met ons Tijdens de kennismaking vertellen we jou alles over het team, de functie en de voorwaarden, maar bespreken we vooral ook jouw wensen en kwaliteiten Jij staat centraal in deze procedure, , Door het Coronavirus hebben wij onze procedure aangepast Kennismaken zal zoveel mogelijk plaatsvinden via videobellen Als je positief bent over het team word je uitgenodigd voor het arbeidsvoorwaardengesprek Je komt dan in dienst bij de zorgorganisatie Wij ondersteunen jou met maar n doel dat jij gelukkig wordt in je nieuwe vaste baan",Full-time,https://www.linkedin.com/jobs/view/externalApply/2253037372?url=https%3A%2F%2Fwww%2Eadzuna%2Enl%2Fdetails%2F1789885507%3Fv%3D6F7076FD3C022CEDB92DCED49E0E4B654E8D13C7%26utm_source%3Dlinkedin2%26utm_medium%3Dorganic%26chnlid%3D880&urlHash=CkMs&refId=4d1b9544-09bd-4d46-ba6c-82c8f00b44cd&trk=public_jobs_apply-link-offsite,https://nl.linkedin.com/jobs/view/verzorgende-ig-loopbaanadvies-gesprek-gratis-at-akkolade-2253037372?refId=4d1b9544-09bd-4d46-ba6c-82c8f00b44cd&position=18&pageNum=2&trk=public_jobs_job-result-card_result-card_full-click,1 month ago,1 month ago,2020-10-14,2020-11-28
69,career development specialist,LinkedIn,2253943076,Verzorgende IG - Nieuwe uitdaging - Loopbaanadvies | Waddinxveen | Akkolade,z+q2HNbBTZuo9uW9qoPwTA==,Werkzoekennl,"Waddinxveen, South Holland, Netherlands","['Hospital & Health Care', 'Mental Health Care']","Vacature van Akkolade, locatie Waddinxveen, , Ben jij als een Verzorgende IG toe aan een nieuwe uitdaging in de regio Waddinxveen Akkolade denkt graag met je mee en biedt een gratis loopbaanadvies aan, , , De zorg heeft jouw hart als Verzorgende IG al lang gestolen Maar toch twijfel je soms of je nog wel op je plek zit bij je huidig werkgever Dat is heel normaal, , Akkolade bied je graag een luisterend oor Voel je vrij om al je wensen met ons te delen, zodat we samen op zoek kunnen gaan naar jouw nieuwe droombaan Met onze expertise in de zorg en welzijn sector en een zeer groot netwerk, kunnen wij jou als geen ander begeleiden Niets moet na dit gesprek, maar alles mag Wij gaan samen vrijblijvend kijken wat het beste bij jou past De kans is groot dat wij vele openstaande vacatures hebben die tot jouw nieuwe mogelijkheden behoren Ligt jouw nieuwe uitdaging misschien binnen een ziekenhuis, verpleeghuis of juist in de thuiszorg Samen komen we hier zeker uit, , Raak je al genspireerd om een volgende stap in je loopbaan te nemen Dan staat de koffie of thee klaar en spreken wij je vast snel, , , , , , Onze missie is zorgprofessionals helpen gelukkig te blijven in hun werk Dit doen we door jou te verbinden aan de juiste werkgever in de zorg en welzijn sector, waar jij een vaste baan krijgt Na jouw vrijblijvende reactie nodigen we je graag uit voor een kennismaking met ons Tijdens de kennismaking vertellen we jou alles over het team, de functie en de voorwaarden, maar bespreken we vooral ook jouw wensen en kwaliteiten Jij staat centraal in deze procedure, , Door het Coronavirus hebben wij onze procedure aangepast Kennismaken zal zoveel mogelijk plaatsvinden via videobellen Als je positief bent over het team word je uitgenodigd voor het arbeidsvoorwaardengesprek Je komt dan in dienst bij de zorgorganisatie Wij ondersteunen jou met maar n doel dat jij gelukkig wordt in je nieuwe vaste baan, , 5cd8a0b9cc68f9ffa4c9253553278a55",Full-time,https://www.linkedin.com/jobs/view/externalApply/2253943076?url=https%3A%2F%2Fwww%2Ewerkzoeken%2Enl%2F3404_akkolade%2Fvacatures%2F4565616_verzorgende-ig-nieuwe-uitdaging-loopbaanadvies%2F%3Fsource%3D5cd8a0b9cc68f9ffa4c9253553278a55%26utm_source%3Dlinkedin%26utm_medium%3Dreferral%26utm_campaign%3Dlinkedin_referral_vertical_vac_feed%26utm_term%3Dhealth%2Bwaddinxveen&urlHash=IRWX&refId=4d1b9544-09bd-4d46-ba6c-82c8f00b44cd&trk=public_jobs_apply-link-offsite,https://nl.linkedin.com/jobs/view/verzorgende-ig-nieuwe-uitdaging-loopbaanadvies-waddinxveen-akkolade-at-werkzoeken-nl-2253943076?refId=4d1b9544-09bd-4d46-ba6c-82c8f00b44cd&position=19&pageNum=2&trk=public_jobs_job-result-card_result-card_full-click,1 month ago,1 month ago,2020-10-14,2020-11-28
70,career development specialist,LinkedIn,2286024282,Verzorgende IG - Loopbaanadvies - Doorgroeien in je vak,W9/IrJpxSWOM4jdZnB8C7w==,Akkolade,"Gouda, South Holland, Netherlands",['Human Resources'],"Ben jij een Verzorgende IG Zoek je een droombaan, maar kan je hierbij wat hulp gebruiken Dan ben je bij Akkolade in Gouda aan het goede adres Wij bieden je namelijk een gratis loopbaanadvies aan Samen gaan we op zoek naar jouw talent en kansen in de markt Niets moet en alles mag na dit gesprek, , Jouw functie, , Als Verzorgende IG ben je zeer waardevol voor onze gezondheidszorg Soms zit je alleen nog niet op de juiste plek Met ons netwerk en expertise binnen de Verpleging, Verzorging en Thuiszorg, gaan wij samen deze juiste plek voor je vinden, , Voel je vrij om al je wensen met ons te delen, zodat we samen op zoek kunnen gaan naar jouw nieuwe droombaan Niets moet na dit gesprek, maar alles magWij gaan geheel vrijblijvende samen kijken wat het beste bij jou past De kans is groot dat wij vele openstaande vacatures hebben die tot jou nieuwe mogelijkheden behoren, Raak je al genspireerd om een volgende stap in je loopbaan te nemen Dan staat de koffie of thee klaar en spreken wij je vast snel, , , , , , , , , , Onze missie is zorgprofessionals helpen gelukkig te blijven in hun werk Dit doen we door jou te verbinden aan de juiste werkgever in de zorg en welzijn sector, waar jij een vaste baan krijgt Na jouw vrijblijvende reactie nodigen we je graag uit voor een kennismaking met ons Tijdens de kennismaking vertellen we jou alles over het team, de functie en de voorwaarden, maar bespreken we vooral ook jouw wensen en kwaliteiten Jij staat centraal in deze procedure, Door het Coronavirus hebben wij onze procedure aangepast Kennismaken zal zoveel mogelijk plaatsvinden via videobellen Als je positief bent over het team word je uitgenodigd voor het arbeidsvoorwaardengesprek Je komt dan in dienst bij de zorgorganisatie Wij ondersteunen jou met maar n doel dat jij gelukkig wordt in je nieuwe vaste baan",Full-time,https://www.linkedin.com/jobs/view/externalApply/2286024282?url=https%3A%2F%2Fnl%2Ejooble%2Eorg%2Fexternal%2F-2781948574854268857%3Futm_campaign%3DNL%26utm_medium%3Dsocial%26utm_source%3Dlinkedin%26JobSource%3DBoard&urlHash=tWw8&refId=4d1b9544-09bd-4d46-ba6c-82c8f00b44cd&trk=public_jobs_apply-link-offsite,https://nl.linkedin.com/jobs/view/verzorgende-ig-loopbaanadvies-doorgroeien-in-je-vak-at-akkolade-2286024282?refId=4d1b9544-09bd-4d46-ba6c-82c8f00b44cd&position=20&pageNum=2&trk=public_jobs_job-result-card_result-card_full-click,1 month ago,1 month ago,2020-10-14,2020-11-28
71,career development specialist,LinkedIn,2253941448,Verzorgende IG - Loopbaanadvies - Orienterend gesprek | Nunspeet | Akkolade,9JhHfMEcShmetiR4Yd2Fzg==,Werkzoekennl,"Nunspeet, Gelderland, Netherlands","['Hospital & Health Care', 'Mental Health Care']","Vacature van Akkolade, locatie Nunspeet, , Ben jij als Verzorgende IG niveau 3 werkzaam in de zorg en ben jij eraan toe jezelf verder te ontwikkelen in een nieuwe uitdaging Wij ondersteunen jou graag in dit traject middels een loopbaanadviesgesprek, , , Ben jij als Verzorgende IG niveau 3 werkzaam in de zorg en ben jij eraan toe jezelf verder te ontwikkelen in een nieuwe uitdaging Wij ondersteunen jou graag in dit traject Middels een loopbaanadviesgesprek gaan we samen op zoek naar jouw kwaliteiten, drijfveren en wensen ten aanzien van een nieuwe baan in de zorg Vervolgens ondersteunen wij jou volledig in het mogelijke vervolgtraject naar jouw droombaan binnen ons uitgebreide netwerk, , Binnen ons brede zorgnetwerk werken wij samen met diverse organisaties in de verpleeghuiszorg, thuiszorg en gehandicaptenzorg waardoor wij samen een grote variatie aan mogelijkheden kunnen bespreken Daarnaast denken wij graag in mogelijkheden en maatwerk die aansluiten bij jouw persoonlijke behoeften en wensen, , , , , , Onze missie is zorgprofessionals helpen gelukkig te blijven in hun werk Dit doen we door jou te verbinden aan de juiste werkgever in de zorg en welzijn sector, waar jij een vaste baan krijgt Na jouw vrijblijvende reactie nodigen we je graag uit voor een kennismaking met ons Tijdens de kennismaking vertellen we jou alles over het team, de functie en de voorwaarden, maar bespreken we vooral ook jouw wensen en kwaliteiten Jij staat centraal in deze procedure, , Door het Coronavirus hebben wij onze procedure aangepast Kennismaken zal zoveel mogelijk plaatsvinden via videobellen Als je positief bent over het team word je uitgenodigd voor het arbeidsvoorwaardengesprek Je komt dan in dienst bij de zorgorganisatie Wij ondersteunen jou met maar n doel dat jij gelukkig wordt in je nieuwe vaste baan, , 5cd8a0b9cc68f9ffa4c9253553278a55",Full-time,https://www.linkedin.com/jobs/view/externalApply/2253941448?url=https%3A%2F%2Fwww%2Ewerkzoeken%2Enl%2F3404_akkolade%2Fvacatures%2F4555089_verzorgende-ig-loopbaanadvies-orienterend-gesprek%2F%3Fsource%3D5cd8a0b9cc68f9ffa4c9253553278a55%26utm_source%3Dlinkedin%26utm_medium%3Dreferral%26utm_campaign%3Dlinkedin_referral_vertical_vac_feed%26utm_term%3Dhealth%2Bnunspeet&urlHash=DINO&refId=4d1b9544-09bd-4d46-ba6c-82c8f00b44cd&trk=public_jobs_apply-link-offsite,https://nl.linkedin.com/jobs/view/verzorgende-ig-loopbaanadvies-orienterend-gesprek-nunspeet-akkolade-at-werkzoeken-nl-2253941448?refId=4d1b9544-09bd-4d46-ba6c-82c8f00b44cd&position=21&pageNum=2&trk=public_jobs_job-result-card_result-card_full-click,1 month ago,1 month ago,2020-10-14,2020-11-28
