Data Row,Search Keyword,Platform,Job ID,Job Title,Tracking ID,Company Name,Location,Industry,Job Description,Employment Type,Company URL,Job URL,Job Age,Job Age Number,Job Date,Collection Date
76,social worker,LinkedIn,2308156174,Physician Case Manager - Rotterdam,Hi+of53gQISSrryVr+EBWQ==,Teladoc Health,"Rotterdam, South Holland, Netherlands","['Medical Devices', 'Medical Practice', 'Hospital & Health Care']","Job DetailsDescriptionRole and ResponsibilitiesLicensed, BIG registered practising physician in the Netherlands",Full-time,https://www.linkedin.com/jobs/view/externalApply/2308156174?url=https%3A%2F%2Fneuvoo%2Enl%2Fjob%2Ephp%3Fid%3D59676d8205ea%26source%3Dlinkedin%26utm_source%3Dpartner%26utm_medium%3Dlinkedin%26puid%3Dfddbcdd78dda7dd9adda7adcbdd8gddeaddgfddb3aebcacffec3ddcg3e&urlHash=0P_G&refId=e15068d7-4f73-4a43-a191-914fc83f22c6&trk=public_jobs_apply-link-offsite,https://nl.linkedin.com/jobs/view/physician-case-manager-rotterdam-at-teladoc-health-2308156174?refId=e15068d7-4f73-4a43-a191-914fc83f22c6&position=1&pageNum=3&trk=public_jobs_job-result-card_result-card_full-click,1 day ago,1 day ago,2020-11-21,2020-11-22
77,social worker,LinkedIn,2304588997,Maatschappelijk werker,HOzkScIeRi2ErKuIPJCluQ==,Maandag,"Rotterdam, South Holland, Netherlands",None,"Wil jij zekerheid combineren met afwisseling en uitdaging Wil jij je kennis en ervaringen delen met zorgorganisaties om zo de Geestelijke Gezondheidszorg in jouw regio naar een hoger niveau te tillen Dan ben je bij Maandag aan het juiste adres Bij Maandag ben je verzekerd van de voordelen van een vaste werkgever maar ook van de voordelen van flexibel werken Een unieke combinatie dus Je kunt altijd bij Maandag als werkgever terecht en ik zal jou begeleiden in het proces Maandag is volwaardig werkgever en bied jou een marktconform salaris conform cao GGZ Ingeschaald word je op basis van je ervaring, wel zo eerlijk Persoonlijke en beroepsmatige ontwikkeling staat centraal bij ons Onze Maandag Academy biedt op verschillende locaties trainingen en opleidingsmogelijkheden waar jij kosteloos aan kunt deelnemen We hechten waarde aan een openheid, transparantie en gelijkwaardigheid en zullen vanuit deze waarden handelen Functiebeschrijving Wil jij graag verschil maken in de maatschappij door een bijdrage te leven aan het stoppen van geweld tegen volwassenen en kinderen Ben je SKJ geregistreerd lees dan snel verder Voor een opdrachtgever in de regio Dordrecht zijn wij op zoek naar een stressbestendige en proactieve maatschappelijk werker Je zal verschillende zaken behandelen waarin het vermoeden is van huiselijk geweld, kinderof oudermishandeling in afhankelijkheidsrelaties Je bent hierbij verantwoordelijk voor het waarborgen van de veiligheid In een multidisciplinaire setting wordt de ernst van het geweld beoordeeld Je werkzaamheden zullen zowel telefonisch, schriftelijke als persoonlijk plaatsvinden Je zal de situatie in beeld brengen door het afleggen van locatie en huisbezoeken en vervolgens een advies uitbrengen inzake de hulpverlening Je hebt een ondersteunende, adviserende en coachende rol met betrekking tot de aanpak van verschillende aspecten van geweld in afhankelijkheidsrelaties Ben jij toe aan een nieuwe uitdaging en wil jij onze nieuwe collega worden Neem contact met mij op en ik help je verder Functieeisen",Full-time,https://www.linkedin.com/jobs/view/externalApply/2304588997?url=https%3A%2F%2Fwww%2Evacatures%2Enl%2Fvacature%2Fmaatschappelijk-werker%3A44208400%2F&urlHash=Ghhl&refId=e15068d7-4f73-4a43-a191-914fc83f22c6&trk=public_jobs_apply-link-offsite,https://nl.linkedin.com/jobs/view/maatschappelijk-werker-at-maandag-2304588997?refId=e15068d7-4f73-4a43-a191-914fc83f22c6&position=2&pageNum=3&trk=public_jobs_job-result-card_result-card_full-click,1 day ago,1 day ago,2020-11-21,2020-11-22
78,social worker,LinkedIn,2308176045,Vacature Maatschappelijk Werker Sterk Papendrecht 24 uur pw - Dordrecht,T+0iQJ3XS5aCLDujsp9xrw==,MEE NL,"Dordrecht, South Holland, Netherlands",None,"Jouw functieJe biedt ondersteuning aan kwetsbare burgers in Papendrecht die vragen en problemen hebben Je legt vanuit een proactieve benadering contact, indien noodzakelijk door een outreachend huisbezoekIn casussen met huiselijk geweld enof kindermishandeling onderhoud en initieer je contact met andere betrokken organisaties zoals Veilig Thuis, scholen en met organisaties voor kind en jeugdgerichte zorg Je kunt zowel nietpluisgevoelens als concrete signalen van huiselijk geweld en kindermishandeling herkennen, onderzoeken en, op een zeker moment, bespreekbaar maken met betrokken clinten en collegasJe maakt hierbij een inschatting van de aard van het geweld en de ernst van de problematiek die in het systeem aan de orde is Je handelt doelgericht en in samenwerking met clinten en relevante netwerkpartners, om zowel acute als structurele onveiligheid te stoppen Je stelt een veiligheidsplan op en je voert individuele gesprekken met de betrokkenen Daarnaast organiseer je en neem je deel aan systeemgesprekkenJe werkt als maatschappelijk werker sociaal werker A vanuit de Sociale Basis, onderdeel van de overkoepelende organisatie MEEVivenzWij bieden een goede werksfeer, volop ruimte voor de eigen ontwikkeling en aantrekkelijke arbeidsvoorwaarden Het salaris wordt, afhankelijk van jouw opleiding en werkervaring, gebaseerd op de cao Sociaal Werk, schaal 8, minimaal 2712, tot maximaal 3864, bruto per maand bij een fulltime werkweek van 36 uurDe Sociale Basis is onderdeel van de overkoepelde organisatie MEEVivenzMEEVivenz biedt n centraal aanspreekpunt voor de sociale wijkteams, welzijnsdiensten en informele zorg in de regio en stemt haar dienstverlening af op specifieke sociale vraagstukken De professionals van de Sociale Basis werken met elkaar aan een samenleving waarin iedereen ertoe doetSterk Papendrecht is het eerste centrale punt voor alle inwoners van 0 100 jaar met een ondersteuningsvraag op alle levensgebieden Ondersteuning wordt georganiseerd samen met en vanuit de vraag van de inwoner met de gedachte zo dichtbij mogelijk, zo vroeg mogelijk en zo zwaar als nodig Sterk Papendrecht is een samenwerkingsverband tussen MEEVivenz de Sociale Basis en MEE Mantelzorg en Stichting Jeugdteams ZHZDe medewerkers werken samen onder n dakVoor vragen over de functie en procedure kun je contact opnemen met Erica Hes, teamcoach, via telefoonnummer 06 51122756 Kijk voor meer informatie over Sterk Papendrecht op de website wwwsterkpapendrechtnlWil je solliciteren, stuur dan jouw motivatiebrief en cv, uiterlijk voor 4 december 2020, naar vacaturesmeevivenznlAcquisitie naar aanleiding van deze vacatures wordt niet op prijs gesteld",Full-time,https://www.linkedin.com/jobs/view/externalApply/2308176045?url=https%3A%2F%2Fneuvoo%2Enl%2Fjob%2Ephp%3Fid%3D7e61adc28b4c%26source%3Dlinkedin%26utm_source%3Dpartner%26utm_medium%3Dlinkedin%26puid%3Dfdd9cadb8dda7ddfaadf7adcbaddgddeadd8fade3deccacdfec3ddcg3e&urlHash=fE7N&refId=e15068d7-4f73-4a43-a191-914fc83f22c6&trk=public_jobs_apply-link-offsite,https://nl.linkedin.com/jobs/view/vacature-maatschappelijk-werker-sterk-papendrecht-24-uur-pw-dordrecht-at-mee-nl-2308176045?refId=e15068d7-4f73-4a43-a191-914fc83f22c6&position=3&pageNum=3&trk=public_jobs_job-result-card_result-card_full-click,1 day ago,1 day ago,2020-11-21,2020-11-22
79,social worker,LinkedIn,2309096893,Maatschappelijk werker Veilig Thuis,hBf3dzyWRWC9tjkR3sXDKg==,Twentecomvacatures,"Enschede, Overijssel, Netherlands","['Electrical/', 'Electronic Manufacturing', 'Information Technology and Services', 'Research']","Heb jij affiniteit met de problematiek van huiselijk geweld en kindermishandeling Kan jij outreachend werken met clinten die vooralsnog geen hulpvraag hebben Kan je zeer goed zelfstandig, maar ook in teamverband werken Dan is Regio Twente op zoek naar jou als Maatschappelijk werker Veilig Thuis in Enschede Regio Twente Zoals iedereen in de regio heeft u waarschijnlijk dagelijks met ons te maken U stuit op wegwerkzaamheden, u leest over de arbeidsmarkt of u zoekt een mooie wandel of fietsroute voor het weekend Regio Twente is direct en indirect betrokken bij allerlei regionale ontwikkelingen Met een groot aantal partners werken wij aan een vitaal Twente Zo komt u ons dus ongemerkt heel vaak tegen Kern van de Regio Regio Twente werkt aan projecten, verdeeld over twee domeinen Gezondheid en Leefomgeving De veertien gemeenten realiseren deze projecten samen, in nauw overleg met Zwolle als provinciale hoofdstad, de politiek in Den Haag en de Europese Unie in Brussel De kern van Regio Twente is dan ook samenwerking Onze plannen voor de komende jaren staan in de Agenda van Twente Een nationaal en internationaal overzicht van de regionale toekomstAls maatschappelijk werker Veilig Thuis ben je stressbestendig en sta je vanzelfsprekend stevig in je schoenen Je herkent belangrijke informatie en legt verbanden tussen verschillende observaties en wettelijke eisen Op basis hiervan trek jij de juiste conclusies Je bepaalt je eigen koers en houdt hieraan vast, ook bij weerstanden en extreme agressie Je hebt de skills en vaardigheden om tegenstellingen te overbruggen en risico en hulpvragen in te schatten Met jouw analytisch vermogen interpreteer je gegevens, signalen en zorgen, en kan je besluiten nemen over de noodzaak tot acuut ingrijpen Met grote mate van zorgvuldigheid weeg jij mogelijkheden af en beoordeel jij situaties, zodat je tot een juiste besluitvorming komt Je hebt hiervoor de benodigde kennis van relevante wet en regelgeving Jouw rapportages zijn concreet, zakelijk en juridisch, in correct en helder Nederlands In jouw werkzaamheden heb je een grote mate van vrijheid en verantwoordelijkheid Daarnaast vinden we het belangrijk dat je kennis hebt van  relevante hulpverleningstheorien en methodieken, de systeemtheoretische benadering  de ontwikkelingsfasen van een kind  verstoringen in deze fasen, die ontstaan zijn door gezinsomstandigheden enof externe omgevingsfactoren  methodisch werken met betrekking tot huiselijk geweld bij volwassenen, ouderen Een afgeronde opleiding HBO Social Work, of een vergelijkbare opleiding  Werkervaring in een vergelijkbare functie is een pr  Geregistreerd bij SKJ  Kennis van de sociale kaart  Bij voorkeur in het bezit van een rijbewijs en auto  Goede contactuele vaardigheden, zowel mondeling als schriftelijk  Flexibel en een collegiale instelling  Een Verklaring Omtrent het Gedrag VOG is een voorwaarde voor de aanstelling Een salaris dat wordt bepaald op basis van je profiel en ervaring  maximaal  4494, bruto per maand, schaal 10 op basis van een fulltime contract 36 uur  Een arbeidsovereenkomst voor, in eerste instantie, de duur van 1 jaar voor 3236 uur per week, verlenging behoort tot de mogelijkheden  Interessante extras, waaronder een Individueel Keuze Budget van 17,05, deelname aan een actieve personeelsvereniging en een moderne werkplek  Mogelijkheid tot deelname aan trainingen georganiseerd door de Twentse School  Ruimte voor nieuwe initiatieven en ideen",Full-time,https://www.linkedin.com/jobs/view/externalApply/2309096893?url=https%3A%2F%2Fnl%2Ejooble%2Eorg%2Fexternal%2F2462699546529901186%3Futm_campaign%3DNL%26utm_medium%3Dsocial%26utm_source%3Dlinkedin%26JobSource%3DBoard&urlHash=hn98&refId=e15068d7-4f73-4a43-a191-914fc83f22c6&trk=public_jobs_apply-link-offsite,https://nl.linkedin.com/jobs/view/maatschappelijk-werker-veilig-thuis-at-twente-com-vacatures-2309096893?refId=e15068d7-4f73-4a43-a191-914fc83f22c6&position=4&pageNum=3&trk=public_jobs_job-result-card_result-card_full-click,1 day ago,1 day ago,2020-11-21,2020-11-22
80,social worker,LinkedIn,2317391234,Stage hbo social work (Deeltijd behandeling en Stekpoint basisonderwijs),uvAlJiNtSo6rPYBCnutErg==,Enver,"Gouda, South Holland, Netherlands",['Religious Institutions'],"Het werken op de deeltijd behandeling en bij stekpoint met kinderen van 513 jaar is een echte uitdaging en in een dynamische omgeving De stage is een combinatie tussen groepswerk en ambulant werk Is jouw passie de jonge jeugd en ben jij in staat om goed samen te werken, dan is deze stage een leuke uitdaging voor jouHoe ziet deze stage eruitGedurende de stage maak je kennis met verschillende methodieken en collegas en leer je het verschil te maken voor het kind Je leert van iedereen en kunt zo jouw eigen stijl ontwikkelen Je wordt opgeleid om de functie van jeugdzorgwerker C uit te oefenen In het begin zal het veel meekijken zijn Jij neemt de theorie vanuit school tot je en samen koppelen we dit aan de praktijk In de deeltijd behandeling groep en ambulant geven wij behandeling aan kinderen van 5 tot 13 jaar en hun ouders die moeilijkheden ervaren op het gebied van opvoeding en ontwikkeling Dit kan zich onder meer uiten in problemen rond gedrag, emotie, het gezinsleven, vrienden en vrije tijdDeeltijd behandelingJe werkt op de maandag, dinsdag en donderdagmiddag op de deeltijd behandeling samen met de collega ambulant hulpverlener Elke dag wordt een onderwerp op het gebied van sociale vaardigheden, weerbaarheid en zelfvertrouwen in de groep behandeld We betrekken altijd ouders en de school bij de deeltijdbehandeling De ambulant hulpverlener heeft gesprekken met de leerkracht op school, waarbij de vooruitgang van het gedrag van het kind besproken wordt en eventueel begeleidingsadviezen gegeven worden De ambulant hulpverlener doet huisbezoeken waarbij opvoedadviezen gegeven worden Als jeugdzorgwerker C maak je een individueel plan dat bijdraagt aan de gewenste ontwikkeling van het kind Hierin betrek je ook de rol van ouders en bijvoorbeeld leerkrachten Je adviseert over kindgerichte behandeling, groepstraining enof oudergerichte begeleidingStekpoint basisonderwijsBij Stekpoint geven we ambulante hulpverlening aan kinderen die binnen het onderwijs problemen ervaren met het leren, met sociale relaties of beschikken over weinig zelfvertrouwen en ondersteunen we ouders met vragen over het gedrag van hun kind of de opvoeding StekPoint begeleiding van kinderen is gericht op de vertrouwde omgeving school, thuis of bij de BSO De ambulant hulpverlener geeft kindgerichte en groepsgerichte behandeling op de school van het kind en doet huisbezoeken Er is niet alleen aandacht voor het kind, maar ook hoe ouders en professionals, zoals de leerkracht, het kind kunnen ondersteunen en begeleiden De ambulante hulpverlening duurt meestal ongeveer 9 tot 12 maanden Je hebt op een 32 uur werkweek ongeveer 10 kinderen in je caseload In het begin draai je mee met de caseload van je stagebegeleiderHet leuke aan deze stage is de interactie met de kinderen en de ouders Elk kind is anders wat voor de n werkt, werkt voor de ander niet En daarom lever je maatwerkJouw collegasOns team bestaat uit 9 jeugdzorgwerkers en een stagiair Daarnaast zijn een ouderbegeleider, gedragswetenschapper en gebiedsmanager aan ons team verbonden Ons team is het best te beschrijven als leergierig, met groot improvisatievermogen en veel samenwerkenWat verwachten we van jouOmdat jij goed voor onze jongeren zorgt, zorgen we ook goed voor jouWerken bij EnverBij Enver kunnen kinderen, jongeren en hun ouders terecht voor preventieve hulp, basishulp en specialistische hulp We ondersteunen kinderen, jongeren en gezinnen op verschillende manieren Onze medewerkers werken in een wijkteam, bieden specialistische hulp aan huis, schoolmaatschappelijk werk, ouderschapsbemiddeling na scheiding, opvoedcursussen en trainingen We bieden kinderen en jongeren ook een plek om tijdelijk te wonen als het thuis niet meer gaat, zoals pleegzorg, gezinshuizen, kamertraining, leefgroepen of crisisopvang Enver is actief in de regios Rotterdam Rijnmond Rotterdam en omgeving tot en met GoereeOverflakkee, MiddenHolland Gouda en omgeving en ZuidHolland zuid Dordrecht en omgeving",Full-time,https://www.linkedin.com/jobs/view/externalApply/2317391234?url=https%3A%2F%2Fjoblift%2Enl%2Fdetails%2F7fcf5d62-34f0-4a6a-acdd-60d3858c4537%3Fjid%3D9ea2e4fdfebd3d060bca1f1953e23a78bca2aaec90b10970733b5704b8fd4b50%26utm_source%3Dlinkedin_nl%26utm_medium%3Dexternal_feed%26utm_campaign%3D126&urlHash=VrRk&refId=e15068d7-4f73-4a43-a191-914fc83f22c6&trk=public_jobs_apply-link-offsite,https://nl.linkedin.com/jobs/view/stage-hbo-social-work-deeltijd-behandeling-en-stekpoint-basisonderwijs-at-enver-2317391234?refId=e15068d7-4f73-4a43-a191-914fc83f22c6&position=5&pageNum=3&trk=public_jobs_job-result-card_result-card_full-click,1 day ago,1 day ago,2020-11-21,2020-11-22
81,social worker,LinkedIn,2305949117,Physician Case Manager,aaRc2qYZQWuRPmtuCZOEBA==,Best Doctors,"Rotterdam, South Holland, Netherlands","['Medical Devices', 'Medical Practice', 'Hospital & Health Care']","Job DetailsDescriptionRole and ResponsibilitiesLicensed, BIG registered practising physician in the Netherlands",Full-time,https://www.linkedin.com/jobs/view/externalApply/2305949117?url=https%3A%2F%2Fneuvoo%2Enl%2Fjob%2Ephp%3Fid%3D3701126a43a1%26source%3Dlinkedin%26utm_source%3Dpartner%26utm_medium%3Dlinkedin%26puid%3Dfdddcdd98ddg7ddfaddf7ddebddagadfaddcfddd3aefcdcffec3ddcg3e&urlHash=6YmD&refId=e15068d7-4f73-4a43-a191-914fc83f22c6&trk=public_jobs_apply-link-offsite,https://nl.linkedin.com/jobs/view/physician-case-manager-at-best-doctors-2305949117?refId=e15068d7-4f73-4a43-a191-914fc83f22c6&position=6&pageNum=3&trk=public_jobs_job-result-card_result-card_full-click,1 day ago,1 day ago,2020-11-21,2020-11-22
82,social worker,LinkedIn,2317635758,Solliciteer nu: Maatschappelijk werker Veilig Thuis,w2UmVR6wTT6+UGKQ7tWxFg==,Twentecomvacatures,"Enschede, Overijssel, Netherlands",['Religious Institutions'],"Solliciteer nuAls maatschappelijk werker Veilig Thuis ben je stressbestendig en sta je vanzelfsprekend stevig in je schoenen Je herkent belangrijke informatie en legt verbanden tussen verschillende observaties en wettelijke eisen Op basis hiervan trek jij de juiste conclusiesJe bepaalt je eigen koers en houdt hieraan vast, ook bij weerstanden en extreme agressie Je hebt de skills en vaardigheden om tegenstellingen te overbruggen en risico en hulpvragen in te schattenMet jouw analytisch vermogen interpreteer je gegevens, signalen en zorgen, en kan je besluiten nemen over de noodzaak tot acuut ingrijpen Met grote mate van zorgvuldigheid weeg jij mogelijkheden af en beoordeel jij situaties, zodat je tot een juiste besluitvorming komt Je hebt hiervoor de benodigde kennis van relevante wet en regelgeving Jouw rapportages zijn concreet, zakelijk en juridisch, in correct en helder Nederlands In jouw werkzaamheden heb je een grote mate van vrijheid en verantwoordelijkheidDaarnaast vinden we het belangrijk dat je kennis hebt vanFunctieeisenBedrijfsomschrijvingHeb jij affiniteit met de problematiek van huiselijk geweld en kindermishandeling Kan jij outreachend werken met clinten die vooralsnog geen hulpvraag hebben Kan je zeer goed zelfstandig, maar ook in teamverband werken Dan is Regio Twente op zoek naar jou als Maatschappelijk werker Veilig Thuis in EnschedeRegio TwenteZoals iedereen in de regio heeft u waarschijnlijk dagelijks met ons te maken U stuit op wegwerkzaamheden, u leest over de arbeidsmarkt of u zoekt een mooie wandel of fietsroute voor het weekend Regio Twente is direct en indirect betrokken bij allerlei regionale ontwikkelingen Met een groot aantal partners werken wij aan een vitaal Twente Zo komt u ons dus ongemerkt heel vaak tegenKern van de RegioRegio Twente werkt aan projecten, verdeeld over twee domeinen Gezondheid en Leefomgeving De veertien gemeenten realiseren deze projecten samen, in nauw overleg met Zwolle als provinciale hoofdstad, de politiek in Den Haag en de Europese Unie in Brussel De kern van Regio Twente is dan ook samenwerking Onze plannen voor de komende jaren staan in de Agenda van Twente Een nationaal en internationaal overzicht van de regionale toekomstArbeidsvoorwaarden",Full-time,https://www.linkedin.com/jobs/view/externalApply/2317635758?url=https%3A%2F%2Fjoblift%2Enl%2Fdetails%2Fdff08ec2-0563-4c42-8e7c-9ff03ce279f3%3Fjid%3Ded6134975fa5f686c02153efdcc0f48e02a04833909547e01ee8afb4ed0ea310%26utm_source%3Dlinkedin_nl%26utm_medium%3Dexternal_feed%26utm_campaign%3D385&urlHash=tdTR&refId=e15068d7-4f73-4a43-a191-914fc83f22c6&trk=public_jobs_apply-link-offsite,https://nl.linkedin.com/jobs/view/solliciteer-nu-maatschappelijk-werker-veilig-thuis-at-twente-com-vacatures-2317635758?refId=e15068d7-4f73-4a43-a191-914fc83f22c6&position=7&pageNum=3&trk=public_jobs_job-result-card_result-card_full-click,1 day ago,1 day ago,2020-11-21,2020-11-22
83,social worker,LinkedIn,2309106852,Maatschappelijk werker Veilig Thuis,mUS9KquBREuArJ9VYq/xRA==,StichtingTwenteBranding,"Enschede, Overijssel, Netherlands","['Electrical/', 'Electronic Manufacturing', 'Internet', 'Human Resources']","FunctieomschrijvingAls maatschappelijk werker Veilig Thuis ben je stressbestendig en sta je vanzelfsprekend stevig in je schoenen Je herkent belangrijke informatie en legt verbanden tussen verschillende observaties en wettelijke eisen Op basis hiervan trek jij de juiste conclusiesJe bepaalt je eigen koers en houdt hieraan vast, ook bij weerstanden en extreme agressie Je hebt de skills en vaardigheden om tegenstellingen te overbruggen en risico en hulpvragen in te schattenMet jouw analytisch vermogen interpreteer je gegevens, signalen en zorgen, en kan je besluiten nemen over de noodzaak tot acuut ingrijpen Met grote mate van zorgvuldigheid weeg jij mogelijkheden af en beoordeel jij situaties, zodat je tot een juiste besluitvorming komt Je hebt hiervoor de benodigde kennis van relevante wet en regelgeving Jouw rapportages zijn concreet, zakelijk en juridisch, in correct en helder Nederlands In jouw werkzaamheden heb je een grote mate van vrijheid en verantwoordelijkheidDaarnaast vinden we het belangrijk dat je kennis hebt vanArbeidsvoorwaarden",Full-time,https://www.linkedin.com/jobs/view/externalApply/2309106852?url=https%3A%2F%2Fnl%2Ejooble%2Eorg%2Fexternal%2F8950889871407169435%3Futm_campaign%3DNL%26utm_medium%3Dsocial%26utm_source%3Dlinkedin%26JobSource%3DBoard&urlHash=jwFH&refId=e15068d7-4f73-4a43-a191-914fc83f22c6&trk=public_jobs_apply-link-offsite,https://nl.linkedin.com/jobs/view/maatschappelijk-werker-veilig-thuis-at-stichtingtwentebranding-2309106852?refId=e15068d7-4f73-4a43-a191-914fc83f22c6&position=8&pageNum=3&trk=public_jobs_job-result-card_result-card_full-click,1 day ago,1 day ago,2020-11-21,2020-11-22
84,social worker,LinkedIn,2305923904,"stage pedagogiek, social work, onderwijskunde, TP, onderwijsontwikkeling/coach/onderzoekend&ontwerpend leren",hYjyOlOeSgWgzEiOlbDlZg==,Stageplazanl,"Amsterdam, North Holland, Netherlands","['Marketing and Advertising', 'Information Technology and Services', 'Internet']","TaakomschrijvingEen veelzijdige en inspirerende werkplekstage op pedagogisch, onderwijskundig en organisatorischprojectmatig vlak Je maakt onderdeel uit van een team dat bezig is met ontwikkeling en onderwijsvernieuwing We zoeken stagiaires die het leuk vinden om voor groepen leerlingen op zowel basisscholen als VO scholen workshops te geven Op VO scholen op het gebied van persoonlijk leiderschap en op basisscholen op verschillende themas vanuit de didactiek van onderzoekend en ontwerpend leren Als je meegaat naar VO scholen draai je ook mee tijdens workshops van onze Academy 4 LifeSKills voor jongeren van 1727 jaar zonder afgeronde beroepsleiding Voorde Academy zijn we bezig met het ontwikkelen van internationale activiteiten Als je het leuk vindt kun je hier een bijdrage aan leveren en mag je zelf een internationale training volgen Je maakt onderdeel uit van een klein team binnen een informele organisatie op een leuke locatie in Amsterdamnieuwsgierig Bel of mail ons voor meer informatie of kom een keer langsWil je graag meer zien Log in of schrijf je inNu solliciteren",Full-time,https://www.linkedin.com/jobs/view/externalApply/2305923904?url=https%3A%2F%2Fneuvoo%2Enl%2Fjob%2Ephp%3Fid%3D294385a96c04%26source%3Dlinkedin%26utm_source%3Dpartner%26utm_medium%3Dlinkedin%26puid%3Dfddecdd78ddc7dddadd87ddbbadfgdd7addafadd3degcdccfec3ddcg3e&urlHash=Cb6A&refId=e15068d7-4f73-4a43-a191-914fc83f22c6&trk=public_jobs_apply-link-offsite,https://nl.linkedin.com/jobs/view/stage-pedagogiek-social-work-onderwijskunde-tp-onderwijsontwikkeling-coach-onderzoekend-ontwerpend-leren-at-stageplaza-nl-2305923904?refId=e15068d7-4f73-4a43-a191-914fc83f22c6&position=9&pageNum=3&trk=public_jobs_job-result-card_result-card_full-click,1 day ago,1 day ago,2020-11-21,2020-11-22
85,social worker,LinkedIn,2264283683,Jurist sociaal domein (Docent opleiding Social Work),C53357MeSx6p/Agpnqoyow==,Hogeschool Inholland  Inholland University of Applied Sciences,"Amsterdam, North Holland, Netherlands",['Higher Education'],"Jij weet welke juridische uitdagingen er in het sociaal domein spelen Met jouw ervaring in de beroepspraktijk heb jij dit zelf dan ook ervaren Jouw kennis op themas als sociale zekerheidsrecht, personen en familierecht, jeugdrecht enof integrale schuldhulpverlening ga je inzetten om jouw studenten op te leiden tot de sociaal werker van morgen Vind jij het een mooie uitdaging om studenten kennis van recht in het sociaal domein bij te brengen Reageer dan op deze vacature",Part-time,https://www.linkedin.com/jobs/view/externalApply/2264283683?url=https%3A%2F%2Fwww%2Einholland%2Enl%2Fover-inholland%2Fwerken-bij-inholland%2Fjurist-sociaal-domein-docent-opleiding-social-work%23sollicitatieformulier&urlHash=Hvdp&refId=e15068d7-4f73-4a43-a191-914fc83f22c6&trk=public_jobs_apply-link-offsite,https://nl.linkedin.com/jobs/view/jurist-sociaal-domein-docent-opleiding-social-work-at-hogeschool-inholland-inholland-university-of-applied-sciences-2264283683?refId=e15068d7-4f73-4a43-a191-914fc83f22c6&position=10&pageNum=3&trk=public_jobs_job-result-card_result-card_full-click,1 day ago,1 day ago,2020-11-21,2020-11-22
