Data Row,Search Keyword,Platform,Job ID,Job Title,Tracking ID,Company Name,Location,Industry,Job Description,Employment Type,Company URL,Job URL,Job Age,Job Age Number,Job Date,Collection Date
1,education,LinkedIn,2327101282,Teamleider Theda Mansholt College,H04RepvCTLmnD0n9TfSTmQ==,BT verantwoord veranderen,"Amsterdam, North Holland, Netherlands","['Primary/', 'Secondary Education', 'Education Management']","Het Theda Mansholt College TMC in Delfzijl zoekt een, , TEAMLEIDER 0,81,0 fte, schaal 12 cao VO, , Een stevige en empathische leidinggevende die samen met het team de ingezette koers verder kan ontwikkelen en zich voor langere tijd aan de school wil verbinden Ben jij een teamleider die het vmbo een warm hart toedraagt Zie jij het werken aan een stevige basis als een mooie uitdaging Lees dan snel verder",Full-time,https://www.linkedin.com/jobs/view/externalApply/2327101282?url=https%3A%2F%2Fwww%2Evbent%2Eorg%2Fwat-we-doen%2Fwerving-selectie%2Fvacature%2Fteamleider%2F%3Futm_source%3Dlinkedin%26utm_medium%3Dcpc%26utm_campaign%3DTheda%2520Mansholt%2520College%26utm_term%3Dvacpag%26utm_content%3Dvacpag&urlHash=FO_0&trk=public_jobs_apply-link-offsite,https://nl.linkedin.com/jobs/view/teamleider-theda-mansholt-college-at-b-t-verantwoord-veranderen-2327101282?refId=7c35ea26-dcc5-4c29-8170-8ff34ee34f96&position=1&pageNum=0&trk=public_jobs_job-result-card_result-card_full-click,2 weeks ago,2 weeks ago,2020-11-19,2020-11-30
2,education,LinkedIn,2315120796,Junior Project Manager,/eFoyXS2SN2GGf+TBx9fjQ==,Benecke GGZ Nascholingen,"Haarlem, North Holland, Netherlands",['Education Management'],"Benecke is bijna 30 jaar de toonaangevende bedenker, ontwikkelaar en uitvoerder van educatie en communicatieconcepten voor professionals in de gezondheidszorg In nauwe samenwerking met medischwetenschappelijke verenigingen organiseren wij zowel kleinschalige als grootschalige nascholingsprojecten Voorbeelden zijn jaarsymposia, studiedagen, workshops, reviews, TeleReviews, online nascholingen en webcasts",Full-time,,https://nl.linkedin.com/jobs/view/junior-project-manager-at-benecke-ggz-nascholingen-2315120796?refId=7c35ea26-dcc5-4c29-8170-8ff34ee34f96&position=2&pageNum=0&trk=public_jobs_job-result-card_result-card_full-click,2 weeks ago,2 weeks ago,2020-11-19,2020-11-30
3,education,LinkedIn,2273746957,Marketeer Educatie,KHIvSVNoTEOzqKYOwOi9Hw==,Sijthoff Media,"Zaandam, North Holland, Netherlands",['Media Production'],"Ben jij ondernemend en beschik jij over de competenties om vanuit een moderne visie op marketing onze opleidingsportfolio verder te laten groeien Dan is de functie van Marketeer Educatie bij Sijthoff Media iets voor jou,  Sijthoff Media is een crossmediaal bedrijf van nieuws en vakmedia en is gevestigd in Capital C, ht centrum voor de creatieve industrie van Amsterdam Onze media bieden content op het gebied van IT, marketing, media, finance, HR, MA, overheid en kinderen Onze onafhankelijke redacties informeren en verbinden maandelijks meer dan n miljoen professionals en ruim 400000 kinderen in de leeftijd 7 tot en met 12 jaar Bekende merken van Sijthoff Media zijn Adformatie, AG Connect, CFO, CHRO, MA, Binnenlands Bestuur, iBestuur, Alex van Groningen, Amsterdam Institute of Finance, FinanceHubnl, FMnl, Kidsweek en Samsam De culturele waarden ambitie, creativiteit, betrokkenheid, persoonlijke groei  ontwikkeling vormen het hart van onze onderneming",Full-time,https://www.linkedin.com/jobs/view/externalApply/2273746957?url=https%3A%2F%2Fsijthoff-media1%2Ehomerun%2Eco%2Fmarketeer-educatie&urlHash=Qo9P&trk=public_jobs_apply-link-offsite,https://nl.linkedin.com/jobs/view/marketeer-educatie-at-sijthoff-media-2273746957?refId=7c35ea26-dcc5-4c29-8170-8ff34ee34f96&position=3&pageNum=0&trk=public_jobs_job-result-card_result-card_full-click,2 weeks ago,2 weeks ago,2020-11-19,2020-11-30
4,education,LinkedIn,2222454724,Social Media Marketeer,ygkVCtatQ5uWrUacy5nV0g==,Kamera Express,"OudBeijerland, South Holland, Netherlands",['Retail'],"Wie zijn wij, Wij zijn gek op alles wat met foto en video te maken heeft Onze klanten maken we blij met geweldige foto en videoproducten, bijzondere accessoires en gadgets Kamera Express is al meer dan 20 jaar d foto en videospecialist van Nederland en Belgi Wij zijn aan het groeien met een sterke omnichannel benadering waarbij de fysieke winkels en de webshop naadloos op elkaar aansluiten Naast Kamera Express bieden wij verhuur aan via Budgetcam en fotoprints, fotoboeken en wanddecoratie via Profotonet",Full-time,https://www.linkedin.com/jobs/view/externalApply/2222454724?url=http%3A%2F%2Fkamera-express%2Enl%2Fvacatures&urlHash=NfEL&refId=7c35ea26-dcc5-4c29-8170-8ff34ee34f96&trk=public_jobs_apply-link-offsite,https://nl.linkedin.com/jobs/view/social-media-marketeer-at-kamera-express-2222454724?refId=7c35ea26-dcc5-4c29-8170-8ff34ee34f96&position=4&pageNum=0&trk=public_jobs_job-result-card_result-card_full-click,2 weeks ago,2 weeks ago,2020-11-19,2020-11-30
5,education,LinkedIn,2300328455,Digital Marketing Intern,YlGtuoRWQIyjDq3qPkUf8Q==,Incision,"Amsterdam, North Holland, Netherlands","['Hospital & Health Care', 'Online Media', 'Information Technology and Services']","Incision zoekt een Stagiair Marketing met schrijftalent, Wil je graag stage lopen in een scaleup sfeer op een gave locatie in Amsterdam, Houd je van schrijven en ben je veel op social media te vinden, Vind je het interessant om te leren hoe je een goede nieuwsbrief schrijft",Internship,,https://nl.linkedin.com/jobs/view/digital-marketing-intern-at-incision-2300328455?refId=7c35ea26-dcc5-4c29-8170-8ff34ee34f96&position=5&pageNum=0&trk=public_jobs_job-result-card_result-card_full-click,2 weeks ago,2 weeks ago,2020-11-19,2020-11-30
6,education,LinkedIn,2327332889,Socialmediamarketeer - The Hague,3md8xPzQQQ2VAuC5+V49+A==,"Koninklijke Bibliotheek KB, nationale bibliotheek van Nederland","The Hague, South Holland, Netherlands",['Libraries'],"Functieeisen, HBO werk en denkniveau, Minimaal vijf jaar ervaring in socialmediamarketingfuncties bij middelgrote organisaties, Het bewezen vermogen om op strategisch, tactisch en operationeel niveau een bijdrage te leveren aan het socialmediabeleid, , , , , Dienstverband voor  1 jaar met uitzicht op een verlenging, , , , , , , De KB is de nationale bibliotheek van Nederland Middeleeuwse handschriften, de eerste Donald Duck, het laatste boek van Saskia Noort in onze magazijnen vind je alles wat in en over Nederland verschijnt Dat komt neer op zon 7 miljoen fysieke publicaties en tientallen miljoenen digitale boeken, kranten en tijdschriften Die bewaren we goed, zodat ook onze achterkleinkinderen er nog plezier van kunnen hebben, , We stellen iedereen in staat om te lezen, te leren en onderzoek te doen Zon 4,5 miljoen Nederlanders gebruiken onze digitale diensten, waaronder de landelijke online Bibliotheek tienduizenden ebooks en duizenden luisterboeken en Delpher meer dan 100 miljoen paginas uit Nederlandse kranten, boeken en tijdschriften We zijn er voor de allerjongsten met voorleeskoffertjes, voor slechtzienden met aangepaste leesvormen en voor iedereen die het nodig heeft  met hulp bij computeren of belastingzaken Natuurlijk zetten we ook vol in op innovatie, samen met onze partners Denk aan de inzet van artificial intelligence in openbare bibliotheken en evenementen rondom linked open data, , Kortom, bij de KB gebeurt meer dan je denkt Samen met 500 collegas werk je aan een slimmer, vaardiger en creatiever Nederland, , , , , , Je komt te werken op de afdeling Marketing  Educatie, in het team Lezen In dit team verzorgen we de marketing en redactie van de digitale diensten en content van de Bibliotheek, zoals de online Bibliotheek, de Jeugdbibliotheek en Bibliotheeknl Als Socialmediamarketeer werk je nauw samen met de webcarecordinator en de marketeers en redacteuren binnen het team",Full-time,https://www.linkedin.com/jobs/view/externalApply/2327332889?url=https%3A%2F%2Fneuvoo%2Enl%2Fjob%2Ephp%3Fid%3D97cfdeb1b0f4%26source%3Dlinkedin%26utm_source%3Dpartner%26utm_medium%3Dlinkedin%26puid%3Dfdd7cdd9eadd8adabadc9adbaadegddfaadefddg3aeacdccfec3ddcg3e&urlHash=Cx9G&refId=7c35ea26-dcc5-4c29-8170-8ff34ee34f96&trk=public_jobs_apply-link-offsite,https://nl.linkedin.com/jobs/view/socialmediamarketeer-the-hague-at-koninklijke-bibliotheek-kb-nationale-bibliotheek-2327332889?refId=7c35ea26-dcc5-4c29-8170-8ff34ee34f96&position=6&pageNum=0&trk=public_jobs_job-result-card_result-card_full-click,2 weeks ago,2 weeks ago,2020-11-19,2020-11-30
7,education,LinkedIn,2327159845,Schadebehandelaar Volmacht | Amsterdam | Werk & Co werving en selectie,po+I0LQFQ329yxgWD21z/g==,Werkzoekennl,"Amsterdam, North Holland, Netherlands","['Financial Services', 'Banking']","Vacature van Werk  Co werving en selectie, locatie Amsterdam, , Ben jij goed voor de klant en geeft het je een prettig gevoel om klanten zo goed mogelijk te helpen bij de afhandeling van hun schade, Kan jij jouw klanten zo goed en snel mogelijk door het meldingsproces begeleiden, Kan jij geheel zelfstandig verschillende schadegevallen beoordelen, behandelen en afwikkelen, , Reageer dan nu op deze mooie functie, , , , Als Schadebehandelaar Volmacht zijn jouw werkzaamheden als volgt, , , , , , , , , , , , , , Assurantietussenpersoon met oog voor het financieel belang van de klant Zij willen dicht bij hun klanten staan, Onze opdrachtgever is sterk in beweging Ondanks dat zij een groei doormaken staat persoonlijke benadering voorop, niet alleen voor hun klanten maar zeker ook voor hun personeel, , , , Mirjam Zijlstra, 0625021099, Mirjamvia de button Solliciteer nu op deze pagina, , 5cd8a0b9cc68f9ffa4c9253553278a55",Full-time,https://www.linkedin.com/jobs/view/externalApply/2327159845?url=https%3A%2F%2Fwww%2Ewerkzoeken%2Enl%2F10636_werk-co-werving-en-selectie%2Fvacatures%2F5012021_schadebehandelaar-volmacht%2F%3Fsource%3D5cd8a0b9cc68f9ffa4c9253553278a55%26utm_source%3Dlinkedin%26utm_medium%3Dreferral%26utm_campaign%3Dlinkedin_referral_vertical_vac_feed%26utm_term%3Dfinance%2Bamsterdam&urlHash=hUH4&refId=7c35ea26-dcc5-4c29-8170-8ff34ee34f96&trk=public_jobs_apply-link-offsite,https://nl.linkedin.com/jobs/view/schadebehandelaar-volmacht-amsterdam-werk-co-werving-en-selectie-at-werkzoeken-nl-2327159845?refId=7c35ea26-dcc5-4c29-8170-8ff34ee34f96&position=7&pageNum=0&trk=public_jobs_job-result-card_result-card_full-click,2 weeks ago,2 weeks ago,2020-11-19,2020-11-30
8,education,LinkedIn,2273916540,Stagiair onderwijs & talentontwikkeling,rD1ML2iTT6aU6Xas6iFuUA==,Stedelijk Museum Amsterdam,"Amsterdam, North Holland, Netherlands","['Design', 'Museums and Institutions', 'Research']","Het Stedelijk Museum Amsterdam is het grootste museum voor moderne en hedendaagse kunst en vormgeving in Nederland, met bekende namen in de collectie en een levendig en spraakmakend tentoonstellingsprogramma, varirend van grote publiekstrekkers tot signalerende tentoonstellingen van jonge kunstenaars en ontwerpers Het Stedelijk Museum heeft Amsterdamse wortels, richt zich op een internationaal publiek en staat met 700000 bezoekers per jaar op de vierde plek van best bezochte musea in Nederland Het Stedelijk Museum beschouwt educatie als een kernopdracht Families, leerlingen, jongeren en volwassenen gaan in dialoog over kunst, kunstenaars en het museum Educatieve programmas en rondleidingen sluiten aan bij belangstelling en kennisniveaus van de bezoekers Een uitnodiging tot kijken, vragen, discussiren n creren In het museum nemen leerlingen en leraren deel aan dialoog gestuurde onderwijsprogrammas en in de klas bieden we online lessen met videos Stagiair Onderwijs  Talentontwikkeling mvx Voor minimaal 5 maanden, 32 uur per week, startdatum bij voorkeur vanaf 1 februari 2021, , Werkzaamheden",Full-time,https://www.linkedin.com/jobs/view/externalApply/2273916540?url=https%3A%2F%2Fwww%2Evacatures%2Enl%2Fvacature%2Fstagiair-onderwijs-en-talentontwikkeling%3A44093536%2F&urlHash=q8HS&refId=7c35ea26-dcc5-4c29-8170-8ff34ee34f96&trk=public_jobs_apply-link-offsite,https://nl.linkedin.com/jobs/view/stagiair-onderwijs-talentontwikkeling-at-stedelijk-museum-amsterdam-2273916540?refId=7c35ea26-dcc5-4c29-8170-8ff34ee34f96&position=8&pageNum=0&trk=public_jobs_job-result-card_result-card_full-click,2 weeks ago,2 weeks ago,2020-11-19,2020-11-30
9,education,LinkedIn,2324767568,Parttime administratief medewerker,VTpahXqaRni8s0r+bChM0A==,Uitzendbureaunl,"Amsterdam, North Holland, Netherlands","['Internet', 'Machinery', 'Staffing and Recruiting']","Ben jij op zoek naar een tijdelijke parttime administratie uitdaging in de buurt van Amsterdam Dan zij wij op zoek naar jou, , Voor een leuk bedrijf in Amsterdam zijn wij op zoek naar een administratief medewerker die per 1 januari kan beginnen voor ongeveer 36 maanden, , De afdeling jij waar jij aan de slag gaat heet Permanente Educatie en is verantwoordelijk voor het nalopen bij houden van de verplichte punten die een accountant moet halen om zijn of haar beroep te kunnen uitoefenen, genaamd PEpunten Ze gaan over van een oud PEpunten systeem naar een nieuw PEpunten systeem en daar komt een hoop administratie bij kijken, , , , Voor deze functie zal jij veel aan de telefoon zitten, bellen is namelijk sneller, , , Deze functie is in eerste instantie tijdelijk en daarom op basis van een tijdelijk dienstverband, , Vaardigheden, , , Opleiding, , MBO 34, , Over de werkgever, , Jij komt te werken bij een beroepsorganisatie van accountants Zij beschermen de titels die accountants mogen dragen doormiddel van het opstellen en handhaven van heldere gedrags en beroepsregels voor alle accountants, door toetsing en door permanente educatie",Part-time,https://www.linkedin.com/jobs/view/externalApply/2324767568?url=https%3A%2F%2Fnl%2Ejooble%2Eorg%2Fexternal%2F-7949798611697588113%3Futm_campaign%3DNL%26utm_medium%3Dsocial%26utm_source%3Dlinkedin%26JobSource%3DBoard&urlHash=Vidu&refId=7c35ea26-dcc5-4c29-8170-8ff34ee34f96&trk=public_jobs_apply-link-offsite,https://nl.linkedin.com/jobs/view/parttime-administratief-medewerker-at-uitzendbureau-nl-2324767568?refId=7c35ea26-dcc5-4c29-8170-8ff34ee34f96&position=9&pageNum=0&trk=public_jobs_job-result-card_result-card_full-click,2 weeks ago,2 weeks ago,2020-11-19,2020-11-30
10,education,LinkedIn,2307095422,Hogeschool Leiden zoekt: Directeur Faculteit Educatie,AFPy+6YsSOiIPUV29Dpn8A==,Hogeschool Leiden,"Leiden, South Holland, Netherlands",['Higher Education'],"Hogeschool Leiden zoekt Directeur Faculteit Educatie, , We hebben een groot verlangen naar ander onderwijs Onderwijs dat gericht is op ontwikkeling als mens, op worden wie je bent Onderwijs dat kinderen en jong volwassenen helpt om wijsheid te ontwikkelen en volwassen in de wereld te kunnen staan met liefde voor zichzelf, de ander en de wereld, met een innerlijk kompas, om het leven te leven, het juiste te doen Onderwijs waarin eigenheid wordt gewaardeerd en gestimuleerd, waarin creativiteit wordt ontplooid, waarin verschillen worden benut, waarin we allemaal lerend zijn en hier zichtbaar in durven te zijn Onze ambities zijn verankerd in een visie op ontwikkelen waarbij de kernwaarden als autonomie in verbondenheid, ruimte en partnerschap centraal staan Wij zoeken een directeur die zich hierin herkent en die samen met ons aan deze missie wil bijdragen",Full-time,https://www.linkedin.com/jobs/view/externalApply/2307095422?url=https%3A%2F%2Fwww%2Ehsleiden%2Enl%2Fover-hl%2Fwerken-bij%2Fvacatures%2Fdirecteur-faculteit-educatie-12-nov-2020&urlHash=dpjH&trk=public_jobs_apply-link-offsite,https://nl.linkedin.com/jobs/view/hogeschool-leiden-zoekt-directeur-faculteit-educatie-at-hogeschool-leiden-2307095422?refId=7c35ea26-dcc5-4c29-8170-8ff34ee34f96&position=10&pageNum=0&trk=public_jobs_job-result-card_result-card_full-click,2 weeks ago,2 weeks ago,2020-11-19,2020-11-30
11,education,LinkedIn,2323371818,Parttime administratief medewerker,epvtBkRoTqu64i34R8SubQ==,Hoplo,"Amsterdam, North Holland, Netherlands",['Business Supplies and Equipment'],"Bedrijfsomschrijving, , Jij komt te werken bij een beroepsorganisatie van accountants Zij beschermen de titels die accountants mogen dragen doormiddel van het opstellen en handhaven van heldere gedrags en beroepsregels voor alle accountants, door toetsing en door permanente educatie, , , , Ben jij op zoek naar een tijdelijke parttime administratie uitdaging in de buurt van Amsterdam Dan zij wij op zoek naar jou, , Voor een leuk bedrijf in Amsterdam zijn wij op zoek naar een administratief medewerker die per 1 januari kan beginnen voor ongeveer 36 maanden, , De afdeling jij waar jij aan de slag gaat heet Permanente Educatie en is verantwoordelijk voor het nalopen bij houden van de verplichte punten die een accountant moet halen om zijn of haar beroep te kunnen uitoefenen, genaamd PEpunten Ze gaan over van een oud PEpunten systeem naar een nieuw PEpunten systeem en daar komt een hoop administratie bij kijken, , , , Voor deze functie zal jij veel aan de telefoon zitten, bellen is namelijk sneller, , , , , , , Deze functie is in eerste instantie tijdelijk en daarom op basis van een tijdelijk dienstverband",Part-time,https://www.linkedin.com/jobs/view/externalApply/2323371818?url=https%3A%2F%2Feasyapply%2Ejobs%2Fr%2Fb7cn00b1U1gFzb36HMP6&urlHash=Qmui&trk=public_jobs_apply-link-offsite,https://nl.linkedin.com/jobs/view/parttime-administratief-medewerker-at-hoplo-s-r-l-2323371818?refId=7c35ea26-dcc5-4c29-8170-8ff34ee34f96&position=11&pageNum=0&trk=public_jobs_job-result-card_result-card_full-click,2 weeks ago,2 weeks ago,2020-11-19,2020-11-30
12,education,LinkedIn,2317394456,P&O Medewerker,Wi84IzwZTtiqHslZHE11HQ==,FYGI  Happy Recruiters,"Amsterdam, North Holland, Netherlands",['Food & Beverages'],"Wil jij als PO medewerker werken bij een uniek, middelgroot accountantskantoor in Amsterdam Die de financile processen en jaarrekeningen van onder andere musea, theaters, welzijnsorganisaties en goede doelen controleert En waarbij jij jouw werkdagen en tijden flexibel kan invullen Ga dan aan de slag bij Dubois  Co Ht unieke aan dit kantoor is dat jouw mening telt Medezeggenschap is verweven in de cultuur Betrokkenheid is het allerbelangrijkst, zowel in maatschappelijk, professioneel als persoonlijk opzicht, , Als PO medewerker ga jij aan de slag bij Dubois  Co in Amsterdam Samen werk jij met ongeveer 45 collegas Wat voor hen zo belangrijk is Het persoonlijke karakter Dat maakt dit accountantskantoor zo bijzonder en prettig Jij bent het eerstelijns PO aanspreekpunt voor de organisatie, zowel voor de controlepraktijk de registeraccountants als de ondersteunende diensten secretariaat en ICT, , Dit ga je doen, , Als PO medewerker ligt jouw primaire focus op het ondersteunen en ontzorgen van de leidinggevenden en andere collegas op POgebied Je zorgt ervoor dat het primaire administratieve PO proces volledig wordt geregeld En, verder, , , Ook vind je het het leuk om te zorgen dat Dubois zowel online als offline zichtbaar is op diverse delen van de arbeidsmarkt Je wordt blij van het uitzetten van wervingsacties voor Young Professionals bij hogescholen en universiteiten Je ondersteunt ook op het gebied van ontwikkeling en educatie van de collegas, onder andere door het organiseren van cursussen en trainingen Deze zelfstandige functie is heel afwisselend waarbij je primair operationele werkzaamheden verricht en ook tactisch meedenkt en werkt, , Functieeisen, , Als PO medewerker bij Dubois  Co in Amsterdam heb jij een hart voor mens en maatschappij Jij bent een aanpakker Een kei in plannen en organiseren Dit is ook waar je energie van krijgt Maar, wat vragen we nog meer van je, , , Arbeidsvoorwaarden, , , , Wil jij aan de slag als PO medewerker bij een uniek accountskantoor in Amsterdam Waarbij je jouw werkplaats, werkdagen en tijden flexibel kunt invullen Dan is dit jouw perfecte baan, , , En, krijgt ruimte om je maatschappelijk betrokken in te zetten bij een doel naar keuze",Full-time,https://www.linkedin.com/jobs/view/externalApply/2317394456?url=https%3A%2F%2Fjoblift%2Enl%2Fdetails%2F7e8bea3f-ac2b-4c27-8892-7089ce2af7b7%3Fjid%3D4df3a1866baa6132e5186196ec2c2391c72421d86d878e11117786df7c42d136%26utm_source%3Dlinkedin_nl%26utm_medium%3Dexternal_feed%26utm_campaign%3D385&urlHash=E1rp&trk=public_jobs_apply-link-offsite,https://nl.linkedin.com/jobs/view/p-o-medewerker-at-fygi-happy-recruiters-2317394456?refId=7c35ea26-dcc5-4c29-8170-8ff34ee34f96&position=12&pageNum=0&trk=public_jobs_job-result-card_result-card_full-click,2 weeks ago,2 weeks ago,2020-11-19,2020-11-30
13,education,LinkedIn,2278409856,Persmanager opera,JJkZSTSOT4+gLMlfruCx6Q==,Dutch National Opera  Ballet,"Amsterdam, North Holland, Netherlands",['Performing Arts'],"Organisatie, , Nationale Opera  Ballet is het huis van De Nationale Opera en Het Nationale Ballet Beide toonaangevende gezelschappen worden door het rijk gerekend tot de topinstellingen Met choreografen, regisseurs, dirigenten en ontwerpers van wereldniveau creren, produceren en presenteren wij producties die behoren tot de internationale top Daarnaast bieden wij kwalitatief hoogwaardige educatie en participatieprojecten voor een breed publiek van jong tot oud Ruim zeshonderd collegas met 30 verschillende nationaliteiten werken dagelijks samen aan de realisatie van onze ambitieuze programmering met een artistieke kwaliteit en vooruitstrevende techniek die ons uniek maken, , Vacature, , Als persmanager zorg je voor het genereren van maximale en positieve aandacht voor De Nationale Opera DNO in binnen en buitenland met als doel het creren van een sterk maatschappelijk draagvlak en het verleiden van een zo groot mogelijke groep mensen tot het bezoeken van een voorstelling, , Je zoekt continu kansen om vrije publiciteit te realiseren Door je goede relatie met de pers in binnen en buitenland en je brede medianetwerk, vasthoudendheid, creativiteit en daadkracht weet je DNO zowel bij operakenners als bij het grote publiek op de kaart te zetten en te houden Je bespeelt daarvoor een zo breed mogelijk veld, van traditionele vakpers en televisie tot bloggers en lifestylemagazines, , Intern weet je goed samen te werken met zangers, dirigenten en leden van artistieke teams om publiciteit te creren voor een productie of DNO als organisatie Voor muziekopera journalisten in binnen en buitenland ben je niet alleen het aanspreekpunt, maar je faciliteert hen ook door het aanleveren van informatie Hierbij word je ondersteund door een gedeelde afdelingsassistent persmanager Je levert daarnaast geregeld content voor de eigen social media, , Je adviseert, ontwikkelt en ondersteunt het mediabeleid van de directeur Opera Daarnaast adviseer en ondersteun je de directeur Opera bij woordvoering en draag je bij aan een internationale persstrategie op het gebied van opinie en beeldvorming over de kunstvorm opera, producties van DNO, het gezelschap en het huis Dit doe je in overleg en afstemming met hoofd Public Affairs DNO, , Samen met de persmanagers Ballet en Corporate Communicatie adviseer je het hoofd van de afdeling over het pers en communicatiebeleid Tot slot werk je nauw samen met andere afdelingen zoals Educatie, Participatie en Programmering en Fondsenwerving en Relatiebeheer, , Wij zoeken, , , , We bieden",Full-time,https://www.linkedin.com/jobs/view/externalApply/2278409856?url=https%3A%2F%2Fjoblift%2Enl%2Fdetails%2F177c5664-61fe-416b-b445-51b4e77b3562%3Fjid%3D03231e2c9892f7ae18a4f30a2f80f401b1e1af5b6b8606c10f2f66ca55cac4b6%26utm_source%3Dlinkedin_nl%26utm_medium%3Dexternal_feed%26utm_campaign%3D126&urlHash=O-dk&refId=7c35ea26-dcc5-4c29-8170-8ff34ee34f96&trk=public_jobs_apply-link-offsite,https://nl.linkedin.com/jobs/view/persmanager-opera-at-nationale-opera-ballet-2278409856?refId=7c35ea26-dcc5-4c29-8170-8ff34ee34f96&position=13&pageNum=0&trk=public_jobs_job-result-card_result-card_full-click,2 weeks ago,2 weeks ago,2020-11-19,2020-11-30
14,education,LinkedIn,2271177160,Stage Digital - januari/februari 2021,QHIxFreYR9ORd6FlSTbGNg==,LOral,"Hoofddorp, North Holland, Netherlands","['Consumer Goods', 'Cosmetics']","Stage Digital, , Per januarifebruari 2021 beschikbaar, , Profiel, , , , , , , , , LOral is n van de meest innovatieve en digital gedreven FMCGbedrijven in Nederland Een stage bij LOral laat jou de wereld buiten de universiteit zien en zorgt ervoor dat jij jezelf beter leert kennen Als stagiair wordt je namelijk opgenomen in het Intern Development Program IDP, waarbij jouw ontwikkeling wordt gestimuleerd middels diverse activiteiten Bij deze 6 maanden durende stage krijg je een goed beeld van de werkzaamheden binnen jouw interessegebied, waardoor het kiezen van een master programma of toekomstige baan makkelijker wordt Daarnaast krijg je binnen onze dynamische organisatie ook inzicht in andere vakgebieden",Full-time,https://www.linkedin.com/jobs/view/externalApply/2271177160?url=https%3A%2F%2Floa%2Eavature%2Enet%2Fcareers%2FJobDetail%2F88219&urlHash=lAv3&refId=7c35ea26-dcc5-4c29-8170-8ff34ee34f96&trk=public_jobs_apply-link-offsite,https://nl.linkedin.com/jobs/view/stage-digital-januari-februari-2021-at-l-or%C3%A9al-2271177160?refId=7c35ea26-dcc5-4c29-8170-8ff34ee34f96&position=14&pageNum=0&trk=public_jobs_job-result-card_result-card_full-click,2 weeks ago,2 weeks ago,2020-11-19,2020-11-30
