Data Row,Search Keyword,Platform,Job ID,Job Title,Tracking ID,Company Name,Location,Industry,Job Description,Employment Type,Company URL,Job URL,Job Age,Job Age Number,Job Date,Collection Date
1,transport,LinkedIn,2224776450,Team Lead Export,fGfhdzq5Rx6okC2YmVB2PA==,DSV  Global Transport and Logistics,"Schiphol, North Holland, Netherlands",['Logistics and Supply Chain'],"Voor onze snelgroeiende divisie DSV Air  Sea, standplaats Rozenburg Schiphol, zijn wij op zoek naar een, , Team Lead Export",Full-time,,https://nl.linkedin.com/jobs/view/team-lead-export-at-dsv-global-transport-and-logistics-2224776450?refId=89df2fa0-45f7-4ca8-a850-1d910e9a6b03&position=1&pageNum=0&trk=public_jobs_job-result-card_result-card_full-click,3 days ago,3 days ago,2020-11-26,2020-11-30
2,transport,LinkedIn,2325472681,Transport Planner,ByBPXaU1TGqUvKG2WcHPEQ==,Talent,"RotterdamThe Hague metropolitan area, South Holland, Netherlands","['Computer Networking', 'Computer & Network Security', 'Telecommunications']","Job Context  Duties, , Study traffic flow, , Apply statistical analysis techniques, , Possess visual literacy, , Analyse transport business networks, , Conduct environmental surveys, , , , Excellent time management and organisational skills, , Accuracy and attention to details, , Ability to work independently, , Good communication, cooperation and team working skills, , Ability to work effectively in an international or multicultural environment",Full-time,https://www.linkedin.com/jobs/view/externalApply/2325472681?url=https%3A%2F%2Fneuvoo%2Enl%2Fjob%2Ephp%3Fid%3D8e341f2f638e%26source%3Dlinkedin%26utm_source%3Dpartner%26utm_medium%3Dlinkedin%26puid%3Dfdd8cadb8dddfddc9ddfaadaaddegadaaddafddd3de8cacbfec3ddcg3e&urlHash=UA-7&refId=89df2fa0-45f7-4ca8-a850-1d910e9a6b03&trk=public_jobs_apply-link-offsite,https://nl.linkedin.com/jobs/view/transport-planner-at-talent-2325472681?refId=89df2fa0-45f7-4ca8-a850-1d910e9a6b03&position=2&pageNum=0&trk=public_jobs_job-result-card_result-card_full-click,3 days ago,3 days ago,2020-11-26,2020-11-30
3,transport,LinkedIn,2319585266,Teamleader Transport,O1oozPluSNmbwheESLdB0g==,DB Schenker,"Amsterdam, North Holland, Netherlands","['Logistics and Supply Chain', 'Airlines/', 'Aviation']","Ben jij graag iedere dag actief binnen de hectische luchtvracht omgeving Zie jij het puzzelen binnen de transport als grootste uitdaging in je baan En geef je ook graag operationele leiding aan een groep Dan zoeken wij naar jou, , De functie",Full-time,https://www.linkedin.com/jobs/view/externalApply/2319585266?url=https%3A%2F%2Fwww%2Eaplitrak%2Ecom%2F%3Fadid%3Dc2NoZW5rZXJsb2dpc3RpY3NiZW5lbHV4LjY2MDYyLjE1NTBAZGJzY2hlbmtlcmJsbmUuYXBsaXRyYWsuY29t&urlHash=udxc&refId=89df2fa0-45f7-4ca8-a850-1d910e9a6b03&trk=public_jobs_apply-link-offsite,https://nl.linkedin.com/jobs/view/teamleader-transport-at-db-schenker-2319585266?refId=89df2fa0-45f7-4ca8-a850-1d910e9a6b03&position=3&pageNum=0&trk=public_jobs_job-result-card_result-card_full-click,3 days ago,3 days ago,2020-11-26,2020-11-30
4,transport,LinkedIn,2311780533,Transport Planning Officer M/F,c+XYC9TcQXWvxT/vXowQmA==,GEFCO,"Waalwijk, North Brabant, Netherlands",['Logistics and Supply Chain'],"Contexte, , With operations in 47 countries, GEFCO Group is a global leader in industrial supply chain solutions and the European 1 in automotive logistics We are proud of our 70 years of heritage and the expertise of our 15,000 employees around the world, , , , , , , , , , , , , ,  , , , , , ,  , , , , , , , , , , , , , , , , , , , , , , , , , , , , , Mission, , , , , , , , , , , , , , , Profil",Full-time,https://www.linkedin.com/jobs/view/externalApply/2311780533?url=https%3A%2F%2Fwww%2Egefco-careers%2Enet%2F%3F_4x1F8B08000000000000006D8FBD0E83200084DF86D1F0A34807062BD03837CE4685365805829AD4B7AF697473BEEFBEDC051F2ACD21F0519BC811E8DB7134715DADE6984296DF306B30638412461B54A7A481680FC0FC31DBC338B1B94B2E3B311F172EE4B30497CABCC1354A0F3644DF9B79AE1633F1B0F7DA31197C17FCBC58F74E06842188BED56E9DBA7DEA950A1F26EBEC52D795B8BE704EFBF6DCBF5E265AFD7FC3252652A97B41B0A21466B94C0B2864AA72951512B2F207727C367D2B010000%26offerid%3D15655&urlHash=5m-P&refId=89df2fa0-45f7-4ca8-a850-1d910e9a6b03&trk=public_jobs_apply-link-offsite,https://nl.linkedin.com/jobs/view/transport-planning-officer-m-f-at-gefco-2311780533?refId=89df2fa0-45f7-4ca8-a850-1d910e9a6b03&position=4&pageNum=0&trk=public_jobs_job-result-card_result-card_full-click,3 days ago,3 days ago,2020-11-26,2020-11-30
5,transport,LinkedIn,2325414612,Freight Transport Dispatcher,ntyo+LruRY63wcyA24fu/g==,Talent,"RotterdamThe Hague metropolitan area, South Holland, Netherlands","['Computer Networking', 'Computer & Network Security', 'Telecommunications']","Job Context  Duties, , Monitor vehicle fleet operations, , Keep task records, , Communicate verbal instructions, , Make independent operating decisions, , Conduct analysis of ship data, , , , Openness and interest in learning and further development, , Good communication, cooperation and team working skills, , Accuracy and attention to details, , Experience of having worked in a similar role, , Ability to work effectively in an international or multicultural environment",Full-time,https://www.linkedin.com/jobs/view/externalApply/2325414612?url=https%3A%2F%2Fneuvoo%2Enl%2Fjob%2Ephp%3Fid%3D4b8e55fc5142%26source%3Dlinkedin%26utm_source%3Dpartner%26utm_medium%3Dlinkedin%26puid%3Dfddccade8dd8fadb9ddbaddbaadagaddaddbfddf3deccdcefec3ddcg3e&urlHash=gQ4D&refId=89df2fa0-45f7-4ca8-a850-1d910e9a6b03&trk=public_jobs_apply-link-offsite,https://nl.linkedin.com/jobs/view/freight-transport-dispatcher-at-talent-2325414612?refId=89df2fa0-45f7-4ca8-a850-1d910e9a6b03&position=5&pageNum=0&trk=public_jobs_job-result-card_result-card_full-click,3 days ago,3 days ago,2020-11-26,2020-11-30
6,transport,LinkedIn,2271136718,Manager Transport,fQVE5yvTQvqO4acN8RaLCw==,Ahrend,"SintOedenrode, North Brabant, Netherlands",['Furniture'],"Wat ga je doen, Als Manager Transport is het voor jou een uitdaging om het uitleverproces te garanderen, nationaal en internationaal, vanuit een distributie centrum naar de eindklanten voor Koninklijke Ahrend Als contract manager draag je de zorg samen met jouw afdeling ca 34 fte dat de uitbestede transporten worden uitgevoerd conform afspraak mbt performance en kosten, maar ben je ook verantwoordelijk voor de administratieve afhandeling van de leveringen De manager cordineert alle transport activiteiten verschillende modaliteiten, zowel nationaal als internationaal Tevens ondersteun je de warehouse  distributie processen maar ook de montage  service processen In het internationale supply chain netwerk ondersteun en adviseer je in contracten, partnerkeuzes en inrichting Je cordineert, organiseert en geeft leiding aan de afdeling",Full-time,https://www.linkedin.com/jobs/view/externalApply/2271136718?url=http%3A%2F%2Fjob%2Eahrend%2Ecom%2Fvacatures%2Fvacature_manager_transport_173851_12%2Ehtml&urlHash=LSvj&refId=89df2fa0-45f7-4ca8-a850-1d910e9a6b03&trk=public_jobs_apply-link-offsite,https://nl.linkedin.com/jobs/view/manager-transport-at-ahrend-2271136718?refId=89df2fa0-45f7-4ca8-a850-1d910e9a6b03&position=6&pageNum=0&trk=public_jobs_job-result-card_result-card_full-click,3 days ago,3 days ago,2020-11-26,2020-11-30
7,transport,LinkedIn,2319892406,Teamleader Transport,KK9RRUXVSpyv6f3L9wY3Zg==,Nederland Vacature Groep,"Amsterdam, North Holland, Netherlands","['Logistics and Supply Chain', 'Staffing and Recruiting', 'Transportation/', 'Trucking/', 'Railroad']","Ben jij graag iedere dag actief binnen de hectische luchtvracht omgeving Zie jij het puzzelen binnen de transport als grootste uitdaging in je baan En geef je ook graag operationele leiding aan een groep Dan zoeken wij naar jou, , De functie, , , , Wij vragen, , , Wij bieden, , Werken in een team, in een transparante organisatie met vestigingen wereldwijd Een marktconform salaris dat past bij deze functie samen met ambitieuze doelstellingen die jij in samenwerking met collegas voor ons bedrijf zal gaan realiseren Wij bieden dit met daarnaast natuurlijk voldoende ruimte voor opleiding en persoonlijke ontwikkeling Jij komt te werken bij de Top 3 speler wereldwijd binnen de logistiek Dat je als medewerker het verschil kan maken, veel bedrijven zeggen het, bij ons is het zo Een preemployment screening is onderdeel van deze procedure, , Voor meer informatie bekijk onze bedrijfspagina klik op ons logo bovenaan de vacature, , , Solliciteer direct, , ",Full-time,https://www.linkedin.com/jobs/view/externalApply/2319892406?url=https%3A%2F%2Fnederlandvacature%2Enl%2Fvacature%2Fteamleader-transport-in-amsterdam%2F253123%2F%3Futm_source%3Dxmlfeed_linkedin%26utm_medium%3Dwebsite%26utm_campaign%3D26470&urlHash=-ixp&refId=89df2fa0-45f7-4ca8-a850-1d910e9a6b03&trk=public_jobs_apply-link-offsite,https://nl.linkedin.com/jobs/view/teamleader-transport-at-nederland-vacature-groep-2319892406?refId=89df2fa0-45f7-4ca8-a850-1d910e9a6b03&position=7&pageNum=0&trk=public_jobs_job-result-card_result-card_full-click,3 days ago,3 days ago,2020-11-26,2020-11-30
8,transport,LinkedIn,2320598375,"Carrier Manager, Amsterdam",7DFv1JSqTJadeEmaNjuUgg==,IC Resources,"Amsterdam, North Holland, Netherlands","['Electrical/', 'Electronic Manufacturing', 'Semiconductors', 'Telecommunications']","As a Carrier Manager you mainly lead the transport tender activities within one of the top players in the market The role, Purchase of transport, Build and maintain relationships with customers,, Negotiate rates with carriers and guarantee service quality",Full-time,https://www.linkedin.com/jobs/view/externalApply/2320598375?url=https%3A%2F%2Fwww%2Evacatures%2Enl%2Fvacature%2Fcarrier-manager-amsterdam%3A44353984%2F&urlHash=I4IY&refId=89df2fa0-45f7-4ca8-a850-1d910e9a6b03&trk=public_jobs_apply-link-offsite,https://nl.linkedin.com/jobs/view/carrier-manager-amsterdam-at-ic-resources-2320598375?refId=89df2fa0-45f7-4ca8-a850-1d910e9a6b03&position=8&pageNum=0&trk=public_jobs_job-result-card_result-card_full-click,3 days ago,3 days ago,2020-11-26,2020-11-30
9,transport,LinkedIn,2295758614,Transport planner,/wKHCA7mRAiwm59176QWpA==,Page Personnel,"Utrecht, Utrecht, Netherlands","['Staffing and Recruiting', 'Retail', 'Financial Services']","Transport planner, Internationale en veelzijdige plannersfunctie, Ruim 80000 ritten en transporten plannen, About Our Client, Deze internationale organisatie is een logistieke dienstverlener die al jaren gespecialiseerd is in het bieden van de beste logistieke oplossingen voor klanten Het kantoor is gevestigd in Utrecht, waar ruim 50 enthousiaste medewerkers elke dag samenwerken om de klant zo goed mogelijk te bedienen Het is een snelgroeiende dynamische organisatie en er worden elk jaar meer dan 80000 ritten en transporten gepland in heel Europa, , , , Als transport planner ben je verantwoordelijk voor een efficinte belading en ritplanning Hierbij houdt je rekening met de wensen van de klant en de beschikbaarheid van mens en materieel en wettelijke voorschriften Dit alles met in acht neming van de opbrengsten en kosten ten einde een positief resultaat te behalen Daarnaast anticipeer je op eventuele knelpunten in het logistieke proces, , , , , , Wij bieden een uitdagende baan in een dynamische organisatie met een informele bedrijfscultuur waar de lijntjes kort worden gehouden Hiernaast betreft het prima primaire en secundaire voorwaarden In deze functie is er een salarisindicatie tussen de 2200 3000 bruto per maand, afhankelijk van je werkervaring Het betreft een fulltime functie met uitzicht op een vast dienstverband",Full-time,https://www.linkedin.com/jobs/view/externalApply/2295758614?url=https%3A%2F%2Fwww%2Epagepersonnel%2Enl%2Fjob-apply%2Ftransport-planner%2Fref%2F178047%3Futm_source%3Dlinkedin%26utm_medium%3Daggregator%26utm_campaign%3Dlimitedlisting&urlHash=YjOj&refId=89df2fa0-45f7-4ca8-a850-1d910e9a6b03&trk=public_jobs_apply-link-offsite,https://nl.linkedin.com/jobs/view/transport-planner-at-page-personnel-2295758614?refId=89df2fa0-45f7-4ca8-a850-1d910e9a6b03&position=9&pageNum=0&trk=public_jobs_job-result-card_result-card_full-click,3 days ago,3 days ago,2020-11-26,2020-11-30
10,transport,LinkedIn,2297599547,Carrier Manager,XfVvuj4kSaa4vVPDVlFHVQ==,IC Resources,"North Holland, Netherlands","['Package/', 'Freight Delivery', 'Logistics and Supply Chain']","Carrier Procurement Manager, As a Carrier Manager you mainly lead the transport tender activities within one of the top players in the market,   The role",Full-time,,https://nl.linkedin.com/jobs/view/carrier-manager-at-ic-resources-2297599547?refId=89df2fa0-45f7-4ca8-a850-1d910e9a6b03&position=10&pageNum=0&trk=public_jobs_job-result-card_result-card_full-click,3 days ago,3 days ago,2020-11-26,2020-11-30
11,transport,LinkedIn,2295757875,Transport Planner,LhxEJGksT8q/ADddL3Unlw==,Page Personnel,"SchipholRijk, North Holland, Netherlands","['Staffing and Recruiting', 'Retail', 'Financial Services']","Transport Planner, Werken in een ambitieuze internationale werkomgeving, Uitdagende positie bij een logistiek dienstverlener in Schiphol, About Our Client, Deze internationale klant is een logistieke dienstverlener die in korte tijd aan het groeien is Het bedrijf richt zich op import en export van consumenten goederen, gefocust op de ECommerce Daarbij verzorgen zij ook verschillende transport diensten",Full-time,https://www.linkedin.com/jobs/view/externalApply/2295757875?url=https%3A%2F%2Fwww%2Epagepersonnel%2Enl%2Fjob-apply%2Ftransport-planner%2Fref%2F182265%3Futm_source%3Dlinkedin%26utm_medium%3Daggregator%26utm_campaign%3Dlimitedlisting&urlHash=k5Io&refId=89df2fa0-45f7-4ca8-a850-1d910e9a6b03&trk=public_jobs_apply-link-offsite,https://nl.linkedin.com/jobs/view/transport-planner-at-page-personnel-2295757875?refId=89df2fa0-45f7-4ca8-a850-1d910e9a6b03&position=11&pageNum=0&trk=public_jobs_job-result-card_result-card_full-click,3 days ago,3 days ago,2020-11-26,2020-11-30
12,transport,LinkedIn,2326312158,Transport Manager,WJJth6pCQdKLe1Ch3EofFg==,MattCo,"De Kwakel, North Holland, Netherlands",['Mining & Metals'],"Functieomschrijving Transport Manager, , Sinds 2018 is Verdel Logistiek opgericht met de droom haar klanten op het gebied van logistiek volledig te ontzorgen Met een eigen loods van ruim 5000 vierkante meters hebben zij afgelopen jaren een enorme groei doorgemaakt en een mooie vaste klantportefeuille weten op te bouwen Voor een van de grootste klanten nemen zij op korte termijn de gehele regie van het totale logistieke proces op zich De indeling en inkoop van het wegtransport door heel Europa is hier een groot onderdeel van Door een betrouwbaar netwerk op te bouwen van leveranciers kun jij het beste transport verzorgen voor de scherpste prijzen Daarnaast ben jij het eerste aanspreekpunt voor deze klant en kunnen zij met al hun vragen bij jou terecht, , Taken en verantwoordelijkheden, , , , Als Transport Manager ben jij altijd op zoek naar de beste kwaliteit voor de beste prijs Met jouw netwerk van transporteurs schakel jij dagelijks over transporten door heel Europa Elk probleem zie jij als een uitdaging en hier heb jij binnen notime een passende oplossing voor, , Functieeisen Transport Manager, , Als teamspeler ben jij een ster in het oplossen van problemen en maken van afspraken Jij weet het overzicht te bewaren in een werkomgeving waar zowel klant als leverancier veel van jou vragen Met een scherp oog voor detail werk jij aan een gestroomlijnd logistiek proces dat efficint is ingericht Met jouw flexibele instelling kan je goed tegen een veranderende omgeving en vind je het leuk om af een toe een taak buiten je eigen takenpakket op te pakken, , Verder voldoe je aan de volgende criteria, , , , Aanbod Transport Manager, , Verdel Logistiek groeit momenteel snel en daar kan jij deel van uitmaken Het internationaal opererende bedrijf gelooft in samenwerken met medewerkers, klanten en partners Zij werken aansluitend met gemotiveerde medewerkers en bieden passende doorgroeimogelijkheden, , Daarnaast wordt het volgende jou aangeboden, , , , Organisatie, , Verdel logistiek bestaat nu circa 2 jaar en is gevestigd in De Kwakel Zij zijn gestart met het aanbieden van warehousing en verzorgen momenteel de regie van het gehele logistieke proces voor verschillende organisaties Als droom zijn zij in staat om klanten volledig te ontzorgen op het gebied van logistiek Dit met hun eigen transport faciliteiten en hun partners, , MATTCO en Solliciteren, , Met MATTCO denken wij in kansen en geloven wij dat iedereen een kans verdient Vanuit dat uitgangspunt zijn wij begonnen met ondernemen Het gaat om de juiste mensen op de juiste plek laten werken Wij helpen de werknemer zijn talent te ontwikkelen en de opdrachtgever zijn doelen te behalen Dat is waar wij voldoening uit halen Gaan wij dit samen met jou realiseren Neem dan contact met ons op",Full-time,https://www.linkedin.com/jobs/view/externalApply/2326312158?url=https%3A%2F%2Fjoblift%2Enl%2Fdetails%2F4e1a4e04-7e34-48ff-88bd-3e49d49223aa%3Fjid%3D528b48dbdb94a03f544db52e7895eae8ababbca49f457f6ec0305907a548569f%26utm_source%3Dlinkedin_nl%26utm_medium%3Dexternal_feed%26utm_campaign%3D126&urlHash=0e8G&refId=89df2fa0-45f7-4ca8-a850-1d910e9a6b03&trk=public_jobs_apply-link-offsite,https://nl.linkedin.com/jobs/view/transport-manager-at-matt-co-2326312158?refId=89df2fa0-45f7-4ca8-a850-1d910e9a6b03&position=12&pageNum=0&trk=public_jobs_job-result-card_result-card_full-click,3 days ago,3 days ago,2020-11-26,2020-11-30
13,transport,LinkedIn,2316671633,Teamleider Transport,u4GLuF94Sh25hZlyN3yjeQ==,Aldi Nederland,"Bleiswijk, South Holland, Netherlands","['Consumer Goods', 'Retail', 'Supermarkets']","Als Teamleider Transport bij ALDI geef je leiding aan een team van chauffeurs Samen met je team ben je verantwoordelijk voor een correcte en tijdige levering van de goederen aan onze filialen, , , , , , , , Weet je dat ALDI hard aan de weg timmert op het gebied van duurzaamheid, gezondheid en maatschappelijke betrokkenheid Kijk hiervoor op onze website wwwaldinlverantwoord , , Enthousiast geworden Kom dan bij ons werken, dit je kans direct, , Een integriteitscontrole via het Waarschuwingsregister van de stichting Fraude Aanpak Detailhandel is onderdeel van de sollicitatieprocedure, , , , Als Teamleider Transport bij ALDI geef je leiding aan een team van chauffeurs Samen met je team ben je verantwoordelijk voor een correcte en tijdige levering van de goederen aan onze filialen, , , , , , , , Weet je dat ALDI hard aan de weg timmert op het gebied van duurzaamheid, gezondheid en maatschappelijke betrokkenheid Kijk hiervoor op onze website wwwaldinlverantwoord , , Enthousiast geworden Kom dan bij ons werken, dit je kans direct, , Een integriteitscontrole via het Waarschuwingsregister van de stichting Fraude Aanpak Detailhandel is onderdeel van de sollicitatieprocedure",Full-time,https://www.linkedin.com/jobs/view/externalApply/2316671633?url=https%3A%2F%2Fwww%2Ewerkenbijaldi%2Enl%2Fvacatures%2Fteamleider-transport%2Fteamleider-transport%2F&urlHash=od9Q&refId=89df2fa0-45f7-4ca8-a850-1d910e9a6b03&trk=public_jobs_apply-link-offsite,https://nl.linkedin.com/jobs/view/teamleider-transport-at-aldi-nederland-2316671633?refId=89df2fa0-45f7-4ca8-a850-1d910e9a6b03&position=13&pageNum=0&trk=public_jobs_job-result-card_result-card_full-click,3 days ago,3 days ago,2020-11-26,2020-11-30
14,transport,LinkedIn,2273088185,Regional Transport Manager,HOofaJ6bSV2B801HFiii2g==,VIA Logistics Professionals,"sHertogenbosch, North Brabant, Netherlands","['Transportation/', 'Trucking/', 'Railroad', 'Logistics and Supply Chain', 'Warehousing']","Our client is a logistics service provider in region Den Bosch, , Function description, In your job as a Regional Transport Manager you will be part of the wider operational leadership team You supporting Business Units across Europe with multimodal primary transport and global forwarding solutions The objective of this role is to manage transport and freight forwarding operations in your respective region",Full-time,,https://nl.linkedin.com/jobs/view/regional-transport-manager-at-via-logistics-professionals-2273088185?refId=89df2fa0-45f7-4ca8-a850-1d910e9a6b03&position=14&pageNum=0&trk=public_jobs_job-result-card_result-card_full-click,3 days ago,3 days ago,2020-11-26,2020-11-30
15,transport,LinkedIn,2325428402,Road Transport Maintenance Scheduler,kguatn9kSt2yv728EE9tjA==,Talent,"RotterdamThe Hague metropolitan area, South Holland, Netherlands","['Computer Networking', 'Computer & Network Security', 'Telecommunications']","Job Context  Duties, , Maintain vehicle spare parts, , Comply with schedule, , Programme work according to incoming orders, , Manage backlogs, , Read standard blueprints, , , , Experience of having worked in a similar role, , Good interpersonal and communication skills, with customer service orientation, , The ability to deal with a range of tasks at the same time, , The ability to carry out work efficiently and accurately, even under pressure, , Ability to work autonomously",Full-time,https://www.linkedin.com/jobs/view/externalApply/2325428402?url=https%3A%2F%2Fneuvoo%2Enl%2Fjob%2Ephp%3Fid%3D6c0a5c76ca89%26source%3Dlinkedin%26utm_source%3Dpartner%26utm_medium%3Dlinkedin%26puid%3Dfddacadd8ddgfadf9ddbaaddadd9gddaaaddfadf3de8cdc7fec3ddcg3e&urlHash=xrVM&refId=89df2fa0-45f7-4ca8-a850-1d910e9a6b03&trk=public_jobs_apply-link-offsite,https://nl.linkedin.com/jobs/view/road-transport-maintenance-scheduler-at-talent-2325428402?refId=89df2fa0-45f7-4ca8-a850-1d910e9a6b03&position=15&pageNum=0&trk=public_jobs_job-result-card_result-card_full-click,3 days ago,3 days ago,2020-11-26,2020-11-30
16,transport,LinkedIn,2321563157,Carrier Manager,bXB1LpIdSKyujXzcw0NfCw==,Technojobs,"Amsterdam, North Holland, Netherlands",['Mining & Metals'],"As a Carrier Manager you mainly lead the transport tender activities within one of the top players in the market, , The role, , , Contact Name Niall Fearon, Reference TJ801V168461",Full-time,https://www.linkedin.com/jobs/view/externalApply/2321563157?url=https%3A%2F%2Fjoblift%2Enl%2Fdetails%2Fb4ec4eb3-15f0-43e8-9553-870ca5241e2d%3Fjid%3Dc59bde5ab8cee2bbfc54449e7b0b2dae7b6cf2140b95b1f09024bf36220ba319%26utm_source%3Dlinkedin_nl%26utm_medium%3Dexternal_feed%26utm_campaign%3D126&urlHash=2Gqu&refId=89df2fa0-45f7-4ca8-a850-1d910e9a6b03&trk=public_jobs_apply-link-offsite,https://nl.linkedin.com/jobs/view/carrier-manager-at-technojobs-2321563157?refId=89df2fa0-45f7-4ca8-a850-1d910e9a6b03&position=16&pageNum=0&trk=public_jobs_job-result-card_result-card_full-click,3 days ago,3 days ago,2020-11-26,2020-11-30
