Data Row,Search Keyword,Platform,Job ID,Job Title,Tracking ID,Company Name,Location,Industry,Job Description,Employment Type,Company URL,Job URL,Job Age,Job Age Number,Job Date,Collection Date
118,career development specialist,LinkedIn,2277696520,Coachend Verpleegkundige- Loopbaanadvies,bfkHB/oBR32JV7mvyaXuMA==,Akkolade,"Gemeente Hillegom, South Holland, Netherlands",None,"Ben jij als Verpleegkundige toe aan de toe aan de volgende stap in je loopbaan Zou je graag een team willen gaan coachen Akkolade denkt graag met je mee en biedt een gratis loopbaanadvies, Standplaats Hillegom, , Jouw functie, , Als Verpleegkundige voel jij je sterk en goed in je vak Maar soms klopt je werkomgeving niet meer bij jouw ambities Misschien is een rol als meewerkend coach dan wel iets voor jou Akkolade biedt graag een luisterend oor, , In een vrijblijvend gesprek mag je al je wensen met ons te delen, zodat we samen op zoek kunnen gaan naar jouw nieuwe droombaan Met onze expertise in de zorg en welzijn sector en een zeer groot netwerk kunnen wij jou als geen ander begeleiden en van advies voorzien Niets moet na dit gesprek, maar alles mag Wij gaan samen kijken wat het beste bij jou past De kans is groot dat wij openstaande vacatures hebben die tot jouw nieuwe mogelijkheden behoren, , Raak je al genspireerd om een volgende stap in je loopbaan te nemen Dan staat de koffie of thee klaar en spreken wij je vast snel, , , , , , , , , , Onze missie is zorgprofessionals helpen gelukkig te blijven in hun werk Dit doen we door jou te verbinden aan de juiste werkgever in de zorg en welzijn sector, waar jij een vaste baan krijgt Na jouw vrijblijvende reactie nodigen we je graag uit voor een kennismaking met ons Tijdens de kennismaking vertellen we jou alles over het team, de functie en de voorwaarden, maar bespreken we vooral ook jouw wensen en kwaliteiten Jij staat centraal in deze procedure, , Door het Coronavirus hebben wij onze procedure aangepast Kennismaken zal zoveel mogelijk plaatsvinden via videobellen Als je positief bent over het team word je uitgenodigd voor het arbeidsvoorwaardengesprek Je komt dan in dienst bij de zorgorganisatie Wij ondersteunen jou met maar n doel dat jij gelukkig wordt in je nieuwe vaste baan",Full-time,https://www.linkedin.com/jobs/view/externalApply/2277696520?url=https%3A%2F%2Ftwiglers%2Enl%2Fvacatures%2Fakkolade%2Fcoachend-verpleegkundige-loopbaanadvies&urlHash=2Tso&refId=e9dfdb7f-5ae3-476d-b12b-6e9fa9bd3a2c&trk=public_jobs_apply-link-offsite,https://nl.linkedin.com/jobs/view/coachend-verpleegkundige-loopbaanadvies-at-akkolade-2277696520?refId=e9dfdb7f-5ae3-476d-b12b-6e9fa9bd3a2c&position=18&pageNum=4&trk=public_jobs_job-result-card_result-card_full-click,1 month ago,1 month ago,2020-10-14,2020-11-28
119,career development specialist,LinkedIn,2282274772,Verpleegkundige - Loopbaanadvies - Orientatie,b/P3yIBWQICHALpNOqr6kQ==,Akkolade,"Gouda, South Holland, Netherlands",None,"Ben jij als Verpleegkundige toe aan de volgende stap Maar heb je wat advies nodig waar jouw kracht en talent ligt ga je switch maken naar de thuiszorg, het ziekenhuis of naar de verpleeghuiszorg Akkolade heeft een luisterend oor, , Jouw functie, , De zorg en welzijn sector heeft jouw hart als Verpleegkundige al lang gestolen Maar toch twijfel je soms of je nog wel op je plek zit Is het misschien tijd voor een nieuwe uitdaging, , Akkolade is gespecialiseerd in jouw vak en heeft een luisterend oor Voel je vrij om al je wensen met ons te delen, zodat we samen op zoek kunnen gaan naar jouw nieuwe droombaan Met onze expertise in onder andere de VVT, Ziekenhuis en GGZ sector en een zeer groot netwerk, kunnen wij jou als geen ander begeleiden, , Wij gaan samen vrijblijvend kijken wat het beste bij jou past Niets moet na dit gesprek, maar alles mag De kans is groot dat wij vele openstaande vacatures hebben die tot jouw nieuwe mogelijkheden behoren Raak je al genspireerd om een volgende stap in je loopbaan te nemen, Dan staat de koffie of thee klaar en spreken wij je vast snel, , , , , , , , , , Onze missie is zorgprofessionals helpen gelukkig te blijven in hun werk Dit doen we door jou te verbinden aan de juiste werkgever in de zorg en welzijn sector, waar jij een vaste baan krijgt Na jouw vrijblijvende reactie nodigen we je graag uit voor een kennismaking met ons Tijdens de kennismaking vertellen we jou alles over het team, de functie en de voorwaarden, maar bespreken we vooral ook jouw wensen en kwaliteiten Jij staat centraal in deze procedure, , Door het Coronavirus hebben wij onze procedure aangepast Kennismaken zal zoveel mogelijk plaatsvinden via videobellen Als je positief bent over het team word je uitgenodigd voor het arbeidsvoorwaardengesprek Je komt dan in dienst bij de zorgorganisatie Wij ondersteunen jou met maar n doel dat jij gelukkig wordt in je nieuwe vaste baan",Full-time,https://www.linkedin.com/jobs/view/externalApply/2282274772?url=https%3A%2F%2Ftwiglers%2Enl%2Fvacatures%2Fakkolade%2Fverpleegkundige-loopbaanadvies-orientatie-1&urlHash=pCq9&refId=e9dfdb7f-5ae3-476d-b12b-6e9fa9bd3a2c&trk=public_jobs_apply-link-offsite,https://nl.linkedin.com/jobs/view/verpleegkundige-loopbaanadvies-orientatie-at-akkolade-2282274772?refId=e9dfdb7f-5ae3-476d-b12b-6e9fa9bd3a2c&position=19&pageNum=4&trk=public_jobs_job-result-card_result-card_full-click,1 month ago,1 month ago,2020-10-14,2020-11-28
120,career development specialist,LinkedIn,2320615209,Senior Data Governance Specialist,jTuCHmgaSjuSWD5MWoxScA==,Eonics Consultancy,"Den Haag, South Holland, Netherlands","['Information Technology and Services', 'Computer Software', 'Internet']","Job Description, , Data Governance Specialist, NN Group is currently launching a Data Governance office to support a large multiyear Data Governance initiative across Group Finance, Risk and Investment Office This initiative will solve major business data problems with Data Governance, Data Management and Data Architecture Solutions Would you like to set up this data governance green field within a professional organisation with impact, , Your impact as a Data Governance Specialist at NN, , The solution to good Data Governance is multifaceted and equal parts people, process and technology As Data Governance Specialist you create transparency of data issues and clear, practical resolutions to our business stakeholders How to administrate and publish metadata, who should have access it and how to safeguard the data quality are typically questions in your day to day work as you are responsible for the administration of functional and technical metadata including data lineage All with the goal in mind to increase the data quality of NN Group as a whole, , With the launch of our Data Governance office, you get to help set up this data governance green field with all the facilities and complexity of a professional, corporate organisation You will help with the roadmap and vision on data governance as well as working with new tools and built data governance from the ground up, , Realistic results, , Using your own initiative and ambition, you achieve excellent results, , , We also care about you, , , , Just as you as our Data Governance Specialist indirectly care for our customers, we also take care of you With great development opportunities and a pleasant working environment, you will have good reason to find going to work every day a pleasure, , , Whatever we do, we do together in an environment full of freedom where your personality, talents and ideas count For example, collaborating with another team is quite the norm and regularly leads to better outcomes We have no thresholds within NN everyone is readily accessible and willing to help each other, , Our purpose, , Thanks to your efforts, we make our financial services relevant and more personal, , Whatever your supporting role within the business, you offer your honest opinion and enthusiastic approach to all you do Your customeroriented attitude helps to encourage your colleagues Together with NN, you help the whole world through various CSR projects Active in 18 countries with over 17 million customers, you understand our work must be faultless We must continuously innovate and invest in an agile business model Thanks to your professionalism we earn the trust of our customers within all our subsidiaries, and there are quite a few NN, NN Investment Partners, NationaleNederlanden, OHRA, ABN AMRO Insurance, BeFrank, Zicht, AZL and Movir, , Clear conditions, , We offer you modern employment conditions and generous employee benefits For example, you have the option of taking extra vacation days We are also working towards implementing Choose your own Device You will receive your holiday allowance and yearend bonus with your salary every month, without restriction and readily available to you, , Due to the coronavirus, most of the NN colleagues work from home At the moment it is unclear when we can return to the office The official location for this position is The Hague An annual salary of 60k to 80k, , Critical skills of a Data Governance Specialist, , You have a high learning agility, meaning you can easily adapt and absorb new information in a changing environment Customer service is central to everything you do, whether it is toward your colleagues from your colleagues or General Management Thanks to your highly developed communication and social skills, you accomplish this with ease You draw the best out of yourself as well as those around you If you can help someone, you do not think twice about it, , You seek continually for opportunities to improve the quality of our data and translate this to innovative and practical solutions You have a vision and in your advice to our stakeholders you are able to explain the importance of Data Governance and in particular metadata management Your are willing to strengthen your vision by following trends and developments on Data Governance and are familiar with DAMADMBOK and MDMproducts and processes, , Commit to NN, , Are you seeking a dynamic position in an organisation where you are constantly challenging yourself Then we would like to meet you Upload your resume via the apply button, , Do you have any questions about the job Then please call Ilco van Spijker via click apply Questions about the application proces Please contact Recruiter Jordi Spijker, via 31 06 215 875 92, , , undefined, , , undefined",Full-time,https://www.linkedin.com/jobs/view/externalApply/2320615209?url=https%3A%2F%2Fnl%2Ejooble%2Eorg%2Fexternal%2F-4917400990126761265%3Futm_campaign%3DNL%26utm_medium%3Dsocial%26utm_source%3Dlinkedin%26JobSource%3DBoard&urlHash=C0fq&refId=e9dfdb7f-5ae3-476d-b12b-6e9fa9bd3a2c&trk=public_jobs_apply-link-offsite,https://nl.linkedin.com/jobs/view/senior-data-governance-specialist-at-eonics-consultancy-2320615209?refId=e9dfdb7f-5ae3-476d-b12b-6e9fa9bd3a2c&position=20&pageNum=4&trk=public_jobs_job-result-card_result-card_full-click,1 month ago,1 month ago,2020-10-14,2020-11-28
121,career development specialist,LinkedIn,2256724904,Verpleegkundige - Loopbaanadvies - gratis,z/PpHnhMS5yCtWaJeG45Jw==,Akkolade,"Gemeente Noordwijk, South Holland, Netherlands",None,"Ben jij als Verpleegkundige toe aan de volgende stap Maar heb je wat advies nodig waar jouw kracht en talent ligt ga je switch maken naar de thuiszorg, het ziekenhuis of naar de verpleeghuiszorg Akkolade heeft een luisterend oor, , Jouw functie, , De zorg en welzijn sector heeft jouw hart als Verpleegkundige al lang gestolen Maar toch twijfel je soms of je nog wel op je plek zit Is het misschien tijd voor een nieuwe uitdaging, , Akkolade is gespecialiseerd in jouw vak en heeft een luisterend oor Voel je vrij om al je wensen met ons te delen, zodat we samen op zoek kunnen gaan naar jouw nieuwe droombaan Met onze expertise in onder andere de VVT, Ziekenhuis en GGZ sector en een zeer groot netwerk, kunnen wij jou als geen ander begeleiden, , Wij gaan samen vrijblijvend kijken wat het beste bij jou past Niets moet na dit gesprek, maar alles mag De kans is groot dat wij vele openstaande vacatures hebben die tot jouw nieuwe mogelijkheden behoren Raak je al genspireerd om een volgende stap in je loopbaan te nemen, Dan staat de koffie of thee klaar en spreken wij je vast snel, , , , , , , , , , Onze missie is zorgprofessionals helpen gelukkig te blijven in hun werk Dit doen we door jou te verbinden aan de juiste werkgever in de zorg en welzijn sector, waar jij een vaste baan krijgt Na jouw vrijblijvende reactie nodigen we je graag uit voor een kennismaking met ons Tijdens de kennismaking vertellen we jou alles over het team, de functie en de voorwaarden, maar bespreken we vooral ook jouw wensen en kwaliteiten Jij staat centraal in deze procedure, , Door het Coronavirus hebben wij onze procedure aangepast Kennismaken zal zoveel mogelijk plaatsvinden via videobellen Als je positief bent over het team word je uitgenodigd voor het arbeidsvoorwaardengesprek Je komt dan in dienst bij de zorgorganisatie Wij ondersteunen jou met maar n doel dat jij gelukkig wordt in je nieuwe vaste baan",Full-time,https://www.linkedin.com/jobs/view/externalApply/2256724904?url=https%3A%2F%2Ftwiglers%2Enl%2Fvacatures%2Fakkolade%2Fverpleegkundige-loopbaanadvies-gratis&urlHash=0f-z&refId=e9dfdb7f-5ae3-476d-b12b-6e9fa9bd3a2c&trk=public_jobs_apply-link-offsite,https://nl.linkedin.com/jobs/view/verpleegkundige-loopbaanadvies-gratis-at-akkolade-2256724904?refId=e9dfdb7f-5ae3-476d-b12b-6e9fa9bd3a2c&position=21&pageNum=4&trk=public_jobs_job-result-card_result-card_full-click,1 month ago,1 month ago,2020-10-14,2020-11-28
122,career development specialist,LinkedIn,2282276456,Coachend Verpleegkundige - Loopbaanadvies - Ouderenzorg,/V2as9LpRgKP5elqYQsjBQ==,Akkolade,"Zoetermeer, South Holland, Netherlands",None,"De rol als Verpleegkundige in de zorg is jou op het lijf geschreven, maar je bent toe aan de volgende stap Het liefst in de regio Zoetermeer Akkolade denkt graag met je mee en biedt een gratis loopbaanadvies aan, Standplaats Zoetermeer, , Jouw functie, , Het vak als Verpleegkundige in de zorg is voor jou gesneden koek Maar soms klopt je werkomgeving niet meer bij jouw ambities Akkolade biedt je graag een luisterend oor, , In een vrijblijvend gesprek mag je al je wensen met ons te delen, zodat we samen op zoek kunnen gaan naar jouw nieuwe droombaan Met onze expertise in de zorg en welzijn sector en een zeer groot netwerk kunnen wij jou als geen ander begeleiden en van advies voorzien Niets moet na dit gesprek, maar alles mag Wij gaan samen kijken wat het beste bij jou past De kans is groot dat wij openstaande vacatures hebben die tot jouw nieuwe mogelijkheden behoren, , Raak je al genspireerd om een volgende stap in je loopbaan te nemen Dan staat de koffie of thee klaar en spreken wij je vast snel, , , , , , , , , , Onze missie is zorgprofessionals helpen gelukkig te blijven in hun werk Dit doen we door jou te verbinden aan de juiste werkgever in de zorg en welzijn sector, waar jij een vaste baan krijgt Na jouw vrijblijvende reactie nodigen we je graag uit voor een kennismaking met ons Tijdens de kennismaking vertellen we jou alles over het team, de functie en de voorwaarden, maar bespreken we vooral ook jouw wensen en kwaliteiten Jij staat centraal in deze procedure, , Door het Coronavirus hebben wij onze procedure aangepast Kennismaken zal zoveel mogelijk plaatsvinden via videobellen Als je positief bent over het team word je uitgenodigd voor het arbeidsvoorwaardengesprek Je komt dan in dienst bij de zorgorganisatie Wij ondersteunen jou met maar n doel dat jij gelukkig wordt in je nieuwe vaste baan",Full-time,https://www.linkedin.com/jobs/view/externalApply/2282276456?url=https%3A%2F%2Ftwiglers%2Enl%2Fvacatures%2Fakkolade%2Fcoachend-verpleegkundige-loopbaanadvies-ouderenzorg&urlHash=4xYU&refId=e9dfdb7f-5ae3-476d-b12b-6e9fa9bd3a2c&trk=public_jobs_apply-link-offsite,https://nl.linkedin.com/jobs/view/coachend-verpleegkundige-loopbaanadvies-ouderenzorg-at-akkolade-2282276456?refId=e9dfdb7f-5ae3-476d-b12b-6e9fa9bd3a2c&position=22&pageNum=4&trk=public_jobs_job-result-card_result-card_full-click,1 month ago,1 month ago,2020-10-14,2020-11-28
123,career development specialist,LinkedIn,2256728459,Verpleegkundige - Loopbaanadvies gesprek (gratis),aQw1lhI/So2/sDFkOZ+2Dw==,Akkolade,"Ridderkerk, South Holland, Netherlands",None,"De rol als Verpleegkundig Coordinator in de zorg is jou op het lijf geschreven, maar je bent toe aan de volgende stap Het liefst in de regio Ridderkerk Akkolade denkt graag met je mee en biedt een gratis loopbaanadvies aan",Full-time,https://www.linkedin.com/jobs/view/externalApply/2256728459?url=https%3A%2F%2Ftwiglers%2Enl%2Fvacatures%2Fakkolade%2Fverpleegkundige-loopbaanadvies-gesprek-gratis&urlHash=sqhN&refId=e9dfdb7f-5ae3-476d-b12b-6e9fa9bd3a2c&trk=public_jobs_apply-link-offsite,https://nl.linkedin.com/jobs/view/verpleegkundige-loopbaanadvies-gesprek-gratis-at-akkolade-2256728459?refId=e9dfdb7f-5ae3-476d-b12b-6e9fa9bd3a2c&position=23&pageNum=4&trk=public_jobs_job-result-card_result-card_full-click,1 month ago,1 month ago,2020-10-14,2020-11-28
124,career development specialist,LinkedIn,2321462894,Senior Data Governance Specialist,L71CWMVnT6eUZ1xYWdHMfg==,Eonics Consultancy,"Almelo, Overijssel, Netherlands",['Public Relations and Communications'],"Job Description, , Data Governance Specialist, NN Group is currently launching a Data Governance office to support a large multiyear Data Governance initiative across Group Finance, Risk and Investment Office This initiative will solve major business data problems with Data Governance, Data Management and Data Architecture Solutions Would you like to set up this data governance green field within a professional organisation with impact, , Your impact as a Data Governance Specialist at NN, The solution to good Data Governance is multifaceted and equal parts people, process and technology As Data Governance Specialist you create transparency of data issues and clear, practical resolutions to our business stakeholders How to administrate and publish metadata, who should have access it and how to safeguard the data quality are typically questions in your day to day work as you are responsible for the administration of functional and technical metadata including data lineage All with the goal in mind to increase the data quality of NN Group as a whole, , With the launch of our Data Governance office, you get to help set up this data governance green field with all the facilities and complexity of a professional, corporate organisation You will help with the roadmap and vision on data governance as well as working with new tools and built data governance from the ground up, , Using your own initiative and ambition, you achieve excellent results, , , We also care about you, , , , Just as you as our Data Governance Specialist indirectly care for our customers, we also take care of you With great development opportunities and a pleasant working environment, you will have good reason to find going to work every day a pleasure, , , Whatever we do, we do together in an environment full of freedom where your personality, talents and ideas count For example, collaborating with another team is quite the norm and regularly leads to better outcomes We have no thresholds within NN everyone is readily accessible and willing to help each other, , Our purpose, , Thanks to your efforts, we make our financial services relevant and more personal, , Whatever your supporting role within the business, you offer your honest opinion and enthusiastic approach to all you do Your customeroriented attitude helps to encourage your colleagues Together with NN, you help the whole world through various CSR projects Active in 18 countries with over 17 million customers, you understand our work must be faultless We must continuously innovate and invest in an agile business model Thanks to your professionalism we earn the trust of our customers within all our subsidiaries, and there are quite a few NN, NN Investment Partners, NationaleNederlanden, OHRA, ABN AMRO Insurance, BeFrank, Zicht, AZL and Movir, , Clear conditions, , We offer you modern employment conditions and generous employee benefits For example, you have the option of taking extra vacation days We are also working towards implementing Choose your own Device You will receive your holiday allowance and yearend bonus with your salary every month, without restriction and readily available to you, , Due to the coronavirus, most of the NN colleagues work from home At the moment it is unclear when we can return to the office The official location for this position is The Hague An annual salary of 60k to 80k, , Critical skills of a Data Governance Specialist, You have a high learning agility, meaning you can easily adapt and absorb new information in a changing environment Customer service is central to everything you do, whether it is toward your colleagues from your colleagues or General Management Thanks to your highly developed communication and social skills, you accomplish this with ease You draw the best out of yourself as well as those around you If you can help someone, you do not think twice about it, , You seek continually for opportunities to improve the quality of our data and translate this to innovative and practical solutions You have a vision and in your advice to our stakeholders you are able to explain the importance of Data Governance and in particular metadata management Your are willing to strengthen your vision by following trends and developments on Data Governance and are familiar with DAMADMBOK and MDMproducts and processes, , Commit to NN, , Are you seeking a dynamic position in an organisation where you are constantly challenging yourself Then we would like to meet you Upload your resume via the apply button, , Do you have any questions about the job Then please call Ilco van Spijker via 31 0 Questions about the application proces Please contact Recruiter Jordi Spijker, via 31 0, , Eisen, , , Wensen, , undefined",Full-time,https://www.linkedin.com/jobs/view/externalApply/2321462894?url=https%3A%2F%2Fjoblift%2Enl%2Fdetails%2F9cd63214-20a4-4a51-b24c-fbde007f2be9%3Fjid%3Db05760c25abba194a211e447f790f329bc70b9064329228f2df658ed2c1640fe%26utm_source%3Dlinkedin_nl%26utm_medium%3Dexternal_feed%26utm_campaign%3D126&urlHash=5Lmk&refId=e9dfdb7f-5ae3-476d-b12b-6e9fa9bd3a2c&trk=public_jobs_apply-link-offsite,https://nl.linkedin.com/jobs/view/senior-data-governance-specialist-at-eonics-consultancy-2321462894?refId=e9dfdb7f-5ae3-476d-b12b-6e9fa9bd3a2c&position=24&pageNum=4&trk=public_jobs_job-result-card_result-card_full-click,1 month ago,1 month ago,2020-10-14,2020-11-28
125,career development specialist,LinkedIn,2256728506,Verpleegkundige (MBO) - Loopbaanadvies,i4My/OgGSTGM8hJEZ+i47A==,Akkolade,"Rijswijk, South Holland, Netherlands",None,"Ben jij op zoek naar meer afwisseling en dynamiek als Verpleegkundige, het internet staat vol met kansen Maar welke kans is voor jou geschikt Wij helpen je graag een keuze te maken",Full-time,https://www.linkedin.com/jobs/view/externalApply/2256728506?url=https%3A%2F%2Ftwiglers%2Enl%2Fvacatures%2Fakkolade%2Fverpleegkundige-mbo-loopbaanadvies&urlHash=sGTE&refId=e9dfdb7f-5ae3-476d-b12b-6e9fa9bd3a2c&trk=public_jobs_apply-link-offsite,https://nl.linkedin.com/jobs/view/verpleegkundige-mbo-loopbaanadvies-at-akkolade-2256728506?refId=e9dfdb7f-5ae3-476d-b12b-6e9fa9bd3a2c&position=25&pageNum=4&trk=public_jobs_job-result-card_result-card_full-click,1 month ago,1 month ago,2020-10-14,2020-11-28
