Data Row,Search Keyword,Platform,Job ID,Job Title,Tracking ID,Company Name,Location,Industry,Job Description,Employment Type,Company URL,Job URL,Job Age,Job Age Number,Job Date,Collection Date
96,electrical engineer,LinkedIn,2333377906,Electrical Test & Design Engineer | Amsterdam | Evoke Detachering,qE7YOTpm3igl81eVKrjKiA==,Werkzoekennl,"Amsterdam, North Holland, Netherlands",['Mechanical or Industrial Engineering'],"Vacature van Evoke Detachering, locatie Amsterdam, , Functieomschrijving, , Jouw werkzaamheden als Electrical Test  Design Engineer bestaan uit het opzetten en operationeel houden van het elektronica test lab voor LED systemen Daarnaast ontwikkel en bedenk je praktische meetopstellingen voor LED driver systemen hardwaresoftware Je rapporteert en documenteert test procedures SOP en calibratie methodieken En werkt aan het onderhouden van calibraties en continue verbetering van test procedures in samenwerking met externe partners Jij bent iemand die initiatief neemt om op de hoogte te blijven van technische ontwikkelingen, nieuwe toepassingen en de concurrentie binnen je werkveld, , , , , , , Binnen Evoke sta jij centraal Wanneer je bij ons in dienst treedt wordt je een van onze collegas Jouw persoonlijke ontwikkeling staat voorop, zowel binnen je carrire als daarbuiten Om jouw kennis verder uit te breiden kent Evoke verschillende opleidingsmogelijkheden Daarnaast voorzien wij je gedurende je loopbaan van persoonlijke begeleiding door een van onze Relatie Managers Iemand die jou, je wensen en ambities maar ook het vakgebied en bedrijf waar je aan de slag gaat kent Goede primaire en secundaire arbeidsvoorwaarden zijn voor ons vanzelfsprekend Een vast marktconform salaris, gunstige pensioenregeling en collectieve korting op individuele verzekeringen behoren tot deze voorwaarden Daarnaast biedt Evoke haar medewerkers verschillende voordelen met betrekking tot sport en beweging Evoke voorziet je dus zowel tijdens al buiten werktijd van een flinke dosis nieuwe energie, , 5cd8a0b9cc68f9ffa4c9253553278a55",Full-time,https://www.linkedin.com/jobs/view/externalApply/2333377906?url=https%3A%2F%2Fwww%2Ewerkzoeken%2Enl%2F8123_evoke-detachering%2Fvacatures%2F4661979_electrical-test-design-engineer%2F%3Fsource%3D5cd8a0b9cc68f9ffa4c9253553278a55%26utm_source%3Dlinkedin%26utm_medium%3Dreferral%26utm_campaign%3Dlinkedin_referral_vertical_vac_feed%26utm_term%3Dengineer%252bcat_ict%2Bamsterda&urlHash=EFVs&refId=2bc1b4fe-4df6-4cdf-8ebd-36d10f2f5f65&trackingId=qE7YOTpm3igl81eVKrjKiA%3D%3D&trk=public_jobs_apply-link-offsite,https://nl.linkedin.com/jobs/view/electrical-test-design-engineer-amsterdam-evoke-detachering-at-werkzoeken-nl-2333377906?refId=2bc1b4fe-4df6-4cdf-8ebd-36d10f2f5f65&trackingId=qE7YOTpm3igl81eVKrjKiA%3D%3D&position=21&pageNum=3&trk=public_jobs_job-result-card_result-card_full-click,1 day ago,1 day ago,2020-12-04,2020-12-05
100,electrical engineer,LinkedIn,2330322328,Senior Electrical Engineer,5sJrjH82jXOT+LkDyOhW4w==,VolkerWessels,"Rotterdam, South Holland, Netherlands",['Mechanical or Industrial Engineering'],"Ben jij een Engineer die zich verder wil ontwikkelen in de energiebranche Zoek jij een baan waar je niet elke dag op kantoor werkt, maar ook op projectlocaties Wil jij meer betrokken zijn tijdens de realisatie van de projecten Stop dan met zoeken want dit is misschien wel het juiste moment om de volgende stap te zetten in jouw carrire en onderdeel te zijn van de realisatie van mooie projecten in de hoogspanningsindustrieJe bent verantwoordelijk Senior Engineer hoogspanning ben je technisch verantwoordelijk voor de engineering van uitdagende hoogspanningsprojecten Je benut jouw technisch inzicht om een effectieve vertaalslag van functioneel ontwerp naar uitvoerbare projectplannen te maken Ook verzorg je de technische documentatie en uitvoeringsstukken Je werkt graag volgens de Systems Engineering methodiek en je bewaakt van nature scherp de kwaliteit en je voelt je verantwoordelijk zodat je technisch inhoudelijke issues proactief terugkoppelt naar onze opdrachtgevers Je stuurt afhankelijk van de grootte van het project zelf enkele medewerkers aan en je verricht geheel zelfstandig de engineering van onze hoogspanningsprojecten Het leuke van deze rol is dat je van A tot Z betrokken bent tijdens de realisatie van de projecten en werk je af en toe ook op de projectlocatiesNaast het cordineren van de engineering projecten verzorg je ook de planning, inclusief budgettering en monitort de technische aspecten Bij dreigende knelpunten grijp je snel en slagvaardig in, bijvoorbeeld door alternatieve oplossingen in kaart te brengen en die overtuigend te presenteren Bovendien organiseer je de kwaliteitsreviews, zodat altijd duidelijk is waar we staan en welke stappen nog gezet moeten wordenJe bent verantwoordelijk voor een breed pakket aan secundaire en primaire engineeringswerkzaamheden werkpakkettenJe bent een allrounder die bekend is met alle in de industrie voorkomende hoogspanninginstallaties van 110 KV tot 380 KV en de daarbij behorende normen en voorschriftenJe werkt in samenspraak met de projectleiding, opdrachtgevers, instanties, leveranciers edAls Engineer stel je systeemdocumentatie en functionele en technische specificaties op Je maakt aanbiedingen, verslagen, rapporten, planningen, werkbeschrijvingen, bestekken en exploitatieoverzichtenOok bewaak je budgetten, en controleer en analyseer je nacalculatiesProactieve voortgangsbewaking, oplossen knelpunten, terugkoppelen bevindingenUitvoeren kwaliteitscontroles, overdragen projectdocumentatieWat breng je meeTechnische HBOWO achtergrond Elektrotechniek, Energietechniek of vergelijkbaarRuime ervaring in het technisch begeleiden en engineeren van projectenAantoonbare en recente werkervaring met netbeheerders enof industrile projectenGoede beheersing van de Nederlandse en Engelse taal in woord en schriftErvaring met UAVGC en Systems Engineering is een prAantoonbare planning en budgettering skillsGoed ontwikkeld risicobewustzijn, sterk klant en kwaliteitsgerichtWaar ga je werkenWerken voor Volker Energy Solutions betekent werken voor een toonaangevende speler op het gebied van energie infrastructuren Zo is Volker Energy Solutions d expert in ontwerp, aanleg en beheer van complexe midden en hoogspanningsinstallaties Wij helpen klanten als netbeheerders, energieopwekkers en zakelijke klanten met uitdagingen die de energietransitie met zich meebrengt Kortom, wij staan voor technisch vooruitstrevende oplossingenDe liefde voor techniek is de verbindende factor binnen Volker Energy Solutions Wij hebben een werkomgeving waar het samen werken aan innovatieve oplossingen voor een toekomstbestendige energievoorziening centraal staat Dat zie je terug in een gedreven, resultaatgerichte instelling met een goede werksfeer Medewerkers zijn trots om bij Volker Energy Solutions te werken Naast een concurrerend salaris en goede secundaire arbeidsvoorwaarden bieden wij je veel mogelijkheden om je verder te ontwikkelen Volker Energy Solutions is een dochteronderneming van Visser  Smit Hanab Daarmee is het een onderneming binnen de koninklijke VolkerWessels NV Volker Energy Solutions omvat circa 180 medewerkersInteresseVoor meer informatie over de procedure kun je contact opnemen met Anne Greven, Recruiter  HRM, op telefoonnummer Email Meteen solliciteren Dat doe je door hieronder je gegevens, cv en eventueel motivatiebrief achter te latenEen VOG screening is een onderdeel van de selectieprocedure Acquisitie naar aanleiding van deze vacature wordt niet op prijs gesteld",Full-time,https://www.linkedin.com/jobs/view/externalApply/2330322328?url=https%3A%2F%2Fjoblift%2Enl%2Fjoblink%3Fto%3DeyJ0eXAiOiJKV1QiLCJhbGciOiJIUzI1NiJ9%2EeyJvZmZlcklkIjoiZjg0YWEzN2YtNDFlOS00NWI2LWI4MTMtNjgxOTkxZjkwZGI0In0%2Ee3Wi0Je5PZWZmBxj2RsKb69UjEBHEfHNj-hUxLija7w%26jid%3D7791145e20dec39fdb1c50bf6a43b664b08223c6b256d83e8dd93af388529759%26utm_source%3Dlinkedin_nl%26utm_medium%3Dexternal_feed%26utm_campaign%3D390&urlHash=gOop&refId=2bc1b4fe-4df6-4cdf-8ebd-36d10f2f5f65&trackingId=5sJrjH82jXOT%2BLkDyOhW4w%3D%3D&trk=public_jobs_apply-link-offsite,https://nl.linkedin.com/jobs/view/senior-electrical-engineer-at-volkerwessels-2330322328?refId=2bc1b4fe-4df6-4cdf-8ebd-36d10f2f5f65&trackingId=5sJrjH82jXOT%2BLkDyOhW4w%3D%3D&position=25&pageNum=3&trk=public_jobs_job-result-card_result-card_full-click,1 day ago,1 day ago,2020-12-04,2020-12-05
101,electrical engineer,LinkedIn,2333370009,Electrical Design Engineer | Werkendam | De Groot Personeel in Techniek,61hALf2yZGMhVOjeeaIIBQ==,Werkzoekennl,"Werkendam, North Brabant, Netherlands",['Mechanical or Industrial Engineering'],"Vacature van De Groot Personeel in Techniek, locatie Werkendam, , Salaris  3000, tot  3500,  Aantal uur 39 uur  Locatie Werkendam  Dienstverband jaarcontract bij opdrachtgever met uitzicht op vast, , , , , , In jouw rol als werk je aan langer lopende opdrachten die over meerdere dagen verspreid zijn Je tekent met schemas van obv bestek Met teken je de hoofdborden van een opdracht uit en maak je bijbehorende kortsluitberekeningen en selectiviteitsdiagrammen Die vul je aan met de door jou opgestelde vermogensbalans Ook houd je je bezig met het in de tekening van woning en stuurhuis, , Wanneer n van de servicemonteurs aanpassingen maakt tijdens een onderhouds of reparatieklus verwerk je deze in de tekening zodat ieder ontwerp altijd uptodate blijft Het is druk op het werk dus er zijn altijd extra klusjes die de bedrijfsvoering ten goede komen Denk aan het bijhouden van wijzigingen vanuit de werkplaats of vanaf de werf, het aanpassen van toestellijsten en het beantwoorden van vragen vanuit het bureau dat de schepen, waaraan je hebt meegewerkt, classificeert, , , , , , Vanwege de verantwoordelijkheid die je draagt, en de moeilijkheidsgraad van het werk, is het belangrijk dat je enkele jaren als elektrotechnisch tekenaar hebt gewerkt Je werkt het liefst samen in een team, onder leiding van een ervaren bedrijfsleider waar je vragen aan kunt stellen en die de grote lijnen bewaakt Je krijg uiteraard ruim de tijd om jezelf de fijne kneepjes eigen te maken en je wordt hierbij ondersteund door een collegatekenaar, , Je hebt de volgende vaardigheden en basiskennis nodig om je werk goed te kunnen doen, , , , , , Onze opdrachtgever is gespecialiseerd in het ontwerp, de installatie en het onderhoud van elektrische installaties aan boord van kust en binnenvaartschepen Met tientallen jaren ervaring in de branche heeft het bedrijf zich gepositioneerd als een betrouwbare speler in de markt met veel oog voor nieuwe ontwikkelen zoals volledige elektrisch aangedreven scheepsmotoren Iedere dag in deze innoverende branche is weer anders omdat ieder schip anders is, , Dat maakt het een interessante werkplek met veel verschillende klanten in de orderportefeuille Het is altijd druk, maar gelukkig hou je iedere dag genoeg tijd over voor een praatje en een grapje met je collegas en heerst er een informele bedrijfssfeer, waarin de vrijmibo natuurlijk niet ontbreekt, , , , , , De werkgever biedt een afwisselende baan vol uitdagingen in een ervaren team, in een informele, collegiale werksfeer, , , 5cd8a0b9cc68f9ffa4c9253553278a55",Full-time,https://www.linkedin.com/jobs/view/externalApply/2333370009?url=https%3A%2F%2Fwww%2Ewerkzoeken%2Enl%2F1021_de-groot-personeel-in-techniek%2Fvacatures%2F4763875_electrical-design-engineer%2F%3Fsource%3D5cd8a0b9cc68f9ffa4c9253553278a55%26utm_source%3Dlinkedin%26utm_medium%3Dreferral%26utm_campaign%3Dlinkedin_referral_vertical_vac_feed%26utm_term%3Dengineer%2Bwerkendam&urlHash=Wzp6&refId=5b876a63-ec30-493d-8c6f-769601786964&trackingId=61hALf2yZGMhVOjeeaIIBQ%3D%3D&trk=public_jobs_apply-link-offsite,https://nl.linkedin.com/jobs/view/electrical-design-engineer-werkendam-de-groot-personeel-in-techniek-at-werkzoeken-nl-2333370009?refId=5b876a63-ec30-493d-8c6f-769601786964&trackingId=61hALf2yZGMhVOjeeaIIBQ%3D%3D&position=1&pageNum=4&trk=public_jobs_job-result-card_result-card_full-click,1 day ago,1 day ago,2020-12-04,2020-12-05
102,electrical engineer,LinkedIn,2331976951,Senior Electrical Engineer (primair),8ogIRT6b7Utgj3HIi+wM4w==,Lievense,"Doorwerth, Gelderland, Netherlands",None,"Wij zoeken een senior electrical engineer met ervaring in de primaire engineering van hoogspanningsstations, , Als specialist in hoogspanningstechniek met een indrukwekkend trackrecord ben je toe aan een echte uitdaging En waarbij je werkt aan toonaangevende projecten Met opdrachtgevers als TenneT, ProRail, regionale netbeheerders en contractors Denk daarbij aan hoogspanningsstations, elektromagnetische compatibiliteitsberekeningen en hoogspanningslijnen kabels die onder en boven de grond door heel Nederland lopen, , De transitie naar duurzame energie en de opkomst van nieuwe technologien vraagt om een hoog kennisniveau op dit gebied En laat dt nu precies onze expertise zijn Als je werkt bij Petersburg Consultants, werk je bij een bedrijf dat de lead pakt in de Energy Transition Als specialist pak jij de lead, deel je kennis met collegas en neem je opdrachtgevers mee in de energietransitie, , Heb jij de drive om ons naar een ng hoger niveau te tillen Zet je volgende carrire stap bij ons, , Wat bieden wij jou, , een goed salaris dat aansluit bij je kennis en ervaring een baan in een jong, ambitieus en sterk groeiend bedrijf open deuren en korte lijnen naar elkaar en de directie volop opleidingsmogelijkheden een leiderschapsprogramma voldoende mogelijkheden om te groeien gezellige, sportieve en sociale collegas goede secundaire arbeidsvoorwaarden Sinds 1 januari 2019 is Petersburg Consultants, een ingenieursbureau op het gebied van hoogspannings en buisleidingeninfrastructuur, onderdeel van Lievense Bekijk de website van Petersburg Consultants voor meer informatie",Full-time,https://www.linkedin.com/jobs/view/externalApply/2331976951?url=https%3A%2F%2Fneuvoo%2Enl%2Fjob%2Ephp%3Fid%3D08e023eb13d6%26source%3Dlinkedin%26utm_source%3Dpartner%26utm_medium%3Dlinkedin%26puid%3Dfddgcdd8eadbgddg7ddefddd9adbgadeaddffddd3aeccdcafec3ddcg3e&urlHash=6Pa2&refId=5b876a63-ec30-493d-8c6f-769601786964&trackingId=8ogIRT6b7Utgj3HIi%2BwM4w%3D%3D&trk=public_jobs_apply-link-offsite,https://nl.linkedin.com/jobs/view/senior-electrical-engineer-primair-at-lievense-2331976951?refId=5b876a63-ec30-493d-8c6f-769601786964&trackingId=8ogIRT6b7Utgj3HIi%2BwM4w%3D%3D&position=2&pageNum=4&trk=public_jobs_job-result-card_result-card_full-click,1 day ago,1 day ago,2020-12-04,2020-12-05
105,electrical engineer,LinkedIn,2267506362,Electrical Engineer Hoogspanning,CTPE1wMcnP+s4o3Xe9ue6w==,Dosign,"Utrecht, Utrecht, Netherlands",None,"Ben jij een ervaren engineer Heb jij ervaring met hoogspanningsstations En ben jij toe aan een volgende stap in je carrire Word Dosigner en start als Electrical Engineer Hoogspanning in Utrecht Binnen deze veelzijdige functie van Electrical Engineer Hoogspanning werk je aan de constructie van nieuwbouw, uitbreiding of renovatie van hoogspanningsstations Het gaat om onder andere hoogspanningstations, hoogspanningsverbindingen 110 kV, middenspanningsstations en verbindingen en ook de ondersteunende systemen",Full-time,https://www.linkedin.com/jobs/view/externalApply/2267506362?url=https%3A%2F%2Fwww%2Evacatures%2Enl%2Fvacature%2Felectrical-engineer-hoogspanning%3A43192736%2F&urlHash=EBHM&refId=5b876a63-ec30-493d-8c6f-769601786964&trackingId=CTPE1wMcnP%2Bs4o3Xe9ue6w%3D%3D&trk=public_jobs_apply-link-offsite,https://nl.linkedin.com/jobs/view/electrical-engineer-hoogspanning-at-dosign-2267506362?refId=5b876a63-ec30-493d-8c6f-769601786964&trackingId=CTPE1wMcnP%2Bs4o3Xe9ue6w%3D%3D&position=5&pageNum=4&trk=public_jobs_job-result-card_result-card_full-click,1 day ago,1 day ago,2020-12-04,2020-12-05
119,electrical engineer,LinkedIn,2273770037,Sr. Electrical Engineer Maritime,NL3ou9dj+XPhvNk+HnwN7g==,Independent Engineering,"Vlissingen, Zeeland, Netherlands","['Electrical/', 'Electronic Manufacturing', 'Mechanical or Industrial Engineering', 'Consumer Goods']","Algemene omschrijving, , This company is going to extend the Electrical  Automation department due to a massive project request Here, you will have to participate in the design, specification, selection and integration of all electrical and automation systems of our vessels As all of the requests and requirements are custom made, you can imagine that these systems are extensive and include electrical power distribution, lighting, networking, platform automation, navigation, communication , , During all projects, you will work in multidisciplinary teams In addition, you will work closely with international subcontractors, suppliers and clients, which requires you to have excellent communication skills, , , , , Gestelde eisen, , 3 to 5 year experience in the design and installation of complex Electrical systems Experience and knowledge of electrical installations, preferably in ships, offshore, , Informatie over Independent Engineering, , This company is a global market leader within the maritime industry and has multipule locations in The Netherlands You will be working in the Rotterdam region Next to this, you could be relocated to other European countries in order to participate in an on site project",Full-time,https://www.linkedin.com/jobs/view/externalApply/2273770037?url=https%3A%2F%2Fnl%2Ejooble%2Eorg%2Fexternal%2F-6916100090245531832%3Futm_campaign%3DNL%26utm_medium%3Dsocial%26utm_source%3Dlinkedin%26JobSource%3DBoard&urlHash=GNvg&refId=5b876a63-ec30-493d-8c6f-769601786964&trackingId=NL3ou9dj%2BXPhvNk%2BHnwN7g%3D%3D&trk=public_jobs_apply-link-offsite,https://nl.linkedin.com/jobs/view/sr-electrical-engineer-maritime-at-independent-engineering-2273770037?refId=5b876a63-ec30-493d-8c6f-769601786964&trackingId=NL3ou9dj%2BXPhvNk%2BHnwN7g%3D%3D&position=19&pageNum=4&trk=public_jobs_job-result-card_result-card_full-click,1 day ago,1 day ago,2020-12-04,2020-12-05
122,electrical engineer,LinkedIn,2330304380,Senior Electrical Engineer (primair),yMIs8c1PxrFXyncCX1Jy9A==,RAADGEVEND INGENIEURSBUREAU CHRISTIAAN CLAES,"Doorwerth, Gelderland, Netherlands","['Electrical/', 'Electronic Manufacturing']","DoorwerthWij zoeken een senior electrical engineer met ervaring in de primaire engineering van hoogspanningsstationsAls specialist in hoogspanningstechniek met een indrukwekkend trackrecord ben je toe aan een echte uitdaging En waarbij je werkt aan toonaangevende projecten Met opdrachtgevers als TenneT, ProRail, regionale netbeheerders en contractors Denk daarbij aan hoogspanningsstations, elektromagnetische compatibiliteitsberekeningen en hoogspanningslijnen kabels die onder en boven de grond door heel Nederland lopen De transitie naar duurzame energie en de opkomst van nieuwe technologien vraagt om een hoog kennisniveau op dit gebied En laat dt nu precies onze expertise zijn Als je werkt bij Petersburg Consultants, werk je bij een bedrijf dat de lead pakt in de Energy Transition Als specialist pak jij de lead, deel je kennis met collegas en neem je opdrachtgevers mee in de energietransitie Heb jij de drive om ons naar een ng hoger niveau te tillen Zet je volgende carrire stap bij ons Competenties8 jaar relevante werkervaringElektrotechniek  Primaire EngineeringHBOWOLeergierig  resultaatgerichtWat bieden wij joueen goed salaris dat aansluit bij je kennis en ervaringeen baan in een jong, ambitieus en sterk groeiend bedrijfopen deuren en korte lijnen naar elkaar en de directievolop opleidingsmogelijkhedeneen leiderschapsprogrammavoldoende mogelijkheden om te groeiengezellige, sportieve en sociale collegasgoede secundaire arbeidsvoorwaardenSinds 1 januari 2019 is Petersburg Consultants, een ingenieursbureau op het gebied van hoogspannings en buisleidingeninfrastructuur, onderdeel van Lievense Bekijk de website van Petersburg Consultants voor meer informatie",Full-time,https://www.linkedin.com/jobs/view/externalApply/2330304380?url=https%3A%2F%2Fjoblift%2Enl%2Fjoblink%3Fto%3DeyJ0eXAiOiJKV1QiLCJhbGciOiJIUzI1NiJ9%2EeyJvZmZlcklkIjoiNzVjNDI5ZmQtZGUwYy00OGMyLTkxYWMtOWNiZWI2ZjZiYmU5In0%2Ew4BoGKxQCdKGIGqmfu2CsFW7jLcd-VLBVMQRbdVzpL0%26jid%3D39ae86c5a7814da2ae32b00d367c657c635432f4e2893b2751948befe0c2f800%26utm_source%3Dlinkedin_nl%26utm_medium%3Dexternal_feed%26utm_campaign%3D390&urlHash=xs5m&refId=5b876a63-ec30-493d-8c6f-769601786964&trackingId=yMIs8c1PxrFXyncCX1Jy9A%3D%3D&trk=public_jobs_apply-link-offsite,https://nl.linkedin.com/jobs/view/senior-electrical-engineer-primair-at-raadgevend-ingenieursbureau-christiaan-claes-2330304380?refId=5b876a63-ec30-493d-8c6f-769601786964&trackingId=yMIs8c1PxrFXyncCX1Jy9A%3D%3D&position=22&pageNum=4&trk=public_jobs_job-result-card_result-card_full-click,1 day ago,1 day ago,2020-12-04,2020-12-05
123,electrical engineer,LinkedIn,2280025641,Sr. Electrical Engineer Maritime,TT6oiFGhk7/m+6K1sgpCIQ==,Independent Engineering,"Vlissingen, Zeeland, Netherlands","['Electrical/', 'Electronic Manufacturing', 'Mechanical or Industrial Engineering', 'Consumer Goods']","Algemene omschrijving, , This company is going to extend the Electrical  Automation department due to a massive project request Here, you will have to participate in the design, specification, selection and integration of all electrical and automation systems of our vessels As all of the requests and requirements are custom made, you can imagine that these systems are extensive and include electrical power distribution, lighting, networking, platform automation, navigation, communication , , During all projects, you will work in multidisciplinary teams In addition, you will work closely with international subcontractors, suppliers and clients, which requires you to have excellent communication skills, , , , , Gestelde eisen, , 3 to 5 year experience in the design and installation of complex Electrical systems Experience and knowledge of electrical installations, preferably in ships, offshore, , Informatie over Independent Engineering, , This company is a global market leader within the maritime industry and has multipule locations in The Netherlands You will be working in the Rotterdam region Next to this, you could be relocated to other European countries in order to participate in an on site project",Full-time,https://www.linkedin.com/jobs/view/externalApply/2280025641?url=https%3A%2F%2Fnl%2Ejooble%2Eorg%2Fexternal%2F4283050161737777575%3Futm_campaign%3DNL%26utm_medium%3Dsocial%26utm_source%3Dlinkedin%26JobSource%3DBoard&urlHash=ypdE&refId=5b876a63-ec30-493d-8c6f-769601786964&trackingId=TT6oiFGhk7%2Fm%2B6K1sgpCIQ%3D%3D&trk=public_jobs_apply-link-offsite,https://nl.linkedin.com/jobs/view/sr-electrical-engineer-maritime-at-independent-engineering-2280025641?refId=5b876a63-ec30-493d-8c6f-769601786964&trackingId=TT6oiFGhk7%2Fm%2B6K1sgpCIQ%3D%3D&position=23&pageNum=4&trk=public_jobs_job-result-card_result-card_full-click,1 day ago,1 day ago,2020-12-04,2020-12-05
125,electrical engineer,LinkedIn,2333289284,Electrical Design Engineer - Eplan | Capelle aan den IJssel | Connetix B.V.,RZeszY1/iB7XtjMQjxx0AA==,Technicusnl,"Capelle aan den IJssel, South Holland, Netherlands","['Construction', 'Mechanical or Industrial Engineering', 'Civil Engineering']","Vacature van Connetix BV, locatie Capelle aan den IJssel, , Introductie, , Op zoek naar een nieuwe of eerste uitdaging als Electrical Design Engineer in de grove machinebouw Solliciteer dan nu bij Connetix voor de vacature Electrical Design Engineer, , , , Organisatie, , Onze opdrachtgever is wereldwijd actief en heeft een internationaal karakter Ze ontwikkelen en produceren hun eigen productensystemen ten behoeve van de marine, offshore en industrie Binnen hun vakgebied doen ze veel aan RD en uitbreiding van het producten aanbod Het betreft een MKB organisatie met ongeveer 40 werknemers waardoor je in nauw contact staat met je collegas, , Afdeling en werksfeer, , Binnen de organisatie is er een grote mate van saamhorigheid en werken ze nauw samen in multidisciplinaire teams Om op een hoog niveau actief te kunnen blijven is ontwikkeling essentieel waardoor onze opdrachtgever veel investeert in persoonlijke ontwikkeling, , , , , , In de functie van Electrical Design Engineer heb veel diversiteit in je functie en ben jij verantwoordelijk voor het ontwerpen en uitwerken van elektrotechnische systemen en ben je betrokken bij de testfase van de systemen, , , Functie eisen, , , , Profiel, , , Uitstekende primaire arbeidsvoorwaarden en secundaire arbeidsvoorwaarden, waaronder een gunstige pensioenregeling en collectiviteitskorting op je zorgverzekering Daarnaast heb je ook een flexibel arbeidsvoorwaardenpakket afhankelijk van je persoonlijke situatie Een uitdagende baan en een goede financile situatie staan op 1, , , 5cd8a0b9cc68f9ffa4c9253553278a55",Full-time,https://www.linkedin.com/jobs/view/externalApply/2333289284?url=https%3A%2F%2Fwww%2Etechnicus%2Enl%2Ftechnische-baan%2F2975_328242_electrical-design-engineer-eplan%2F%3Fsource%3D5cd8a0b9cc68f9ffa4c9253553278a55%26utm_source%3Dlinkedin%26utm_medium%3Dreferral%26utm_campaign%3Dlinkedin_referral_vertical_vac_feed%26utm_term%3Dengineer%2Bcapelle%2Baan%2Bden%2B&urlHash=9gho&refId=5b876a63-ec30-493d-8c6f-769601786964&trackingId=RZeszY1%2FiB7XtjMQjxx0AA%3D%3D&trk=public_jobs_apply-link-offsite,https://nl.linkedin.com/jobs/view/electrical-design-engineer-eplan-capelle-aan-den-ijssel-connetix-b-v-at-technicus-nl-2333289284?refId=5b876a63-ec30-493d-8c6f-769601786964&trackingId=RZeszY1%2FiB7XtjMQjxx0AA%3D%3D&position=25&pageNum=4&trk=public_jobs_job-result-card_result-card_full-click,1 day ago,1 day ago,2020-12-04,2020-12-05
